Airline,Date_of_Journey,Source,Destination,Route,Dep_Time,Arrival_Time,Duration,Total_Stops,Additional_Info,Price,Journey_Date,Journey_Day,Journey_Month,Journey_Weekday,Duration_min,Total_Stops_num,Dep_Hour,Arr_Hour
IndiGo,24/03/2019,Banglore,New Delhi,BLR → DEL,22:20,01:10 22 Mar,2h 50m,non-stop,No info,3897,2019-03-24,24,3,6,170,0,22,1
Air India,1/05/2019,Kolkata,Banglore,CCU → IXR → BBI → BLR,05:50,13:15,7h 25m,2 stops,No info,7662,2019-05-01,1,5,2,445,2,5,13
Jet Airways,9/06/2019,Delhi,Cochin,DEL → LKO → BOM → COK,09:25,04:25 10 Jun,19h,2 stops,No info,13882,2019-06-09,9,6,6,1140,2,9,4
IndiGo,12/05/2019,Kolkata,Banglore,CCU → NAG → BLR,18:05,23:30,5h 25m,1 stop,No info,6218,2019-05-12,12,5,6,325,1,18,23
IndiGo,01/03/2019,Banglore,New Delhi,BLR → NAG → DEL,16:50,21:35,4h 45m,1 stop,No info,13302,2019-03-01,1,3,4,285,1,16,21
SpiceJet,24/06/2019,Kolkata,Banglore,CCU → BLR,09:00,11:25,2h 25m,non-stop,No info,3873,2019-06-24,24,6,0,145,0,9,11
Jet Airways,12/03/2019,Banglore,New Delhi,BLR → BOM → DEL,18:55,10:25 13 Mar,15h 30m,1 stop,In-flight meal not included,11087,2019-03-12,12,3,1,930,1,18,10
Jet Airways,01/03/2019,Banglore,New Delhi,BLR → BOM → DEL,08:00,05:05 02 Mar,21h 5m,1 stop,No info,22270,2019-03-01,1,3,4,1265,1,8,5
Jet Airways,12/03/2019,Banglore,New Delhi,BLR → BOM → DEL,08:55,10:25 13 Mar,25h 30m,1 stop,In-flight meal not included,11087,2019-03-12,12,3,1,1530,1,8,10
Multiple carriers,27/05/2019,Delhi,Cochin,DEL → BOM → COK,11:25,19:15,7h 50m,1 stop,No info,8625,2019-05-27,27,5,0,470,1,11,19
Air India,1/06/2019,Delhi,Cochin,DEL → BLR → COK,09:45,23:00,13h 15m,1 stop,No info,8907,2019-06-01,1,6,5,795,1,9,23
IndiGo,18/04/2019,Kolkata,Banglore,CCU → BLR,20:20,22:55,2h 35m,non-stop,No info,4174,2019-04-18,18,4,3,155,0,20,22
Air India,24/06/2019,Chennai,Kolkata,MAA → CCU,11:40,13:55,2h 15m,non-stop,No info,4667,2019-06-24,24,6,0,135,0,11,13
Jet Airways,9/05/2019,Kolkata,Banglore,CCU → BOM → BLR,21:10,09:20 10 May,12h 10m,1 stop,In-flight meal not included,9663,2019-05-09,9,5,3,730,1,21,9
IndiGo,24/04/2019,Kolkata,Banglore,CCU → BLR,17:15,19:50,2h 35m,non-stop,No info,4804,2019-04-24,24,4,2,155,0,17,19
Air India,3/03/2019,Delhi,Cochin,DEL → AMD → BOM → COK,16:40,19:15 04 Mar,26h 35m,2 stops,No info,14011,2019-03-03,3,3,6,1595,2,16,19
SpiceJet,15/04/2019,Delhi,Cochin,DEL → PNQ → COK,08:45,13:15,4h 30m,1 stop,No info,5830,2019-04-15,15,4,0,270,1,8,13
Jet Airways,12/06/2019,Delhi,Cochin,DEL → BOM → COK,14:00,12:35 13 Jun,22h 35m,1 stop,In-flight meal not included,10262,2019-06-12,12,6,2,1355,1,14,12
Air India,12/06/2019,Delhi,Cochin,DEL → CCU → BOM → COK,20:15,19:15 13 Jun,23h,2 stops,No info,13381,2019-06-12,12,6,2,1380,2,20,19
Jet Airways,27/05/2019,Delhi,Cochin,DEL → BOM → COK,16:00,12:35 28 May,20h 35m,1 stop,In-flight meal not included,12898,2019-05-27,27,5,0,1235,1,16,12
GoAir,6/03/2019,Delhi,Cochin,DEL → BOM → COK,14:10,19:20,5h 10m,1 stop,No info,19495,2019-03-06,6,3,2,310,1,14,19
Air India,21/03/2019,Banglore,New Delhi,BLR → COK → DEL,22:00,13:20 19 Mar,15h 20m,1 stop,No info,6955,2019-03-21,21,3,3,920,1,22,13
IndiGo,3/04/2019,Banglore,Delhi,BLR → DEL,04:00,06:50,2h 50m,non-stop,No info,3943,2019-04-03,3,4,2,170,0,4,6
IndiGo,1/05/2019,Banglore,Delhi,BLR → DEL,18:55,21:50,2h 55m,non-stop,No info,4823,2019-05-01,1,5,2,175,0,18,21
Jet Airways,6/05/2019,Kolkata,Banglore,CCU → BOM → BLR,18:55,08:15 07 May,13h 20m,1 stop,In-flight meal not included,7757,2019-05-06,6,5,0,800,1,18,8
Jet Airways,9/06/2019,Delhi,Cochin,DEL → IDR → BOM → COK,21:25,12:35 10 Jun,15h 10m,2 stops,No info,13292,2019-06-09,9,6,6,910,2,21,12
IndiGo,1/06/2019,Delhi,Cochin,DEL → LKO → COK,21:50,03:35 02 Jun,5h 45m,1 stop,No info,8238,2019-06-01,1,6,5,345,1,21,3
GoAir,15/05/2019,Delhi,Cochin,DEL → BOM → COK,07:00,12:55,5h 55m,1 stop,No info,7682,2019-05-15,15,5,2,355,1,7,12
Vistara,18/06/2019,Banglore,Delhi,BLR → DEL,09:45,12:35,2h 50m,non-stop,No info,4668,2019-06-18,18,6,1,170,0,9,12
Vistara,15/06/2019,Chennai,Kolkata,MAA → CCU,07:05,09:20,2h 15m,non-stop,No info,3687,2019-06-15,15,6,5,135,0,7,9
Vistara,18/06/2019,Chennai,Kolkata,MAA → CCU,07:05,09:20,2h 15m,non-stop,No info,3687,2019-06-18,18,6,1,135,0,7,9
Air India,1/05/2019,Kolkata,Banglore,CCU → GAU → DEL → BLR,09:50,23:15,13h 25m,2 stops,No info,13227,2019-05-01,1,5,2,805,2,9,23
IndiGo,6/04/2019,Banglore,Delhi,BLR → DEL,04:00,06:50,2h 50m,non-stop,No info,4423,2019-04-06,6,4,5,170,0,4,6
Jet Airways,15/06/2019,Delhi,Cochin,DEL → NAG → BOM → COK,14:35,12:35 16 Jun,22h,2 stops,In-flight meal not included,10919,2019-06-15,15,6,5,1320,2,14,12
Jet Airways,18/05/2019,Delhi,Cochin,DEL → BOM → COK,07:05,12:35,5h 30m,1 stop,In-flight meal not included,12373,2019-05-18,18,5,5,330,1,7,12
IndiGo,27/06/2019,Delhi,Cochin,DEL → BOM → COK,10:35,21:00,10h 25m,1 stop,No info,5894,2019-06-27,27,6,3,625,1,10,21
SpiceJet,21/05/2019,Kolkata,Banglore,CCU → MAA → BLR,15:05,20:20,5h 15m,1 stop,No info,4649,2019-05-21,21,5,1,315,1,15,20
Air India,18/05/2019,Kolkata,Banglore,CCU → BLR,14:15,16:45,2h 30m,non-stop,No info,6245,2019-05-18,18,5,5,150,0,14,16
Jet Airways,06/03/2019,Banglore,New Delhi,BLR → BOM → DEL,07:00,13:15,6h 15m,1 stop,No info,19225,2019-03-06,6,3,2,375,1,7,13
Jet Airways,3/06/2019,Delhi,Cochin,DEL → BOM → COK,07:05,19:00,11h 55m,1 stop,No info,14924,2019-06-03,3,6,0,715,1,7,19
Multiple carriers,21/05/2019,Delhi,Cochin,DEL → HYD → COK,07:05,18:10,11h 5m,1 stop,No info,9646,2019-05-21,21,5,1,665,1,7,18
Air India,15/03/2019,Banglore,New Delhi,BLR → BOM → DEL,06:45,15:15,8h 30m,1 stop,No info,8714,2019-03-15,15,3,4,510,1,6,15
Jet Airways,18/05/2019,Delhi,Cochin,DEL → BOM → COK,20:55,19:00 19 May,22h 5m,1 stop,In-flight meal not included,12373,2019-05-18,18,5,5,1325,1,20,19
Air Asia,6/05/2019,Banglore,Delhi,BLR → DEL,11:10,13:55,2h 45m,non-stop,No info,3383,2019-05-06,6,5,0,165,0,11,13
Multiple carriers,21/03/2019,Delhi,Cochin,DEL → BOM → COK,09:00,21:00,12h,1 stop,No info,13062,2019-03-21,21,3,3,720,1,9,21
SpiceJet,24/03/2019,Banglore,New Delhi,BLR → DEL,05:45,08:35,2h 50m,non-stop,No check-in baggage included,3527,2019-03-24,24,3,6,170,0,5,8
IndiGo,27/05/2019,Banglore,Delhi,BLR → DEL,04:00,06:50,2h 50m,non-stop,No info,3943,2019-05-27,27,5,0,170,0,4,6
Air India,3/05/2019,Chennai,Kolkata,MAA → CCU,11:40,13:55,2h 15m,non-stop,No info,4667,2019-05-03,3,5,4,135,0,11,13
Air India,15/05/2019,Kolkata,Banglore,CCU → HYD → BLR,19:00,11:05 16 May,16h 5m,1 stop,No info,6117,2019-05-15,15,5,2,965,1,19,11
Jet Airways,27/06/2019,Delhi,Cochin,DEL → AMD → BOM → COK,23:05,19:00 28 Jun,19h 55m,2 stops,In-flight meal not included,11150,2019-06-27,27,6,3,1195,2,23,19
Jet Airways,9/03/2019,Delhi,Cochin,DEL → COK,11:00,14:15,3h 15m,non-stop,In-flight meal not included,7202,2019-03-09,9,3,5,195,0,11,14
Jet Airways,1/05/2019,Kolkata,Banglore,CCU → DEL → BLR,09:35,10:55 02 May,25h 20m,1 stop,No info,12121,2019-05-01,1,5,2,1520,1,9,10
IndiGo,24/03/2019,Banglore,New Delhi,BLR → DEL,22:20,01:10 28 Mar,2h 50m,non-stop,No info,4377,2019-03-24,24,3,6,170,0,22,1
IndiGo,18/06/2019,Banglore,Delhi,BLR → DEL,21:15,00:15 19 Jun,3h,non-stop,No info,3943,2019-06-18,18,6,1,180,0,21,0
Air Asia,3/04/2019,Banglore,Delhi,BLR → DEL,23:55,02:45 04 Apr,2h 50m,non-stop,No info,4483,2019-04-03,3,4,2,170,0,23,2
Jet Airways,24/03/2019,Kolkata,Banglore,CCU → BOM → BLR,19:45,12:00 25 Mar,16h 15m,1 stop,No info,14231,2019-03-24,24,3,6,975,1,19,12
Air India,01/03/2019,Banglore,New Delhi,BLR → BOM → AMD → DEL,08:50,23:55,15h 5m,2 stops,No info,17345,2019-03-01,1,3,4,905,2,8,23
Vistara,6/03/2019,Chennai,Kolkata,MAA → CCU,07:05,09:20,2h 15m,non-stop,No info,7414,2019-03-06,6,3,2,135,0,7,9
Multiple carriers,6/05/2019,Delhi,Cochin,DEL → BOM → COK,19:00,01:30 07 May,6h 30m,1 stop,No info,8073,2019-05-06,6,5,0,390,1,19,1
Vistara,6/03/2019,Mumbai,Hyderabad,BOM → DEL → HYD,15:40,16:45 07 Mar,25h 5m,1 stop,No info,12395,2019-03-06,6,3,2,1505,1,15,16
Air India,6/06/2019,Kolkata,Banglore,CCU → BOM → BLR,09:25,21:50,12h 25m,1 stop,No info,8366,2019-06-06,6,6,3,745,1,9,21
Air India,3/04/2019,Delhi,Cochin,DEL → MAA → COK,06:05,09:25 04 Apr,27h 20m,1 stop,No info,5117,2019-04-03,3,4,2,1640,1,6,9
Multiple carriers,3/06/2019,Delhi,Cochin,DEL → BOM → COK,08:45,19:00,10h 15m,1 stop,No info,12524,2019-06-03,3,6,0,615,1,8,19
IndiGo,15/05/2019,Delhi,Cochin,DEL → BOM → COK,15:00,01:30 16 May,10h 30m,1 stop,No info,7191,2019-05-15,15,5,2,630,1,15,1
Vistara,24/05/2019,Chennai,Kolkata,MAA → CCU,07:05,09:20,2h 15m,non-stop,No info,3687,2019-05-24,24,5,4,135,0,7,9
IndiGo,24/06/2019,Delhi,Cochin,DEL → BOM → COK,10:35,21:00,10h 25m,1 stop,No info,5894,2019-06-24,24,6,0,625,1,10,21
Vistara,24/04/2019,Banglore,Delhi,BLR → DEL,09:45,12:35,2h 50m,non-stop,No info,5403,2019-04-24,24,4,2,170,0,9,12
Air India,6/05/2019,Mumbai,Hyderabad,BOM → HYD,13:55,15:25,1h 30m,non-stop,No info,3625,2019-05-06,6,5,0,90,0,13,15
Air India,21/05/2019,Delhi,Cochin,DEL → BHO → BOM → COK,05:55,19:15,13h 20m,2 stops,No info,10861,2019-05-21,21,5,1,800,2,5,19
IndiGo,12/03/2019,Chennai,Kolkata,MAA → CCU,13:20,15:35,2h 15m,non-stop,No info,6297,2019-03-12,12,3,1,135,0,13,15
Jet Airways,1/06/2019,Mumbai,Hyderabad,BOM → HYD,07:05,08:30,1h 25m,non-stop,No info,5678,2019-06-01,1,6,5,85,0,7,8
Jet Airways,09/03/2019,Banglore,New Delhi,BLR → BOM → DEL,05:45,08:15 13 Mar,26h 30m,1 stop,In-flight meal not included,9134,2019-03-09,9,3,5,1590,1,5,8
Multiple carriers,24/06/2019,Delhi,Cochin,DEL → BOM → COK,11:40,19:00,7h 20m,1 stop,In-flight meal not included,10791,2019-06-24,24,6,0,440,1,11,19
Jet Airways,24/06/2019,Delhi,Cochin,DEL → AMD → BOM → COK,23:05,12:35 25 Jun,13h 30m,2 stops,No info,12819,2019-06-24,24,6,0,810,2,23,12
IndiGo,21/03/2019,Delhi,Cochin,DEL → BLR → COK,05:05,10:05,5h,1 stop,No info,6893,2019-03-21,21,3,3,300,1,5,10
Vistara,09/03/2019,Banglore,New Delhi,BLR → DEL,09:50,12:35,2h 45m,non-stop,No info,7240,2019-03-09,9,3,5,165,0,9,12
GoAir,3/04/2019,Banglore,Delhi,BLR → DEL,11:40,14:30,2h 50m,non-stop,No info,3898,2019-04-03,3,4,2,170,0,11,14
IndiGo,3/04/2019,Mumbai,Hyderabad,BOM → HYD,06:25,07:55,1h 30m,non-stop,No info,4049,2019-04-03,3,4,2,90,0,6,7
Jet Airways,15/06/2019,Delhi,Cochin,DEL → BOM → COK,17:30,12:35 16 Jun,19h 5m,1 stop,In-flight meal not included,10262,2019-06-15,15,6,5,1145,1,17,12
SpiceJet,21/03/2019,Chennai,Kolkata,MAA → CCU,08:20,10:35,2h 15m,non-stop,No check-in baggage included,3332,2019-03-21,21,3,3,135,0,8,10
Jet Airways,9/06/2019,Kolkata,Banglore,CCU → BOM → BLR,21:10,12:00 10 Jun,14h 50m,1 stop,In-flight meal not included,10844,2019-06-09,9,6,6,890,1,21,12
Jet Airways,24/03/2019,Banglore,New Delhi,BLR → DEL,19:55,22:35,2h 40m,non-stop,No info,7229,2019-03-24,24,3,6,160,0,19,22
Jet Airways,6/05/2019,Kolkata,Banglore,CCU → BOM → BLR,06:30,04:40 07 May,22h 10m,1 stop,No info,13941,2019-05-06,6,5,0,1330,1,6,4
IndiGo,27/06/2019,Delhi,Cochin,DEL → BOM → COK,11:25,21:00,9h 35m,1 stop,No info,5894,2019-06-27,27,6,3,575,1,11,21
Multiple carriers,18/05/2019,Delhi,Cochin,DEL → BOM → COK,09:00,19:00,10h,1 stop,No info,10197,2019-05-18,18,5,5,600,1,9,19
Jet Airways,06/03/2019,Banglore,New Delhi,BLR → BOM → DEL,14:05,11:25 07 Mar,21h 20m,1 stop,In-flight meal not included,13712,2019-03-06,6,3,2,1280,1,14,11
IndiGo,24/06/2019,Delhi,Cochin,DEL → MAA → COK,02:00,07:25,5h 25m,1 stop,No info,5636,2019-06-24,24,6,0,325,1,2,7
Jet Airways,6/06/2019,Delhi,Cochin,DEL → JAI → BOM → COK,09:40,04:25 07 Jun,18h 45m,2 stops,No info,13014,2019-06-06,6,6,3,1125,2,9,4
Jet Airways,1/04/2019,Kolkata,Banglore,CCU → BOM → BLR,08:25,20:45,12h 20m,1 stop,In-flight meal not included,7064,2019-04-01,1,4,0,740,1,8,20
Jet Airways,24/05/2019,Kolkata,Banglore,CCU → DEL → BLR,20:25,14:25 25 May,18h,1 stop,In-flight meal not included,10703,2019-05-24,24,5,4,1080,1,20,14
Multiple carriers,27/05/2019,Delhi,Cochin,DEL → HYD → COK,13:15,22:30,9h 15m,1 stop,No info,9646,2019-05-27,27,5,0,555,1,13,22
Multiple carriers,6/03/2019,Delhi,Cochin,DEL → BOM → COK,02:15,13:20,11h 5m,1 stop,No info,17057,2019-03-06,6,3,2,665,1,2,13
Jet Airways,12/03/2019,Banglore,New Delhi,BLR → BOM → DEL,16:55,10:25 13 Mar,17h 30m,1 stop,No info,13817,2019-03-12,12,3,1,1050,1,16,10
Air India,6/03/2019,Delhi,Cochin,DEL → BHO → BOM → COK,05:55,19:15,13h 20m,2 stops,No info,13748,2019-03-06,6,3,2,800,2,5,19
Air India,21/04/2019,Kolkata,Banglore,CCU → BLR,20:45,23:20,2h 35m,non-stop,No info,4880,2019-04-21,21,4,6,155,0,20,23
IndiGo,21/06/2019,Chennai,Kolkata,MAA → CCU,05:15,07:40,2h 25m,non-stop,No info,3540,2019-06-21,21,6,4,145,0,5,7
SpiceJet,15/05/2019,Banglore,Delhi,BLR → DEL,05:55,08:35,2h 40m,non-stop,No check-in baggage included,3257,2019-05-15,15,5,2,160,0,5,8
Jet Airways,3/06/2019,Banglore,Delhi,BLR → DEL,19:50,22:50,3h,non-stop,In-flight meal not included,6478,2019-06-03,3,6,0,180,0,19,22
Jet Airways,18/06/2019,Mumbai,Hyderabad,BOM → HYD,07:05,08:30,1h 25m,non-stop,No info,8040,2019-06-18,18,6,1,85,0,7,8
Jet Airways,12/06/2019,Delhi,Cochin,DEL → ATQ → BOM → COK,20:00,12:35 13 Jun,16h 35m,2 stops,No info,14300,2019-06-12,12,6,2,995,2,20,12
Jet Airways,15/05/2019,Kolkata,Banglore,CCU → BOM → BLR,08:25,20:45,12h 20m,1 stop,No info,14781,2019-05-15,15,5,2,740,1,8,20
Jet Airways,9/06/2019,Kolkata,Banglore,CCU → BOM → BLR,20:00,08:15 10 Jun,12h 15m,1 stop,No info,14939,2019-06-09,9,6,6,735,1,20,8
Jet Airways,24/06/2019,Delhi,Cochin,DEL → BOM → COK,20:55,04:25 25 Jun,7h 30m,1 stop,In-flight meal not included,10262,2019-06-24,24,6,0,450,1,20,4
Air India,12/05/2019,Kolkata,Banglore,CCU → MAA → BLR,14:35,14:35 13 May,24h,1 stop,No info,6528,2019-05-12,12,5,6,1440,1,14,14
Air India,1/05/2019,Banglore,Delhi,BLR → DEL,06:10,08:55,2h 45m,non-stop,No info,6121,2019-05-01,1,5,2,165,0,6,8
Jet Airways,18/05/2019,Delhi,Cochin,DEL → JAI → BOM → COK,19:30,04:25 19 May,8h 55m,2 stops,In-flight meal not included,13029,2019-05-18,18,5,5,535,2,19,4
Multiple carriers,27/03/2019,Delhi,Cochin,DEL → BOM → COK,11:40,18:50,7h 10m,1 stop,No info,11421,2019-03-27,27,3,2,430,1,11,18
Multiple carriers,27/03/2019,Delhi,Cochin,DEL → BOM → COK,04:45,19:15,14h 30m,1 stop,No info,7574,2019-03-27,27,3,2,870,1,4,19
Air India,9/05/2019,Delhi,Cochin,DEL → JDH → BOM → COK,12:55,19:15 10 May,30h 20m,2 stops,No info,11596,2019-05-09,9,5,3,1820,2,12,19
Jet Airways,24/05/2019,Delhi,Cochin,DEL → AMD → BOM → COK,23:05,19:00 25 May,19h 55m,2 stops,No info,15129,2019-05-24,24,5,4,1195,2,23,19
Jet Airways,18/03/2019,Banglore,New Delhi,BLR → BOM → DEL,14:05,05:05 16 Mar,15h,1 stop,No info,13555,2019-03-18,18,3,0,900,1,14,5
IndiGo,12/04/2019,Banglore,Delhi,BLR → DEL,18:55,21:50,2h 55m,non-stop,No info,5780,2019-04-12,12,4,4,175,0,18,21
Vistara,12/05/2019,Kolkata,Banglore,CCU → DEL → BLR,20:20,09:05 13 May,12h 45m,1 stop,No info,9397,2019-05-12,12,5,6,765,1,20,9
Jet Airways,6/03/2019,Delhi,Cochin,DEL → BOM → COK,18:15,04:25 07 Mar,10h 10m,1 stop,No info,17024,2019-03-06,6,3,2,610,1,18,4
GoAir,27/06/2019,Delhi,Cochin,DEL → BOM → COK,07:00,12:55,5h 55m,1 stop,No info,5281,2019-06-27,27,6,3,355,1,7,12
Multiple carriers,18/05/2019,Delhi,Cochin,DEL → HYD → COK,07:05,22:30,15h 25m,1 stop,No info,10348,2019-05-18,18,5,5,925,1,7,22
Air India,6/03/2019,Delhi,Cochin,DEL → MAA → COK,17:20,09:25 07 Mar,16h 5m,1 stop,No info,12677,2019-03-06,6,3,2,965,1,17,9
Multiple carriers,3/03/2019,Delhi,Cochin,DEL → BOM → COK,15:25,01:35 04 Mar,10h 10m,1 stop,No info,15147,2019-03-03,3,3,6,610,1,15,1
Vistara,12/06/2019,Banglore,Delhi,BLR → DEL,07:00,09:40,2h 40m,non-stop,No info,4668,2019-06-12,12,6,2,160,0,7,9
Jet Airways,9/05/2019,Delhi,Cochin,DEL → BOM → COK,07:05,19:00,11h 55m,1 stop,No info,15554,2019-05-09,9,5,3,715,1,7,19
SpiceJet,9/04/2019,Banglore,Delhi,BLR → DEL,05:55,08:35,2h 40m,non-stop,No info,3971,2019-04-09,9,4,1,160,0,5,8
Air India,3/05/2019,Mumbai,Hyderabad,BOM → HYD,15:00,16:25,1h 25m,non-stop,No info,3100,2019-05-03,3,5,4,85,0,15,16
Jet Airways,6/05/2019,Kolkata,Banglore,CCU → BOM → BLR,20:00,10:05 07 May,14h 5m,1 stop,In-flight meal not included,9663,2019-05-06,6,5,0,845,1,20,10
Air India,1/03/2019,Delhi,Cochin,DEL → BOM → COK,23:00,19:15 02 Mar,20h 15m,1 stop,No info,27430,2019-03-01,1,3,4,1215,1,23,19
IndiGo,12/05/2019,Chennai,Kolkata,MAA → CCU,05:15,07:40,2h 25m,non-stop,No info,3540,2019-05-12,12,5,6,145,0,5,7
Air India,21/05/2019,Kolkata,Banglore,CCU → BBI → BOM → BLR,12:00,11:10 22 May,23h 10m,2 stops,No info,10676,2019-05-21,21,5,1,1390,2,12,11
Jet Airways,12/06/2019,Kolkata,Banglore,CCU → BOM → BLR,14:05,08:15 13 Jun,18h 10m,1 stop,No info,13044,2019-06-12,12,6,2,1090,1,14,8
Jet Airways,6/05/2019,Kolkata,Banglore,CCU → BOM → BLR,20:00,12:00 07 May,16h,1 stop,No info,14388,2019-05-06,6,5,0,960,1,20,12
IndiGo,24/06/2019,Banglore,Delhi,BLR → DEL,04:00,06:50,2h 50m,non-stop,No info,3943,2019-06-24,24,6,0,170,0,4,6
IndiGo,3/06/2019,Chennai,Kolkata,MAA → CCU,14:45,17:05,2h 20m,non-stop,No info,3597,2019-06-03,3,6,0,140,0,14,17
Air India,21/03/2019,Banglore,New Delhi,BLR → MAA → DEL,11:50,19:50,8h,1 stop,No info,5932,2019-03-21,21,3,3,480,1,11,19
Jet Airways,15/06/2019,Delhi,Cochin,DEL → BOM → COK,11:30,04:25 16 Jun,16h 55m,1 stop,In-flight meal not included,10262,2019-06-15,15,6,5,1015,1,11,4
Vistara,12/05/2019,Delhi,Cochin,DEL → COK,14:40,17:50,3h 10m,non-stop,No info,6216,2019-05-12,12,5,6,190,0,14,17
IndiGo,15/06/2019,Kolkata,Banglore,CCU → BLR,20:25,23:10,2h 45m,non-stop,No info,4804,2019-06-15,15,6,5,165,0,20,23
Multiple carriers,21/05/2019,Delhi,Cochin,DEL → BOM → COK,11:30,01:30 22 May,14h,1 stop,No info,14067,2019-05-21,21,5,1,840,1,11,1
Jet Airways,18/05/2019,Delhi,Cochin,DEL → AMD → BOM → COK,19:10,19:00 19 May,23h 50m,2 stops,No info,15129,2019-05-18,18,5,5,1430,2,19,19
Jet Airways,6/06/2019,Delhi,Cochin,DEL → NAG → BOM → COK,06:45,04:25 07 Jun,21h 40m,2 stops,No info,13376,2019-06-06,6,6,3,1300,2,6,4
Air India,27/06/2019,Delhi,Cochin,DEL → GOI → BOM → COK,22:00,19:15 28 Jun,21h 15m,2 stops,No info,10441,2019-06-27,27,6,3,1275,2,22,19
Jet Airways,24/05/2019,Banglore,Delhi,BLR → DEL,06:00,08:45,2h 45m,non-stop,In-flight meal not included,4030,2019-05-24,24,5,4,165,0,6,8
Jet Airways,3/03/2019,Delhi,Cochin,DEL → BOM → COK,08:00,18:50,10h 50m,1 stop,No info,17024,2019-03-03,3,3,6,650,1,8,18
Multiple carriers,9/04/2019,Delhi,Cochin,DEL → BOM → COK,17:30,01:30 10 Apr,8h,1 stop,No info,13017,2019-04-09,9,4,1,480,1,17,1
GoAir,6/06/2019,Kolkata,Banglore,CCU → BOM → BLR,23:30,07:45 07 Jun,8h 15m,1 stop,No info,6686,2019-06-06,6,6,3,495,1,23,7
IndiGo,15/06/2019,Delhi,Cochin,DEL → MAA → COK,02:00,07:25,5h 25m,1 stop,No info,5636,2019-06-15,15,6,5,325,1,2,7
IndiGo,9/06/2019,Delhi,Cochin,DEL → HYD → COK,07:35,16:10,8h 35m,1 stop,No info,6442,2019-06-09,9,6,6,515,1,7,16
Multiple carriers,21/05/2019,Delhi,Cochin,DEL → HYD → COK,13:05,00:55 22 May,11h 50m,1 stop,No info,9486,2019-05-21,21,5,1,710,1,13,0
Jet Airways,21/05/2019,Kolkata,Banglore,CCU → BOM → BLR,20:00,23:35 22 May,27h 35m,1 stop,In-flight meal not included,10844,2019-05-21,21,5,1,1655,1,20,23
Jet Airways,3/06/2019,Delhi,Cochin,DEL → ATQ → BOM → COK,20:00,04:25 04 Jun,8h 25m,2 stops,In-flight meal not included,15318,2019-06-03,3,6,0,505,2,20,4
Air India,3/04/2019,Delhi,Cochin,DEL → MAA → COK,12:30,09:25 04 Apr,20h 55m,1 stop,No info,5117,2019-04-03,3,4,2,1255,1,12,9
IndiGo,24/06/2019,Delhi,Cochin,DEL → BLR → COK,15:10,20:00,4h 50m,1 stop,No info,6147,2019-06-24,24,6,0,290,1,15,20
Multiple carriers,9/06/2019,Delhi,Cochin,DEL → BOM → COK,12:50,21:00,8h 10m,1 stop,No info,7005,2019-06-09,9,6,6,490,1,12,21
SpiceJet,3/04/2019,Kolkata,Banglore,CCU → BLR,22:20,00:40 04 Apr,2h 20m,non-stop,No info,3873,2019-04-03,3,4,2,140,0,22,0
Jet Airways,21/03/2019,Delhi,Cochin,DEL → BDQ → BOM → COK,18:25,18:50 22 Mar,24h 25m,2 stops,In-flight meal not included,9270,2019-03-21,21,3,3,1465,2,18,18
GoAir,27/06/2019,Banglore,Delhi,BLR → DEL,11:40,14:30,2h 50m,non-stop,No info,3898,2019-06-27,27,6,3,170,0,11,14
Jet Airways,12/05/2019,Kolkata,Banglore,CCU → BOM → BLR,08:25,20:45,12h 20m,1 stop,No info,14781,2019-05-12,12,5,6,740,1,8,20
Jet Airways,24/05/2019,Kolkata,Banglore,CCU → BOM → BLR,20:00,08:15 25 May,12h 15m,1 stop,In-flight meal not included,8586,2019-05-24,24,5,4,735,1,20,8
Air India,9/05/2019,Kolkata,Banglore,CCU → JAI → BOM → BLR,08:20,07:55 10 May,23h 35m,2 stops,No info,10697,2019-05-09,9,5,3,1415,2,8,7
Jet Airways,27/06/2019,Delhi,Cochin,DEL → ATQ → BOM → COK,20:00,12:35 28 Jun,16h 35m,2 stops,No info,14300,2019-06-27,27,6,3,995,2,20,12
IndiGo,03/03/2019,Banglore,New Delhi,BLR → DEL,18:55,21:45,2h 50m,non-stop,No info,8855,2019-03-03,3,3,6,170,0,18,21
Jet Airways,12/05/2019,Kolkata,Banglore,CCU → BOM → BLR,16:30,18:15 13 May,25h 45m,1 stop,In-flight meal not included,10844,2019-05-12,12,5,6,1545,1,16,18
Jet Airways,6/03/2019,Delhi,Cochin,DEL → BOM → COK,02:15,04:25 07 Mar,26h 10m,1 stop,No info,17024,2019-03-06,6,3,2,1570,1,2,4
Jet Airways,1/05/2019,Kolkata,Banglore,CCU → DEL → BLR,09:35,14:25 02 May,28h 50m,1 stop,In-flight meal not included,9314,2019-05-01,1,5,2,1730,1,9,14
IndiGo,24/03/2019,Banglore,New Delhi,BLR → DEL,00:40,03:25,2h 45m,non-stop,No info,4777,2019-03-24,24,3,6,165,0,0,3
Air India,9/06/2019,Kolkata,Banglore,CCU → BBI → BLR,12:00,13:15 10 Jun,25h 15m,1 stop,No info,7662,2019-06-09,9,6,6,1515,1,12,13
IndiGo,9/05/2019,Delhi,Cochin,DEL → HYD → COK,06:50,16:10,9h 20m,1 stop,No info,6442,2019-05-09,9,5,3,560,1,6,16
SpiceJet,12/06/2019,Delhi,Cochin,DEL → PNQ → COK,08:45,13:15,4h 30m,1 stop,No info,5264,2019-06-12,12,6,2,270,1,8,13
Jet Airways,27/05/2019,Delhi,Cochin,DEL → BOM → COK,13:00,04:25 28 May,15h 25m,1 stop,In-flight meal not included,12898,2019-05-27,27,5,0,925,1,13,4
Air India,3/03/2019,Mumbai,Hyderabad,BOM → HYD,13:55,15:25,1h 30m,non-stop,No info,6092,2019-03-03,3,3,6,90,0,13,15
SpiceJet,21/05/2019,Banglore,Delhi,BLR → DEL,05:55,08:35,2h 40m,non-stop,No info,3311,2019-05-21,21,5,1,160,0,5,8
Jet Airways,27/03/2019,Delhi,Cochin,DEL → BOM → COK,19:15,04:25 28 Mar,9h 10m,1 stop,In-flight meal not included,6540,2019-03-27,27,3,2,550,1,19,4
IndiGo,27/05/2019,Banglore,Delhi,BLR → DEL,01:30,04:15,2h 45m,non-stop,No info,3419,2019-05-27,27,5,0,165,0,1,4
Jet Airways,3/04/2019,Delhi,Cochin,DEL → BOM → COK,14:00,12:35 04 Apr,22h 35m,1 stop,In-flight meal not included,5177,2019-04-03,3,4,2,1355,1,14,12
Air India,18/04/2019,Delhi,Cochin,DEL → COK,18:05,21:10,3h 5m,non-stop,No info,8246,2019-04-18,18,4,3,185,0,18,21
Jet Airways,9/06/2019,Kolkata,Banglore,CCU → DEL → BLR,09:35,21:05,11h 30m,1 stop,No info,14676,2019-06-09,9,6,6,690,1,9,21
Multiple carriers,27/06/2019,Delhi,Cochin,DEL → BOM → COK,11:30,21:00,9h 30m,1 stop,No info,13587,2019-06-27,27,6,3,570,1,11,21
Jet Airways,6/05/2019,Kolkata,Banglore,CCU → BOM → BLR,21:10,09:20 07 May,12h 10m,1 stop,In-flight meal not included,9663,2019-05-06,6,5,0,730,1,21,9
Jet Airways,12/06/2019,Kolkata,Banglore,CCU → BOM → BLR,16:30,10:05 13 Jun,17h 35m,1 stop,No info,13044,2019-06-12,12,6,2,1055,1,16,10
IndiGo,3/04/2019,Delhi,Cochin,DEL → BOM → COK,20:25,01:30 04 Apr,5h 5m,1 stop,No info,5073,2019-04-03,3,4,2,305,1,20,1
Vistara,21/05/2019,Kolkata,Banglore,CCU → DEL → BLR,17:00,18:50 22 May,25h 50m,1 stop,No info,9345,2019-05-21,21,5,1,1550,1,17,18
Jet Airways,6/05/2019,Kolkata,Banglore,CCU → BOM → BLR,14:05,10:05 07 May,20h,1 stop,In-flight meal not included,9663,2019-05-06,6,5,0,1200,1,14,10
Multiple carriers,21/05/2019,Delhi,Cochin,DEL → BOM → COK,08:00,21:00,13h,1 stop,No info,14277,2019-05-21,21,5,1,780,1,8,21
Jet Airways,1/06/2019,Delhi,Cochin,DEL → BOM → COK,10:00,04:25 02 Jun,18h 25m,1 stop,In-flight meal not included,10262,2019-06-01,1,6,5,1105,1,10,4
Jet Airways,27/03/2019,Mumbai,Hyderabad,BOM → HYD,19:35,21:05,1h 30m,non-stop,No info,5678,2019-03-27,27,3,2,90,0,19,21
Multiple carriers,15/05/2019,Delhi,Cochin,DEL → BOM → COK,16:00,01:30 16 May,9h 30m,1 stop,No info,13727,2019-05-15,15,5,2,570,1,16,1
Jet Airways,6/05/2019,Kolkata,Banglore,CCU → BOM → BLR,20:00,12:00 07 May,16h,1 stop,In-flight meal not included,9663,2019-05-06,6,5,0,960,1,20,12
IndiGo,12/05/2019,Chennai,Kolkata,MAA → CCU,14:45,17:05,2h 20m,non-stop,No info,3858,2019-05-12,12,5,6,140,0,14,17
SpiceJet,24/06/2019,Delhi,Cochin,DEL → PNQ → COK,08:45,13:15,4h 30m,1 stop,No info,4812,2019-06-24,24,6,0,270,1,8,13
IndiGo,27/06/2019,Delhi,Cochin,DEL → LKO → COK,21:50,03:35 28 Jun,5h 45m,1 stop,No info,5775,2019-06-27,27,6,3,345,1,21,3
Jet Airways,6/06/2019,Kolkata,Banglore,CCU → DEL → BLR,09:35,09:45 07 Jun,24h 10m,1 stop,In-flight meal not included,10539,2019-06-06,6,6,3,1450,1,9,9
IndiGo,3/06/2019,Kolkata,Banglore,CCU → BLR,15:30,18:05,2h 35m,non-stop,No info,4804,2019-06-03,3,6,0,155,0,15,18
Air Asia,12/06/2019,Banglore,Delhi,BLR → DEL,11:10,13:55,2h 45m,non-stop,No info,3383,2019-06-12,12,6,2,165,0,11,13
IndiGo,03/03/2019,Banglore,New Delhi,BLR → HYD → DEL,12:10,17:05,4h 55m,1 stop,No info,8738,2019-03-03,3,3,6,295,1,12,17
Air India,27/03/2019,Delhi,Cochin,DEL → TRV → COK,05:15,06:50 28 Mar,25h 35m,1 stop,No info,7165,2019-03-27,27,3,2,1535,1,5,6
IndiGo,24/06/2019,Delhi,Cochin,DEL → HYD → COK,16:10,22:30,6h 20m,1 stop,No info,6412,2019-06-24,24,6,0,380,1,16,22
Jet Airways,27/06/2019,Banglore,Delhi,BLR → DEL,18:55,22:00,3h 5m,non-stop,No info,8016,2019-06-27,27,6,3,185,0,18,22
Jet Airways,12/03/2019,Banglore,New Delhi,BLR → BOM → DEL,20:35,15:15 13 Mar,18h 40m,1 stop,In-flight meal not included,11087,2019-03-12,12,3,1,1120,1,20,15
SpiceJet,27/06/2019,Chennai,Kolkata,MAA → CCU,09:45,12:00,2h 15m,non-stop,No check-in baggage included,3543,2019-06-27,27,6,3,135,0,9,12
Jet Airways,12/06/2019,Kolkata,Banglore,CCU → BOM → BLR,16:30,04:40 13 Jun,12h 10m,1 stop,No info,12471,2019-06-12,12,6,2,730,1,16,4
Jet Airways,24/06/2019,Delhi,Cochin,DEL → BOM → COK,09:00,04:25 25 Jun,19h 25m,1 stop,In-flight meal not included,10262,2019-06-24,24,6,0,1165,1,9,4
Air India,18/03/2019,Banglore,New Delhi,BLR → DEL,13:20,16:10,2h 50m,non-stop,No info,4441,2019-03-18,18,3,0,170,0,13,16
Multiple carriers,27/03/2019,Delhi,Cochin,DEL → BOM → COK,07:05,15:30,8h 25m,1 stop,No info,12537,2019-03-27,27,3,2,505,1,7,15
GoAir,24/03/2019,Kolkata,Banglore,CCU → BOM → BLR,22:25,07:40 25 Mar,9h 15m,1 stop,No info,10091,2019-03-24,24,3,6,555,1,22,7
Air India,3/06/2019,Banglore,Delhi,BLR → DEL,21:05,23:55,2h 50m,non-stop,No info,6961,2019-06-03,3,6,0,170,0,21,23
IndiGo,24/04/2019,Delhi,Cochin,DEL → COK,05:35,08:50,3h 15m,non-stop,No info,5013,2019-04-24,24,4,2,195,0,5,8
Air India,18/05/2019,Delhi,Cochin,DEL → COK,05:10,08:00,2h 50m,non-stop,No info,6934,2019-05-18,18,5,5,170,0,5,8
Multiple carriers,3/06/2019,Delhi,Cochin,DEL → BOM → COK,06:40,19:00,12h 20m,1 stop,No info,10877,2019-06-03,3,6,0,740,1,6,19
Jet Airways,18/04/2019,Banglore,Delhi,BLR → DEL,15:15,18:10,2h 55m,non-stop,No info,7229,2019-04-18,18,4,3,175,0,15,18
IndiGo,27/03/2019,Delhi,Cochin,DEL → BOM → COK,16:00,01:35 28 Mar,9h 35m,1 stop,No info,7048,2019-03-27,27,3,2,575,1,16,1
Vistara,27/06/2019,Banglore,Delhi,BLR → DEL,17:00,19:35,2h 35m,non-stop,No info,4878,2019-06-27,27,6,3,155,0,17,19
Jet Airways,21/05/2019,Kolkata,Banglore,CCU → BOM → BLR,14:05,23:35,9h 30m,1 stop,In-flight meal not included,10844,2019-05-21,21,5,1,570,1,14,23
Jet Airways,18/05/2019,Delhi,Cochin,DEL → AMD → BOM → COK,23:05,04:25 20 May,29h 20m,2 stops,No info,15129,2019-05-18,18,5,5,1760,2,23,4
IndiGo,12/05/2019,Banglore,Delhi,BLR → DEL,00:30,03:25,2h 55m,non-stop,No info,3943,2019-05-12,12,5,6,175,0,0,3
SpiceJet,6/06/2019,Delhi,Cochin,DEL → MAA → COK,06:05,11:20,5h 15m,1 stop,No info,5583,2019-06-06,6,6,3,315,1,6,11
Multiple carriers,6/06/2019,Delhi,Cochin,DEL → HYD → COK,07:05,16:10,9h 5m,1 stop,No info,9646,2019-06-06,6,6,3,545,1,7,16
Multiple carriers,3/06/2019,Delhi,Cochin,DEL → BOM → COK,08:30,19:15,10h 45m,1 stop,No info,7677,2019-06-03,3,6,0,645,1,8,19
IndiGo,1/06/2019,Delhi,Cochin,DEL → BLR → COK,05:10,10:05,4h 55m,1 stop,No info,6842,2019-06-01,1,6,5,295,1,5,10
Jet Airways,24/06/2019,Mumbai,Hyderabad,BOM → HYD,08:45,10:15,1h 30m,non-stop,In-flight meal not included,4995,2019-06-24,24,6,0,90,0,8,10
Vistara,9/06/2019,Kolkata,Banglore,CCU → DEL → BLR,07:10,18:50,11h 40m,1 stop,No info,9555,2019-06-09,9,6,6,700,1,7,18
IndiGo,1/06/2019,Banglore,Delhi,BLR → DEL,01:30,04:15,2h 45m,non-stop,No info,4077,2019-06-01,1,6,5,165,0,1,4
Jet Airways,12/05/2019,Banglore,Delhi,BLR → DEL,15:15,18:10,2h 55m,non-stop,No info,7229,2019-05-12,12,5,6,175,0,15,18
Multiple carriers,9/06/2019,Delhi,Cochin,DEL → BOM → COK,09:00,19:00,10h,1 stop,No info,12192,2019-06-09,9,6,6,600,1,9,19
Air India,12/04/2019,Banglore,Delhi,BLR → DEL,10:00,12:45,2h 45m,non-stop,No info,5911,2019-04-12,12,4,4,165,0,10,12
Air India,12/06/2019,Delhi,Cochin,DEL → BOM → COK,09:00,19:15,10h 15m,1 stop,No info,8372,2019-06-12,12,6,2,615,1,9,19
Jet Airways,18/03/2019,Mumbai,Hyderabad,BOM → HYD,07:10,08:35,1h 25m,non-stop,In-flight meal not included,4995,2019-03-18,18,3,0,85,0,7,8
Multiple carriers,9/05/2019,Delhi,Cochin,DEL → BOM → COK,10:00,19:15,9h 15m,1 stop,No info,14323,2019-05-09,9,5,3,555,1,10,19
Jet Airways,9/06/2019,Delhi,Cochin,DEL → JAI → BOM → COK,05:30,04:25 10 Jun,22h 55m,2 stops,No info,13014,2019-06-09,9,6,6,1375,2,5,4
Air India,6/06/2019,Delhi,Cochin,DEL → CCU → BOM → COK,14:25,19:15 07 Jun,28h 50m,2 stops,No info,13591,2019-06-06,6,6,3,1730,2,14,19
Jet Airways,3/03/2019,Delhi,Cochin,DEL → IDR → BOM → COK,05:25,18:50 04 Mar,37h 25m,2 stops,No info,18799,2019-03-03,3,3,6,2245,2,5,18
IndiGo,27/04/2019,Banglore,Delhi,BLR → DEL,23:30,02:20 28 Apr,2h 50m,non-stop,No info,3943,2019-04-27,27,4,5,170,0,23,2
SpiceJet,21/05/2019,Mumbai,Hyderabad,BOM → HYD,05:45,07:15,1h 30m,non-stop,No check-in baggage included,1965,2019-05-21,21,5,1,90,0,5,7
Jet Airways,27/05/2019,Mumbai,Hyderabad,BOM → HYD,10:20,11:50,1h 30m,non-stop,In-flight meal not included,4995,2019-05-27,27,5,0,90,0,10,11
Air India,24/03/2019,Kolkata,Banglore,CCU → BOM → BLR,16:50,18:30 25 Mar,25h 40m,1 stop,No info,14641,2019-03-24,24,3,6,1540,1,16,18
Air India,12/04/2019,Kolkata,Banglore,CCU → BLR,20:45,23:20,2h 35m,non-stop,No info,4460,2019-04-12,12,4,4,155,0,20,23
Air India,18/05/2019,Delhi,Cochin,DEL → BOM → COK,13:00,19:15,6h 15m,1 stop,No info,10191,2019-05-18,18,5,5,375,1,13,19
Jet Airways,9/03/2019,Delhi,Cochin,DEL → BOM → COK,02:15,19:45,17h 30m,1 stop,In-flight meal not included,13843,2019-03-09,9,3,5,1050,1,2,19
IndiGo,1/05/2019,Delhi,Cochin,DEL → LKO → COK,21:50,03:35 02 May,5h 45m,1 stop,No info,6349,2019-05-01,1,5,2,345,1,21,3
Air Asia,1/05/2019,Kolkata,Banglore,CCU → BLR,10:20,12:55,2h 35m,non-stop,No info,4409,2019-05-01,1,5,2,155,0,10,12
Jet Airways,6/03/2019,Delhi,Cochin,DEL → BOM → COK,18:15,19:45 07 Mar,25h 30m,1 stop,No info,17024,2019-03-06,6,3,2,1530,1,18,19
Multiple carriers,18/05/2019,Delhi,Cochin,DEL → BOM → COK,07:05,21:00,13h 55m,1 stop,No info,13727,2019-05-18,18,5,5,835,1,7,21
IndiGo,15/03/2019,Banglore,New Delhi,BLR → DEL,18:25,21:20,2h 55m,non-stop,No info,8855,2019-03-15,15,3,4,175,0,18,21
Multiple carriers,24/06/2019,Delhi,Cochin,DEL → BOM → COK,08:45,19:00,10h 15m,1 stop,No info,12524,2019-06-24,24,6,0,615,1,8,19
Jet Airways,18/03/2019,Banglore,New Delhi,BLR → BOM → DEL,11:40,20:20,8h 40m,1 stop,No info,13555,2019-03-18,18,3,0,520,1,11,20
Jet Airways,6/06/2019,Kolkata,Banglore,CCU → BOM → BLR,06:30,12:00,5h 30m,1 stop,In-flight meal not included,10844,2019-06-06,6,6,3,330,1,6,12
Multiple carriers,9/06/2019,Delhi,Cochin,DEL → BOM → COK,09:00,21:00,12h,1 stop,No info,13587,2019-06-09,9,6,6,720,1,9,21
SpiceJet,12/06/2019,Chennai,Kolkata,MAA → CCU,09:45,12:00,2h 15m,non-stop,No check-in baggage included,3543,2019-06-12,12,6,2,135,0,9,12
Vistara,18/03/2019,Chennai,Kolkata,MAA → CCU,07:05,09:20,2h 15m,non-stop,No info,4842,2019-03-18,18,3,0,135,0,7,9
IndiGo,24/04/2019,Banglore,Delhi,BLR → DEL,23:30,02:20 25 Apr,2h 50m,non-stop,No info,3943,2019-04-24,24,4,2,170,0,23,2
Jet Airways,9/06/2019,Delhi,Cochin,DEL → BOM → COK,19:15,04:25 10 Jun,9h 10m,1 stop,In-flight meal not included,10577,2019-06-09,9,6,6,550,1,19,4
IndiGo,15/05/2019,Delhi,Cochin,DEL → BOM → COK,10:35,21:00,10h 25m,1 stop,No info,6979,2019-05-15,15,5,2,625,1,10,21
Vistara,27/06/2019,Chennai,Kolkata,MAA → CCU,17:45,20:05,2h 20m,non-stop,No info,11982,2019-06-27,27,6,3,140,0,17,20
SpiceJet,6/06/2019,Delhi,Cochin,DEL → PNQ → COK,08:45,13:15,4h 30m,1 stop,No info,5264,2019-06-06,6,6,3,270,1,8,13
Vistara,3/03/2019,Delhi,Cochin,DEL → COK,06:00,09:10,3h 10m,non-stop,No info,8001,2019-03-03,3,3,6,190,0,6,9
Air India,1/06/2019,Delhi,Cochin,DEL → AMD → BOM → COK,19:45,19:15 02 Jun,23h 30m,2 stops,No info,10651,2019-06-01,1,6,5,1410,2,19,19
Jet Airways,24/05/2019,Kolkata,Banglore,CCU → BOM → BLR,16:30,19:50 25 May,27h 20m,1 stop,In-flight meal not included,10844,2019-05-24,24,5,4,1640,1,16,19
Multiple carriers,27/03/2019,Delhi,Cochin,DEL → HYD → COK,09:45,22:20,12h 35m,1 stop,No info,6601,2019-03-27,27,3,2,755,1,9,22
Air India,21/03/2019,Delhi,Cochin,DEL → BOM → COK,19:00,19:15 22 Mar,24h 15m,1 stop,No info,6587,2019-03-21,21,3,3,1455,1,19,19
SpiceJet,21/03/2019,Mumbai,Hyderabad,BOM → HYD,13:10,14:30,1h 20m,non-stop,No info,3173,2019-03-21,21,3,3,80,0,13,14
Air India,9/05/2019,Banglore,Delhi,BLR → DEL,10:00,12:45,2h 45m,non-stop,No info,5228,2019-05-09,9,5,3,165,0,10,12
Jet Airways,21/06/2019,Banglore,Delhi,BLR → DEL,07:10,10:10,3h,non-stop,In-flight meal not included,5769,2019-06-21,21,6,4,180,0,7,10
Jet Airways,6/06/2019,Delhi,Cochin,DEL → BOM → COK,08:00,19:00,11h,1 stop,No info,14714,2019-06-06,6,6,3,660,1,8,19
Jet Airways,3/06/2019,Delhi,Cochin,DEL → JAI → BOM → COK,05:30,19:00,13h 30m,2 stops,No info,13014,2019-06-03,3,6,0,810,2,5,19
IndiGo,3/06/2019,Banglore,Delhi,BLR → DEL,22:10,01:00 04 Jun,2h 50m,non-stop,No info,3359,2019-06-03,3,6,0,170,0,22,1
GoAir,03/03/2019,Banglore,New Delhi,BLR → DEL,20:55,23:50,2h 55m,non-stop,No info,6722,2019-03-03,3,3,6,175,0,20,23
IndiGo,18/03/2019,Kolkata,Banglore,CCU → BLR,09:35,12:20,2h 45m,non-stop,No info,4462,2019-03-18,18,3,0,165,0,9,12
IndiGo,9/03/2019,Delhi,Cochin,DEL → HYD → COK,04:55,16:10,11h 15m,1 stop,No info,6171,2019-03-09,9,3,5,675,1,4,16
Air India,21/05/2019,Kolkata,Banglore,CCU → IXR → DEL → BLR,05:50,20:25,14h 35m,2 stops,No info,12303,2019-05-21,21,5,1,875,2,5,20
Multiple carriers,21/03/2019,Delhi,Cochin,DEL → BOM → COK,11:40,01:35 22 Mar,13h 55m,1 stop,No info,7695,2019-03-21,21,3,3,835,1,11,1
IndiGo,24/06/2019,Delhi,Cochin,DEL → BOM → COK,11:25,01:30 25 Jun,14h 5m,1 stop,No info,5684,2019-06-24,24,6,0,845,1,11,1
Air India,12/06/2019,Kolkata,Banglore,CCU → BOM → BLR,16:50,07:55 13 Jun,15h 5m,1 stop,No info,8366,2019-06-12,12,6,2,905,1,16,7
Air India,1/03/2019,Chennai,Kolkata,MAA → CCU,11:40,13:55,2h 15m,non-stop,No info,19630,2019-03-01,1,3,4,135,0,11,13
Jet Airways,06/03/2019,Banglore,New Delhi,BLR → BOM → DEL,14:05,05:05 07 Mar,15h,1 stop,In-flight meal not included,13502,2019-03-06,6,3,2,900,1,14,5
Jet Airways,1/05/2019,Kolkata,Banglore,CCU → BOM → BLR,21:10,10:05 02 May,12h 55m,1 stop,No info,14781,2019-05-01,1,5,2,775,1,21,10
Multiple carriers,12/06/2019,Delhi,Cochin,DEL → HYD → COK,07:10,16:10,9h,1 stop,No info,6513,2019-06-12,12,6,2,540,1,7,16
Air India,1/06/2019,Delhi,Cochin,DEL → BOM → COK,07:00,19:15,12h 15m,1 stop,No info,9929,2019-06-01,1,6,5,735,1,7,19
Multiple carriers,6/06/2019,Delhi,Cochin,DEL → IXU → BOM → COK,17:50,01:30 07 Jun,7h 40m,2 stops,No info,18275,2019-06-06,6,6,3,460,2,17,1
Air India,9/04/2019,Delhi,Cochin,DEL → MAA → COK,06:05,09:25 10 Apr,27h 20m,1 stop,No info,4487,2019-04-09,9,4,1,1640,1,6,9
IndiGo,15/03/2019,Mumbai,Hyderabad,BOM → HYD,21:20,22:45,1h 25m,non-stop,No info,2754,2019-03-15,15,3,4,85,0,21,22
Air India,27/03/2019,Mumbai,Hyderabad,BOM → HYD,06:20,07:40,1h 20m,non-stop,No info,2575,2019-03-27,27,3,2,80,0,6,7
SpiceJet,12/06/2019,Kolkata,Banglore,CCU → IXB → BLR,15:55,21:25,5h 30m,1 stop,No info,8224,2019-06-12,12,6,2,330,1,15,21
Air India,9/03/2019,Delhi,Cochin,DEL → BLR → COK,20:30,08:15 10 Mar,11h 45m,1 stop,No info,8991,2019-03-09,9,3,5,705,1,20,8
IndiGo,24/06/2019,Delhi,Cochin,DEL → COK,05:35,08:50,3h 15m,non-stop,No info,5000,2019-06-24,24,6,0,195,0,5,8
Jet Airways,12/06/2019,Kolkata,Banglore,CCU → BOM → BLR,18:55,19:50 13 Jun,24h 55m,1 stop,In-flight meal not included,8529,2019-06-12,12,6,2,1495,1,18,19
Air India,3/03/2019,Delhi,Cochin,DEL → MAA → COK,06:05,09:25 04 Mar,27h 20m,1 stop,No info,14042,2019-03-03,3,3,6,1640,1,6,9
Jet Airways,24/05/2019,Banglore,Delhi,BLR → DEL,11:10,14:05,2h 55m,non-stop,In-flight meal not included,4030,2019-05-24,24,5,4,175,0,11,14
Jet Airways,6/06/2019,Kolkata,Banglore,CCU → BOM → BLR,18:55,12:00 07 Jun,17h 5m,1 stop,In-flight meal not included,10844,2019-06-06,6,6,3,1025,1,18,12
IndiGo,6/05/2019,Kolkata,Banglore,CCU → BLR,21:25,00:05 07 May,2h 40m,non-stop,No info,4804,2019-05-06,6,5,0,160,0,21,0
Multiple carriers,27/05/2019,Delhi,Cochin,DEL → BOM → COK,17:30,01:30 28 May,8h,1 stop,In-flight meal not included,7308,2019-05-27,27,5,0,480,1,17,1
IndiGo,12/05/2019,Banglore,Delhi,BLR → DEL,16:55,19:55,3h,non-stop,No info,4823,2019-05-12,12,5,6,180,0,16,19
Jet Airways,24/06/2019,Delhi,Cochin,DEL → BOM → COK,09:00,12:35 25 Jun,27h 35m,1 stop,In-flight meal not included,10262,2019-06-24,24,6,0,1655,1,9,12
Jet Airways,27/05/2019,Delhi,Cochin,DEL → BOM → COK,20:55,04:25 28 May,7h 30m,1 stop,In-flight meal not included,12898,2019-05-27,27,5,0,450,1,20,4
Air India,12/03/2019,Banglore,New Delhi,BLR → BOM → JDH → DEL,17:25,16:20 13 Mar,22h 55m,2 stops,No info,12778,2019-03-12,12,3,1,1375,2,17,16
IndiGo,3/03/2019,Delhi,Cochin,DEL → BOM → COK,04:45,13:20,8h 35m,1 stop,No info,14871,2019-03-03,3,3,6,515,1,4,13
Air India,21/03/2019,Delhi,Cochin,DEL → UDR → BOM → COK,13:20,19:15 22 Mar,29h 55m,2 stops,No info,8708,2019-03-21,21,3,3,1795,2,13,19
Jet Airways,6/06/2019,Kolkata,Banglore,CCU → BOM → BLR,20:00,18:15 07 Jun,22h 15m,1 stop,In-flight meal not included,10844,2019-06-06,6,6,3,1335,1,20,18
SpiceJet,6/03/2019,Mumbai,Hyderabad,BOM → HYD,05:45,07:05,1h 20m,non-stop,No info,4129,2019-03-06,6,3,2,80,0,5,7
IndiGo,18/05/2019,Kolkata,Banglore,CCU → BLR,21:25,00:05 19 May,2h 40m,non-stop,No info,4804,2019-05-18,18,5,5,160,0,21,0
Jet Airways,6/05/2019,Banglore,Delhi,BLR → DEL,08:20,11:20,3h,non-stop,No info,7229,2019-05-06,6,5,0,180,0,8,11
Jet Airways,21/03/2019,Banglore,New Delhi,BLR → BOM → DEL,07:00,19:10,12h 10m,1 stop,In-flight meal not included,7832,2019-03-21,21,3,3,730,1,7,19
SpiceJet,18/03/2019,Chennai,Kolkata,MAA → CCU,09:30,12:05,2h 35m,non-stop,No info,3859,2019-03-18,18,3,0,155,0,9,12
Multiple carriers,6/06/2019,Delhi,Cochin,DEL → BOM → COK,07:30,19:15,11h 45m,1 stop,No info,9001,2019-06-06,6,6,3,705,1,7,19
Vistara,9/05/2019,Banglore,Delhi,BLR → DEL,17:00,19:35,2h 35m,non-stop,No info,4878,2019-05-09,9,5,3,155,0,17,19
IndiGo,3/05/2019,Mumbai,Hyderabad,BOM → HYD,02:35,04:05,1h 30m,non-stop,No info,2754,2019-05-03,3,5,4,90,0,2,4
Vistara,27/06/2019,Banglore,Delhi,BLR → DEL,07:00,09:40,2h 40m,non-stop,No info,4668,2019-06-27,27,6,3,160,0,7,9
Air Asia,12/05/2019,Kolkata,Banglore,CCU → BLR,10:20,12:55,2h 35m,non-stop,No info,5216,2019-05-12,12,5,6,155,0,10,12
Jet Airways,6/06/2019,Delhi,Cochin,DEL → JAI → BOM → COK,05:30,04:25 07 Jun,22h 55m,2 stops,In-flight meal not included,10368,2019-06-06,6,6,3,1375,2,5,4
IndiGo,9/03/2019,Delhi,Cochin,DEL → HYD → MAA → COK,06:40,21:20,14h 40m,2 stops,No info,8146,2019-03-09,9,3,5,880,2,6,21
Jet Airways,27/03/2019,Delhi,Cochin,DEL → BOM → COK,13:00,04:25 28 Mar,15h 25m,1 stop,No info,12242,2019-03-27,27,3,2,925,1,13,4
Jet Airways,15/03/2019,Banglore,New Delhi,BLR → BOM → DEL,08:00,15:15,7h 15m,1 stop,In-flight meal not included,9134,2019-03-15,15,3,4,435,1,8,15
Air India,6/06/2019,Delhi,Cochin,DEL → HYD → MAA → COK,13:15,09:25 07 Jun,20h 10m,2 stops,No info,10939,2019-06-06,6,6,3,1210,2,13,9
Air India,6/06/2019,Delhi,Cochin,DEL → GOI → BOM → COK,10:55,07:40 07 Jun,20h 45m,2 stops,No info,11753,2019-06-06,6,6,3,1245,2,10,7
SpiceJet,24/04/2019,Kolkata,Banglore,CCU → BLR,17:10,19:40,2h 30m,non-stop,No info,4174,2019-04-24,24,4,2,150,0,17,19
Jet Airways,21/05/2019,Kolkata,Banglore,CCU → BOM → BLR,20:00,19:50 22 May,23h 50m,1 stop,In-flight meal not included,10844,2019-05-21,21,5,1,1430,1,20,19
Jet Airways,3/06/2019,Delhi,Cochin,DEL → BOM → COK,16:00,19:00 04 Jun,27h,1 stop,No info,14714,2019-06-03,3,6,0,1620,1,16,19
Jet Airways,12/06/2019,Kolkata,Banglore,CCU → BOM → BLR,06:30,12:00,5h 30m,1 stop,In-flight meal not included,9899,2019-06-12,12,6,2,330,1,6,12
IndiGo,3/03/2019,Delhi,Cochin,DEL → BOM → COK,09:10,21:00,11h 50m,1 stop,No info,14871,2019-03-03,3,3,6,710,1,9,21
IndiGo,6/03/2019,Chennai,Kolkata,MAA → CCU,13:20,15:35,2h 15m,non-stop,No info,7295,2019-03-06,6,3,2,135,0,13,15
Air India,6/06/2019,Delhi,Cochin,DEL → JAI → BOM → COK,18:45,19:15 07 Jun,24h 30m,2 stops,No info,13465,2019-06-06,6,6,3,1470,2,18,19
SpiceJet,21/05/2019,Chennai,Kolkata,MAA → CCU,17:45,20:05,2h 20m,non-stop,No check-in baggage included,3543,2019-05-21,21,5,1,140,0,17,20
Multiple carriers,27/06/2019,Delhi,Cochin,DEL → BOM → COK,19:00,01:30 28 Jun,6h 30m,1 stop,No info,7198,2019-06-27,27,6,3,390,1,19,1
Jet Airways,1/06/2019,Delhi,Cochin,DEL → BOM → COK,08:00,04:25 02 Jun,20h 25m,1 stop,In-flight meal not included,10262,2019-06-01,1,6,5,1225,1,8,4
IndiGo,15/03/2019,Kolkata,Banglore,CCU → BLR,15:20,17:55,2h 35m,non-stop,No info,4148,2019-03-15,15,3,4,155,0,15,17
Jet Airways,27/06/2019,Banglore,Delhi,BLR → DEL,15:15,18:10,2h 55m,non-stop,No info,8016,2019-06-27,27,6,3,175,0,15,18
Jet Airways,9/06/2019,Delhi,Cochin,DEL → BOM → COK,22:50,04:25 10 Jun,5h 35m,1 stop,In-flight meal not included,10262,2019-06-09,9,6,6,335,1,22,4
SpiceJet,15/06/2019,Kolkata,Banglore,CCU → BLR,14:55,17:25,2h 30m,non-stop,No check-in baggage included,3841,2019-06-15,15,6,5,150,0,14,17
Jet Airways,12/03/2019,Banglore,New Delhi,BLR → MAA → DEL,09:45,00:30 13 Mar,14h 45m,1 stop,No info,11507,2019-03-12,12,3,1,885,1,9,0
Jet Airways,1/05/2019,Kolkata,Banglore,CCU → BOM → BLR,08:25,20:45,12h 20m,1 stop,No info,14781,2019-05-01,1,5,2,740,1,8,20
Jet Airways,27/05/2019,Delhi,Cochin,DEL → BOM → COK,17:30,19:00 28 May,25h 30m,1 stop,No info,16079,2019-05-27,27,5,0,1530,1,17,19
Jet Airways,27/05/2019,Delhi,Cochin,DEL → BOM → COK,22:50,04:25 28 May,5h 35m,1 stop,In-flight meal not included,12898,2019-05-27,27,5,0,335,1,22,4
Multiple carriers,6/03/2019,Delhi,Cochin,DEL → BOM → COK,07:30,19:15,11h 45m,1 stop,No info,15353,2019-03-06,6,3,2,705,1,7,19
IndiGo,24/03/2019,Banglore,New Delhi,BLR → DEL,18:25,21:20,2h 55m,non-stop,No info,7303,2019-03-24,24,3,6,175,0,18,21
SpiceJet,24/03/2019,Kolkata,Banglore,CCU → MAA → BLR,15:05,20:45,5h 40m,1 stop,No info,6197,2019-03-24,24,3,6,340,1,15,20
Air India,9/06/2019,Kolkata,Banglore,CCU → BBI → BLR,09:10,13:15,4h 5m,1 stop,No info,8996,2019-06-09,9,6,6,245,1,9,13
IndiGo,21/03/2019,Delhi,Cochin,DEL → HYD → COK,14:20,22:20,8h,1 stop,No info,6528,2019-03-21,21,3,3,480,1,14,22
GoAir,9/04/2019,Banglore,Delhi,BLR → DEL,20:55,23:40,2h 45m,non-stop,No info,4239,2019-04-09,9,4,1,165,0,20,23
IndiGo,12/03/2019,Kolkata,Banglore,CCU → BLR,20:25,23:05,2h 40m,non-stop,No info,4148,2019-03-12,12,3,1,160,0,20,23
SpiceJet,24/05/2019,Banglore,Delhi,BLR → DEL,21:10,00:05 25 May,2h 55m,non-stop,No info,3971,2019-05-24,24,5,4,175,0,21,0
Air Asia,6/05/2019,Kolkata,Banglore,CCU → DEL → BLR,07:35,23:30,15h 55m,1 stop,No info,5192,2019-05-06,6,5,0,955,1,7,23
Jet Airways,9/04/2019,Delhi,Cochin,DEL → AMD → BOM → COK,13:25,12:35 10 Apr,23h 10m,2 stops,No info,9483,2019-04-09,9,4,1,1390,2,13,12
Jet Airways,3/06/2019,Delhi,Cochin,DEL → JDH → BOM → COK,11:40,19:00,7h 20m,2 stops,No info,18804,2019-06-03,3,6,0,440,2,11,19
Air India,18/06/2019,Delhi,Cochin,DEL → COK,05:10,08:00,2h 50m,non-stop,No info,5201,2019-06-18,18,6,1,170,0,5,8
Jet Airways,27/05/2019,Delhi,Cochin,DEL → BOM → COK,11:30,19:00,7h 30m,1 stop,No info,16079,2019-05-27,27,5,0,450,1,11,19
Jet Airways,15/06/2019,Banglore,Delhi,BLR → DEL,19:50,22:50,3h,non-stop,In-flight meal not included,7229,2019-06-15,15,6,5,180,0,19,22
Multiple carriers,27/05/2019,Delhi,Cochin,DEL → BOM → COK,17:45,01:30 28 May,7h 45m,1 stop,No info,6795,2019-05-27,27,5,0,465,1,17,1
Jet Airways,9/05/2019,Kolkata,Banglore,CCU → DEL → BLR,09:35,10:55 10 May,25h 20m,1 stop,No info,10953,2019-05-09,9,5,3,1520,1,9,10
Multiple carriers,24/06/2019,Delhi,Cochin,DEL → IDR → BOM → COK,15:05,01:30 25 Jun,10h 25m,2 stops,No info,15965,2019-06-24,24,6,0,625,2,15,1
Air India,9/04/2019,Delhi,Cochin,DEL → JDH → BOM → COK,12:55,19:15 10 Apr,30h 20m,2 stops,No info,9968,2019-04-09,9,4,1,1820,2,12,19
IndiGo,6/06/2019,Kolkata,Banglore,CCU → BLR,22:15,00:50 07 Jun,2h 35m,non-stop,No info,4804,2019-06-06,6,6,3,155,0,22,0
Jet Airways,27/05/2019,Delhi,Cochin,DEL → BOM → COK,10:00,19:00,9h,1 stop,No info,16079,2019-05-27,27,5,0,540,1,10,19
Jet Airways,12/06/2019,Delhi,Cochin,DEL → IDR → BOM → COK,21:25,12:35 13 Jun,15h 10m,2 stops,In-flight meal not included,11507,2019-06-12,12,6,2,910,2,21,12
Air India,9/06/2019,Kolkata,Banglore,CCU → BOM → COK → BLR,09:25,13:45 10 Jun,28h 20m,2 stops,No info,11542,2019-06-09,9,6,6,1700,2,9,13
Jet Airways,24/04/2019,Banglore,Delhi,BLR → DEL,17:45,20:45,3h,non-stop,No info,7229,2019-04-24,24,4,2,180,0,17,20
Jet Airways,27/04/2019,Banglore,Delhi,BLR → DEL,06:00,08:45,2h 45m,non-stop,In-flight meal not included,4544,2019-04-27,27,4,5,165,0,6,8
IndiGo,15/05/2019,Delhi,Cochin,DEL → BLR → COK,05:10,10:05,4h 55m,1 stop,No info,6496,2019-05-15,15,5,2,295,1,5,10
IndiGo,15/06/2019,Kolkata,Banglore,CCU → BLR,21:25,00:05 16 Jun,2h 40m,non-stop,No info,4804,2019-06-15,15,6,5,160,0,21,0
Air India,01/03/2019,Banglore,New Delhi,BLR → CCU → DEL,11:05,09:15 02 Mar,22h 10m,1 stop,No info,13439,2019-03-01,1,3,4,1330,1,11,9
Jet Airways,27/03/2019,Delhi,Cochin,DEL → BOM → COK,18:15,04:25 28 Mar,10h 10m,1 stop,In-flight meal not included,6540,2019-03-27,27,3,2,610,1,18,4
IndiGo,1/06/2019,Banglore,Delhi,BLR → DEL,23:30,02:20 02 Jun,2h 50m,non-stop,No info,4591,2019-06-01,1,6,5,170,0,23,2
IndiGo,18/03/2019,Banglore,New Delhi,BLR → HYD → DEL,16:15,20:35,4h 20m,1 stop,No info,4437,2019-03-18,18,3,0,260,1,16,20
Air Asia,21/03/2019,Delhi,Cochin,DEL → BLR → COK,20:10,07:10 22 Mar,11h,1 stop,No info,6151,2019-03-21,21,3,3,660,1,20,7
Jet Airways,21/06/2019,Banglore,Delhi,BLR → DEL,17:45,20:45,3h,non-stop,In-flight meal not included,7754,2019-06-21,21,6,4,180,0,17,20
Jet Airways,24/06/2019,Delhi,Cochin,DEL → BOM → COK,14:00,12:35 25 Jun,22h 35m,1 stop,In-flight meal not included,10262,2019-06-24,24,6,0,1355,1,14,12
Jet Airways,9/06/2019,Banglore,Delhi,BLR → DEL,18:55,22:00,3h 5m,non-stop,No info,8016,2019-06-09,9,6,6,185,0,18,22
SpiceJet,24/03/2019,Kolkata,Banglore,CCU → BLR,06:55,09:35,2h 40m,non-stop,No check-in baggage included,4781,2019-03-24,24,3,6,160,0,6,9
Vistara,27/06/2019,Banglore,Delhi,BLR → DEL,11:30,14:20,2h 50m,non-stop,No info,4668,2019-06-27,27,6,3,170,0,11,14
Air India,06/03/2019,Banglore,New Delhi,BLR → MAA → DEL,11:50,08:55 07 Mar,21h 5m,1 stop,No info,14594,2019-03-06,6,3,2,1265,1,11,8
Jet Airways,24/03/2019,Kolkata,Banglore,CCU → BOM → BLR,16:55,04:45 25 Mar,11h 50m,1 stop,No info,14231,2019-03-24,24,3,6,710,1,16,4
Air India,15/05/2019,Delhi,Cochin,DEL → TRV → COK,05:15,06:50 16 May,25h 35m,1 stop,No info,8425,2019-05-15,15,5,2,1535,1,5,6
Multiple carriers,12/06/2019,Delhi,Cochin,DEL → HYD → COK,07:05,22:30,15h 25m,1 stop,No info,9646,2019-06-12,12,6,2,925,1,7,22
IndiGo,3/03/2019,Chennai,Kolkata,MAA → CCU,14:40,17:05,2h 25m,non-stop,No info,7295,2019-03-03,3,3,6,145,0,14,17
Air Asia,9/04/2019,Kolkata,Banglore,CCU → BBI → BLR,06:50,10:30,3h 40m,1 stop,No info,5162,2019-04-09,9,4,1,220,1,6,10
IndiGo,09/03/2019,Banglore,New Delhi,BLR → DEL,18:25,21:20,2h 55m,non-stop,No info,6860,2019-03-09,9,3,5,175,0,18,21
Vistara,15/04/2019,Delhi,Cochin,DEL → COK,06:00,09:10,3h 10m,non-stop,No info,6216,2019-04-15,15,4,0,190,0,6,9
Air Asia,24/05/2019,Kolkata,Banglore,CCU → DEL → BLR,07:35,19:25,11h 50m,1 stop,No info,5192,2019-05-24,24,5,4,710,1,7,19
IndiGo,9/04/2019,Banglore,Delhi,BLR → DEL,20:00,22:50,2h 50m,non-stop,No info,4823,2019-04-09,9,4,1,170,0,20,22
SpiceJet,3/04/2019,Banglore,Delhi,BLR → DEL,09:30,12:20,2h 50m,non-stop,No check-in baggage included,3919,2019-04-03,3,4,2,170,0,9,12
IndiGo,3/06/2019,Mumbai,Hyderabad,BOM → HYD,19:05,20:35,1h 30m,non-stop,No info,2754,2019-06-03,3,6,0,90,0,19,20
Multiple carriers,9/05/2019,Delhi,Cochin,DEL → BOM → COK,07:30,19:00,11h 30m,1 stop,No info,9315,2019-05-09,9,5,3,690,1,7,19
Multiple carriers,27/03/2019,Delhi,Cochin,DEL → BOM → COK,10:00,18:50,8h 50m,1 stop,No info,11667,2019-03-27,27,3,2,530,1,10,18
Jet Airways,12/06/2019,Kolkata,Banglore,CCU → BOM → BLR,08:25,04:40 13 Jun,20h 15m,1 stop,In-flight meal not included,6224,2019-06-12,12,6,2,1215,1,8,4
Air India,24/03/2019,Kolkata,Banglore,CCU → BOM → GOI → BLR,09:25,05:35 25 Mar,20h 10m,2 stops,No info,13349,2019-03-24,24,3,6,1210,2,9,5
Jet Airways,18/03/2019,Banglore,New Delhi,BLR → BOM → DEL,16:55,09:00 16 Mar,16h 5m,1 stop,In-flight meal not included,11087,2019-03-18,18,3,0,965,1,16,9
Multiple carriers,6/03/2019,Delhi,Cochin,DEL → BOM → COK,13:00,01:35 07 Mar,12h 35m,1 stop,No info,15603,2019-03-06,6,3,2,755,1,13,1
Jet Airways,9/05/2019,Delhi,Cochin,DEL → JAI → BOM → COK,19:30,12:35 10 May,17h 5m,2 stops,No info,15129,2019-05-09,9,5,3,1025,2,19,12
IndiGo,9/04/2019,Banglore,Delhi,BLR → DEL,16:55,19:55,3h,non-stop,No info,4823,2019-04-09,9,4,1,180,0,16,19
Vistara,1/05/2019,Kolkata,Banglore,CCU → DEL → BLR,07:10,22:40,15h 30m,1 stop,No info,8452,2019-05-01,1,5,2,930,1,7,22
Multiple carriers,6/06/2019,Delhi,Cochin,DEL → BOM → COK,07:30,19:00,11h 30m,1 stop,No info,12524,2019-06-06,6,6,3,690,1,7,19
SpiceJet,27/03/2019,Chennai,Kolkata,MAA → CCU,17:45,20:05,2h 20m,non-stop,No info,3384,2019-03-27,27,3,2,140,0,17,20
Jet Airways,1/06/2019,Delhi,Cochin,DEL → BOM → COK,19:15,19:00 02 Jun,23h 45m,1 stop,In-flight meal not included,10262,2019-06-01,1,6,5,1425,1,19,19
SpiceJet,18/06/2019,Mumbai,Hyderabad,BOM → HYD,13:15,14:45,1h 30m,non-stop,No check-in baggage included,1965,2019-06-18,18,6,1,90,0,13,14
IndiGo,18/05/2019,Kolkata,Banglore,CCU → BLR,22:15,00:50 19 May,2h 35m,non-stop,No info,4804,2019-05-18,18,5,5,155,0,22,0
Jet Airways,27/05/2019,Delhi,Cochin,DEL → BOM → COK,18:15,19:00 28 May,24h 45m,1 stop,No info,16079,2019-05-27,27,5,0,1485,1,18,19
Jet Airways,1/06/2019,Delhi,Cochin,DEL → IDR → BOM → COK,21:25,19:00 02 Jun,21h 35m,2 stops,No info,13292,2019-06-01,1,6,5,1295,2,21,19
Air Asia,9/05/2019,Delhi,Cochin,DEL → BLR → COK,07:55,13:25,5h 30m,1 stop,No info,6751,2019-05-09,9,5,3,330,1,7,13
Air India,15/05/2019,Delhi,Cochin,DEL → BOM → COK,07:00,19:15,12h 15m,1 stop,No info,8669,2019-05-15,15,5,2,735,1,7,19
IndiGo,3/03/2019,Delhi,Cochin,DEL → BOM → COK,17:30,01:35 04 Mar,8h 5m,1 stop,No info,14871,2019-03-03,3,3,6,485,1,17,1
Jet Airways,21/05/2019,Delhi,Cochin,DEL → BOM → COK,14:00,19:00,5h,1 stop,In-flight meal not included,12898,2019-05-21,21,5,1,300,1,14,19
SpiceJet,6/06/2019,Banglore,Delhi,BLR → DEL,09:30,12:20,2h 50m,non-stop,No check-in baggage included,3919,2019-06-06,6,6,3,170,0,9,12
Multiple carriers,1/03/2019,Delhi,Cochin,DEL → BOM → COK,12:50,19:15,6h 25m,1 stop,No info,36983,2019-03-01,1,3,4,385,1,12,19
IndiGo,3/06/2019,Chennai,Kolkata,MAA → CCU,19:35,21:55,2h 20m,non-stop,No info,3597,2019-06-03,3,6,0,140,0,19,21
Air India,09/03/2019,Banglore,New Delhi,BLR → DEL,17:00,19:45,2h 45m,non-stop,No info,10741,2019-03-09,9,3,5,165,0,17,19
Air India,6/06/2019,Kolkata,Banglore,CCU → BOM → GOI → BLR,16:50,05:35 07 Jun,12h 45m,2 stops,No info,11432,2019-06-06,6,6,3,765,2,16,5
Jet Airways,12/03/2019,Banglore,New Delhi,BLR → BOM → DEL,18:55,10:45 13 Mar,15h 50m,1 stop,In-flight meal not included,11087,2019-03-12,12,3,1,950,1,18,10
Jet Airways,3/06/2019,Delhi,Cochin,DEL → IDR → BOM → COK,09:35,12:35 04 Jun,27h,2 stops,No info,13292,2019-06-03,3,6,0,1620,2,9,12
Air India,15/06/2019,Delhi,Cochin,DEL → RPR → NAG → BOM → COK,05:15,07:40 16 Jun,26h 25m,3 stops,No info,10493,2019-06-15,15,6,5,1585,3,5,7
GoAir,09/03/2019,Banglore,New Delhi,BLR → DEL,07:45,10:40,2h 55m,non-stop,No info,7631,2019-03-09,9,3,5,175,0,7,10
Air India,6/06/2019,Delhi,Cochin,DEL → CCU → BOM → COK,06:50,07:40 07 Jun,24h 50m,2 stops,No info,13381,2019-06-06,6,6,3,1490,2,6,7
Jet Airways,6/06/2019,Kolkata,Banglore,CCU → BOM → BLR,20:00,04:40 07 Jun,8h 40m,1 stop,No info,13731,2019-06-06,6,6,3,520,1,20,4
Air India,21/05/2019,Delhi,Cochin,DEL → BHO → BOM → COK,05:55,07:40 22 May,25h 45m,2 stops,No info,11911,2019-05-21,21,5,1,1545,2,5,7
IndiGo,18/04/2019,Banglore,Delhi,BLR → DEL,23:30,02:20 19 Apr,2h 50m,non-stop,No info,4591,2019-04-18,18,4,3,170,0,23,2
Multiple carriers,3/06/2019,Delhi,Cochin,DEL → BOM → COK,13:00,19:15,6h 15m,1 stop,No info,14848,2019-06-03,3,6,0,375,1,13,19
Multiple carriers,12/06/2019,Delhi,Cochin,DEL → BOM → COK,08:45,19:15,10h 30m,1 stop,No info,8266,2019-06-12,12,6,2,630,1,8,19
Air India,18/05/2019,Delhi,Cochin,DEL → HYD → BOM → COK,17:15,19:15 19 May,26h,2 stops,No info,12392,2019-05-18,18,5,5,1560,2,17,19
Jet Airways,12/06/2019,Kolkata,Banglore,CCU → BOM → BLR,18:55,12:00 13 Jun,17h 5m,1 stop,No info,13044,2019-06-12,12,6,2,1025,1,18,12
Jet Airways,21/05/2019,Delhi,Cochin,DEL → BOM → COK,07:05,04:25 22 May,21h 20m,1 stop,In-flight meal not included,12898,2019-05-21,21,5,1,1280,1,7,4
Jet Airways,21/03/2019,Delhi,Cochin,DEL → BOM → COK,22:50,04:25 22 Mar,5h 35m,1 stop,No info,12242,2019-03-21,21,3,3,335,1,22,4
IndiGo,18/05/2019,Banglore,Delhi,BLR → DEL,10:10,13:00,2h 50m,non-stop,No info,3943,2019-05-18,18,5,5,170,0,10,13
Vistara,24/03/2019,Kolkata,Banglore,CCU → DEL → BLR,20:20,22:10 25 Mar,25h 50m,1 stop,No info,11105,2019-03-24,24,3,6,1550,1,20,22
Jet Airways,12/05/2019,Kolkata,Banglore,CCU → BOM → BLR,21:10,09:20 13 May,12h 10m,1 stop,No info,14388,2019-05-12,12,5,6,730,1,21,9
Jet Airways,18/05/2019,Delhi,Cochin,DEL → JAI → BOM → COK,19:30,12:35 19 May,17h 5m,2 stops,No info,13014,2019-05-18,18,5,5,1025,2,19,12
Multiple carriers,6/03/2019,Delhi,Cochin,DEL → BOM → COK,10:20,18:50,8h 30m,1 stop,No info,15411,2019-03-06,6,3,2,510,1,10,18
Jet Airways,9/03/2019,Delhi,Cochin,DEL → BOM → COK,19:45,18:50 10 Mar,23h 5m,1 stop,No info,16289,2019-03-09,9,3,5,1385,1,19,18
IndiGo,15/05/2019,Delhi,Cochin,DEL → HYD → COK,06:50,16:10,9h 20m,1 stop,No info,6442,2019-05-15,15,5,2,560,1,6,16
Jet Airways,18/05/2019,Kolkata,Banglore,CCU → BOM → BLR,08:25,16:20,7h 55m,1 stop,In-flight meal not included,10844,2019-05-18,18,5,5,475,1,8,16
Jet Airways,18/05/2019,Mumbai,Hyderabad,BOM → HYD,10:20,11:50,1h 30m,non-stop,No info,5678,2019-05-18,18,5,5,90,0,10,11
IndiGo,12/04/2019,Banglore,Delhi,BLR → DEL,23:30,02:20 13 Apr,2h 50m,non-stop,No info,6906,2019-04-12,12,4,4,170,0,23,2
SpiceJet,21/05/2019,Chennai,Kolkata,MAA → CCU,09:45,12:00,2h 15m,non-stop,No check-in baggage included,3543,2019-05-21,21,5,1,135,0,9,12
Jet Airways,6/06/2019,Delhi,Cochin,DEL → BOM → COK,09:00,19:00,10h,1 stop,No info,14714,2019-06-06,6,6,3,600,1,9,19
Vistara Premium economy,03/03/2019,Banglore,New Delhi,BLR → DEL,16:00,18:35,2h 35m,non-stop,No info,11793,2019-03-03,3,3,6,155,0,16,18
Multiple carriers,15/05/2019,Delhi,Cochin,DEL → BOM → COK,11:30,19:15,7h 45m,1 stop,No info,14323,2019-05-15,15,5,2,465,1,11,19
SpiceJet,9/04/2019,Banglore,Delhi,BLR → DEL,21:10,00:05 10 Apr,2h 55m,non-stop,No info,3971,2019-04-09,9,4,1,175,0,21,0
Vistara,6/05/2019,Kolkata,Banglore,CCU → DEL → BLR,20:20,22:40 07 May,26h 20m,1 stop,No info,8452,2019-05-06,6,5,0,1580,1,20,22
Vistara,12/04/2019,Banglore,Delhi,BLR → DEL,07:00,09:40,2h 40m,non-stop,No info,5403,2019-04-12,12,4,4,160,0,7,9
Multiple carriers,9/05/2019,Delhi,Cochin,DEL → BOM → COK,10:00,21:00,11h,1 stop,No info,13727,2019-05-09,9,5,3,660,1,10,21
Air India,1/04/2019,Kolkata,Banglore,CCU → DEL → AMD → BLR,10:00,05:25 02 Apr,19h 25m,2 stops,No info,12639,2019-04-01,1,4,0,1165,2,10,5
Jet Airways,18/04/2019,Banglore,Delhi,BLR → DEL,15:15,18:10,2h 55m,non-stop,In-flight meal not included,5198,2019-04-18,18,4,3,175,0,15,18
Vistara,1/06/2019,Banglore,Delhi,BLR → DEL,19:30,22:15,2h 45m,non-stop,No info,4878,2019-06-01,1,6,5,165,0,19,22
Jet Airways,18/05/2019,Delhi,Cochin,DEL → BOM → COK,19:45,19:00 19 May,23h 15m,1 stop,In-flight meal not included,12373,2019-05-18,18,5,5,1395,1,19,19
Multiple carriers,3/03/2019,Delhi,Cochin,DEL → HYD → COK,07:10,16:10,9h,1 stop,In-flight meal not included,8552,2019-03-03,3,3,6,540,1,7,16
Vistara,21/04/2019,Delhi,Cochin,DEL → COK,14:40,17:50,3h 10m,non-stop,No info,6741,2019-04-21,21,4,6,190,0,14,17
Multiple carriers,9/04/2019,Delhi,Cochin,DEL → BOM → COK,12:50,19:15,6h 25m,1 stop,No info,6481,2019-04-09,9,4,1,385,1,12,19
Multiple carriers,6/06/2019,Delhi,Cochin,DEL → BOM → COK,10:35,19:15,8h 40m,1 stop,No info,7354,2019-06-06,6,6,3,520,1,10,19
Air India,21/04/2019,Banglore,Delhi,BLR → DEL,21:05,23:55,2h 50m,non-stop,No info,5228,2019-04-21,21,4,6,170,0,21,23
Jet Airways,12/05/2019,Kolkata,Banglore,CCU → BOM → BLR,08:25,20:45,12h 20m,1 stop,In-flight meal not included,10844,2019-05-12,12,5,6,740,1,8,20
IndiGo,18/05/2019,Delhi,Cochin,DEL → HYD → COK,06:50,12:10,5h 20m,1 stop,No info,6347,2019-05-18,18,5,5,320,1,6,12
Air India,15/03/2019,Banglore,New Delhi,BLR → HYD → DEL,08:15,12:15,4h,1 stop,No info,5013,2019-03-15,15,3,4,240,1,8,12
Jet Airways,9/06/2019,Kolkata,Banglore,CCU → BOM → BLR,18:55,04:40 10 Jun,9h 45m,1 stop,In-flight meal not included,9663,2019-06-09,9,6,6,585,1,18,4
IndiGo,6/04/2019,Banglore,Delhi,BLR → DEL,18:25,21:20,2h 55m,non-stop,No info,4823,2019-04-06,6,4,5,175,0,18,21
Air India,24/06/2019,Delhi,Cochin,DEL → CCU → BOM → COK,16:55,19:15 25 Jun,26h 20m,2 stops,No info,13381,2019-06-24,24,6,0,1580,2,16,19
SpiceJet,1/06/2019,Chennai,Kolkata,MAA → CCU,09:45,12:00,2h 15m,non-stop,No check-in baggage included,3543,2019-06-01,1,6,5,135,0,9,12
Jet Airways,15/05/2019,Kolkata,Banglore,CCU → BOM → BLR,18:55,04:40 16 May,9h 45m,1 stop,In-flight meal not included,9663,2019-05-15,15,5,2,585,1,18,4
Jet Airways,1/04/2019,Kolkata,Banglore,CCU → BOM → BLR,18:55,19:50 02 Apr,24h 55m,1 stop,In-flight meal not included,7064,2019-04-01,1,4,0,1495,1,18,19
Jet Airways,9/06/2019,Delhi,Cochin,DEL → BOM → COK,07:05,19:00,11h 55m,1 stop,In-flight meal not included,10262,2019-06-09,9,6,6,715,1,7,19
Air India,1/06/2019,Delhi,Cochin,DEL → GOI → BOM → COK,10:55,19:15,8h 20m,2 stops,No info,13013,2019-06-01,1,6,5,500,2,10,19
Jet Airways,27/06/2019,Delhi,Cochin,DEL → AMD → BOM → COK,19:10,12:35 28 Jun,17h 25m,2 stops,No info,15339,2019-06-27,27,6,3,1045,2,19,12
GoAir,18/04/2019,Banglore,Delhi,BLR → DEL,11:40,14:30,2h 50m,non-stop,No info,4937,2019-04-18,18,4,3,170,0,11,14
IndiGo,6/06/2019,Delhi,Cochin,DEL → HYD → COK,05:05,12:10,7h 5m,1 stop,No info,6818,2019-06-06,6,6,3,425,1,5,12
Air India,18/05/2019,Delhi,Cochin,DEL → GOI → BOM → COK,22:00,19:15 19 May,21h 15m,2 stops,No info,10441,2019-05-18,18,5,5,1275,2,22,19
Jet Airways,3/04/2019,Delhi,Cochin,DEL → BOM → COK,14:00,19:00,5h,1 stop,In-flight meal not included,5177,2019-04-03,3,4,2,300,1,14,19
IndiGo,27/06/2019,Chennai,Kolkata,MAA → CCU,11:35,14:00,2h 25m,non-stop,No info,3858,2019-06-27,27,6,3,145,0,11,14
IndiGo,18/05/2019,Kolkata,Banglore,CCU → PNQ → BLR,21:00,02:15 19 May,5h 15m,1 stop,No info,6534,2019-05-18,18,5,5,315,1,21,2
Multiple carriers,15/06/2019,Delhi,Cochin,DEL → BOM → COK,10:20,01:30 16 Jun,15h 10m,1 stop,No info,6795,2019-06-15,15,6,5,910,1,10,1
Multiple carriers,3/06/2019,Delhi,Cochin,DEL → BOM → COK,07:30,19:15,11h 45m,1 stop,No info,9736,2019-06-03,3,6,0,705,1,7,19
Jet Airways,1/05/2019,Banglore,Delhi,BLR → DEL,19:50,22:50,3h,non-stop,No info,7229,2019-05-01,1,5,2,180,0,19,22
SpiceJet,24/04/2019,Delhi,Cochin,DEL → BLR → COK,17:55,22:50,4h 55m,1 stop,No info,4957,2019-04-24,24,4,2,295,1,17,22
IndiGo,09/03/2019,Banglore,New Delhi,BLR → DEL,06:00,08:45,2h 45m,non-stop,No info,7648,2019-03-09,9,3,5,165,0,6,8
SpiceJet,15/06/2019,Kolkata,Banglore,CCU → BLR,14:55,17:25,2h 30m,non-stop,No info,3873,2019-06-15,15,6,5,150,0,14,17
Jet Airways,12/05/2019,Kolkata,Banglore,CCU → BOM → BLR,18:55,04:40 13 May,9h 45m,1 stop,No info,14388,2019-05-12,12,5,6,585,1,18,4
IndiGo,6/03/2019,Kolkata,Banglore,CCU → BLR,17:15,19:55,2h 40m,non-stop,No info,5618,2019-03-06,6,3,2,160,0,17,19
Multiple carriers,9/06/2019,Delhi,Cochin,DEL → BOM → COK,19:00,01:30 10 Jun,6h 30m,1 stop,No info,7408,2019-06-09,9,6,6,390,1,19,1
Air Asia,3/03/2019,Delhi,Cochin,DEL → BLR → COK,16:45,22:15,5h 30m,1 stop,No info,13774,2019-03-03,3,3,6,330,1,16,22
Vistara,3/05/2019,Banglore,Delhi,BLR → DEL,07:00,09:40,2h 40m,non-stop,No info,4668,2019-05-03,3,5,4,160,0,7,9
Jet Airways,21/03/2019,Delhi,Cochin,DEL → UDR → BOM → COK,18:20,04:25 23 Mar,34h 5m,2 stops,No info,13082,2019-03-21,21,3,3,2045,2,18,4
Air India,3/06/2019,Delhi,Cochin,DEL → BOM → COK,03:50,19:15,15h 25m,1 stop,No info,8669,2019-06-03,3,6,0,925,1,3,19
IndiGo,24/06/2019,Delhi,Cochin,DEL → BOM → COK,16:00,01:30 25 Jun,9h 30m,1 stop,No info,6316,2019-06-24,24,6,0,570,1,16,1
Jet Airways,6/03/2019,Delhi,Cochin,DEL → BOM → COK,22:20,04:25 07 Mar,6h 5m,1 stop,In-flight meal not included,12583,2019-03-06,6,3,2,365,1,22,4
Vistara,09/03/2019,Banglore,New Delhi,BLR → DEL,16:10,18:50,2h 40m,non-stop,No info,7923,2019-03-09,9,3,5,160,0,16,18
GoAir,3/03/2019,Delhi,Cochin,DEL → BOM → COK,07:00,12:50,5h 50m,1 stop,No info,7378,2019-03-03,3,3,6,350,1,7,12
Vistara,3/06/2019,Banglore,Delhi,BLR → DEL,19:30,22:15,2h 45m,non-stop,No info,4878,2019-06-03,3,6,0,165,0,19,22
Jet Airways,18/05/2019,Kolkata,Banglore,CCU → BOM → BLR,16:30,19:50 19 May,27h 20m,1 stop,In-flight meal not included,10844,2019-05-18,18,5,5,1640,1,16,19
Jet Airways,3/04/2019,Banglore,Delhi,BLR → DEL,08:20,11:20,3h,non-stop,No info,7229,2019-04-03,3,4,2,180,0,8,11
SpiceJet,21/05/2019,Delhi,Cochin,DEL → MAA → COK,06:05,11:20,5h 15m,1 stop,No info,6297,2019-05-21,21,5,1,315,1,6,11
Jet Airways,12/06/2019,Kolkata,Banglore,CCU → BOM → BLR,20:00,12:00 13 Jun,16h,1 stop,In-flight meal not included,8529,2019-06-12,12,6,2,960,1,20,12
Multiple carriers,18/05/2019,Delhi,Cochin,DEL → BOM → COK,14:00,21:00,7h,1 stop,No info,13727,2019-05-18,18,5,5,420,1,14,21
SpiceJet,24/05/2019,Kolkata,Banglore,CCU → PNQ → BLR,08:35,17:15,8h 40m,1 stop,No info,6643,2019-05-24,24,5,4,520,1,8,17
Multiple carriers,9/05/2019,Delhi,Cochin,DEL → BOM → COK,10:00,19:00,9h,1 stop,No info,10197,2019-05-09,9,5,3,540,1,10,19
SpiceJet,21/04/2019,Kolkata,Banglore,CCU → BLR,22:20,00:40 22 Apr,2h 20m,non-stop,No info,4911,2019-04-21,21,4,6,140,0,22,0
IndiGo,6/03/2019,Chennai,Kolkata,MAA → CCU,05:15,07:35,2h 20m,non-stop,No info,6482,2019-03-06,6,3,2,140,0,5,7
Jet Airways,01/03/2019,Banglore,New Delhi,BLR → BOM → DEL,08:55,15:15,6h 20m,1 stop,No info,26890,2019-03-01,1,3,4,380,1,8,15
IndiGo,18/05/2019,Kolkata,Banglore,CCU → HYD → BLR,19:20,23:45,4h 25m,1 stop,No info,3717,2019-05-18,18,5,5,265,1,19,23
IndiGo,1/06/2019,Chennai,Kolkata,MAA → CCU,13:15,15:35,2h 20m,non-stop,No info,3597,2019-06-01,1,6,5,140,0,13,15
Air India,18/03/2019,Banglore,New Delhi,BLR → CCU → GAU → DEL,11:05,22:10,11h 5m,2 stops,No info,10846,2019-03-18,18,3,0,665,2,11,22
Air India,01/03/2019,Banglore,New Delhi,BLR → CCU → DEL,05:50,22:45,16h 55m,1 stop,No info,14069,2019-03-01,1,3,4,1015,1,5,22
Jet Airways,1/04/2019,Delhi,Cochin,DEL → BOM → COK,22:50,12:35 02 Apr,13h 45m,1 stop,In-flight meal not included,5177,2019-04-01,1,4,0,825,1,22,12
Air India,6/03/2019,Delhi,Cochin,DEL → NAG → BOM → COK,05:55,07:40 07 Mar,25h 45m,2 stops,No info,14641,2019-03-06,6,3,2,1545,2,5,7
IndiGo,6/06/2019,Delhi,Cochin,DEL → HYD → COK,08:35,22:30,13h 55m,1 stop,No info,6442,2019-06-06,6,6,3,835,1,8,22
Air India,21/03/2019,Delhi,Cochin,DEL → BLR → COK,17:45,23:00,5h 15m,1 stop,No info,5704,2019-03-21,21,3,3,315,1,17,23
Jet Airways,6/05/2019,Kolkata,Banglore,CCU → BOM → BLR,14:05,09:20 07 May,19h 15m,1 stop,In-flight meal not included,9663,2019-05-06,6,5,0,1155,1,14,9
Jet Airways,6/06/2019,Delhi,Cochin,DEL → BOM → COK,20:55,04:25 07 Jun,7h 30m,1 stop,No info,14714,2019-06-06,6,6,3,450,1,20,4
Jet Airways,1/04/2019,Delhi,Cochin,DEL → BOM → COK,10:00,19:00,9h,1 stop,In-flight meal not included,5406,2019-04-01,1,4,0,540,1,10,19
Vistara,15/05/2019,Kolkata,Banglore,CCU → DEL → BLR,20:20,20:20 16 May,24h,1 stop,No info,8610,2019-05-15,15,5,2,1440,1,20,20
Jet Airways,12/06/2019,Delhi,Cochin,DEL → BDQ → BOM → COK,18:25,12:35 13 Jun,18h 10m,2 stops,No info,14237,2019-06-12,12,6,2,1090,2,18,12
IndiGo,9/06/2019,Banglore,Delhi,BLR → DEL,07:10,10:05,2h 55m,non-stop,No info,4823,2019-06-09,9,6,6,175,0,7,10
IndiGo,27/03/2019,Mumbai,Hyderabad,BOM → HYD,20:05,21:35,1h 30m,non-stop,No info,2227,2019-03-27,27,3,2,90,0,20,21
Jet Airways,18/05/2019,Delhi,Cochin,DEL → BOM → COK,07:05,04:25 19 May,21h 20m,1 stop,In-flight meal not included,12373,2019-05-18,18,5,5,1280,1,7,4
Air India,6/06/2019,Delhi,Cochin,DEL → BOM → COK,13:00,19:15,6h 15m,1 stop,No info,8372,2019-06-06,6,6,3,375,1,13,19
Jet Airways,3/03/2019,Delhi,Cochin,DEL → BOM → COK,13:55,04:25 04 Mar,14h 30m,1 stop,No info,17024,2019-03-03,3,3,6,870,1,13,4
Air India,27/05/2019,Mumbai,Hyderabad,BOM → HYD,21:05,22:25,1h 20m,non-stop,No info,3100,2019-05-27,27,5,0,80,0,21,22
Jet Airways,9/03/2019,Delhi,Cochin,DEL → BOM → COK,06:50,19:45,12h 55m,1 stop,In-flight meal not included,14053,2019-03-09,9,3,5,775,1,6,19
IndiGo,9/05/2019,Chennai,Kolkata,MAA → CCU,05:15,07:40,2h 25m,non-stop,No info,3540,2019-05-09,9,5,3,145,0,5,7
Vistara,21/05/2019,Kolkata,Banglore,CCU → DEL → BLR,20:20,18:50 22 May,22h 30m,1 stop,No info,9345,2019-05-21,21,5,1,1350,1,20,18
Jet Airways,1/06/2019,Delhi,Cochin,DEL → JAI → BOM → COK,05:30,04:25 02 Jun,22h 55m,2 stops,In-flight meal not included,10368,2019-06-01,1,6,5,1375,2,5,4
Jet Airways,01/03/2019,Banglore,New Delhi,BLR → BOM → DEL,07:00,12:25,5h 25m,1 stop,No info,26890,2019-03-01,1,3,4,325,1,7,12
SpiceJet,9/03/2019,Mumbai,Hyderabad,BOM → HYD,08:50,10:15,1h 25m,non-stop,No info,5755,2019-03-09,9,3,5,85,0,8,10
Jet Airways,21/03/2019,Banglore,New Delhi,BLR → BOM → DEL,08:55,16:10,7h 15m,1 stop,In-flight meal not included,7832,2019-03-21,21,3,3,435,1,8,16
Jet Airways,6/05/2019,Kolkata,Banglore,CCU → BOM → BLR,08:25,20:45,12h 20m,1 stop,No info,14388,2019-05-06,6,5,0,740,1,8,20
Air India,27/06/2019,Delhi,Cochin,DEL → HYD → MAA → COK,13:15,09:25 28 Jun,20h 10m,2 stops,No info,8839,2019-06-27,27,6,3,1210,2,13,9
Air India,3/03/2019,Delhi,Cochin,DEL → GOI → BOM → COK,22:00,19:15 04 Mar,21h 15m,2 stops,No info,22096,2019-03-03,3,3,6,1275,2,22,19
Vistara,27/05/2019,Chennai,Kolkata,MAA → CCU,07:05,09:20,2h 15m,non-stop,No info,3687,2019-05-27,27,5,0,135,0,7,9
Multiple carriers,15/05/2019,Delhi,Cochin,DEL → BOM → COK,08:30,19:00,10h 30m,1 stop,No info,9627,2019-05-15,15,5,2,630,1,8,19
Multiple carriers,21/03/2019,Delhi,Cochin,DEL → BOM → COK,11:30,01:35 22 Mar,14h 5m,1 stop,No info,13542,2019-03-21,21,3,3,845,1,11,1
IndiGo,27/04/2019,Banglore,Delhi,BLR → DEL,04:00,06:50,2h 50m,non-stop,No info,4423,2019-04-27,27,4,5,170,0,4,6
IndiGo,3/03/2019,Delhi,Cochin,DEL → HYD → MAA → COK,04:55,21:20,16h 25m,2 stops,No info,8899,2019-03-03,3,3,6,985,2,4,21
SpiceJet,21/04/2019,Delhi,Cochin,DEL → MAA → COK,06:05,11:20,5h 15m,1 stop,No info,5583,2019-04-21,21,4,6,315,1,6,11
Air Asia,27/05/2019,Delhi,Cochin,DEL → BLR → COK,16:45,06:35 28 May,13h 50m,1 stop,No info,6752,2019-05-27,27,5,0,830,1,16,6
SpiceJet,21/05/2019,Chennai,Kolkata,MAA → CCU,08:20,10:35,2h 15m,non-stop,No check-in baggage included,3543,2019-05-21,21,5,1,135,0,8,10
Jet Airways,21/03/2019,Banglore,New Delhi,BLR → BOM → DEL,08:00,15:15,7h 15m,1 stop,In-flight meal not included,7832,2019-03-21,21,3,3,435,1,8,15
Air India,1/05/2019,Kolkata,Banglore,CCU → IXR → DEL → BLR,05:50,08:55 02 May,27h 5m,2 stops,No info,10991,2019-05-01,1,5,2,1625,2,5,8
Jet Airways,27/05/2019,Delhi,Cochin,DEL → BOM → COK,09:00,12:35 28 May,27h 35m,1 stop,In-flight meal not included,12898,2019-05-27,27,5,0,1655,1,9,12
Jet Airways,27/05/2019,Delhi,Cochin,DEL → BOM → COK,14:00,19:00,5h,1 stop,In-flight meal not included,12898,2019-05-27,27,5,0,300,1,14,19
GoAir,24/05/2019,Banglore,Delhi,BLR → DEL,11:40,14:30,2h 50m,non-stop,No info,3398,2019-05-24,24,5,4,170,0,11,14
Air India,24/04/2019,Delhi,Cochin,DEL → COK,05:10,08:00,2h 50m,non-stop,No info,5201,2019-04-24,24,4,2,170,0,5,8
Air India,6/05/2019,Kolkata,Banglore,CCU → DEL → COK → BLR,10:00,01:20 07 May,15h 20m,2 stops,No info,13873,2019-05-06,6,5,0,920,2,10,1
Air India,15/06/2019,Delhi,Cochin,DEL → BLR → COK,17:40,23:00,5h 20m,1 stop,No info,7384,2019-06-15,15,6,5,320,1,17,23
Jet Airways,6/06/2019,Delhi,Cochin,DEL → BOM → COK,18:15,04:25 07 Jun,10h 10m,1 stop,In-flight meal not included,10262,2019-06-06,6,6,3,610,1,18,4
Jet Airways,24/03/2019,Kolkata,Banglore,CCU → BOM → BLR,08:25,12:00 25 Mar,27h 35m,1 stop,In-flight meal not included,10031,2019-03-24,24,3,6,1655,1,8,12
Jet Airways,6/05/2019,Kolkata,Banglore,CCU → DEL → BLR,09:35,19:10,9h 35m,1 stop,In-flight meal not included,12384,2019-05-06,6,5,0,575,1,9,19
Jet Airways,9/05/2019,Kolkata,Banglore,CCU → BOM → BLR,14:05,18:15 10 May,28h 10m,1 stop,In-flight meal not included,7757,2019-05-09,9,5,3,1690,1,14,18
Jet Airways,06/03/2019,Banglore,New Delhi,BLR → BOM → DEL,21:25,11:25 07 Mar,14h,1 stop,No info,17261,2019-03-06,6,3,2,840,1,21,11
SpiceJet,1/03/2019,Chennai,Kolkata,MAA → CCU,09:30,12:05,2h 35m,non-stop,No info,7298,2019-03-01,1,3,4,155,0,9,12
Jet Airways,6/04/2019,Banglore,Delhi,BLR → DEL,15:15,18:10,2h 55m,non-stop,No info,7229,2019-04-06,6,4,5,175,0,15,18
IndiGo,1/04/2019,Kolkata,Banglore,CCU → BLR,04:40,07:15,2h 35m,non-stop,No info,4174,2019-04-01,1,4,0,155,0,4,7
IndiGo,18/05/2019,Kolkata,Banglore,CCU → MAA → BLR,17:35,22:15,4h 40m,1 stop,No info,5699,2019-05-18,18,5,5,280,1,17,22
Air India,24/04/2019,Kolkata,Banglore,CCU → BLR,14:15,16:45,2h 30m,non-stop,No info,4880,2019-04-24,24,4,2,150,0,14,16
Air India,6/03/2019,Delhi,Cochin,DEL → BOM → COK,08:00,19:15,11h 15m,1 stop,No info,15284,2019-03-06,6,3,2,675,1,8,19
Jet Airways,24/03/2019,Kolkata,Banglore,CCU → BOM → BLR,08:25,16:20,7h 55m,1 stop,No info,13759,2019-03-24,24,3,6,475,1,8,16
Vistara,24/03/2019,Kolkata,Banglore,CCU → DEL → BLR,09:55,18:45,8h 50m,1 stop,No info,16092,2019-03-24,24,3,6,530,1,9,18
IndiGo,9/03/2019,Mumbai,Hyderabad,BOM → HYD,06:20,07:45,1h 25m,non-stop,No info,4392,2019-03-09,9,3,5,85,0,6,7
Jet Airways,24/06/2019,Delhi,Cochin,DEL → BOM → COK,20:55,12:35 25 Jun,15h 40m,1 stop,In-flight meal not included,10262,2019-06-24,24,6,0,940,1,20,12
SpiceJet,12/06/2019,Kolkata,Banglore,CCU → BLR,06:55,09:30,2h 35m,non-stop,No check-in baggage included,3841,2019-06-12,12,6,2,155,0,6,9
GoAir,1/06/2019,Banglore,Delhi,BLR → DEL,07:45,10:40,2h 55m,non-stop,No info,5048,2019-06-01,1,6,5,175,0,7,10
Air India,21/05/2019,Kolkata,Banglore,CCU → DEL → BLR,07:00,20:25,13h 25m,1 stop,No info,11096,2019-05-21,21,5,1,805,1,7,20
IndiGo,24/04/2019,Delhi,Cochin,DEL → HYD → COK,07:35,12:10,4h 35m,1 stop,No info,5073,2019-04-24,24,4,2,275,1,7,12
Jet Airways,3/03/2019,Delhi,Cochin,DEL → BOM → COK,09:55,04:25 04 Mar,18h 30m,1 stop,No info,19828,2019-03-03,3,3,6,1110,1,9,4
Vistara,21/03/2019,Chennai,Kolkata,MAA → CCU,07:05,09:20,2h 15m,non-stop,No info,3739,2019-03-21,21,3,3,135,0,7,9
Air India,9/03/2019,Delhi,Cochin,DEL → AMD → BOM → COK,05:00,19:15 10 Mar,38h 15m,2 stops,No info,10598,2019-03-09,9,3,5,2295,2,5,19
Jet Airways,15/06/2019,Banglore,Delhi,BLR → DEL,18:55,22:00,3h 5m,non-stop,In-flight meal not included,7229,2019-06-15,15,6,5,185,0,18,22
Vistara,1/04/2019,Kolkata,Banglore,CCU → DEL → BLR,17:00,18:50 02 Apr,25h 50m,1 stop,No info,8610,2019-04-01,1,4,0,1550,1,17,18
Vistara,9/05/2019,Delhi,Cochin,DEL → COK,14:40,17:50,3h 10m,non-stop,No info,6216,2019-05-09,9,5,3,190,0,14,17
Air India,9/06/2019,Banglore,Delhi,BLR → DEL,13:20,16:10,2h 50m,non-stop,No info,6961,2019-06-09,9,6,6,170,0,13,16
Jet Airways,6/05/2019,Kolkata,Banglore,CCU → DEL → BLR,09:35,21:05,11h 30m,1 stop,In-flight meal not included,10703,2019-05-06,6,5,0,690,1,9,21
Jet Airways,15/05/2019,Kolkata,Banglore,CCU → DEL → BLR,17:00,23:35,6h 35m,1 stop,No info,14151,2019-05-15,15,5,2,395,1,17,23
Jet Airways,9/05/2019,Kolkata,Banglore,CCU → BOM → BLR,06:30,10:05 10 May,27h 35m,1 stop,In-flight meal not included,8586,2019-05-09,9,5,3,1655,1,6,10
IndiGo,12/04/2019,Kolkata,Banglore,CCU → BLR,20:20,22:55,2h 35m,non-stop,No info,4488,2019-04-12,12,4,4,155,0,20,22
Multiple carriers,15/06/2019,Delhi,Cochin,DEL → BOM → COK,18:00,01:30 16 Jun,7h 30m,1 stop,No info,7408,2019-06-15,15,6,5,450,1,18,1
Jet Airways,18/04/2019,Delhi,Cochin,DEL → COK,11:00,14:15,3h 15m,non-stop,In-flight meal not included,5443,2019-04-18,18,4,3,195,0,11,14
Jet Airways,12/06/2019,Kolkata,Banglore,CCU → DEL → BLR,09:35,19:10,9h 35m,1 stop,In-flight meal not included,10539,2019-06-12,12,6,2,575,1,9,19
Multiple carriers,1/06/2019,Delhi,Cochin,DEL → BOM → COK,13:00,01:30 02 Jun,12h 30m,1 stop,No info,7723,2019-06-01,1,6,5,750,1,13,1
Multiple carriers,6/03/2019,Delhi,Cochin,DEL → BOM → COK,07:30,18:50,11h 20m,1 stop,No info,15411,2019-03-06,6,3,2,680,1,7,18
Jet Airways,21/05/2019,Banglore,Delhi,BLR → DEL,07:10,10:10,3h,non-stop,No info,7229,2019-05-21,21,5,1,180,0,7,10
IndiGo,21/06/2019,Kolkata,Banglore,CCU → BLR,20:20,22:55,2h 35m,non-stop,No info,4804,2019-06-21,21,6,4,155,0,20,22
Jet Airways,3/03/2019,Mumbai,Hyderabad,BOM → HYD,02:55,04:25,1h 30m,non-stop,In-flight meal not included,4050,2019-03-03,3,3,6,90,0,2,4
Jet Airways,18/05/2019,Kolkata,Banglore,CCU → DEL → BLR,17:00,19:10 19 May,26h 10m,1 stop,No info,14151,2019-05-18,18,5,5,1570,1,17,19
SpiceJet,6/04/2019,Delhi,Cochin,DEL → BLR → COK,17:55,22:50,4h 55m,1 stop,No info,4957,2019-04-06,6,4,5,295,1,17,22
Air India,03/03/2019,Banglore,New Delhi,BLR → DEL,21:10,23:55,2h 45m,non-stop,No info,7591,2019-03-03,3,3,6,165,0,21,23
Jet Airways,24/03/2019,Kolkata,Banglore,CCU → BOM → BLR,13:55,22:35,8h 40m,1 stop,In-flight meal not included,11134,2019-03-24,24,3,6,520,1,13,22
IndiGo,27/05/2019,Delhi,Cochin,DEL → HYD → COK,05:05,12:10,7h 5m,1 stop,No info,6600,2019-05-27,27,5,0,425,1,5,12
Air India,09/03/2019,Banglore,New Delhi,BLR → DEL,21:10,23:55,2h 45m,non-stop,No info,4966,2019-03-09,9,3,5,165,0,21,23
Air India,1/06/2019,Delhi,Cochin,DEL → CCU → BOM → COK,06:50,07:40 02 Jun,24h 50m,2 stops,No info,15481,2019-06-01,1,6,5,1490,2,6,7
SpiceJet,1/03/2019,Kolkata,Banglore,CCU → BLR,22:20,00:40 02 Mar,2h 20m,non-stop,No info,5515,2019-03-01,1,3,4,140,0,22,0
Jet Airways,15/06/2019,Delhi,Cochin,DEL → BOM → COK,08:00,19:00,11h,1 stop,No info,14714,2019-06-15,15,6,5,660,1,8,19
GoAir,15/06/2019,Delhi,Cochin,DEL → BOM → COK,10:35,19:35,9h,1 stop,No info,4959,2019-06-15,15,6,5,540,1,10,19
Jet Airways,21/04/2019,Banglore,Delhi,BLR → DEL,11:10,14:05,2h 55m,non-stop,No info,7229,2019-04-21,21,4,6,175,0,11,14
Air India,15/05/2019,Delhi,Cochin,DEL → COK,18:05,21:10,3h 5m,non-stop,No info,6094,2019-05-15,15,5,2,185,0,18,21
Air Asia,24/04/2019,Kolkata,Banglore,CCU → BLR,10:20,12:55,2h 35m,non-stop,No info,4409,2019-04-24,24,4,2,155,0,10,12
Multiple carriers,18/05/2019,Delhi,Cochin,DEL → BOM → COK,06:00,19:00,13h,1 stop,No info,9794,2019-05-18,18,5,5,780,1,6,19
Jet Airways,3/04/2019,Mumbai,Hyderabad,BOM → HYD,02:55,04:20,1h 25m,non-stop,No info,5678,2019-04-03,3,4,2,85,0,2,4
IndiGo,15/06/2019,Delhi,Cochin,DEL → HYD → COK,08:35,16:10,7h 35m,1 stop,No info,6442,2019-06-15,15,6,5,455,1,8,16
Vistara,18/05/2019,Banglore,Delhi,BLR → DEL,07:00,09:40,2h 40m,non-stop,No info,4878,2019-05-18,18,5,5,160,0,7,9
Jet Airways,24/03/2019,Kolkata,Banglore,CCU → BOM → BLR,21:10,10:05 25 Mar,12h 55m,1 stop,In-flight meal not included,12446,2019-03-24,24,3,6,775,1,21,10
Jet Airways,9/05/2019,Delhi,Cochin,DEL → AMD → BOM → COK,23:05,04:25 11 May,29h 20m,2 stops,No info,16704,2019-05-09,9,5,3,1760,2,23,4
Jet Airways,15/03/2019,Banglore,New Delhi,BLR → BOM → DEL,05:45,10:45,5h,1 stop,In-flight meal not included,9134,2019-03-15,15,3,4,300,1,5,10
Jet Airways,15/05/2019,Kolkata,Banglore,CCU → BOM → BLR,20:00,04:40 16 May,8h 40m,1 stop,In-flight meal not included,8586,2019-05-15,15,5,2,520,1,20,4
Jet Airways,1/06/2019,Banglore,Delhi,BLR → DEL,07:10,10:10,3h,non-stop,In-flight meal not included,7229,2019-06-01,1,6,5,180,0,7,10
Jet Airways,21/04/2019,Banglore,Delhi,BLR → DEL,07:10,10:10,3h,non-stop,In-flight meal not included,6144,2019-04-21,21,4,6,180,0,7,10
Air India,18/05/2019,Banglore,Delhi,BLR → DEL,10:00,12:45,2h 45m,non-stop,No info,6961,2019-05-18,18,5,5,165,0,10,12
Jet Airways,9/05/2019,Kolkata,Banglore,CCU → BOM → BLR,16:30,04:40 10 May,12h 10m,1 stop,In-flight meal not included,10844,2019-05-09,9,5,3,730,1,16,4
IndiGo,21/05/2019,Chennai,Kolkata,MAA → CCU,19:35,21:55,2h 20m,non-stop,No info,3597,2019-05-21,21,5,1,140,0,19,21
SpiceJet,21/03/2019,Banglore,New Delhi,BLR → PNQ → DEL,10:20,18:15,7h 55m,1 stop,No info,7139,2019-03-21,21,3,3,475,1,10,18
Air India,6/03/2019,Mumbai,Hyderabad,BOM → JDH → DEL → HYD,09:40,15:15 07 Mar,29h 35m,2 stops,No info,25139,2019-03-06,6,3,2,1775,2,9,15
Jet Airways,1/06/2019,Delhi,Cochin,DEL → JAI → BOM → COK,09:40,12:35 02 Jun,26h 55m,2 stops,In-flight meal not included,10368,2019-06-01,1,6,5,1615,2,9,12
Air India,6/04/2019,Delhi,Cochin,DEL → MAA → COK,20:40,09:25 07 Apr,12h 45m,1 stop,No info,5117,2019-04-06,6,4,5,765,1,20,9
Multiple carriers,18/05/2019,Delhi,Cochin,DEL → BOM → COK,11:40,19:15,7h 35m,1 stop,No info,9211,2019-05-18,18,5,5,455,1,11,19
SpiceJet,15/04/2019,Kolkata,Banglore,CCU → BLR,17:10,19:40,2h 30m,non-stop,No info,4174,2019-04-15,15,4,0,150,0,17,19
Multiple carriers,27/05/2019,Delhi,Cochin,DEL → BOM → COK,07:30,19:15,11h 45m,1 stop,No info,10786,2019-05-27,27,5,0,705,1,7,19
Jet Airways,15/03/2019,Banglore,New Delhi,BLR → BOM → DEL,08:00,07:40 16 Mar,23h 40m,1 stop,In-flight meal not included,9134,2019-03-15,15,3,4,1420,1,8,7
Jet Airways,1/06/2019,Delhi,Cochin,DEL → NAG → BOM → COK,14:35,04:25 02 Jun,13h 50m,2 stops,No info,13376,2019-06-01,1,6,5,830,2,14,4
Air India,21/03/2019,Banglore,New Delhi,BLR → COK → DEL,22:00,10:50 19 Mar,12h 50m,1 stop,No info,6955,2019-03-21,21,3,3,770,1,22,10
Jet Airways,9/05/2019,Kolkata,Banglore,CCU → BOM → BLR,08:25,18:15,9h 50m,1 stop,In-flight meal not included,10844,2019-05-09,9,5,3,590,1,8,18
Air Asia,1/04/2019,Kolkata,Banglore,CCU → BLR,19:55,22:25,2h 30m,non-stop,No info,3807,2019-04-01,1,4,0,150,0,19,22
Jet Airways,1/05/2019,Kolkata,Banglore,CCU → BOM → BLR,14:05,12:00 02 May,21h 55m,1 stop,In-flight meal not included,9663,2019-05-01,1,5,2,1315,1,14,12
Jet Airways,9/05/2019,Delhi,Cochin,DEL → BOM → COK,02:15,04:25 10 May,26h 10m,1 stop,In-flight meal not included,12373,2019-05-09,9,5,3,1570,1,2,4
SpiceJet,1/05/2019,Banglore,Delhi,BLR → DEL,21:10,00:05 02 May,2h 55m,non-stop,No info,4991,2019-05-01,1,5,2,175,0,21,0
Air India,21/03/2019,Delhi,Cochin,DEL → BOM → COK,23:00,19:15 22 Mar,20h 15m,1 stop,No info,6745,2019-03-21,21,3,3,1215,1,23,19
Jet Airways,15/06/2019,Delhi,Cochin,DEL → BOM → COK,22:50,19:00 16 Jun,20h 10m,1 stop,In-flight meal not included,10262,2019-06-15,15,6,5,1210,1,22,19
Jet Airways,27/03/2019,Delhi,Cochin,DEL → BOM → COK,17:30,04:25 28 Mar,10h 55m,1 stop,In-flight meal not included,6540,2019-03-27,27,3,2,655,1,17,4
SpiceJet,6/04/2019,Kolkata,Banglore,CCU → BLR,17:10,19:40,2h 30m,non-stop,No info,3873,2019-04-06,6,4,5,150,0,17,19
Jet Airways,9/05/2019,Delhi,Cochin,DEL → BOM → COK,21:50,19:00 10 May,21h 10m,1 stop,No info,15554,2019-05-09,9,5,3,1270,1,21,19
IndiGo,27/05/2019,Kolkata,Banglore,CCU → BLR,20:20,22:55,2h 35m,non-stop,No info,4804,2019-05-27,27,5,0,155,0,20,22
Jet Airways,27/03/2019,Delhi,Cochin,DEL → BOM → COK,23:05,19:45 28 Mar,20h 40m,1 stop,In-flight meal not included,7438,2019-03-27,27,3,2,1240,1,23,19
Air Asia,3/05/2019,Banglore,Delhi,BLR → DEL,04:55,07:45,2h 50m,non-stop,No info,6181,2019-05-03,3,5,4,170,0,4,7
Multiple carriers,1/05/2019,Delhi,Cochin,DEL → BOM → COK,19:00,01:30 02 May,6h 30m,1 stop,No info,9424,2019-05-01,1,5,2,390,1,19,1
Air India,12/03/2019,Banglore,New Delhi,BLR → BOM → BHO → DEL,17:25,23:25 13 Mar,30h,2 stops,No info,12725,2019-03-12,12,3,1,1800,2,17,23
Air India,15/03/2019,Banglore,New Delhi,BLR → HYD → DEL,08:15,21:25,13h 10m,1 stop,No info,6046,2019-03-15,15,3,4,790,1,8,21
SpiceJet,15/06/2019,Banglore,Delhi,BLR → DEL,21:10,00:05 16 Jun,2h 55m,non-stop,No info,3971,2019-06-15,15,6,5,175,0,21,0
Jet Airways,6/06/2019,Kolkata,Banglore,CCU → DEL → BLR,20:25,14:25 07 Jun,18h,1 stop,No info,12692,2019-06-06,6,6,3,1080,1,20,14
IndiGo,6/03/2019,Delhi,Cochin,DEL → HYD → COK,14:20,22:20,8h,1 stop,No info,7451,2019-03-06,6,3,2,480,1,14,22
Jet Airways,12/03/2019,Banglore,New Delhi,BLR → BOM → DEL,22:55,07:40 13 Mar,8h 45m,1 stop,No info,13817,2019-03-12,12,3,1,525,1,22,7
Jet Airways,6/05/2019,Kolkata,Banglore,CCU → DEL → BLR,09:35,22:05,12h 30m,1 stop,In-flight meal not included,10703,2019-05-06,6,5,0,750,1,9,22
Jet Airways,12/03/2019,Banglore,New Delhi,BLR → BOM → DEL,21:25,10:45 13 Mar,13h 20m,1 stop,No info,13817,2019-03-12,12,3,1,800,1,21,10
Jet Airways,15/03/2019,Banglore,New Delhi,BLR → BOM → DEL,22:55,05:05 13 Mar,6h 10m,1 stop,No info,27210,2019-03-15,15,3,4,370,1,22,5
Jet Airways,18/05/2019,Kolkata,Banglore,CCU → BOM → BLR,21:10,04:40 19 May,7h 30m,1 stop,No info,13941,2019-05-18,18,5,5,450,1,21,4
Air India,01/03/2019,Banglore,New Delhi,BLR → HYD → DEL,17:00,12:15 02 Mar,19h 15m,1 stop,No info,10246,2019-03-01,1,3,4,1155,1,17,12
IndiGo,6/05/2019,Kolkata,Banglore,CCU → BLR,17:15,19:50,2h 35m,non-stop,No info,4804,2019-05-06,6,5,0,155,0,17,19
Air Asia,6/06/2019,Kolkata,Banglore,CCU → DEL → BLR,22:40,10:40 07 Jun,12h,1 stop,No info,6810,2019-06-06,6,6,3,720,1,22,10
Jet Airways,1/05/2019,Banglore,Delhi,BLR → DEL,08:20,11:20,3h,non-stop,In-flight meal not included,5198,2019-05-01,1,5,2,180,0,8,11
Vistara,3/05/2019,Banglore,Delhi,BLR → DEL,21:00,23:50,2h 50m,non-stop,No info,5613,2019-05-03,3,5,4,170,0,21,23
IndiGo,3/03/2019,Mumbai,Hyderabad,BOM → HYD,21:20,22:45,1h 25m,non-stop,No info,4784,2019-03-03,3,3,6,85,0,21,22
Jet Airways,21/03/2019,Delhi,Cochin,DEL → BOM → COK,19:45,18:50 22 Mar,23h 5m,1 stop,In-flight meal not included,5406,2019-03-21,21,3,3,1385,1,19,18
Air India,27/04/2019,Banglore,Delhi,BLR → DEL,13:20,16:10,2h 50m,non-stop,No info,5228,2019-04-27,27,4,5,170,0,13,16
Jet Airways,27/05/2019,Delhi,Cochin,DEL → BOM → COK,20:55,19:00 28 May,22h 5m,1 stop,In-flight meal not included,12898,2019-05-27,27,5,0,1325,1,20,19
Air India,15/06/2019,Chennai,Kolkata,MAA → CCU,11:40,13:55,2h 15m,non-stop,No info,4667,2019-06-15,15,6,5,135,0,11,13
Jet Airways,21/05/2019,Kolkata,Banglore,CCU → BOM → BLR,14:05,19:50,5h 45m,1 stop,No info,14781,2019-05-21,21,5,1,345,1,14,19
Vistara,21/04/2019,Banglore,Delhi,BLR → DEL,09:45,12:35,2h 50m,non-stop,No info,5403,2019-04-21,21,4,6,170,0,9,12
Jet Airways,12/06/2019,Kolkata,Banglore,CCU → BOM → BLR,14:05,23:35,9h 30m,1 stop,In-flight meal not included,9899,2019-06-12,12,6,2,570,1,14,23
Jet Airways,21/05/2019,Delhi,Cochin,DEL → JAI → BOM → COK,19:30,04:25 22 May,8h 55m,2 stops,In-flight meal not included,13029,2019-05-21,21,5,1,535,2,19,4
Vistara,18/05/2019,Kolkata,Banglore,CCU → DEL → BLR,17:00,10:45 19 May,17h 45m,1 stop,No info,9187,2019-05-18,18,5,5,1065,1,17,10
IndiGo,24/05/2019,Banglore,Delhi,BLR → DEL,20:00,22:50,2h 50m,non-stop,No info,4823,2019-05-24,24,5,4,170,0,20,22
Air India,27/03/2019,Delhi,Cochin,DEL → HYD → BOM → COK,21:30,19:15 28 Mar,21h 45m,2 stops,No info,8665,2019-03-27,27,3,2,1305,2,21,19
IndiGo,6/03/2019,Delhi,Cochin,DEL → BOM → COK,08:25,21:00,12h 35m,1 stop,No info,14871,2019-03-06,6,3,2,755,1,8,21
IndiGo,21/06/2019,Mumbai,Hyderabad,BOM → HYD,06:25,07:55,1h 30m,non-stop,No info,4049,2019-06-21,21,6,4,90,0,6,7
Air India,12/06/2019,Chennai,Kolkata,MAA → CCU,11:40,13:55,2h 15m,non-stop,No info,4667,2019-06-12,12,6,2,135,0,11,13
IndiGo,9/04/2019,Kolkata,Banglore,CCU → BBI → BLR,19:55,23:50,3h 55m,1 stop,No info,4226,2019-04-09,9,4,1,235,1,19,23
Air India,03/03/2019,Banglore,New Delhi,BLR → DEL,06:10,08:55,2h 45m,non-stop,No info,7591,2019-03-03,3,3,6,165,0,6,8
Jet Airways,06/03/2019,Banglore,New Delhi,BLR → BOM → DEL,05:45,13:15,7h 30m,1 stop,No info,19225,2019-03-06,6,3,2,450,1,5,13
Jet Airways,27/05/2019,Delhi,Cochin,DEL → BOM → COK,19:15,12:35 28 May,17h 20m,1 stop,In-flight meal not included,12898,2019-05-27,27,5,0,1040,1,19,12
IndiGo,9/06/2019,Mumbai,Hyderabad,BOM → HYD,12:00,13:30,1h 30m,non-stop,No info,2754,2019-06-09,9,6,6,90,0,12,13
SpiceJet,3/05/2019,Mumbai,Hyderabad,BOM → HYD,13:15,14:45,1h 30m,non-stop,No check-in baggage included,1965,2019-05-03,3,5,4,90,0,13,14
Air India,24/03/2019,Kolkata,Banglore,CCU → GAU → DEL → BLR,16:45,23:15 25 Mar,30h 30m,2 stops,No info,12835,2019-03-24,24,3,6,1830,2,16,23
Jet Airways Business,01/03/2019,Banglore,New Delhi,BLR → BOM → DEL,05:45,10:45,5h,1 stop,No info,52229,2019-03-01,1,3,4,300,1,5,10
Multiple carriers,15/05/2019,Delhi,Cochin,DEL → BOM → COK,08:00,19:15,11h 15m,1 stop,No info,14533,2019-05-15,15,5,2,675,1,8,19
Vistara,24/06/2019,Banglore,Delhi,BLR → DEL,09:45,12:35,2h 50m,non-stop,No info,4668,2019-06-24,24,6,0,170,0,9,12
Jet Airways,9/04/2019,Delhi,Cochin,DEL → BOM → COK,17:30,12:35 10 Apr,19h 5m,1 stop,No info,11822,2019-04-09,9,4,1,1145,1,17,12
Jet Airways,27/03/2019,Delhi,Cochin,DEL → BOM → COK,21:50,04:25 28 Mar,6h 35m,1 stop,In-flight meal not included,6017,2019-03-27,27,3,2,395,1,21,4
Jet Airways,9/06/2019,Delhi,Cochin,DEL → BOM → COK,11:30,19:00,7h 30m,1 stop,No info,14714,2019-06-09,9,6,6,450,1,11,19
SpiceJet,9/06/2019,Chennai,Kolkata,MAA → CCU,08:20,10:35,2h 15m,non-stop,No info,3597,2019-06-09,9,6,6,135,0,8,10
Air Asia,24/04/2019,Banglore,Delhi,BLR → DEL,11:10,13:55,2h 45m,non-stop,No info,3383,2019-04-24,24,4,2,165,0,11,13
Air India,18/05/2019,Kolkata,Banglore,CCU → BOM → GOI → BLR,16:50,05:35 19 May,12h 45m,2 stops,No info,11642,2019-05-18,18,5,5,765,2,16,5
Vistara,27/04/2019,Banglore,Delhi,BLR → DEL,21:00,23:50,2h 50m,non-stop,No info,5403,2019-04-27,27,4,5,170,0,21,23
Air India,3/03/2019,Delhi,Cochin,DEL → AMD → BOM → COK,16:40,19:15 04 Mar,26h 35m,2 stops,No info,14221,2019-03-03,3,3,6,1595,2,16,19
Jet Airways,18/05/2019,Kolkata,Banglore,CCU → BOM → BLR,21:10,10:05 19 May,12h 55m,1 stop,In-flight meal not included,8586,2019-05-18,18,5,5,775,1,21,10
IndiGo,12/06/2019,Mumbai,Hyderabad,BOM → HYD,09:10,10:40,1h 30m,non-stop,No info,4049,2019-06-12,12,6,2,90,0,9,10
Jet Airways,3/06/2019,Delhi,Cochin,DEL → BOM → COK,19:45,04:25 04 Jun,8h 40m,1 stop,In-flight meal not included,10262,2019-06-03,3,6,0,520,1,19,4
Multiple carriers,21/05/2019,Delhi,Cochin,DEL → BOM → COK,07:00,21:00,14h,1 stop,No info,7888,2019-05-21,21,5,1,840,1,7,21
Air India,21/03/2019,Delhi,Cochin,DEL → AMD → BOM → COK,19:45,19:15 22 Mar,23h 30m,2 stops,No info,8236,2019-03-21,21,3,3,1410,2,19,19
Air India,6/06/2019,Delhi,Cochin,DEL → UDR → BOM → COK,13:20,19:15 07 Jun,29h 55m,2 stops,No info,12961,2019-06-06,6,6,3,1795,2,13,19
Jet Airways,9/05/2019,Kolkata,Banglore,CCU → BOM → BLR,06:30,04:40 10 May,22h 10m,1 stop,In-flight meal not included,8586,2019-05-09,9,5,3,1330,1,6,4
IndiGo,18/05/2019,Kolkata,Banglore,CCU → MAA → BLR,08:10,13:00,4h 50m,1 stop,No info,5279,2019-05-18,18,5,5,290,1,8,13
GoAir,18/06/2019,Banglore,Delhi,BLR → DEL,20:55,23:40,2h 45m,non-stop,No info,3419,2019-06-18,18,6,1,165,0,20,23
Jet Airways,15/06/2019,Delhi,Cochin,DEL → IDR → BOM → COK,05:30,19:00,13h 30m,2 stops,No info,13292,2019-06-15,15,6,5,810,2,5,19
Jet Airways,15/05/2019,Kolkata,Banglore,CCU → DEL → BLR,20:25,09:45 16 May,13h 20m,1 stop,No info,13067,2019-05-15,15,5,2,800,1,20,9
IndiGo,3/05/2019,Chennai,Kolkata,MAA → CCU,13:15,15:35,2h 20m,non-stop,No info,3597,2019-05-03,3,5,4,140,0,13,15
Jet Airways,18/05/2019,Delhi,Cochin,DEL → BOM → COK,07:05,19:00,11h 55m,1 stop,No info,15554,2019-05-18,18,5,5,715,1,7,19
IndiGo,15/05/2019,Delhi,Cochin,DEL → BLR → COK,17:05,22:15,5h 10m,1 stop,No info,6027,2019-05-15,15,5,2,310,1,17,22
Jet Airways,9/05/2019,Kolkata,Banglore,CCU → BOM → BLR,06:30,18:15,11h 45m,1 stop,No info,14781,2019-05-09,9,5,3,705,1,6,18
Jet Airways,1/06/2019,Delhi,Cochin,DEL → NAG → BOM → COK,14:35,04:25 02 Jun,13h 50m,2 stops,No info,13376,2019-06-01,1,6,5,830,2,14,4
IndiGo,27/05/2019,Banglore,Delhi,BLR → DEL,21:15,00:15 28 May,3h,non-stop,No info,3943,2019-05-27,27,5,0,180,0,21,0
GoAir,12/06/2019,Delhi,Cochin,DEL → AMD → COK,07:25,13:35,6h 10m,1 stop,No info,5842,2019-06-12,12,6,2,370,1,7,13
IndiGo,15/03/2019,Chennai,Kolkata,MAA → CCU,05:15,07:35,2h 20m,non-stop,No info,4326,2019-03-15,15,3,4,140,0,5,7
Multiple carriers,1/06/2019,Delhi,Cochin,DEL → BOM → COK,08:30,19:15,10h 45m,1 stop,No info,8937,2019-06-01,1,6,5,645,1,8,19
Air India,21/03/2019,Chennai,Kolkata,MAA → CCU,11:40,13:55,2h 15m,non-stop,No info,3670,2019-03-21,21,3,3,135,0,11,13
IndiGo,18/06/2019,Banglore,Delhi,BLR → DEL,18:25,21:20,2h 55m,non-stop,No info,4823,2019-06-18,18,6,1,175,0,18,21
Jet Airways,3/04/2019,Mumbai,Hyderabad,BOM → HYD,19:35,21:05,1h 30m,non-stop,In-flight meal not included,2071,2019-04-03,3,4,2,90,0,19,21
Multiple carriers,27/06/2019,Delhi,Cochin,DEL → HYD → COK,14:55,22:30,7h 35m,1 stop,In-flight meal not included,6093,2019-06-27,27,6,3,455,1,14,22
Vistara,24/03/2019,Kolkata,Banglore,CCU → DEL → BLR,20:20,22:55 25 Mar,26h 35m,1 stop,No info,11682,2019-03-24,24,3,6,1595,1,20,22
IndiGo,03/03/2019,Banglore,New Delhi,BLR → LKO → DEL,05:25,10:10,4h 45m,1 stop,No info,7774,2019-03-03,3,3,6,285,1,5,10
Jet Airways,12/05/2019,Kolkata,Banglore,CCU → DEL → BLR,17:00,14:25 13 May,21h 25m,1 stop,No info,13067,2019-05-12,12,5,6,1285,1,17,14
IndiGo,27/05/2019,Delhi,Cochin,DEL → HYD → COK,07:35,16:10,8h 35m,1 stop,No info,7514,2019-05-27,27,5,0,515,1,7,16
Multiple carriers,9/04/2019,Delhi,Cochin,DEL → BOM → COK,17:00,01:30 10 Apr,8h 30m,1 stop,No info,6838,2019-04-09,9,4,1,510,1,17,1
IndiGo,18/03/2019,Chennai,Kolkata,MAA → CCU,13:20,15:35,2h 15m,non-stop,No info,3858,2019-03-18,18,3,0,135,0,13,15
Multiple carriers,15/06/2019,Delhi,Cochin,DEL → BOM → COK,12:50,01:30 16 Jun,12h 40m,1 stop,No info,6795,2019-06-15,15,6,5,760,1,12,1
Jet Airways,27/05/2019,Delhi,Cochin,DEL → ATQ → BOM → COK,20:00,04:25 28 May,8h 25m,2 stops,No info,16263,2019-05-27,27,5,0,505,2,20,4
Air India,9/05/2019,Kolkata,Banglore,CCU → BOM → BLR,16:50,18:30 10 May,25h 40m,1 stop,No info,8576,2019-05-09,9,5,3,1540,1,16,18
Air India,6/05/2019,Banglore,Delhi,BLR → DEL,10:00,12:45,2h 45m,non-stop,No info,5228,2019-05-06,6,5,0,165,0,10,12
Jet Airways,1/05/2019,Delhi,Cochin,DEL → AMD → BOM → COK,23:05,04:25 03 May,29h 20m,2 stops,No info,16704,2019-05-01,1,5,2,1760,2,23,4
IndiGo,24/03/2019,Kolkata,Banglore,CCU → BLR,20:25,23:05,2h 40m,non-stop,No info,8872,2019-03-24,24,3,6,160,0,20,23
GoAir,3/05/2019,Banglore,Delhi,BLR → DEL,11:40,14:30,2h 50m,non-stop,No info,3898,2019-05-03,3,5,4,170,0,11,14
SpiceJet,21/03/2019,Chennai,Kolkata,MAA → CCU,17:45,20:05,2h 20m,non-stop,No check-in baggage included,3332,2019-03-21,21,3,3,140,0,17,20
Jet Airways,21/05/2019,Kolkata,Banglore,CCU → GAU → BLR,10:20,17:35,7h 15m,1 stop,In-flight meal not included,5608,2019-05-21,21,5,1,435,1,10,17
Jet Airways,9/05/2019,Kolkata,Banglore,CCU → BOM → BLR,08:25,04:40 10 May,20h 15m,1 stop,No info,13941,2019-05-09,9,5,3,1215,1,8,4
Multiple carriers,21/03/2019,Delhi,Cochin,DEL → BOM → COK,07:30,19:15,11h 45m,1 stop,No info,9100,2019-03-21,21,3,3,705,1,7,19
Vistara,15/06/2019,Banglore,Delhi,BLR → DEL,17:00,19:35,2h 35m,non-stop,No info,4878,2019-06-15,15,6,5,155,0,17,19
IndiGo,1/06/2019,Delhi,Cochin,DEL → BOM → COK,07:30,21:00,13h 30m,1 stop,No info,6416,2019-06-01,1,6,5,810,1,7,21
SpiceJet,12/05/2019,Mumbai,Hyderabad,BOM → HYD,05:45,07:15,1h 30m,non-stop,No info,2017,2019-05-12,12,5,6,90,0,5,7
Jet Airways,27/03/2019,Delhi,Cochin,DEL → AMD → BOM → COK,19:10,19:45 28 Mar,24h 35m,2 stops,No info,10976,2019-03-27,27,3,2,1475,2,19,19
Jet Airways,24/03/2019,Kolkata,Banglore,CCU → BOM → BLR,19:45,16:20 25 Mar,20h 35m,1 stop,In-flight meal not included,10031,2019-03-24,24,3,6,1235,1,19,16
IndiGo,18/03/2019,Kolkata,Banglore,CCU → BLR,05:30,08:20,2h 50m,non-stop,No info,4462,2019-03-18,18,3,0,170,0,5,8
IndiGo,1/04/2019,Delhi,Cochin,DEL → HYD → COK,07:35,12:10,4h 35m,1 stop,No info,5073,2019-04-01,1,4,0,275,1,7,12
IndiGo,27/03/2019,Chennai,Kolkata,MAA → CCU,05:15,07:35,2h 20m,non-stop,No info,4326,2019-03-27,27,3,2,140,0,5,7
Multiple carriers Premium economy,21/03/2019,Delhi,Cochin,DEL → BOM → COK,07:30,19:15,11h 45m,1 stop,No info,10161,2019-03-21,21,3,3,705,1,7,19
IndiGo,12/06/2019,Mumbai,Hyderabad,BOM → HYD,16:55,18:25,1h 30m,non-stop,No info,3175,2019-06-12,12,6,2,90,0,16,18
Vistara,24/03/2019,Kolkata,Banglore,CCU → DEL → BLR,20:20,09:10 25 Mar,12h 50m,1 stop,No info,12312,2019-03-24,24,3,6,770,1,20,9
Jet Airways,21/03/2019,Delhi,Cochin,DEL → UDR → BOM → COK,18:20,18:50 22 Mar,24h 30m,2 stops,No info,12604,2019-03-21,21,3,3,1470,2,18,18
Multiple carriers,15/06/2019,Delhi,Cochin,DEL → BOM → COK,07:30,19:00,11h 30m,1 stop,No info,10877,2019-06-15,15,6,5,690,1,7,19
IndiGo,18/05/2019,Kolkata,Banglore,CCU → MAA → BLR,06:20,10:20,4h,1 stop,No info,4226,2019-05-18,18,5,5,240,1,6,10
Jet Airways,6/04/2019,Delhi,Cochin,DEL → BOM → COK,08:00,19:00,11h,1 stop,In-flight meal not included,5406,2019-04-06,6,4,5,660,1,8,19
IndiGo,15/05/2019,Delhi,Cochin,DEL → MAA → COK,02:00,07:25,5h 25m,1 stop,No info,8618,2019-05-15,15,5,2,325,1,2,7
IndiGo,18/04/2019,Kolkata,Banglore,CCU → BLR,17:15,19:50,2h 35m,non-stop,No info,4174,2019-04-18,18,4,3,155,0,17,19
GoAir,1/06/2019,Delhi,Cochin,DEL → BOM → COK,14:25,19:35,5h 10m,1 stop,No info,10651,2019-06-01,1,6,5,310,1,14,19
Jet Airways,21/03/2019,Delhi,Cochin,DEL → BOM → COK,18:15,04:25 22 Mar,10h 10m,1 stop,In-flight meal not included,5963,2019-03-21,21,3,3,610,1,18,4
Jet Airways,12/06/2019,Delhi,Cochin,DEL → JAI → BOM → COK,09:40,12:35 13 Jun,26h 55m,2 stops,In-flight meal not included,10368,2019-06-12,12,6,2,1615,2,9,12
IndiGo,6/03/2019,Mumbai,Hyderabad,BOM → GOI → HYD,15:45,23:00,7h 15m,1 stop,No info,7681,2019-03-06,6,3,2,435,1,15,23
Multiple carriers,21/05/2019,Delhi,Cochin,DEL → BOM → COK,12:50,21:00,8h 10m,1 stop,No info,7485,2019-05-21,21,5,1,490,1,12,21
Jet Airways,3/04/2019,Banglore,Delhi,BLR → DEL,15:15,18:10,2h 55m,non-stop,In-flight meal not included,4544,2019-04-03,3,4,2,175,0,15,18
SpiceJet,15/04/2019,Kolkata,Banglore,CCU → MAA → BLR,15:05,20:20,5h 15m,1 stop,No info,4649,2019-04-15,15,4,0,315,1,15,20
Vistara,12/05/2019,Chennai,Kolkata,MAA → CCU,17:45,20:05,2h 20m,non-stop,No info,11982,2019-05-12,12,5,6,140,0,17,20
Jet Airways,24/06/2019,Mumbai,Hyderabad,BOM → HYD,07:05,08:30,1h 25m,non-stop,In-flight meal not included,4995,2019-06-24,24,6,0,85,0,7,8
IndiGo,9/05/2019,Kolkata,Banglore,CCU → MAA → BLR,08:10,13:00,4h 50m,1 stop,No info,5069,2019-05-09,9,5,3,290,1,8,13
SpiceJet,1/06/2019,Kolkata,Banglore,CCU → BLR,22:20,00:40 02 Jun,2h 20m,non-stop,No info,3873,2019-06-01,1,6,5,140,0,22,0
SpiceJet,27/04/2019,Kolkata,Banglore,CCU → BLR,22:20,00:40 28 Apr,2h 20m,non-stop,No info,3873,2019-04-27,27,4,5,140,0,22,0
Air India,27/05/2019,Delhi,Cochin,DEL → BLR → COK,09:45,23:00,13h 15m,1 stop,No info,8907,2019-05-27,27,5,0,795,1,9,23
Jet Airways,9/06/2019,Kolkata,Banglore,CCU → BOM → BLR,21:10,16:20 10 Jun,19h 10m,1 stop,In-flight meal not included,10844,2019-06-09,9,6,6,1150,1,21,16
Jet Airways,15/05/2019,Kolkata,Banglore,CCU → BOM → BLR,21:10,19:50 16 May,22h 40m,1 stop,In-flight meal not included,10844,2019-05-15,15,5,2,1360,1,21,19
Jet Airways,6/05/2019,Kolkata,Banglore,CCU → BOM → BLR,21:10,12:00 07 May,14h 50m,1 stop,In-flight meal not included,9663,2019-05-06,6,5,0,890,1,21,12
Jet Airways,1/06/2019,Delhi,Cochin,DEL → IDR → BOM → COK,21:25,12:35 02 Jun,15h 10m,2 stops,No info,13292,2019-06-01,1,6,5,910,2,21,12
Jet Airways,12/06/2019,Delhi,Cochin,DEL → BHO → BOM → COK,05:30,12:35,7h 5m,2 stops,No info,14441,2019-06-12,12,6,2,425,2,5,12
Jet Airways,9/06/2019,Mumbai,Hyderabad,BOM → HYD,02:55,04:20,1h 25m,non-stop,In-flight meal not included,4050,2019-06-09,9,6,6,85,0,2,4
IndiGo,09/03/2019,Banglore,New Delhi,BLR → DEL,21:20,00:15 10 Mar,2h 55m,non-stop,No info,6144,2019-03-09,9,3,5,175,0,21,0
IndiGo,6/03/2019,Delhi,Cochin,DEL → BOM → COK,07:30,15:30,8h,1 stop,No info,14871,2019-03-06,6,3,2,480,1,7,15
Air Asia,18/04/2019,Banglore,Delhi,BLR → DEL,11:10,13:55,2h 45m,non-stop,No info,4483,2019-04-18,18,4,3,165,0,11,13
IndiGo,15/05/2019,Delhi,Cochin,DEL → BOM → COK,10:35,01:30 16 May,14h 55m,1 stop,No info,6979,2019-05-15,15,5,2,895,1,10,1
Jet Airways,27/06/2019,Mumbai,Hyderabad,BOM → HYD,10:20,11:50,1h 30m,non-stop,No info,8040,2019-06-27,27,6,3,90,0,10,11
IndiGo,1/06/2019,Delhi,Cochin,DEL → BOM → COK,09:15,01:30 02 Jun,16h 15m,1 stop,No info,7048,2019-06-01,1,6,5,975,1,9,1
SpiceJet,27/06/2019,Banglore,Delhi,BLR → DEL,09:30,12:20,2h 50m,non-stop,No check-in baggage included,3573,2019-06-27,27,6,3,170,0,9,12
IndiGo,27/05/2019,Delhi,Cochin,DEL → BOM → COK,16:00,21:00,5h,1 stop,No info,5054,2019-05-27,27,5,0,300,1,16,21
Air India,1/06/2019,Delhi,Cochin,DEL → BOM → COK,21:00,19:15 02 Jun,22h 15m,1 stop,No info,8582,2019-06-01,1,6,5,1335,1,21,19
Air Asia,9/06/2019,Delhi,Cochin,DEL → BLR → COK,07:55,13:25,5h 30m,1 stop,No info,8759,2019-06-09,9,6,6,330,1,7,13
IndiGo,27/04/2019,Delhi,Cochin,DEL → HYD → COK,07:35,16:10,8h 35m,1 stop,No info,6442,2019-04-27,27,4,5,515,1,7,16
Air India,18/05/2019,Delhi,Cochin,DEL → BOM → COK,03:50,19:15,15h 25m,1 stop,No info,8879,2019-05-18,18,5,5,925,1,3,19
Jet Airways,24/03/2019,Kolkata,Banglore,CCU → BOM → BLR,21:10,18:10 25 Mar,21h,1 stop,In-flight meal not included,10031,2019-03-24,24,3,6,1260,1,21,18
Jet Airways,3/06/2019,Delhi,Cochin,DEL → JAI → BOM → COK,05:30,19:00,13h 30m,2 stops,In-flight meal not included,10368,2019-06-03,3,6,0,810,2,5,19
IndiGo,24/06/2019,Banglore,Delhi,BLR → DEL,13:00,15:50,2h 50m,non-stop,No info,3943,2019-06-24,24,6,0,170,0,13,15
IndiGo,3/03/2019,Delhi,Cochin,DEL → BOM → COK,04:45,11:30,6h 45m,1 stop,No info,14871,2019-03-03,3,3,6,405,1,4,11
Jet Airways,18/06/2019,Mumbai,Hyderabad,BOM → HYD,08:45,10:15,1h 30m,non-stop,In-flight meal not included,4995,2019-06-18,18,6,1,90,0,8,10
Multiple carriers,24/06/2019,Delhi,Cochin,DEL → BOM → COK,10:20,19:00,8h 40m,1 stop,In-flight meal not included,10791,2019-06-24,24,6,0,520,1,10,19
SpiceJet,3/06/2019,Mumbai,Hyderabad,BOM → HYD,05:45,07:15,1h 30m,non-stop,No info,2753,2019-06-03,3,6,0,90,0,5,7
IndiGo,9/04/2019,Banglore,Delhi,BLR → DEL,10:10,13:00,2h 50m,non-stop,No info,4423,2019-04-09,9,4,1,170,0,10,13
Air Asia,27/05/2019,Kolkata,Banglore,CCU → BLR,10:20,12:55,2h 35m,non-stop,No info,4409,2019-05-27,27,5,0,155,0,10,12
Air India,9/05/2019,Kolkata,Banglore,CCU → HYD → BLR,19:00,11:05 10 May,16h 5m,1 stop,No info,6117,2019-05-09,9,5,3,965,1,19,11
Jet Airways,21/05/2019,Delhi,Cochin,DEL → AMD → BOM → COK,19:10,19:00 22 May,23h 50m,2 stops,No info,15129,2019-05-21,21,5,1,1430,2,19,19
Vistara,6/06/2019,Kolkata,Banglore,CCU → DEL → BLR,20:20,23:25 07 Jun,27h 5m,1 stop,No info,9345,2019-06-06,6,6,3,1625,1,20,23
Vistara,9/05/2019,Kolkata,Banglore,CCU → DEL → BLR,07:10,23:25,16h 15m,1 stop,No info,8085,2019-05-09,9,5,3,975,1,7,23
Jet Airways,6/05/2019,Delhi,Cochin,DEL → BOM → COK,13:00,04:25 07 May,15h 25m,1 stop,No info,15554,2019-05-06,6,5,0,925,1,13,4
SpiceJet,21/05/2019,Banglore,Delhi,BLR → DEL,09:30,12:20,2h 50m,non-stop,No check-in baggage included,3573,2019-05-21,21,5,1,170,0,9,12
Multiple carriers,3/03/2019,Delhi,Cochin,DEL → BOM → COK,17:00,01:35 04 Mar,8h 35m,1 stop,No info,17073,2019-03-03,3,3,6,515,1,17,1
Multiple carriers,9/06/2019,Delhi,Cochin,DEL → BOM → COK,11:40,01:30 10 Jun,13h 50m,1 stop,No info,6795,2019-06-09,9,6,6,830,1,11,1
Vistara,21/03/2019,Banglore,New Delhi,BLR → DEL,07:00,09:40,2h 40m,non-stop,No info,5403,2019-03-21,21,3,3,160,0,7,9
IndiGo,15/05/2019,Chennai,Kolkata,MAA → CCU,05:15,07:40,2h 25m,non-stop,No info,3540,2019-05-15,15,5,2,145,0,5,7
Vistara,24/04/2019,Delhi,Cochin,DEL → COK,14:40,17:50,3h 10m,non-stop,No info,6216,2019-04-24,24,4,2,190,0,14,17
Jet Airways,21/05/2019,Banglore,Delhi,BLR → DEL,15:50,18:45,2h 55m,non-stop,In-flight meal not included,3359,2019-05-21,21,5,1,175,0,15,18
Jet Airways,24/05/2019,Kolkata,Banglore,CCU → BOM → BLR,18:55,23:35 25 May,28h 40m,1 stop,In-flight meal not included,10844,2019-05-24,24,5,4,1720,1,18,23
Air India,15/06/2019,Banglore,Delhi,BLR → DEL,13:20,16:10,2h 50m,non-stop,No info,6961,2019-06-15,15,6,5,170,0,13,16
Air Asia,3/04/2019,Kolkata,Banglore,CCU → BLR,10:20,12:55,2h 35m,non-stop,No info,4107,2019-04-03,3,4,2,155,0,10,12
Multiple carriers,21/03/2019,Delhi,Cochin,DEL → BOM → COK,09:10,18:50,9h 40m,1 stop,No info,13069,2019-03-21,21,3,3,580,1,9,18
Jet Airways,24/06/2019,Delhi,Cochin,DEL → LKO → BOM → COK,11:45,04:25 25 Jun,16h 40m,2 stops,No info,13357,2019-06-24,24,6,0,1000,2,11,4
IndiGo,1/06/2019,Delhi,Cochin,DEL → HYD → COK,16:10,22:30,6h 20m,1 stop,No info,6938,2019-06-01,1,6,5,380,1,16,22
Jet Airways,27/06/2019,Delhi,Cochin,DEL → IDR → BOM → COK,09:35,12:35 28 Jun,27h,2 stops,No info,13292,2019-06-27,27,6,3,1620,2,9,12
Air India,01/03/2019,Banglore,New Delhi,BLR → BOM → BHO → DEL,08:50,23:25,14h 35m,2 stops,1 Short layover,26743,2019-03-01,1,3,4,875,2,8,23
Multiple carriers,21/03/2019,Delhi,Cochin,DEL → BOM → COK,06:40,18:50,12h 10m,1 stop,No info,13568,2019-03-21,21,3,3,730,1,6,18
Multiple carriers,6/03/2019,Delhi,Cochin,DEL → BOM → COK,11:40,19:15,7h 35m,1 stop,No info,15353,2019-03-06,6,3,2,455,1,11,19
IndiGo,15/05/2019,Chennai,Kolkata,MAA → CCU,14:45,17:05,2h 20m,non-stop,No info,3597,2019-05-15,15,5,2,140,0,14,17
Jet Airways,24/03/2019,Kolkata,Banglore,CCU → BOM → BLR,21:10,16:20 25 Mar,19h 10m,1 stop,In-flight meal not included,10031,2019-03-24,24,3,6,1150,1,21,16
Air India,9/05/2019,Kolkata,Banglore,CCU → BOM → AMD → BLR,09:25,05:25 10 May,20h,2 stops,No info,14687,2019-05-09,9,5,3,1200,2,9,5
Jet Airways,6/06/2019,Banglore,Delhi,BLR → DEL,19:50,22:50,3h,non-stop,In-flight meal not included,7229,2019-06-06,6,6,3,180,0,19,22
GoAir,9/05/2019,Delhi,Cochin,DEL → BOM → COK,14:25,19:35,5h 10m,1 stop,No info,10188,2019-05-09,9,5,3,310,1,14,19
Vistara,09/03/2019,Banglore,New Delhi,BLR → DEL,07:00,09:40,2h 40m,non-stop,No info,7398,2019-03-09,9,3,5,160,0,7,9
Jet Airways,18/05/2019,Delhi,Cochin,DEL → AMD → BOM → COK,13:25,19:00 19 May,29h 35m,2 stops,No info,16704,2019-05-18,18,5,5,1775,2,13,19
IndiGo,01/03/2019,Banglore,New Delhi,BLR → HYD → DEL,16:55,21:50,4h 55m,1 stop,No Info,8153,2019-03-01,1,3,4,295,1,16,21
Jet Airways,9/04/2019,Banglore,Delhi,BLR → DEL,07:10,10:10,3h,non-stop,No info,7229,2019-04-09,9,4,1,180,0,7,10
Multiple carriers,27/05/2019,Delhi,Cochin,DEL → BOM → COK,13:00,01:30 28 May,12h 30m,1 stop,In-flight meal not included,6943,2019-05-27,27,5,0,750,1,13,1
Multiple carriers,1/06/2019,Delhi,Cochin,DEL → BOM → COK,06:40,19:15,12h 35m,1 stop,No info,8937,2019-06-01,1,6,5,755,1,6,19
Air India,3/03/2019,Delhi,Cochin,DEL → HYD → MAA → COK,07:05,09:25 04 Mar,26h 20m,2 stops,No info,9400,2019-03-03,3,3,6,1580,2,7,9
Vistara,24/03/2019,Kolkata,Banglore,CCU → DEL → BLR,07:10,20:25,13h 15m,1 stop,No info,13152,2019-03-24,24,3,6,795,1,7,20
IndiGo,1/06/2019,Banglore,Delhi,BLR → DEL,22:10,01:00 02 Jun,2h 50m,non-stop,No info,3419,2019-06-01,1,6,5,170,0,22,1
Vistara,12/06/2019,Kolkata,Banglore,CCU → DEL → BLR,20:20,09:05 13 Jun,12h 45m,1 stop,No info,7927,2019-06-12,12,6,2,765,1,20,9
Air India,15/03/2019,Banglore,New Delhi,BLR → CCU → GAU → DEL,05:50,22:10,16h 20m,2 stops,No info,9796,2019-03-15,15,3,4,980,2,5,22
Vistara,03/03/2019,Banglore,New Delhi,BLR → DEL,11:30,14:10,2h 40m,non-stop,No info,8028,2019-03-03,3,3,6,160,0,11,14
Multiple carriers,6/03/2019,Delhi,Cochin,DEL → HYD → MAA → COK,13:05,21:20,8h 15m,2 stops,No info,10759,2019-03-06,6,3,2,495,2,13,21
Multiple carriers,21/05/2019,Delhi,Cochin,DEL → BOM → COK,07:00,19:00,12h,1 stop,No info,10197,2019-05-21,21,5,1,720,1,7,19
Air India,1/06/2019,Banglore,Delhi,BLR → DEL,21:05,23:55,2h 50m,non-stop,No info,5228,2019-06-01,1,6,5,170,0,21,23
Multiple carriers,18/05/2019,Delhi,Cochin,DEL → BOM → COK,10:00,21:00,11h,1 stop,In-flight meal not included,9275,2019-05-18,18,5,5,660,1,10,21
IndiGo,3/03/2019,Chennai,Kolkata,MAA → CCU,22:05,00:25 04 Mar,2h 20m,non-stop,No info,5277,2019-03-03,3,3,6,140,0,22,0
Jet Airways,18/05/2019,Delhi,Cochin,DEL → NAG → BOM → COK,14:35,04:25 19 May,13h 50m,2 stops,In-flight meal not included,13848,2019-05-18,18,5,5,830,2,14,4
IndiGo,15/05/2019,Delhi,Cochin,DEL → HYD → COK,14:20,22:30,8h 10m,1 stop,No info,6412,2019-05-15,15,5,2,490,1,14,22
Jet Airways,18/05/2019,Kolkata,Banglore,CCU → BOM → BLR,16:30,04:40 19 May,12h 10m,1 stop,No info,13941,2019-05-18,18,5,5,730,1,16,4
Vistara,6/05/2019,Banglore,Delhi,BLR → DEL,07:00,09:40,2h 40m,non-stop,No info,4668,2019-05-06,6,5,0,160,0,7,9
IndiGo,18/06/2019,Banglore,Delhi,BLR → DEL,01:30,04:15,2h 45m,non-stop,No info,3419,2019-06-18,18,6,1,165,0,1,4
IndiGo,6/04/2019,Banglore,Delhi,BLR → DEL,22:10,01:00 07 Apr,2h 50m,non-stop,No info,3943,2019-04-06,6,4,5,170,0,22,1
Air India,24/05/2019,Kolkata,Banglore,CCU → MAA → BLR,14:35,14:35 25 May,24h,1 stop,No info,6528,2019-05-24,24,5,4,1440,1,14,14
Jet Airways,21/05/2019,Banglore,Delhi,BLR → DEL,17:45,20:45,3h,non-stop,No info,7229,2019-05-21,21,5,1,180,0,17,20
Multiple carriers,21/03/2019,Delhi,Cochin,DEL → BOM → COK,13:00,01:35 22 Mar,12h 35m,1 stop,No info,13542,2019-03-21,21,3,3,755,1,13,1
Jet Airways,12/06/2019,Kolkata,Banglore,CCU → BOM → BLR,18:55,20:45 13 Jun,25h 50m,1 stop,In-flight meal not included,8529,2019-06-12,12,6,2,1550,1,18,20
Jet Airways,21/06/2019,Banglore,Delhi,BLR → DEL,15:15,18:10,2h 55m,non-stop,No info,8016,2019-06-21,21,6,4,175,0,15,18
Jet Airways,9/05/2019,Delhi,Cochin,DEL → JAI → BOM → COK,19:30,12:35 10 May,17h 5m,2 stops,In-flight meal not included,13029,2019-05-09,9,5,3,1025,2,19,12
Jet Airways,9/05/2019,Delhi,Cochin,DEL → AMD → BOM → COK,23:05,04:25 11 May,29h 20m,2 stops,No info,15129,2019-05-09,9,5,3,1760,2,23,4
Jet Airways,9/06/2019,Delhi,Cochin,DEL → JAI → BOM → COK,19:30,04:25 10 Jun,8h 55m,2 stops,In-flight meal not included,10368,2019-06-09,9,6,6,535,2,19,4
Air India,3/03/2019,Delhi,Cochin,DEL → COK,18:05,21:10,3h 5m,non-stop,No info,8666,2019-03-03,3,3,6,185,0,18,21
Jet Airways,18/05/2019,Delhi,Cochin,DEL → BOM → COK,10:00,19:00,9h,1 stop,No info,15554,2019-05-18,18,5,5,540,1,10,19
Jet Airways,01/03/2019,Banglore,New Delhi,BLR → BOM → DEL,05:45,16:10,10h 25m,1 stop,No info,26890,2019-03-01,1,3,4,625,1,5,16
Jet Airways,21/05/2019,Kolkata,Banglore,CCU → DEL → BLR,17:00,09:45 22 May,16h 45m,1 stop,No info,13067,2019-05-21,21,5,1,1005,1,17,9
Jet Airways,1/04/2019,Banglore,Delhi,BLR → DEL,06:00,08:45,2h 45m,non-stop,In-flight meal not included,4544,2019-04-01,1,4,0,165,0,6,8
Vistara,21/05/2019,Kolkata,Banglore,CCU → DEL → BLR,20:20,22:40 22 May,26h 20m,1 stop,No info,8452,2019-05-21,21,5,1,1580,1,20,22
Multiple carriers,27/06/2019,Delhi,Cochin,DEL → BOM → COK,06:00,19:15,13h 15m,1 stop,In-flight meal not included,7268,2019-06-27,27,6,3,795,1,6,19
Multiple carriers,9/05/2019,Delhi,Cochin,DEL → BOM → COK,08:30,19:00,10h 30m,1 stop,No info,9627,2019-05-09,9,5,3,630,1,8,19
Multiple carriers,9/05/2019,Delhi,Cochin,DEL → BOM → COK,11:25,19:00,7h 35m,1 stop,No info,9103,2019-05-09,9,5,3,455,1,11,19
Multiple carriers,9/04/2019,Delhi,Cochin,DEL → BOM → COK,08:00,19:00,11h,1 stop,No info,11142,2019-04-09,9,4,1,660,1,8,19
IndiGo,9/03/2019,Kolkata,Banglore,CCU → BLR,05:30,08:20,2h 50m,non-stop,No info,4148,2019-03-09,9,3,5,170,0,5,8
Jet Airways,18/05/2019,Kolkata,Banglore,CCU → BOM → BLR,16:30,18:15 19 May,25h 45m,1 stop,In-flight meal not included,10844,2019-05-18,18,5,5,1545,1,16,18
Multiple carriers,6/06/2019,Delhi,Cochin,DEL → HYD → COK,09:45,16:10,6h 25m,1 stop,No info,9646,2019-06-06,6,6,3,385,1,9,16
IndiGo,1/03/2019,Mumbai,Hyderabad,BOM → HYD,12:00,13:25,1h 25m,non-stop,No info,12475,2019-03-01,1,3,4,85,0,12,13
Jet Airways,18/05/2019,Delhi,Cochin,DEL → BOM → COK,22:50,19:00 19 May,20h 10m,1 stop,No info,15554,2019-05-18,18,5,5,1210,1,22,19
Jet Airways,27/06/2019,Delhi,Cochin,DEL → BOM → COK,07:05,19:00,11h 55m,1 stop,In-flight meal not included,10262,2019-06-27,27,6,3,715,1,7,19
Air India,12/06/2019,Banglore,Delhi,BLR → DEL,13:20,16:10,2h 50m,non-stop,No info,6961,2019-06-12,12,6,2,170,0,13,16
Jet Airways,15/06/2019,Delhi,Cochin,DEL → BOM → COK,14:00,19:00,5h,1 stop,In-flight meal not included,10262,2019-06-15,15,6,5,300,1,14,19
Jet Airways,27/06/2019,Delhi,Cochin,DEL → BOM → COK,16:00,19:00 28 Jun,27h,1 stop,In-flight meal not included,10262,2019-06-27,27,6,3,1620,1,16,19
IndiGo,9/05/2019,Banglore,Delhi,BLR → DEL,23:30,02:20 10 May,2h 50m,non-stop,No info,3943,2019-05-09,9,5,3,170,0,23,2
Air India,24/05/2019,Mumbai,Hyderabad,BOM → HYD,19:30,20:45,1h 15m,non-stop,No info,3625,2019-05-24,24,5,4,75,0,19,20
Multiple carriers,21/03/2019,Delhi,Cochin,DEL → BOM → COK,09:00,19:15,10h 15m,1 stop,No info,13378,2019-03-21,21,3,3,615,1,9,19
Jet Airways,15/06/2019,Delhi,Cochin,DEL → LKO → BOM → COK,11:45,12:35 16 Jun,24h 50m,2 stops,No info,13882,2019-06-15,15,6,5,1490,2,11,12
IndiGo,18/06/2019,Banglore,Delhi,BLR → DEL,05:30,08:20,2h 50m,non-stop,No info,3943,2019-06-18,18,6,1,170,0,5,8
Air India,15/05/2019,Kolkata,Banglore,CCU → BOM → AMD → BLR,09:25,05:25 16 May,20h,2 stops,No info,14687,2019-05-15,15,5,2,1200,2,9,5
Air Asia,27/05/2019,Delhi,Cochin,DEL → BLR → COK,07:55,13:25,5h 30m,1 stop,No info,6451,2019-05-27,27,5,0,330,1,7,13
Vistara,9/06/2019,Banglore,Delhi,BLR → DEL,19:30,22:15,2h 45m,non-stop,No info,4878,2019-06-09,9,6,6,165,0,19,22
IndiGo,9/05/2019,Delhi,Cochin,DEL → BOM → COK,18:35,01:30 10 May,6h 55m,1 stop,No info,8542,2019-05-09,9,5,3,415,1,18,1
IndiGo,24/05/2019,Kolkata,Banglore,CCU → BLR,09:35,12:20,2h 45m,non-stop,No info,4804,2019-05-24,24,5,4,165,0,9,12
IndiGo,6/06/2019,Kolkata,Banglore,CCU → PNQ → BLR,21:00,02:15 07 Jun,5h 15m,1 stop,No info,6711,2019-06-06,6,6,3,315,1,21,2
Multiple carriers,15/06/2019,Delhi,Cochin,DEL → BOM → COK,13:00,19:15,6h 15m,1 stop,No info,16108,2019-06-15,15,6,5,375,1,13,19
IndiGo,6/06/2019,Banglore,Delhi,BLR → DEL,00:25,03:15,2h 50m,non-stop,No info,3943,2019-06-06,6,6,3,170,0,0,3
Air India,24/05/2019,Kolkata,Banglore,CCU → DEL → AMD → BLR,10:00,05:25 25 May,19h 25m,2 stops,No info,15422,2019-05-24,24,5,4,1165,2,10,5
IndiGo,24/03/2019,Banglore,New Delhi,BLR → DEL,21:20,00:15 28 Mar,2h 55m,non-stop,No info,5694,2019-03-24,24,3,6,175,0,21,0
Jet Airways,1/04/2019,Kolkata,Banglore,CCU → BOM → BLR,08:25,19:50,11h 25m,1 stop,No info,12681,2019-04-01,1,4,0,685,1,8,19
Jet Airways,1/05/2019,Kolkata,Banglore,CCU → BOM → BLR,20:00,10:05 02 May,14h 5m,1 stop,In-flight meal not included,8586,2019-05-01,1,5,2,845,1,20,10
IndiGo,03/03/2019,Banglore,New Delhi,BLR → DEL,00:40,03:25,2h 45m,non-stop,No info,6144,2019-03-03,3,3,6,165,0,0,3
IndiGo,27/04/2019,Delhi,Cochin,DEL → COK,05:35,08:50,3h 15m,non-stop,No info,6015,2019-04-27,27,4,5,195,0,5,8
Multiple carriers,27/06/2019,Delhi,Cochin,DEL → BOM → COK,04:55,19:15,14h 20m,1 stop,No info,7155,2019-06-27,27,6,3,860,1,4,19
Jet Airways,12/06/2019,Kolkata,Banglore,CCU → DEL → BLR,09:35,22:05,12h 30m,1 stop,No info,12692,2019-06-12,12,6,2,750,1,9,22
Air India,18/05/2019,Delhi,Cochin,DEL → BLR → COK,17:40,23:00,5h 20m,1 stop,No info,8277,2019-05-18,18,5,5,320,1,17,23
Air India,9/05/2019,Delhi,Cochin,DEL → HYD → MAA → COK,07:05,09:25 10 May,26h 20m,2 stops,No info,9347,2019-05-09,9,5,3,1580,2,7,9
Air India,15/03/2019,Delhi,Cochin,DEL → COK,18:05,21:10,3h 5m,non-stop,No info,4939,2019-03-15,15,3,4,185,0,18,21
Jet Airways,12/03/2019,Mumbai,Hyderabad,BOM → HYD,19:40,21:10,1h 30m,non-stop,No info,5678,2019-03-12,12,3,1,90,0,19,21
Jet Airways,6/06/2019,Kolkata,Banglore,CCU → BOM → BLR,16:30,23:35,7h 5m,1 stop,In-flight meal not included,10844,2019-06-06,6,6,3,425,1,16,23
Jet Airways,21/03/2019,Banglore,New Delhi,BLR → MAA → DEL,09:45,15:55,6h 10m,1 stop,In-flight meal not included,7280,2019-03-21,21,3,3,370,1,9,15
Multiple carriers,21/03/2019,Delhi,Cochin,DEL → BOM → COK,13:00,21:00,8h,1 stop,No info,7618,2019-03-21,21,3,3,480,1,13,21
Multiple carriers,6/03/2019,Delhi,Cochin,DEL → BOM → COK,08:55,21:00,12h 5m,1 stop,No info,15147,2019-03-06,6,3,2,725,1,8,21
Jet Airways,18/05/2019,Kolkata,Banglore,CCU → BOM → BLR,21:10,10:05 19 May,12h 55m,1 stop,No info,13941,2019-05-18,18,5,5,775,1,21,10
Jet Airways,1/04/2019,Kolkata,Banglore,CCU → DEL → BLR,09:35,19:10,9h 35m,1 stop,No info,11467,2019-04-01,1,4,0,575,1,9,19
Multiple carriers,27/06/2019,Delhi,Cochin,DEL → BOM → COK,10:20,01:30 28 Jun,15h 10m,1 stop,No info,6270,2019-06-27,27,6,3,910,1,10,1
Multiple carriers,3/03/2019,Delhi,Cochin,DEL → BOM → COK,13:55,01:35 04 Mar,11h 40m,1 stop,No info,17057,2019-03-03,3,3,6,700,1,13,1
Jet Airways,3/06/2019,Banglore,Delhi,BLR → DEL,15:15,18:10,2h 55m,non-stop,No info,8016,2019-06-03,3,6,0,175,0,15,18
SpiceJet,27/06/2019,Delhi,Cochin,DEL → PNQ → COK,08:45,13:15,4h 30m,1 stop,No check-in baggage included,4760,2019-06-27,27,6,3,270,1,8,13
SpiceJet,21/03/2019,Kolkata,Banglore,CCU → BLR,06:55,09:35,2h 40m,non-stop,No check-in baggage included,3815,2019-03-21,21,3,3,160,0,6,9
SpiceJet,1/05/2019,Kolkata,Banglore,CCU → BLR,17:10,19:40,2h 30m,non-stop,No info,4174,2019-05-01,1,5,2,150,0,17,19
Jet Airways,6/06/2019,Kolkata,Banglore,CCU → DEL → BLR,09:35,09:45 07 Jun,24h 10m,1 stop,No info,12692,2019-06-06,6,6,3,1450,1,9,9
Air India,15/05/2019,Kolkata,Banglore,CCU → BOM → COK → BLR,09:25,13:45 16 May,28h 20m,2 stops,No info,15532,2019-05-15,15,5,2,1700,2,9,13
Jet Airways,6/06/2019,Mumbai,Hyderabad,BOM → HYD,07:05,08:30,1h 25m,non-stop,In-flight meal not included,4995,2019-06-06,6,6,3,85,0,7,8
Jet Airways,27/05/2019,Delhi,Cochin,DEL → BOM → COK,18:15,04:25 28 May,10h 10m,1 stop,In-flight meal not included,12898,2019-05-27,27,5,0,610,1,18,4
Multiple carriers,9/05/2019,Delhi,Cochin,DEL → BOM → COK,07:30,19:00,11h 30m,1 stop,No info,9794,2019-05-09,9,5,3,690,1,7,19
Air India,15/05/2019,Banglore,Delhi,BLR → DEL,13:20,16:10,2h 50m,non-stop,No info,5228,2019-05-15,15,5,2,170,0,13,16
Jet Airways,27/06/2019,Delhi,Cochin,DEL → BOM → COK,22:50,12:35 28 Jun,13h 45m,1 stop,In-flight meal not included,10262,2019-06-27,27,6,3,825,1,22,12
Multiple carriers,24/06/2019,Delhi,Cochin,DEL → HYD → COK,09:45,16:10,6h 25m,1 stop,No info,9646,2019-06-24,24,6,0,385,1,9,16
Jet Airways,15/05/2019,Kolkata,Banglore,CCU → BOM → BLR,21:10,10:05 16 May,12h 55m,1 stop,No info,15149,2019-05-15,15,5,2,775,1,21,10
IndiGo,9/06/2019,Kolkata,Banglore,CCU → HYD → BLR,19:20,23:45,4h 25m,1 stop,No info,4205,2019-06-09,9,6,6,265,1,19,23
Multiple carriers,6/03/2019,Delhi,Cochin,DEL → BOM → COK,07:30,21:00,13h 30m,1 stop,No info,15147,2019-03-06,6,3,2,810,1,7,21
Jet Airways,06/03/2019,Banglore,New Delhi,BLR → BOM → DEL,08:55,09:00 07 Mar,24h 5m,1 stop,In-flight meal not included,13712,2019-03-06,6,3,2,1445,1,8,9
Air India,9/03/2019,Delhi,Cochin,DEL → MAA → COK,17:20,09:25 10 Mar,16h 5m,1 stop,No info,12415,2019-03-09,9,3,5,965,1,17,9
Air Asia,15/05/2019,Kolkata,Banglore,CCU → IXR → DEL → BLR,15:10,23:30,8h 20m,2 stops,No info,5192,2019-05-15,15,5,2,500,2,15,23
Air Asia,15/05/2019,Kolkata,Banglore,CCU → BBI → BLR,06:50,10:30,3h 40m,1 stop,No info,5162,2019-05-15,15,5,2,220,1,6,10
IndiGo,3/03/2019,Delhi,Cochin,DEL → HYD → COK,06:40,16:10,9h 30m,1 stop,No info,9027,2019-03-03,3,3,6,570,1,6,16
Jet Airways,24/03/2019,Kolkata,Banglore,CCU → BOM → BLR,13:55,18:10 25 Mar,28h 15m,1 stop,In-flight meal not included,11134,2019-03-24,24,3,6,1695,1,13,18
Jet Airways,24/05/2019,Kolkata,Banglore,CCU → BOM → BLR,20:00,09:20 25 May,13h 20m,1 stop,In-flight meal not included,10844,2019-05-24,24,5,4,800,1,20,9
Vistara,24/03/2019,Kolkata,Banglore,CCU → DEL → BLR,17:00,10:50 25 Mar,17h 50m,1 stop,No info,12890,2019-03-24,24,3,6,1070,1,17,10
Jet Airways,9/06/2019,Kolkata,Banglore,CCU → BOM → BLR,20:00,16:20 10 Jun,20h 20m,1 stop,No info,14571,2019-06-09,9,6,6,1220,1,20,16
Jet Airways,12/05/2019,Kolkata,Banglore,CCU → DEL → BLR,17:00,21:05 13 May,28h 5m,1 stop,No info,12121,2019-05-12,12,5,6,1685,1,17,21
Jet Airways,9/05/2019,Delhi,Cochin,DEL → BOM → COK,13:00,04:25 10 May,15h 25m,1 stop,In-flight meal not included,12373,2019-05-09,9,5,3,925,1,13,4
Air India,09/03/2019,Banglore,New Delhi,BLR → MAA → DEL,11:50,23:55,12h 5m,1 stop,No info,10972,2019-03-09,9,3,5,725,1,11,23
Jet Airways,1/06/2019,Delhi,Cochin,DEL → BOM → COK,02:15,12:35,10h 20m,1 stop,In-flight meal not included,10262,2019-06-01,1,6,5,620,1,2,12
Jet Airways,27/05/2019,Delhi,Cochin,DEL → BOM → COK,16:00,04:25 28 May,12h 25m,1 stop,In-flight meal not included,12898,2019-05-27,27,5,0,745,1,16,4
IndiGo,18/05/2019,Delhi,Cochin,DEL → HYD → COK,08:35,16:10,7h 35m,1 stop,No info,6442,2019-05-18,18,5,5,455,1,8,16
Vistara,3/04/2019,Banglore,Delhi,BLR → DEL,09:45,12:35,2h 50m,non-stop,No info,5403,2019-04-03,3,4,2,170,0,9,12
IndiGo,21/04/2019,Delhi,Cochin,DEL → HYD → COK,07:35,12:10,4h 35m,1 stop,No info,5703,2019-04-21,21,4,6,275,1,7,12
Multiple carriers,9/05/2019,Delhi,Cochin,DEL → BOM → COK,08:00,19:15,11h 15m,1 stop,In-flight meal not included,9871,2019-05-09,9,5,3,675,1,8,19
IndiGo,15/04/2019,Kolkata,Banglore,CCU → BLR,15:30,18:05,2h 35m,non-stop,No info,4174,2019-04-15,15,4,0,155,0,15,18
Air India,21/05/2019,Delhi,Cochin,DEL → HYD → BOM → COK,17:15,19:15 22 May,26h,2 stops,No info,11972,2019-05-21,21,5,1,1560,2,17,19
SpiceJet,18/04/2019,Kolkata,Banglore,CCU → BLR,09:00,11:25,2h 25m,non-stop,No info,4174,2019-04-18,18,4,3,145,0,9,11
IndiGo,21/05/2019,Kolkata,Banglore,CCU → BLR,17:15,19:50,2h 35m,non-stop,No info,4804,2019-05-21,21,5,1,155,0,17,19
Jet Airways,1/04/2019,Kolkata,Banglore,CCU → BOM → BLR,06:30,20:45,14h 15m,1 stop,No info,12681,2019-04-01,1,4,0,855,1,6,20
Air Asia,6/06/2019,Kolkata,Banglore,CCU → BLR,10:20,12:55,2h 35m,non-stop,No info,4508,2019-06-06,6,6,3,155,0,10,12
Jet Airways,3/06/2019,Delhi,Cochin,DEL → BOM → COK,20:55,19:00 04 Jun,22h 5m,1 stop,In-flight meal not included,10262,2019-06-03,3,6,0,1325,1,20,19
Multiple carriers,3/03/2019,Delhi,Cochin,DEL → BOM → COK,19:00,01:35 04 Mar,6h 35m,1 stop,No info,16775,2019-03-03,3,3,6,395,1,19,1
Multiple carriers,12/06/2019,Delhi,Cochin,DEL → BOM → COK,17:00,01:30 13 Jun,8h 30m,1 stop,No info,7198,2019-06-12,12,6,2,510,1,17,1
Jet Airways,15/06/2019,Delhi,Cochin,DEL → JAI → BOM → COK,09:40,04:25 16 Jun,18h 45m,2 stops,No info,13014,2019-06-15,15,6,5,1125,2,9,4
Air India,12/05/2019,Kolkata,Banglore,CCU → BBI → IXR → DEL → BLR,12:00,23:15 13 May,35h 15m,3 stops,No info,10991,2019-05-12,12,5,6,2115,3,12,23
Vistara,21/06/2019,Chennai,Kolkata,MAA → CCU,07:05,09:20,2h 15m,non-stop,No info,3687,2019-06-21,21,6,4,135,0,7,9
Air Asia,12/05/2019,Kolkata,Banglore,CCU → BLR,19:55,22:25,2h 30m,non-stop,No info,5530,2019-05-12,12,5,6,150,0,19,22
SpiceJet,27/03/2019,Kolkata,Banglore,CCU → BLR,22:20,00:40 28 Mar,2h 20m,non-stop,No check-in baggage included,3815,2019-03-27,27,3,2,140,0,22,0
Air India,1/03/2019,Kolkata,Banglore,CCU → BLR,14:15,16:45,2h 30m,non-stop,No info,6535,2019-03-01,1,3,4,150,0,14,16
Jet Airways,3/03/2019,Delhi,Cochin,DEL → BOM → COK,20:50,04:25 04 Mar,7h 35m,1 stop,No info,17234,2019-03-03,3,3,6,455,1,20,4
Jet Airways,6/03/2019,Delhi,Cochin,DEL → DED → BOM → COK,16:50,04:25 08 Mar,35h 35m,2 stops,No info,19907,2019-03-06,6,3,2,2135,2,16,4
Air India,27/03/2019,Delhi,Cochin,DEL → BLR → COK,20:30,23:00 28 Mar,26h 30m,1 stop,No info,5022,2019-03-27,27,3,2,1590,1,20,23
Multiple carriers,27/03/2019,Delhi,Cochin,DEL → BOM → COK,04:00,15:30,11h 30m,1 stop,No info,6305,2019-03-27,27,3,2,690,1,4,15
Jet Airways,21/03/2019,Delhi,Cochin,DEL → MAA → BOM → COK,16:10,18:50 22 Mar,26h 40m,2 stops,In-flight meal not included,8728,2019-03-21,21,3,3,1600,2,16,18
IndiGo,1/06/2019,Banglore,Delhi,BLR → DEL,21:15,00:15 02 Jun,3h,non-stop,No info,3943,2019-06-01,1,6,5,180,0,21,0
IndiGo,18/03/2019,Mumbai,Hyderabad,BOM → HYD,16:55,18:25,1h 30m,non-stop,No info,3175,2019-03-18,18,3,0,90,0,16,18
Jet Airways,24/03/2019,Banglore,New Delhi,BLR → DEL,11:10,14:05,2h 55m,non-stop,No info,7229,2019-03-24,24,3,6,175,0,11,14
Multiple carriers,9/03/2019,Delhi,Cochin,DEL → HYD → MAA → COK,07:05,21:20,14h 15m,2 stops,No info,8620,2019-03-09,9,3,5,855,2,7,21
Air India,09/03/2019,Banglore,New Delhi,BLR → CCU → DEL,05:50,22:45,16h 55m,1 stop,No info,10657,2019-03-09,9,3,5,1015,1,5,22
Jet Airways,21/03/2019,Banglore,New Delhi,BLR → BOM → DEL,08:00,20:20,12h 20m,1 stop,In-flight meal not included,7832,2019-03-21,21,3,3,740,1,8,20
Jet Airways,27/06/2019,Delhi,Cochin,DEL → AMD → BOM → COK,13:25,19:00 28 Jun,29h 35m,2 stops,In-flight meal not included,11150,2019-06-27,27,6,3,1775,2,13,19
Jet Airways,01/03/2019,Banglore,New Delhi,BLR → BOM → DEL,22:50,19:10 02 Mar,20h 20m,1 stop,No info,25735,2019-03-01,1,3,4,1220,1,22,19
Jet Airways,9/05/2019,Delhi,Cochin,DEL → ATQ → BOM → COK,20:00,04:25 10 May,8h 25m,2 stops,No info,16263,2019-05-09,9,5,3,505,2,20,4
Multiple carriers,24/06/2019,Delhi,Cochin,DEL → BOM → COK,11:40,01:30 25 Jun,13h 50m,1 stop,In-flight meal not included,5797,2019-06-24,24,6,0,830,1,11,1
Jet Airways,6/06/2019,Delhi,Cochin,DEL → BDQ → BOM → COK,18:25,04:25 07 Jun,10h,2 stops,No info,14237,2019-06-06,6,6,3,600,2,18,4
Jet Airways,9/06/2019,Delhi,Cochin,DEL → BOM → COK,09:00,04:25 10 Jun,19h 25m,1 stop,In-flight meal not included,10262,2019-06-09,9,6,6,1165,1,9,4
Jet Airways,9/06/2019,Delhi,Cochin,DEL → BOM → COK,15:00,19:00 10 Jun,28h,1 stop,In-flight meal not included,10262,2019-06-09,9,6,6,1680,1,15,19
IndiGo,12/05/2019,Banglore,Delhi,BLR → DEL,04:00,06:50,2h 50m,non-stop,No info,3943,2019-05-12,12,5,6,170,0,4,6
Jet Airways,21/05/2019,Delhi,Cochin,DEL → BOM → COK,19:15,12:35 22 May,17h 20m,1 stop,In-flight meal not included,12898,2019-05-21,21,5,1,1040,1,19,12
IndiGo,15/05/2019,Banglore,Delhi,BLR → DEL,01:30,04:15,2h 45m,non-stop,No info,3419,2019-05-15,15,5,2,165,0,1,4
IndiGo,15/03/2019,Banglore,New Delhi,BLR → DEL,21:20,00:15 16 Mar,2h 55m,non-stop,No info,8033,2019-03-15,15,3,4,175,0,21,0
Jet Airways,01/03/2019,Banglore,New Delhi,BLR → BOM → DEL,05:45,19:10,13h 25m,1 stop,No info,27992,2019-03-01,1,3,4,805,1,5,19
Jet Airways,12/05/2019,Kolkata,Banglore,CCU → BOM → BLR,21:10,10:05 13 May,12h 55m,1 stop,No info,13941,2019-05-12,12,5,6,775,1,21,10
Jet Airways,21/05/2019,Kolkata,Banglore,CCU → BOM → BLR,18:55,04:40 22 May,9h 45m,1 stop,No info,14388,2019-05-21,21,5,1,585,1,18,4
Jet Airways,12/05/2019,Kolkata,Banglore,CCU → BOM → BLR,18:55,16:20 13 May,21h 25m,1 stop,In-flight meal not included,10844,2019-05-12,12,5,6,1285,1,18,16
IndiGo,3/03/2019,Delhi,Cochin,DEL → HYD → COK,06:40,22:20,15h 40m,1 stop,No info,11600,2019-03-03,3,3,6,940,1,6,22
IndiGo,6/06/2019,Chennai,Kolkata,MAA → CCU,22:05,00:25 07 Jun,2h 20m,non-stop,No info,5277,2019-06-06,6,6,3,140,0,22,0
Jet Airways,3/06/2019,Delhi,Cochin,DEL → BOM → COK,14:00,04:25 04 Jun,14h 25m,1 stop,In-flight meal not included,10262,2019-06-03,3,6,0,865,1,14,4
IndiGo,03/03/2019,Banglore,New Delhi,BLR → DEL,04:00,06:50,2h 50m,non-stop,No info,6144,2019-03-03,3,3,6,170,0,4,6
Jet Airways,3/06/2019,Delhi,Cochin,DEL → BOM → COK,21:50,04:25 04 Jun,6h 35m,1 stop,In-flight meal not included,12898,2019-06-03,3,6,0,395,1,21,4
Jet Airways,12/05/2019,Kolkata,Banglore,CCU → BOM → BLR,06:30,04:40 13 May,22h 10m,1 stop,No info,13941,2019-05-12,12,5,6,1330,1,6,4
Jet Airways,18/05/2019,Delhi,Cochin,DEL → BOM → COK,14:00,04:25 19 May,14h 25m,1 stop,In-flight meal not included,12373,2019-05-18,18,5,5,865,1,14,4
SpiceJet,3/04/2019,Kolkata,Banglore,CCU → BLR,17:10,19:40,2h 30m,non-stop,No check-in baggage included,3841,2019-04-03,3,4,2,150,0,17,19
Air India,18/05/2019,Kolkata,Banglore,CCU → JAI → BOM → BLR,08:20,07:55 19 May,23h 35m,2 stops,No info,10697,2019-05-18,18,5,5,1415,2,8,7
Jet Airways,01/03/2019,Banglore,New Delhi,BLR → BOM → DEL,11:40,00:45 02 Mar,13h 5m,1 stop,No info,26890,2019-03-01,1,3,4,785,1,11,0
SpiceJet,1/06/2019,Mumbai,Hyderabad,BOM → HYD,13:15,14:45,1h 30m,non-stop,No check-in baggage included,2175,2019-06-01,1,6,5,90,0,13,14
IndiGo,27/05/2019,Delhi,Cochin,DEL → PNQ → COK,23:30,04:35 28 May,5h 5m,1 stop,No info,9476,2019-05-27,27,5,0,305,1,23,4
Air India,24/05/2019,Mumbai,Hyderabad,BOM → HYD,21:05,22:25,1h 20m,non-stop,No info,3100,2019-05-24,24,5,4,80,0,21,22
Jet Airways,15/06/2019,Delhi,Cochin,DEL → JAI → BOM → COK,05:30,04:25 16 Jun,22h 55m,2 stops,In-flight meal not included,10368,2019-06-15,15,6,5,1375,2,5,4
SpiceJet,18/05/2019,Mumbai,Hyderabad,BOM → HYD,22:45,00:15 19 May,1h 30m,non-stop,No info,2017,2019-05-18,18,5,5,90,0,22,0
SpiceJet,15/04/2019,Kolkata,Banglore,CCU → BLR,06:55,09:30,2h 35m,non-stop,No check-in baggage included,3841,2019-04-15,15,4,0,155,0,6,9
Air India,21/05/2019,Delhi,Cochin,DEL → NAG → BOM → COK,05:55,19:15 22 May,37h 20m,2 stops,No info,10493,2019-05-21,21,5,1,2240,2,5,19
SpiceJet,09/03/2019,Banglore,New Delhi,BLR → DEL,05:45,08:35,2h 50m,non-stop,No info,5126,2019-03-09,9,3,5,170,0,5,8
IndiGo,18/06/2019,Banglore,Delhi,BLR → DEL,23:30,02:20 19 Jun,2h 50m,non-stop,No info,3943,2019-06-18,18,6,1,170,0,23,2
Air India,6/03/2019,Delhi,Cochin,DEL → HYD → BOM → COK,07:05,19:15 07 Mar,36h 10m,2 stops,No info,11552,2019-03-06,6,3,2,2170,2,7,19
Air India,21/03/2019,Delhi,Cochin,DEL → BOM → COK,10:00,19:15,9h 15m,1 stop,No info,7934,2019-03-21,21,3,3,555,1,10,19
Air India,1/03/2019,Mumbai,Hyderabad,BOM → HYD,15:00,16:25,1h 25m,non-stop,No info,6092,2019-03-01,1,3,4,85,0,15,16
IndiGo,12/06/2019,Delhi,Cochin,DEL → PNQ → COK,23:30,04:35 13 Jun,5h 5m,1 stop,No info,10112,2019-06-12,12,6,2,305,1,23,4
Vistara,9/03/2019,Chennai,Kolkata,MAA → CCU,07:05,09:20,2h 15m,non-stop,No info,6627,2019-03-09,9,3,5,135,0,7,9
Jet Airways,3/06/2019,Delhi,Cochin,DEL → IDR → BOM → COK,21:25,12:35 04 Jun,15h 10m,2 stops,In-flight meal not included,11507,2019-06-03,3,6,0,910,2,21,12
Jet Airways,01/03/2019,Banglore,New Delhi,BLR → BOM → DEL,22:50,00:45 03 Mar,25h 55m,1 stop,No info,26890,2019-03-01,1,3,4,1555,1,22,0
Jet Airways,12/03/2019,Banglore,New Delhi,BLR → BOM → DEL,05:45,11:25,5h 40m,1 stop,No info,13817,2019-03-12,12,3,1,340,1,5,11
Jet Airways,1/04/2019,Kolkata,Banglore,CCU → BOM → BLR,21:10,04:40 02 Apr,7h 30m,1 stop,No info,13364,2019-04-01,1,4,0,450,1,21,4
Vistara,6/06/2019,Kolkata,Banglore,CCU → DEL → BLR,17:00,10:45 07 Jun,17h 45m,1 stop,No info,9187,2019-06-06,6,6,3,1065,1,17,10
IndiGo,9/05/2019,Chennai,Kolkata,MAA → CCU,22:05,00:25 10 May,2h 20m,non-stop,No info,5277,2019-05-09,9,5,3,140,0,22,0
Air India,12/03/2019,Banglore,New Delhi,BLR → AMD → DEL,00:30,08:45,8h 15m,1 stop,No info,13492,2019-03-12,12,3,1,495,1,0,8
Air Asia,12/06/2019,Kolkata,Banglore,CCU → BBI → BLR,06:50,10:30,3h 40m,1 stop,No info,5162,2019-06-12,12,6,2,220,1,6,10
GoAir,9/06/2019,Delhi,Cochin,DEL → BOM → COK,07:00,12:55,5h 55m,1 stop,No info,5897,2019-06-09,9,6,6,355,1,7,12
Air India,3/06/2019,Kolkata,Banglore,CCU → BLR,14:15,16:45,2h 30m,non-stop,No info,5510,2019-06-03,3,6,0,150,0,14,16
Jet Airways,06/03/2019,Banglore,New Delhi,BLR → BOM → DEL,16:55,10:25 07 Mar,17h 30m,1 stop,No info,17261,2019-03-06,6,3,2,1050,1,16,10
Multiple carriers,21/05/2019,Delhi,Cochin,DEL → BOM → COK,11:40,01:30 22 May,13h 50m,1 stop,No info,7485,2019-05-21,21,5,1,830,1,11,1
Air India,21/06/2019,Chennai,Kolkata,MAA → CCU,11:40,13:55,2h 15m,non-stop,No info,4667,2019-06-21,21,6,4,135,0,11,13
Jet Airways,15/05/2019,Kolkata,Banglore,CCU → DEL → BLR,20:25,18:00 16 May,21h 35m,1 stop,No info,14151,2019-05-15,15,5,2,1295,1,20,18
IndiGo,27/05/2019,Delhi,Cochin,DEL → BOM → COK,16:00,01:30 28 May,9h 30m,1 stop,No info,7048,2019-05-27,27,5,0,570,1,16,1
Jet Airways,21/03/2019,Delhi,Cochin,DEL → BOM → COK,19:45,04:25 22 Mar,8h 40m,1 stop,No info,12557,2019-03-21,21,3,3,520,1,19,4
Multiple carriers,15/06/2019,Delhi,Cochin,DEL → IDR → BOM → COK,15:05,01:30 16 Jun,10h 25m,2 stops,No info,15965,2019-06-15,15,6,5,625,2,15,1
Air India,03/03/2019,Banglore,New Delhi,BLR → CCU → GAU → DEL,11:05,22:10 07 Mar,35h 5m,2 stops,No info,11791,2019-03-03,3,3,6,2105,2,11,22
Multiple carriers,3/03/2019,Delhi,Cochin,DEL → HYD → MAA → COK,07:05,21:20,14h 15m,2 stops,No info,8291,2019-03-03,3,3,6,855,2,7,21
IndiGo,21/04/2019,Banglore,Delhi,BLR → DEL,16:55,19:55,3h,non-stop,No info,4990,2019-04-21,21,4,6,180,0,16,19
Vistara,12/05/2019,Kolkata,Banglore,CCU → DEL → BLR,17:00,18:50 13 May,25h 50m,1 stop,No info,9135,2019-05-12,12,5,6,1550,1,17,18
Air Asia,12/04/2019,Kolkata,Banglore,CCU → BLR,22:50,01:20 13 Apr,2h 30m,non-stop,No info,4409,2019-04-12,12,4,4,150,0,22,1
Jet Airways,21/05/2019,Kolkata,Banglore,CCU → BOM → BLR,20:00,04:40 22 May,8h 40m,1 stop,In-flight meal not included,10844,2019-05-21,21,5,1,520,1,20,4
Multiple carriers,27/05/2019,Delhi,Cochin,DEL → BOM → COK,09:00,19:00,10h,1 stop,No info,10407,2019-05-27,27,5,0,600,1,9,19
Multiple carriers,27/05/2019,Delhi,Cochin,DEL → BOM → COK,07:30,19:00,11h 30m,1 stop,No info,9315,2019-05-27,27,5,0,690,1,7,19
Jet Airways,24/05/2019,Kolkata,Banglore,CCU → BOM → BLR,21:10,04:40 25 May,7h 30m,1 stop,In-flight meal not included,9663,2019-05-24,24,5,4,450,1,21,4
IndiGo,21/03/2019,Delhi,Cochin,DEL → BOM → COK,18:35,01:35 22 Mar,7h,1 stop,No info,9264,2019-03-21,21,3,3,420,1,18,1
SpiceJet,15/05/2019,Chennai,Kolkata,MAA → CCU,09:45,12:00,2h 15m,non-stop,No info,3597,2019-05-15,15,5,2,135,0,9,12
IndiGo,24/06/2019,Delhi,Cochin,DEL → HYD → COK,05:05,12:10,7h 5m,1 stop,No info,6442,2019-06-24,24,6,0,425,1,5,12
Multiple carriers,9/05/2019,Delhi,Cochin,DEL → BOM → COK,17:30,01:30 10 May,8h,1 stop,No info,15078,2019-05-09,9,5,3,480,1,17,1
IndiGo,1/05/2019,Kolkata,Banglore,CCU → NAG → BLR,18:05,23:30,5h 25m,1 stop,No info,6218,2019-05-01,1,5,2,325,1,18,23
Jet Airways,12/06/2019,Delhi,Cochin,DEL → BOM → COK,13:00,12:35 13 Jun,23h 35m,1 stop,In-flight meal not included,10262,2019-06-12,12,6,2,1415,1,13,12
Multiple carriers,9/03/2019,Delhi,Cochin,DEL → BOM → COK,19:00,01:35 10 Mar,6h 35m,1 stop,No info,13677,2019-03-09,9,3,5,395,1,19,1
Jet Airways,24/06/2019,Banglore,Delhi,BLR → DEL,07:10,10:10,3h,non-stop,No info,8016,2019-06-24,24,6,0,180,0,7,10
Jet Airways,3/06/2019,Delhi,Cochin,DEL → BOM → COK,17:30,12:35 04 Jun,19h 5m,1 stop,In-flight meal not included,10262,2019-06-03,3,6,0,1145,1,17,12
SpiceJet,27/06/2019,Kolkata,Banglore,CCU → BLR,06:55,09:30,2h 35m,non-stop,No info,3873,2019-06-27,27,6,3,155,0,6,9
SpiceJet,27/06/2019,Delhi,Cochin,DEL → PNQ → COK,08:45,13:15,4h 30m,1 stop,No info,4812,2019-06-27,27,6,3,270,1,8,13
SpiceJet,15/05/2019,Mumbai,Hyderabad,BOM → HYD,22:45,00:15 16 May,1h 30m,non-stop,No info,2017,2019-05-15,15,5,2,90,0,22,0
IndiGo,21/03/2019,Kolkata,Banglore,CCU → BLR,20:25,23:05,2h 40m,non-stop,No info,4462,2019-03-21,21,3,3,160,0,20,23
Air India,15/06/2019,Delhi,Cochin,DEL → AMD → BOM → COK,05:00,07:40 16 Jun,26h 40m,2 stops,No info,10231,2019-06-15,15,6,5,1600,2,5,7
Air India,21/03/2019,Banglore,New Delhi,BLR → VGA → DEL,10:30,22:55,12h 25m,1 stop,No info,6383,2019-03-21,21,3,3,745,1,10,22
Air India,24/06/2019,Delhi,Cochin,DEL → HYD → BOM → COK,17:15,07:40 25 Jun,14h 25m,2 stops,No info,11989,2019-06-24,24,6,0,865,2,17,7
IndiGo,24/03/2019,Banglore,New Delhi,BLR → DEL,18:55,21:45,2h 50m,non-stop,No info,7303,2019-03-24,24,3,6,170,0,18,21
Jet Airways,21/04/2019,Banglore,Delhi,BLR → DEL,18:55,22:00,3h 5m,non-stop,No info,7229,2019-04-21,21,4,6,185,0,18,22
Jet Airways,21/06/2019,Mumbai,Hyderabad,BOM → HYD,08:45,10:15,1h 30m,non-stop,In-flight meal not included,4995,2019-06-21,21,6,4,90,0,8,10
Multiple carriers,15/06/2019,Delhi,Cochin,DEL → BOM → COK,13:00,21:00,8h,1 stop,No info,7408,2019-06-15,15,6,5,480,1,13,21
Air India,15/05/2019,Kolkata,Banglore,CCU → GAU → DEL → BLR,16:45,12:30 16 May,19h 45m,2 stops,No info,14960,2019-05-15,15,5,2,1185,2,16,12
Air Asia,24/03/2019,Banglore,New Delhi,BLR → DEL,23:25,02:10 28 Mar,2h 45m,non-stop,No info,4482,2019-03-24,24,3,6,165,0,23,2
IndiGo,1/06/2019,Delhi,Cochin,DEL → HYD → COK,06:50,16:10,9h 20m,1 stop,No info,6442,2019-06-01,1,6,5,560,1,6,16
Jet Airways,12/05/2019,Banglore,Delhi,BLR → DEL,08:20,11:20,3h,non-stop,In-flight meal not included,6144,2019-05-12,12,5,6,180,0,8,11
Jet Airways,27/05/2019,Delhi,Cochin,DEL → JAI → BOM → COK,09:40,12:35 28 May,26h 55m,2 stops,No info,15129,2019-05-27,27,5,0,1615,2,9,12
Air India,21/05/2019,Delhi,Cochin,DEL → GOI → BOM → COK,22:00,19:15 22 May,21h 15m,2 stops,No info,10231,2019-05-21,21,5,1,1275,2,22,19
IndiGo,3/04/2019,Banglore,Delhi,BLR → DEL,20:00,22:50,2h 50m,non-stop,No info,4823,2019-04-03,3,4,2,170,0,20,22
IndiGo,9/06/2019,Banglore,Delhi,BLR → DEL,08:30,11:20,2h 50m,non-stop,No info,4823,2019-06-09,9,6,6,170,0,8,11
Jet Airways,21/05/2019,Delhi,Cochin,DEL → BOM → COK,11:30,04:25 22 May,16h 55m,1 stop,In-flight meal not included,12898,2019-05-21,21,5,1,1015,1,11,4
Jet Airways,1/05/2019,Mumbai,Hyderabad,BOM → HYD,19:35,21:05,1h 30m,non-stop,No info,5678,2019-05-01,1,5,2,90,0,19,21
Air India,9/03/2019,Delhi,Cochin,DEL → BHO → BOM → COK,05:55,07:40 10 Mar,25h 45m,2 stops,No info,14483,2019-03-09,9,3,5,1545,2,5,7
Jet Airways,15/05/2019,Mumbai,Hyderabad,BOM → HYD,19:35,21:05,1h 30m,non-stop,In-flight meal not included,2228,2019-05-15,15,5,2,90,0,19,21
Multiple carriers,15/06/2019,Delhi,Cochin,DEL → HYD → COK,13:15,22:30,9h 15m,1 stop,No info,8018,2019-06-15,15,6,5,555,1,13,22
Multiple carriers,6/03/2019,Delhi,Cochin,DEL → BOM → COK,09:55,21:00,11h 5m,1 stop,In-flight meal not included,15136,2019-03-06,6,3,2,665,1,9,21
SpiceJet,24/04/2019,Delhi,Cochin,DEL → MAA → COK,15:45,22:05,6h 20m,1 stop,No info,5583,2019-04-24,24,4,2,380,1,15,22
Air India,12/06/2019,Delhi,Cochin,DEL → CCU → BOM → COK,14:25,19:15 13 Jun,28h 50m,2 stops,No info,13381,2019-06-12,12,6,2,1730,2,14,19
Air India,15/03/2019,Banglore,New Delhi,BLR → COK → DEL,06:55,10:50 16 Mar,27h 55m,1 stop,No info,7932,2019-03-15,15,3,4,1675,1,6,10
Jet Airways,9/05/2019,Kolkata,Banglore,CCU → BOM → BLR,20:00,08:15 10 May,12h 15m,1 stop,In-flight meal not included,7757,2019-05-09,9,5,3,735,1,20,8
Jet Airways,18/05/2019,Delhi,Cochin,DEL → JAI → BOM → COK,05:30,04:25 19 May,22h 55m,2 stops,In-flight meal not included,13029,2019-05-18,18,5,5,1375,2,5,4
SpiceJet,9/06/2019,Kolkata,Banglore,CCU → BLR,06:55,09:30,2h 35m,non-stop,No check-in baggage included,3841,2019-06-09,9,6,6,155,0,6,9
Air India,03/03/2019,Banglore,New Delhi,BLR → DEL,13:20,16:10,2h 50m,non-stop,No info,10216,2019-03-03,3,3,6,170,0,13,16
Air India,21/05/2019,Mumbai,Hyderabad,BOM → HYD,21:05,22:25,1h 20m,non-stop,No info,3100,2019-05-21,21,5,1,80,0,21,22
Air India,21/03/2019,Delhi,Cochin,DEL → HYD → BOM → COK,17:15,19:15 22 Mar,26h,2 stops,No info,8245,2019-03-21,21,3,3,1560,2,17,19
Air India,01/03/2019,Banglore,New Delhi,BLR → CCU → DEL,11:05,19:50,8h 45m,1 stop,1 Long layover,14594,2019-03-01,1,3,4,525,1,11,19
Jet Airways,1/06/2019,Delhi,Cochin,DEL → BDQ → BOM → COK,18:25,12:35 02 Jun,18h 10m,2 stops,No info,14237,2019-06-01,1,6,5,1090,2,18,12
Air India,21/05/2019,Kolkata,Banglore,CCU → JAI → DEL → BLR,08:20,23:15,14h 55m,2 stops,No info,13164,2019-05-21,21,5,1,895,2,8,23
Jet Airways,9/06/2019,Delhi,Cochin,DEL → BOM → COK,20:55,04:25 10 Jun,7h 30m,1 stop,No info,14924,2019-06-09,9,6,6,450,1,20,4
Jet Airways,21/05/2019,Kolkata,Banglore,CCU → BOM → BLR,21:10,16:20 22 May,19h 10m,1 stop,In-flight meal not included,10844,2019-05-21,21,5,1,1150,1,21,16
Jet Airways,6/05/2019,Kolkata,Banglore,CCU → GAU → BLR,10:20,17:35,7h 15m,1 stop,In-flight meal not included,7064,2019-05-06,6,5,0,435,1,10,17
Vistara,24/05/2019,Kolkata,Banglore,CCU → DEL → BLR,07:10,18:50,11h 40m,1 stop,No info,9555,2019-05-24,24,5,4,700,1,7,18
Multiple carriers,24/06/2019,Delhi,Cochin,DEL → BOM → COK,10:35,19:15,8h 40m,1 stop,No info,7155,2019-06-24,24,6,0,520,1,10,19
Multiple carriers,9/06/2019,Delhi,Cochin,DEL → BOM → COK,08:00,19:00,11h,1 stop,No info,12192,2019-06-09,9,6,6,660,1,8,19
Air Asia,18/05/2019,Delhi,Cochin,DEL → BLR → COK,16:45,07:10 19 May,14h 25m,1 stop,No info,7353,2019-05-18,18,5,5,865,1,16,7
IndiGo,27/06/2019,Delhi,Cochin,DEL → HYD → COK,07:35,12:10,4h 35m,1 stop,No info,5054,2019-06-27,27,6,3,275,1,7,12
Multiple carriers,15/06/2019,Delhi,Cochin,DEL → IXU → BOM → COK,17:50,01:30 16 Jun,7h 40m,2 stops,No info,18485,2019-06-15,15,6,5,460,2,17,1
Jet Airways,6/06/2019,Kolkata,Banglore,CCU → BOM → BLR,06:30,18:15,11h 45m,1 stop,In-flight meal not included,10844,2019-06-06,6,6,3,705,1,6,18
Jet Airways,18/05/2019,Banglore,Delhi,BLR → DEL,08:20,11:20,3h,non-stop,In-flight meal not included,6144,2019-05-18,18,5,5,180,0,8,11
IndiGo,1/05/2019,Mumbai,Hyderabad,BOM → HYD,19:05,20:35,1h 30m,non-stop,No info,2754,2019-05-01,1,5,2,90,0,19,20
Multiple carriers,27/03/2019,Delhi,Cochin,DEL → BOM → COK,15:05,01:35 28 Mar,10h 30m,1 stop,No info,12327,2019-03-27,27,3,2,630,1,15,1
SpiceJet,6/05/2019,Kolkata,Banglore,CCU → BLR,06:55,09:30,2h 35m,non-stop,No check-in baggage included,3841,2019-05-06,6,5,0,155,0,6,9
Jet Airways,18/05/2019,Delhi,Cochin,DEL → BOM → COK,22:50,04:25 19 May,5h 35m,1 stop,In-flight meal not included,12373,2019-05-18,18,5,5,335,1,22,4
Air India,21/05/2019,Delhi,Cochin,DEL → GOI → BOM → COK,22:00,19:15 22 May,21h 15m,2 stops,No info,10231,2019-05-21,21,5,1,1275,2,22,19
IndiGo,21/05/2019,Delhi,Cochin,DEL → BOM → COK,09:15,21:00,11h 45m,1 stop,No info,7318,2019-05-21,21,5,1,705,1,9,21
Jet Airways,06/03/2019,Banglore,New Delhi,BLR → BOM → DEL,11:40,07:40 07 Mar,20h,1 stop,No info,16736,2019-03-06,6,3,2,1200,1,11,7
IndiGo,9/06/2019,Delhi,Cochin,DEL → LKO → COK,21:50,03:35 10 Jun,5h 45m,1 stop,No info,6195,2019-06-09,9,6,6,345,1,21,3
SpiceJet,6/06/2019,Mumbai,Hyderabad,BOM → HYD,05:45,07:15,1h 30m,non-stop,No info,2753,2019-06-06,6,6,3,90,0,5,7
SpiceJet,24/03/2019,Chennai,Kolkata,MAA → CCU,09:30,12:05,2h 35m,non-stop,No check-in baggage included,3807,2019-03-24,24,3,6,155,0,9,12
Jet Airways,3/03/2019,Delhi,Cochin,DEL → IDR → BOM → COK,05:25,04:25 05 Mar,47h,2 stops,No info,20064,2019-03-03,3,3,6,2820,2,5,4
IndiGo,21/06/2019,Delhi,Cochin,DEL → COK,21:05,00:20 22 Jun,3h 15m,non-stop,No info,5406,2019-06-21,21,6,4,195,0,21,0
Air India,1/06/2019,Delhi,Cochin,DEL → GOI → BOM → COK,22:00,19:15 02 Jun,21h 15m,2 stops,No info,10441,2019-06-01,1,6,5,1275,2,22,19
Jet Airways,6/05/2019,Kolkata,Banglore,CCU → DEL → BLR,20:25,09:45 07 May,13h 20m,1 stop,In-flight meal not included,8066,2019-05-06,6,5,0,800,1,20,9
Air India,27/06/2019,Banglore,Delhi,BLR → DEL,17:00,19:45,2h 45m,non-stop,No info,6961,2019-06-27,27,6,3,165,0,17,19
Vistara,21/03/2019,Delhi,Cochin,DEL → COK,14:55,17:50,2h 55m,non-stop,No info,5586,2019-03-21,21,3,3,175,0,14,17
Air India,1/06/2019,Delhi,Cochin,DEL → BLR → COK,17:40,23:00,5h 20m,1 stop,No info,7384,2019-06-01,1,6,5,320,1,17,23
Jet Airways,01/03/2019,Banglore,New Delhi,BLR → BOM → DEL,11:40,09:00 02 Mar,21h 20m,1 stop,No info,20800,2019-03-01,1,3,4,1280,1,11,9
Jet Airways,12/05/2019,Kolkata,Banglore,CCU → BOM → BLR,06:30,12:00,5h 30m,1 stop,No info,13941,2019-05-12,12,5,6,330,1,6,12
Jet Airways,3/05/2019,Banglore,Delhi,BLR → DEL,08:20,11:20,3h,non-stop,In-flight meal not included,5198,2019-05-03,3,5,4,180,0,8,11
SpiceJet,18/03/2019,Chennai,Kolkata,MAA → CCU,09:30,12:05,2h 35m,non-stop,No check-in baggage included,3807,2019-03-18,18,3,0,155,0,9,12
Multiple carriers,3/03/2019,Delhi,Cochin,DEL → HYD → COK,09:45,22:20,12h 35m,1 stop,No info,13838,2019-03-03,3,3,6,755,1,9,22
Air India,24/06/2019,Delhi,Cochin,DEL → HYD → MAA → COK,07:05,09:25 25 Jun,26h 20m,2 stops,No info,11185,2019-06-24,24,6,0,1580,2,7,9
Jet Airways,21/06/2019,Banglore,Delhi,BLR → DEL,15:15,18:10,2h 55m,non-stop,In-flight meal not included,7229,2019-06-21,21,6,4,175,0,15,18
Jet Airways,12/06/2019,Delhi,Cochin,DEL → BOM → COK,21:50,04:25 13 Jun,6h 35m,1 stop,In-flight meal not included,10262,2019-06-12,12,6,2,395,1,21,4
Air Asia,9/03/2019,Kolkata,Banglore,CCU → BLR,19:35,22:05,2h 30m,non-stop,No info,4384,2019-03-09,9,3,5,150,0,19,22
Jet Airways,27/06/2019,Delhi,Cochin,DEL → AMD → BOM → COK,13:25,12:35 28 Jun,23h 10m,2 stops,No info,12819,2019-06-27,27,6,3,1390,2,13,12
Jet Airways,6/05/2019,Kolkata,Banglore,CCU → BOM → BLR,21:10,10:05 07 May,12h 55m,1 stop,In-flight meal not included,7757,2019-05-06,6,5,0,775,1,21,10
Air India,21/04/2019,Delhi,Cochin,DEL → BLR → COK,20:30,23:00 22 Apr,26h 30m,1 stop,No info,7174,2019-04-21,21,4,6,1590,1,20,23
IndiGo,1/06/2019,Delhi,Cochin,DEL → HYD → COK,11:55,22:30,10h 35m,1 stop,No info,6674,2019-06-01,1,6,5,635,1,11,22
IndiGo,18/05/2019,Mumbai,Hyderabad,BOM → HYD,20:05,21:40,1h 35m,non-stop,No info,2227,2019-05-18,18,5,5,95,0,20,21
Jet Airways,12/06/2019,Delhi,Cochin,DEL → JAI → BOM → COK,19:30,12:35 13 Jun,17h 5m,2 stops,No info,13014,2019-06-12,12,6,2,1025,2,19,12
IndiGo,21/03/2019,Mumbai,Hyderabad,BOM → HYD,16:55,18:25,1h 30m,non-stop,No info,3175,2019-03-21,21,3,3,90,0,16,18
IndiGo,1/03/2019,Kolkata,Banglore,CCU → BLR,09:35,12:20,2h 45m,non-stop,No info,6565,2019-03-01,1,3,4,165,0,9,12
Jet Airways,1/04/2019,Kolkata,Banglore,CCU → BOM → BLR,18:55,23:35 02 Apr,28h 40m,1 stop,No info,12681,2019-04-01,1,4,0,1720,1,18,23
Vistara,1/06/2019,Chennai,Kolkata,MAA → CCU,07:05,09:20,2h 15m,non-stop,No info,3687,2019-06-01,1,6,5,135,0,7,9
Jet Airways,15/06/2019,Mumbai,Hyderabad,BOM → HYD,19:35,21:05,1h 30m,non-stop,In-flight meal not included,3210,2019-06-15,15,6,5,90,0,19,21
IndiGo,6/03/2019,Kolkata,Banglore,CCU → BLR,20:25,23:05,2h 40m,non-stop,No info,4778,2019-03-06,6,3,2,160,0,20,23
Multiple carriers,3/06/2019,Delhi,Cochin,DEL → BOM → COK,11:25,19:00,7h 35m,1 stop,No info,10877,2019-06-03,3,6,0,455,1,11,19
Vistara,24/05/2019,Kolkata,Banglore,CCU → DEL → BLR,20:20,10:45 25 May,14h 25m,1 stop,No info,9187,2019-05-24,24,5,4,865,1,20,10
Air India,15/03/2019,Banglore,New Delhi,BLR → COK → DEL,22:00,23:20 16 Mar,25h 20m,1 stop,No info,6850,2019-03-15,15,3,4,1520,1,22,23
Jet Airways,12/05/2019,Kolkata,Banglore,CCU → BOM → BLR,08:25,18:15,9h 50m,1 stop,No info,14781,2019-05-12,12,5,6,590,1,8,18
Air India,6/05/2019,Kolkata,Banglore,CCU → GAU → DEL → BLR,16:45,08:55 07 May,16h 10m,2 stops,No info,13227,2019-05-06,6,5,0,970,2,16,8
Vistara,9/05/2019,Banglore,Delhi,BLR → DEL,07:00,09:40,2h 40m,non-stop,No info,4668,2019-05-09,9,5,3,160,0,7,9
Jet Airways,24/05/2019,Kolkata,Banglore,CCU → BOM → BLR,06:30,12:00,5h 30m,1 stop,No info,14178,2019-05-24,24,5,4,330,1,6,12
Jet Airways,6/05/2019,Kolkata,Banglore,CCU → DEL → BLR,17:00,09:45 07 May,16h 45m,1 stop,In-flight meal not included,8066,2019-05-06,6,5,0,1005,1,17,9
IndiGo,6/05/2019,Banglore,Delhi,BLR → DEL,13:00,15:50,2h 50m,non-stop,No info,3943,2019-05-06,6,5,0,170,0,13,15
Multiple carriers,1/06/2019,Delhi,Cochin,DEL → BOM → COK,07:30,19:00,11h 30m,1 stop,No info,11200,2019-06-01,1,6,5,690,1,7,19
Jet Airways,18/05/2019,Kolkata,Banglore,CCU → BOM → BLR,18:55,04:40 19 May,9h 45m,1 stop,In-flight meal not included,8586,2019-05-18,18,5,5,585,1,18,4
Jet Airways,12/06/2019,Kolkata,Banglore,CCU → BOM → BLR,21:10,10:05 13 Jun,12h 55m,1 stop,No info,13044,2019-06-12,12,6,2,775,1,21,10
Multiple carriers,3/06/2019,Delhi,Cochin,DEL → BOM → COK,09:15,19:15,10h,1 stop,No info,8099,2019-06-03,3,6,0,600,1,9,19
Jet Airways,15/06/2019,Delhi,Cochin,DEL → BOM → COK,17:30,04:25 16 Jun,10h 55m,1 stop,In-flight meal not included,10262,2019-06-15,15,6,5,655,1,17,4
Multiple carriers,24/06/2019,Delhi,Cochin,DEL → IXU → BOM → COK,17:50,01:30 25 Jun,7h 40m,2 stops,No info,18275,2019-06-24,24,6,0,460,2,17,1
Multiple carriers,27/05/2019,Delhi,Cochin,DEL → BOM → COK,06:00,21:00,15h,1 stop,No info,8475,2019-05-27,27,5,0,900,1,6,21
SpiceJet,6/04/2019,Kolkata,Banglore,CCU → BLR,22:20,00:40 07 Apr,2h 20m,non-stop,No info,3873,2019-04-06,6,4,5,140,0,22,0
IndiGo,21/06/2019,Mumbai,Hyderabad,BOM → HYD,21:20,22:50,1h 30m,non-stop,No info,2227,2019-06-21,21,6,4,90,0,21,22
Jet Airways,6/03/2019,Delhi,Cochin,DEL → IDR → BOM → COK,05:25,19:45 07 Mar,38h 20m,2 stops,In-flight meal not included,16389,2019-03-06,6,3,2,2300,2,5,19
Air India,3/05/2019,Banglore,Delhi,BLR → DEL,06:10,08:55,2h 45m,non-stop,No info,5228,2019-05-03,3,5,4,165,0,6,8
Air India,21/03/2019,Banglore,New Delhi,BLR → MAA → DEL,11:50,08:55 19 Mar,21h 5m,1 stop,No info,5092,2019-03-21,21,3,3,1265,1,11,8
IndiGo,09/03/2019,Banglore,New Delhi,BLR → DEL,21:20,00:15 13 Mar,2h 55m,non-stop,No info,4777,2019-03-09,9,3,5,175,0,21,0
Air Asia,24/03/2019,Banglore,New Delhi,BLR → DEL,05:50,08:40,2h 50m,non-stop,No info,3383,2019-03-24,24,3,6,170,0,5,8
Vistara,21/05/2019,Kolkata,Banglore,CCU → DEL → BLR,07:10,09:05 22 May,25h 55m,1 stop,No info,8452,2019-05-21,21,5,1,1555,1,7,9
IndiGo,27/05/2019,Banglore,Delhi,BLR → DEL,23:30,02:20 28 May,2h 50m,non-stop,No info,3943,2019-05-27,27,5,0,170,0,23,2
Air India,24/06/2019,Mumbai,Hyderabad,BOM → HYD,21:05,22:25,1h 20m,non-stop,No info,3100,2019-06-24,24,6,0,80,0,21,22
IndiGo,6/03/2019,Delhi,Cochin,DEL → BOM → COK,09:10,01:35 07 Mar,16h 25m,1 stop,No info,14871,2019-03-06,6,3,2,985,1,9,1
Jet Airways,21/06/2019,Banglore,Delhi,BLR → DEL,11:10,14:05,2h 55m,non-stop,No info,8016,2019-06-21,21,6,4,175,0,11,14
Multiple carriers,12/06/2019,Delhi,Cochin,DEL → BOM → COK,06:00,19:00,13h,1 stop,No info,11789,2019-06-12,12,6,2,780,1,6,19
Multiple carriers,15/05/2019,Delhi,Cochin,DEL → BOM → COK,11:40,19:00,7h 20m,1 stop,No info,10529,2019-05-15,15,5,2,440,1,11,19
Air Asia,15/03/2019,Banglore,New Delhi,BLR → DEL,05:50,08:40,2h 50m,non-stop,No info,5615,2019-03-15,15,3,4,170,0,5,8
SpiceJet,6/06/2019,Kolkata,Banglore,CCU → MAA → BLR,15:05,20:20,5h 15m,1 stop,No info,4649,2019-06-06,6,6,3,315,1,15,20
Air India,9/06/2019,Kolkata,Banglore,CCU → IXR → DEL → BLR,05:50,23:15,17h 25m,2 stops,No info,12723,2019-06-09,9,6,6,1045,2,5,23
Jet Airways,24/05/2019,Kolkata,Banglore,CCU → BOM → BLR,06:30,18:15,11h 45m,1 stop,In-flight meal not included,10844,2019-05-24,24,5,4,705,1,6,18
Jet Airways,3/06/2019,Delhi,Cochin,DEL → BOM → COK,20:55,19:00 04 Jun,22h 5m,1 stop,No info,14714,2019-06-03,3,6,0,1325,1,20,19
Vistara,12/06/2019,Delhi,Cochin,DEL → COK,14:40,17:50,3h 10m,non-stop,No info,6216,2019-06-12,12,6,2,190,0,14,17
IndiGo,15/03/2019,Kolkata,Banglore,CCU → BLR,09:35,12:20,2h 45m,non-stop,No info,4148,2019-03-15,15,3,4,165,0,9,12
IndiGo,6/03/2019,Delhi,Cochin,DEL → HYD → COK,06:40,12:00,5h 20m,1 stop,No info,5647,2019-03-06,6,3,2,320,1,6,12
Jet Airways,15/05/2019,Kolkata,Banglore,CCU → BOM → BLR,08:25,18:15,9h 50m,1 stop,In-flight meal not included,10844,2019-05-15,15,5,2,590,1,8,18
IndiGo,9/05/2019,Delhi,Cochin,DEL → HYD → COK,05:05,12:10,7h 5m,1 stop,No info,6818,2019-05-09,9,5,3,425,1,5,12
Air India,27/05/2019,Delhi,Cochin,DEL → GOI → BOM → COK,10:55,07:40 28 May,20h 45m,2 stops,No info,13643,2019-05-27,27,5,0,1245,2,10,7
Multiple carriers,27/03/2019,Delhi,Cochin,DEL → BOM → COK,07:00,21:00,14h,1 stop,No info,6358,2019-03-27,27,3,2,840,1,7,21
Jet Airways,1/06/2019,Delhi,Cochin,DEL → BOM → COK,13:00,19:00,6h,1 stop,No info,14714,2019-06-01,1,6,5,360,1,13,19
SpiceJet,21/04/2019,Delhi,Cochin,DEL → PNQ → COK,08:45,13:15,4h 30m,1 stop,No info,6460,2019-04-21,21,4,6,270,1,8,13
Jet Airways,12/05/2019,Kolkata,Banglore,CCU → BOM → BLR,21:10,12:00 13 May,14h 50m,1 stop,In-flight meal not included,9663,2019-05-12,12,5,6,890,1,21,12
Jet Airways,21/05/2019,Kolkata,Banglore,CCU → BOM → BLR,06:30,10:05 22 May,27h 35m,1 stop,No info,13941,2019-05-21,21,5,1,1655,1,6,10
Jet Airways,27/03/2019,Delhi,Cochin,DEL → BOM → COK,19:45,19:45 28 Mar,24h,1 stop,In-flight meal not included,5963,2019-03-27,27,3,2,1440,1,19,19
Jet Airways,15/06/2019,Delhi,Cochin,DEL → JAI → BOM → COK,19:30,12:35 16 Jun,17h 5m,2 stops,No info,13014,2019-06-15,15,6,5,1025,2,19,12
Jet Airways,9/05/2019,Kolkata,Banglore,CCU → BOM → BLR,16:30,09:20 10 May,16h 50m,1 stop,In-flight meal not included,9663,2019-05-09,9,5,3,1010,1,16,9
IndiGo,6/04/2019,Banglore,Delhi,BLR → DEL,13:00,15:50,2h 50m,non-stop,No info,4423,2019-04-06,6,4,5,170,0,13,15
Jet Airways,6/05/2019,Delhi,Cochin,DEL → JDH → BOM → COK,11:40,19:00,7h 20m,2 stops,No info,21219,2019-05-06,6,5,0,440,2,11,19
IndiGo,24/05/2019,Delhi,Cochin,DEL → BOM → COK,18:35,01:30 25 May,6h 55m,1 stop,No info,7503,2019-05-24,24,5,4,415,1,18,1
IndiGo,24/06/2019,Kolkata,Banglore,CCU → BLR,21:25,00:05 25 Jun,2h 40m,non-stop,No info,4804,2019-06-24,24,6,0,160,0,21,0
Jet Airways,9/05/2019,Delhi,Cochin,DEL → JAI → BOM → COK,09:40,12:35 10 May,26h 55m,2 stops,No info,15129,2019-05-09,9,5,3,1615,2,9,12
Multiple carriers,27/03/2019,Delhi,Cochin,DEL → HYD → MAA → COK,07:10,21:20,14h 10m,2 stops,No info,6197,2019-03-27,27,3,2,850,2,7,21
SpiceJet,27/05/2019,Chennai,Kolkata,MAA → CCU,17:45,20:05,2h 20m,non-stop,No info,3597,2019-05-27,27,5,0,140,0,17,20
Multiple carriers,27/03/2019,Delhi,Cochin,DEL → BOM → COK,07:30,19:15,11h 45m,1 stop,No info,9100,2019-03-27,27,3,2,705,1,7,19
Jet Airways,1/06/2019,Mumbai,Hyderabad,BOM → HYD,07:05,08:30,1h 25m,non-stop,In-flight meal not included,4050,2019-06-01,1,6,5,85,0,7,8
Multiple carriers,6/06/2019,Delhi,Cochin,DEL → BOM → COK,10:00,01:30 07 Jun,15h 30m,1 stop,No info,7723,2019-06-06,6,6,3,930,1,10,1
Jet Airways,9/05/2019,Delhi,Cochin,DEL → AMD → BOM → COK,23:05,19:00 10 May,19h 55m,2 stops,No info,15129,2019-05-09,9,5,3,1195,2,23,19
Jet Airways,18/05/2019,Delhi,Cochin,DEL → BOM → COK,08:00,19:00,11h,1 stop,In-flight meal not included,12373,2019-05-18,18,5,5,660,1,8,19
IndiGo,3/05/2019,Banglore,Delhi,BLR → DEL,23:30,02:20 04 May,2h 50m,non-stop,No info,4591,2019-05-03,3,5,4,170,0,23,2
SpiceJet,9/03/2019,Chennai,Kolkata,MAA → CCU,08:20,10:35,2h 15m,non-stop,No info,6300,2019-03-09,9,3,5,135,0,8,10
Air India,24/03/2019,Banglore,New Delhi,BLR → DEL,17:00,19:45,2h 45m,non-stop,No info,5176,2019-03-24,24,3,6,165,0,17,19
Multiple carriers,15/06/2019,Delhi,Cochin,DEL → BOM → COK,09:00,19:00,10h,1 stop,No info,12717,2019-06-15,15,6,5,600,1,9,19
Air India,18/03/2019,Chennai,Kolkata,MAA → CCU,11:40,13:55,2h 15m,non-stop,No info,4405,2019-03-18,18,3,0,135,0,11,13
SpiceJet,21/04/2019,Delhi,Cochin,DEL → MAA → COK,15:45,22:05,6h 20m,1 stop,No info,6749,2019-04-21,21,4,6,380,1,15,22
Jet Airways,12/05/2019,Kolkata,Banglore,CCU → GAU → BLR,10:20,17:35,7h 15m,1 stop,In-flight meal not included,7064,2019-05-12,12,5,6,435,1,10,17
Jet Airways,21/05/2019,Delhi,Cochin,DEL → BOM → COK,07:05,12:35,5h 30m,1 stop,No info,16289,2019-05-21,21,5,1,330,1,7,12
IndiGo,15/03/2019,Chennai,Kolkata,MAA → CCU,11:35,14:00,2h 25m,non-stop,No info,6297,2019-03-15,15,3,4,145,0,11,14
Jet Airways,12/05/2019,Mumbai,Hyderabad,BOM → HYD,19:35,21:05,1h 30m,non-stop,No info,5678,2019-05-12,12,5,6,90,0,19,21
Jet Airways,1/05/2019,Kolkata,Banglore,CCU → BOM → BLR,20:00,09:20 02 May,13h 20m,1 stop,No info,14388,2019-05-01,1,5,2,800,1,20,9
Jet Airways,18/04/2019,Banglore,Delhi,BLR → DEL,06:00,08:45,2h 45m,non-stop,No info,7229,2019-04-18,18,4,3,165,0,6,8
IndiGo,24/03/2019,Kolkata,Banglore,CCU → BBI → BLR,11:55,16:25,4h 30m,1 stop,No info,9806,2019-03-24,24,3,6,270,1,11,16
IndiGo,6/06/2019,Delhi,Cochin,DEL → LKO → COK,21:50,03:35 07 Jun,5h 45m,1 stop,No info,6195,2019-06-06,6,6,3,345,1,21,3
Jet Airways,12/06/2019,Kolkata,Banglore,CCU → BOM → BLR,18:55,18:15 13 Jun,23h 20m,1 stop,No info,13044,2019-06-12,12,6,2,1400,1,18,18
Jet Airways,27/06/2019,Delhi,Cochin,DEL → LKO → BOM → COK,11:45,04:25 28 Jun,16h 40m,2 stops,No info,13882,2019-06-27,27,6,3,1000,2,11,4
Jet Airways,24/03/2019,Banglore,New Delhi,BLR → BOM → DEL,05:45,10:45,5h,1 stop,In-flight meal not included,8147,2019-03-24,24,3,6,300,1,5,10
Air India,9/04/2019,Delhi,Cochin,DEL → HYD → BOM → COK,17:15,07:40 10 Apr,14h 25m,2 stops,No info,8052,2019-04-09,9,4,1,865,2,17,7
Jet Airways,1/05/2019,Kolkata,Banglore,CCU → BOM → BLR,06:30,19:50,13h 20m,1 stop,No info,14781,2019-05-01,1,5,2,800,1,6,19
Jet Airways,24/05/2019,Kolkata,Banglore,CCU → DEL → BLR,09:35,22:05,12h 30m,1 stop,No info,14151,2019-05-24,24,5,4,750,1,9,22
IndiGo,18/05/2019,Kolkata,Banglore,CCU → NAG → BLR,18:05,23:30,5h 25m,1 stop,No info,6704,2019-05-18,18,5,5,325,1,18,23
Jet Airways,1/05/2019,Kolkata,Banglore,CCU → BOM → BLR,08:25,12:00 02 May,27h 35m,1 stop,In-flight meal not included,9663,2019-05-01,1,5,2,1655,1,8,12
IndiGo,18/03/2019,Kolkata,Banglore,CCU → BLR,15:20,17:55,2h 35m,non-stop,No info,4462,2019-03-18,18,3,0,155,0,15,17
Jet Airways,21/03/2019,Delhi,Cochin,DEL → BDQ → BOM → COK,10:45,04:25 22 Mar,17h 40m,2 stops,In-flight meal not included,8367,2019-03-21,21,3,3,1060,2,10,4
Jet Airways,9/06/2019,Delhi,Cochin,DEL → NAG → BOM → COK,06:45,04:25 10 Jun,21h 40m,2 stops,No info,13376,2019-06-09,9,6,6,1300,2,6,4
Jet Airways,21/05/2019,Kolkata,Banglore,CCU → DEL → BLR,20:25,09:45 22 May,13h 20m,1 stop,No info,13067,2019-05-21,21,5,1,800,1,20,9
IndiGo,21/05/2019,Kolkata,Banglore,CCU → BLR,14:25,16:55,2h 30m,non-stop,No info,5224,2019-05-21,21,5,1,150,0,14,16
Multiple carriers,21/03/2019,Delhi,Cochin,DEL → BOM → COK,16:00,01:35 22 Mar,9h 35m,1 stop,No info,13542,2019-03-21,21,3,3,575,1,16,1
GoAir,24/05/2019,Banglore,Delhi,BLR → DEL,07:45,10:40,2h 55m,non-stop,No info,3419,2019-05-24,24,5,4,175,0,7,10
Multiple carriers,6/03/2019,Delhi,Cochin,DEL → HYD → MAA → COK,09:45,21:20,11h 35m,2 stops,No info,10444,2019-03-06,6,3,2,695,2,9,21
IndiGo,1/06/2019,Kolkata,Banglore,CCU → BLR,09:35,12:10,2h 35m,non-stop,No info,4804,2019-06-01,1,6,5,155,0,9,12
Jet Airways,21/05/2019,Mumbai,Hyderabad,BOM → HYD,07:05,08:30,1h 25m,non-stop,In-flight meal not included,4995,2019-05-21,21,5,1,85,0,7,8
SpiceJet,27/04/2019,Delhi,Cochin,DEL → BLR → COK,17:55,22:50,4h 55m,1 stop,No info,4957,2019-04-27,27,4,5,295,1,17,22
Jet Airways,9/05/2019,Delhi,Cochin,DEL → BOM → COK,20:55,04:25 10 May,7h 30m,1 stop,No info,15554,2019-05-09,9,5,3,450,1,20,4
Jet Airways,1/05/2019,Kolkata,Banglore,CCU → BOM → BLR,20:00,12:00 02 May,16h,1 stop,In-flight meal not included,9663,2019-05-01,1,5,2,960,1,20,12
Jet Airways,18/05/2019,Kolkata,Banglore,CCU → DEL → BLR,09:35,09:45 19 May,24h 10m,1 stop,No info,14151,2019-05-18,18,5,5,1450,1,9,9
IndiGo,6/06/2019,Delhi,Cochin,DEL → COK,05:35,08:50,3h 15m,non-stop,No info,5601,2019-06-06,6,6,3,195,0,5,8
Multiple carriers,15/05/2019,Delhi,Cochin,DEL → BOM → COK,06:40,19:15,12h 35m,1 stop,No info,7787,2019-05-15,15,5,2,755,1,6,19
Air India,21/03/2019,Banglore,New Delhi,BLR → MAA → DEL,11:50,23:55,12h 5m,1 stop,No info,5092,2019-03-21,21,3,3,725,1,11,23
Jet Airways,6/06/2019,Kolkata,Banglore,CCU → BOM → BLR,21:10,09:20 07 Jun,12h 10m,1 stop,In-flight meal not included,10844,2019-06-06,6,6,3,730,1,21,9
Multiple carriers,9/03/2019,Delhi,Cochin,DEL → IXU → BOM → COK,17:50,01:35 10 Mar,7h 45m,2 stops,No info,23583,2019-03-09,9,3,5,465,2,17,1
Air India,12/05/2019,Kolkata,Banglore,CCU → BBI → BOM → BLR,12:00,18:30 13 May,30h 30m,2 stops,No info,10676,2019-05-12,12,5,6,1830,2,12,18
SpiceJet,6/06/2019,Kolkata,Banglore,CCU → IXB → BLR,11:15,18:30,7h 15m,1 stop,No info,10156,2019-06-06,6,6,3,435,1,11,18
Air Asia,6/03/2019,Delhi,Cochin,DEL → BLR → COK,16:45,07:10 07 Mar,14h 25m,1 stop,No info,8627,2019-03-06,6,3,2,865,1,16,7
Air Asia,21/05/2019,Kolkata,Banglore,CCU → BLR,09:45,12:15,2h 30m,non-stop,No info,4409,2019-05-21,21,5,1,150,0,9,12
Multiple carriers,18/05/2019,Delhi,Cochin,DEL → HYD → COK,09:45,16:10,6h 25m,1 stop,No info,9646,2019-05-18,18,5,5,385,1,9,16
Jet Airways,12/03/2019,Banglore,New Delhi,BLR → BOM → DEL,21:25,12:25 13 Mar,15h,1 stop,No info,13817,2019-03-12,12,3,1,900,1,21,12
Air India,9/05/2019,Delhi,Cochin,DEL → UDR → BOM → COK,13:20,07:40 10 May,18h 20m,2 stops,No info,13538,2019-05-09,9,5,3,1100,2,13,7
Air India,9/05/2019,Kolkata,Banglore,CCU → BBI → BOM → BLR,12:00,07:55 10 May,19h 55m,2 stops,No info,9416,2019-05-09,9,5,3,1195,2,12,7
Jet Airways,27/04/2019,Banglore,Delhi,BLR → DEL,11:10,14:05,2h 55m,non-stop,No info,7229,2019-04-27,27,4,5,175,0,11,14
Air India,1/05/2019,Kolkata,Banglore,CCU → DEL → BLR,10:00,23:15,13h 15m,1 stop,No info,10203,2019-05-01,1,5,2,795,1,10,23
IndiGo,21/05/2019,Delhi,Cochin,DEL → HYD → COK,16:10,00:55 22 May,8h 45m,1 stop,No info,6778,2019-05-21,21,5,1,525,1,16,0
IndiGo,15/06/2019,Mumbai,Hyderabad,BOM → HYD,12:00,13:30,1h 30m,non-stop,No info,2754,2019-06-15,15,6,5,90,0,12,13
Air India,1/05/2019,Kolkata,Banglore,CCU → IXR → DEL → BLR,05:50,20:25,14h 35m,2 stops,No info,10991,2019-05-01,1,5,2,875,2,5,20
Vistara,27/05/2019,Banglore,Delhi,BLR → DEL,11:30,14:20,2h 50m,non-stop,No info,4668,2019-05-27,27,5,0,170,0,11,14
SpiceJet,3/06/2019,Delhi,Cochin,DEL → PNQ → COK,08:45,13:15,4h 30m,1 stop,No check-in baggage included,5726,2019-06-03,3,6,0,270,1,8,13
Air India,12/06/2019,Kolkata,Banglore,CCU → GAU → DEL → BLR,09:50,23:15,13h 25m,2 stops,No info,14960,2019-06-12,12,6,2,805,2,9,23
Air India,21/05/2019,Delhi,Cochin,DEL → MAA → COK,20:40,09:25 22 May,12h 45m,1 stop,No info,7480,2019-05-21,21,5,1,765,1,20,9
Air Asia,21/05/2019,Kolkata,Banglore,CCU → BLR,19:55,22:25,2h 30m,non-stop,No info,4107,2019-05-21,21,5,1,150,0,19,22
Jet Airways,1/05/2019,Kolkata,Banglore,CCU → DEL → BLR,09:35,09:45 02 May,24h 10m,1 stop,No info,11467,2019-05-01,1,5,2,1450,1,9,9
IndiGo,27/04/2019,Delhi,Cochin,DEL → MAA → COK,02:00,07:25,5h 25m,1 stop,No info,5796,2019-04-27,27,4,5,325,1,2,7
Jet Airways,6/06/2019,Delhi,Cochin,DEL → BOM → COK,02:15,19:00,16h 45m,1 stop,In-flight meal not included,10262,2019-06-06,6,6,3,1005,1,2,19
Air India,27/06/2019,Delhi,Cochin,DEL → RPR → NAG → BOM → COK,05:15,07:40 28 Jun,26h 25m,3 stops,No info,11543,2019-06-27,27,6,3,1585,3,5,7
IndiGo,24/04/2019,Delhi,Cochin,DEL → HYD → COK,06:50,12:10,5h 20m,1 stop,No info,5298,2019-04-24,24,4,2,320,1,6,12
Air Asia,27/04/2019,Delhi,Cochin,DEL → BLR → COK,20:45,07:10 28 Apr,10h 25m,1 stop,No info,6451,2019-04-27,27,4,5,625,1,20,7
Air India,9/06/2019,Kolkata,Banglore,CCU → BLR,14:15,16:45,2h 30m,non-stop,No info,6245,2019-06-09,9,6,6,150,0,14,16
Jet Airways,27/03/2019,Mumbai,Hyderabad,BOM → HYD,19:35,21:05,1h 30m,non-stop,In-flight meal not included,2071,2019-03-27,27,3,2,90,0,19,21
IndiGo,15/05/2019,Kolkata,Banglore,CCU → BLR,09:35,12:20,2h 45m,non-stop,No info,4804,2019-05-15,15,5,2,165,0,9,12
Multiple carriers,27/06/2019,Delhi,Cochin,DEL → BOM → COK,07:30,21:00,13h 30m,1 stop,No info,7005,2019-06-27,27,6,3,810,1,7,21
Jet Airways,18/03/2019,Banglore,New Delhi,BLR → BOM → DEL,05:45,12:25,6h 40m,1 stop,No info,12284,2019-03-18,18,3,0,400,1,5,12
Air India,9/05/2019,Kolkata,Banglore,CCU → DEL → BLR,07:00,20:25,13h 25m,1 stop,No info,10203,2019-05-09,9,5,3,805,1,7,20
IndiGo,27/05/2019,Delhi,Cochin,DEL → HYD → COK,14:20,22:30,8h 10m,1 stop,No info,6938,2019-05-27,27,5,0,490,1,14,22
Multiple carriers,12/06/2019,Delhi,Cochin,DEL → BOM → COK,10:00,01:30 13 Jun,15h 30m,1 stop,No info,13377,2019-06-12,12,6,2,930,1,10,1
Multiple carriers,1/06/2019,Delhi,Cochin,DEL → BOM → COK,09:15,19:15,10h,1 stop,No info,9779,2019-06-01,1,6,5,600,1,9,19
Air India,15/05/2019,Chennai,Kolkata,MAA → CCU,11:40,13:55,2h 15m,non-stop,No info,4667,2019-05-15,15,5,2,135,0,11,13
Jet Airways,3/04/2019,Banglore,Delhi,BLR → DEL,19:50,22:50,3h,non-stop,In-flight meal not included,4544,2019-04-03,3,4,2,180,0,19,22
Jet Airways,27/06/2019,Delhi,Cochin,DEL → BOM → COK,21:50,04:25 28 Jun,6h 35m,1 stop,No info,16079,2019-06-27,27,6,3,395,1,21,4
Jet Airways,1/04/2019,Kolkata,Banglore,CCU → BOM → BLR,16:30,19:50 02 Apr,27h 20m,1 stop,In-flight meal not included,7064,2019-04-01,1,4,0,1640,1,16,19
Jet Airways,18/05/2019,Delhi,Cochin,DEL → BOM → COK,14:00,19:00,5h,1 stop,No info,15554,2019-05-18,18,5,5,300,1,14,19
SpiceJet,18/05/2019,Chennai,Kolkata,MAA → CCU,09:45,12:00,2h 15m,non-stop,No check-in baggage included,3543,2019-05-18,18,5,5,135,0,9,12
Air India,18/04/2019,Banglore,Delhi,BLR → DEL,13:20,16:10,2h 50m,non-stop,No info,6121,2019-04-18,18,4,3,170,0,13,16
IndiGo,27/03/2019,Delhi,Cochin,DEL → BOM → COK,08:25,15:30,7h 5m,1 stop,No info,8075,2019-03-27,27,3,2,425,1,8,15
Multiple carriers,3/06/2019,Delhi,Cochin,DEL → BOM → COK,11:30,01:30 04 Jun,14h,1 stop,No info,13377,2019-06-03,3,6,0,840,1,11,1
Jet Airways,24/05/2019,Kolkata,Banglore,CCU → BOM → BLR,14:05,19:50,5h 45m,1 stop,No info,14571,2019-05-24,24,5,4,345,1,14,19
SpiceJet,24/04/2019,Banglore,Delhi,BLR → DEL,05:55,08:35,2h 40m,non-stop,No check-in baggage included,3919,2019-04-24,24,4,2,160,0,5,8
Jet Airways,24/03/2019,Kolkata,Banglore,CCU → BOM → BLR,18:55,04:45 25 Mar,9h 50m,1 stop,No info,14231,2019-03-24,24,3,6,590,1,18,4
IndiGo,15/03/2019,Mumbai,Hyderabad,BOM → HYD,19:05,20:30,1h 25m,non-stop,No info,2754,2019-03-15,15,3,4,85,0,19,20
Air India,21/05/2019,Delhi,Cochin,DEL → BLR → COK,17:40,23:00,5h 20m,1 stop,No info,8067,2019-05-21,21,5,1,320,1,17,23
Vistara,6/05/2019,Kolkata,Banglore,CCU → DEL → BLR,07:10,22:40,15h 30m,1 stop,No info,8452,2019-05-06,6,5,0,930,1,7,22
Jet Airways,06/03/2019,Banglore,New Delhi,BLR → BOM → DEL,14:05,11:25 07 Mar,21h 20m,1 stop,No info,15025,2019-03-06,6,3,2,1280,1,14,11
Jet Airways,01/03/2019,Banglore,New Delhi,BLR → BOM → DEL,08:55,16:10,7h 15m,1 stop,No info,26890,2019-03-01,1,3,4,435,1,8,16
Jet Airways,6/03/2019,Delhi,Cochin,DEL → BOM → COK,13:00,18:50,5h 50m,1 stop,In-flight meal not included,15103,2019-03-06,6,3,2,350,1,13,18
Jet Airways,24/05/2019,Kolkata,Banglore,CCU → BOM → BLR,14:05,04:40 25 May,14h 35m,1 stop,In-flight meal not included,8586,2019-05-24,24,5,4,875,1,14,4
Jet Airways,9/06/2019,Kolkata,Banglore,CCU → BOM → BLR,08:25,16:20,7h 55m,1 stop,In-flight meal not included,10844,2019-06-09,9,6,6,475,1,8,16
Jet Airways,21/05/2019,Delhi,Cochin,DEL → BOM → COK,21:50,04:25 22 May,6h 35m,1 stop,In-flight meal not included,12898,2019-05-21,21,5,1,395,1,21,4
Jet Airways,12/05/2019,Kolkata,Banglore,CCU → BOM → BLR,06:30,08:15 13 May,25h 45m,1 stop,In-flight meal not included,8586,2019-05-12,12,5,6,1545,1,6,8
Multiple carriers,9/06/2019,Delhi,Cochin,DEL → BOM → COK,08:30,19:00,10h 30m,1 stop,No info,11622,2019-06-09,9,6,6,630,1,8,19
Air India,6/05/2019,Delhi,Cochin,DEL → LKO → BOM → COK,12:20,19:15 07 May,30h 55m,2 stops,No info,13538,2019-05-06,6,5,0,1855,2,12,19
Jet Airways,1/06/2019,Delhi,Cochin,DEL → JAI → BOM → COK,05:30,04:25 02 Jun,22h 55m,2 stops,No info,13014,2019-06-01,1,6,5,1375,2,5,4
Jet Airways,9/05/2019,Kolkata,Banglore,CCU → BOM → BLR,18:55,10:05 10 May,15h 10m,1 stop,No info,13941,2019-05-09,9,5,3,910,1,18,10
Jet Airways,18/05/2019,Kolkata,Banglore,CCU → DEL → BLR,09:35,10:55 19 May,25h 20m,1 stop,No info,14151,2019-05-18,18,5,5,1520,1,9,10
Multiple carriers,21/03/2019,Delhi,Cochin,DEL → BOM → COK,17:30,01:35 22 Mar,8h 5m,1 stop,No info,13542,2019-03-21,21,3,3,485,1,17,1
IndiGo,21/03/2019,Delhi,Cochin,DEL → HYD → COK,06:40,22:20,15h 40m,1 stop,No info,6558,2019-03-21,21,3,3,940,1,6,22
Air Asia,18/05/2019,Kolkata,Banglore,CCU → DEL → BLR,07:35,19:25,11h 50m,1 stop,No info,5192,2019-05-18,18,5,5,710,1,7,19
Vistara,1/06/2019,Banglore,Delhi,BLR → DEL,07:00,09:40,2h 40m,non-stop,No info,4878,2019-06-01,1,6,5,160,0,7,9
Jet Airways,27/05/2019,Delhi,Cochin,DEL → BOM → COK,15:00,12:35 28 May,21h 35m,1 stop,In-flight meal not included,12898,2019-05-27,27,5,0,1295,1,15,12
Air India,9/06/2019,Delhi,Cochin,DEL → BLR → COK,17:40,23:00,5h 20m,1 stop,No info,7384,2019-06-09,9,6,6,320,1,17,23
GoAir,3/05/2019,Banglore,Delhi,BLR → DEL,07:45,10:40,2h 55m,non-stop,No info,3898,2019-05-03,3,5,4,175,0,7,10
Air Asia,6/05/2019,Banglore,Delhi,BLR → DEL,23:55,02:45 07 May,2h 50m,non-stop,No info,3383,2019-05-06,6,5,0,170,0,23,2
IndiGo,24/06/2019,Delhi,Cochin,DEL → BOM → COK,06:40,21:00,14h 20m,1 stop,No info,6093,2019-06-24,24,6,0,860,1,6,21
Multiple carriers,12/06/2019,Delhi,Cochin,DEL → BOM → COK,08:00,19:00,11h,1 stop,No info,12192,2019-06-12,12,6,2,660,1,8,19
Multiple carriers,12/06/2019,Delhi,Cochin,DEL → BOM → COK,12:50,01:30 13 Jun,12h 40m,1 stop,No info,6795,2019-06-12,12,6,2,760,1,12,1
Jet Airways,18/03/2019,Banglore,New Delhi,BLR → BOM → DEL,07:00,07:40 16 Mar,24h 40m,1 stop,No info,11455,2019-03-18,18,3,0,1480,1,7,7
IndiGo,1/06/2019,Chennai,Kolkata,MAA → CCU,15:40,18:25,2h 45m,non-stop,No info,3540,2019-06-01,1,6,5,165,0,15,18
Multiple carriers,27/05/2019,Delhi,Cochin,DEL → BOM → COK,09:00,19:15,10h 15m,1 stop,No info,15898,2019-05-27,27,5,0,615,1,9,19
Multiple carriers,3/06/2019,Delhi,Cochin,DEL → BOM → COK,10:00,21:00,11h,1 stop,No info,9718,2019-06-03,3,6,0,660,1,10,21
GoAir,15/05/2019,Kolkata,Banglore,CCU → AMD → BLR,16:40,00:15 16 May,7h 35m,1 stop,No info,7831,2019-05-15,15,5,2,455,1,16,0
IndiGo,3/06/2019,Delhi,Cochin,DEL → BOM → COK,08:30,21:00,12h 30m,1 stop,No info,6416,2019-06-03,3,6,0,750,1,8,21
Vistara,27/03/2019,Chennai,Kolkata,MAA → CCU,07:05,09:20,2h 15m,non-stop,No info,3739,2019-03-27,27,3,2,135,0,7,9
Vistara,6/05/2019,Kolkata,Banglore,CCU → DEL → BLR,07:10,23:25,16h 15m,1 stop,No info,8085,2019-05-06,6,5,0,975,1,7,23
IndiGo,3/05/2019,Banglore,Delhi,BLR → DEL,16:55,19:55,3h,non-stop,No info,4823,2019-05-03,3,5,4,180,0,16,19
Jet Airways,9/06/2019,Delhi,Cochin,DEL → NAG → BOM → COK,14:35,12:35 10 Jun,22h,2 stops,No info,13376,2019-06-09,9,6,6,1320,2,14,12
Vistara,15/05/2019,Kolkata,Banglore,CCU → DEL → BLR,20:20,10:45 16 May,14h 25m,1 stop,No info,8452,2019-05-15,15,5,2,865,1,20,10
Jet Airways,6/06/2019,Kolkata,Banglore,CCU → BOM → BLR,20:00,22:35 07 Jun,26h 35m,1 stop,In-flight meal not included,10844,2019-06-06,6,6,3,1595,1,20,22
Vistara,27/03/2019,Delhi,Cochin,DEL → COK,06:00,09:10,3h 10m,non-stop,No info,4851,2019-03-27,27,3,2,190,0,6,9
Multiple carriers,15/06/2019,Delhi,Cochin,DEL → BOM → COK,19:00,01:30 16 Jun,6h 30m,1 stop,No info,6795,2019-06-15,15,6,5,390,1,19,1
IndiGo,18/05/2019,Banglore,Delhi,BLR → DEL,08:30,11:20,2h 50m,non-stop,No info,4823,2019-05-18,18,5,5,170,0,8,11
Jet Airways,9/06/2019,Delhi,Cochin,DEL → BOM → COK,20:55,04:25 10 Jun,7h 30m,1 stop,In-flight meal not included,10577,2019-06-09,9,6,6,450,1,20,4
Jet Airways,27/03/2019,Delhi,Cochin,DEL → BOM → COK,20:50,19:45 28 Mar,22h 55m,1 stop,No info,12032,2019-03-27,27,3,2,1375,1,20,19
Air Asia,1/06/2019,Delhi,Cochin,DEL → BLR → COK,07:55,13:25,5h 30m,1 stop,No info,9330,2019-06-01,1,6,5,330,1,7,13
Vistara,1/04/2019,Kolkata,Banglore,CCU → DEL → BLR,17:00,22:55,5h 55m,1 stop,No info,8977,2019-04-01,1,4,0,355,1,17,22
Multiple carriers,1/06/2019,Delhi,Cochin,DEL → BOM → COK,12:50,21:00,8h 10m,1 stop,No info,7005,2019-06-01,1,6,5,490,1,12,21
Jet Airways,18/05/2019,Kolkata,Banglore,CCU → BOM → BLR,14:05,20:45,6h 40m,1 stop,In-flight meal not included,10844,2019-05-18,18,5,5,400,1,14,20
Multiple carriers,24/06/2019,Delhi,Cochin,DEL → BOM → COK,03:50,12:35,8h 45m,1 stop,No info,12192,2019-06-24,24,6,0,525,1,3,12
Air India,24/03/2019,Banglore,New Delhi,BLR → DEL,10:00,12:45,2h 45m,non-stop,No info,4441,2019-03-24,24,3,6,165,0,10,12
Multiple carriers,9/05/2019,Delhi,Cochin,DEL → BOM → COK,10:35,19:15,8h 40m,1 stop,No info,7575,2019-05-09,9,5,3,520,1,10,19
IndiGo,21/06/2019,Kolkata,Banglore,CCU → BLR,04:40,07:15,2h 35m,non-stop,No info,4804,2019-06-21,21,6,4,155,0,4,7
SpiceJet,6/06/2019,Chennai,Kolkata,MAA → CCU,09:45,12:00,2h 15m,non-stop,No info,3597,2019-06-06,6,6,3,135,0,9,12
Air India,6/06/2019,Kolkata,Banglore,CCU → DEL → BLR,17:30,20:25 07 Jun,26h 55m,1 stop,No info,10413,2019-06-06,6,6,3,1615,1,17,20
Jet Airways,9/06/2019,Banglore,Delhi,BLR → DEL,06:00,08:45,2h 45m,non-stop,No info,8016,2019-06-09,9,6,6,165,0,6,8
Jet Airways,9/06/2019,Kolkata,Banglore,CCU → BOM → BLR,20:00,12:00 10 Jun,16h,1 stop,In-flight meal not included,10844,2019-06-09,9,6,6,960,1,20,12
Jet Airways,12/05/2019,Kolkata,Banglore,CCU → BOM → BLR,16:30,09:20 13 May,16h 50m,1 stop,In-flight meal not included,9663,2019-05-12,12,5,6,1010,1,16,9
IndiGo,18/05/2019,Delhi,Cochin,DEL → BOM → COK,20:25,01:30 19 May,5h 5m,1 stop,No info,6069,2019-05-18,18,5,5,305,1,20,1
IndiGo,27/05/2019,Delhi,Cochin,DEL → HYD → COK,11:55,22:30,10h 35m,1 stop,No info,6442,2019-05-27,27,5,0,635,1,11,22
Multiple carriers,1/06/2019,Delhi,Cochin,DEL → BOM → COK,09:00,21:00,12h,1 stop,No info,13587,2019-06-01,1,6,5,720,1,9,21
Air India,9/05/2019,Mumbai,Hyderabad,BOM → HYD,19:30,20:45,1h 15m,non-stop,No info,3100,2019-05-09,9,5,3,75,0,19,20
Jet Airways,21/05/2019,Kolkata,Banglore,CCU → BOM → BLR,06:30,18:15,11h 45m,1 stop,No info,14781,2019-05-21,21,5,1,705,1,6,18
Jet Airways,21/05/2019,Delhi,Cochin,DEL → BOM → COK,21:50,19:00 22 May,21h 10m,1 stop,In-flight meal not included,12898,2019-05-21,21,5,1,1270,1,21,19
IndiGo,18/06/2019,Kolkata,Banglore,CCU → BLR,14:25,16:55,2h 30m,non-stop,No info,4804,2019-06-18,18,6,1,150,0,14,16
SpiceJet,15/04/2019,Kolkata,Banglore,CCU → BLR,09:00,11:25,2h 25m,non-stop,No info,4174,2019-04-15,15,4,0,145,0,9,11
IndiGo,24/05/2019,Banglore,Delhi,BLR → DEL,23:30,02:20 25 May,2h 50m,non-stop,No info,4591,2019-05-24,24,5,4,170,0,23,2
Jet Airways,6/05/2019,Kolkata,Banglore,CCU → BOM → BLR,16:30,19:50 07 May,27h 20m,1 stop,In-flight meal not included,9663,2019-05-06,6,5,0,1640,1,16,19
Multiple carriers,15/05/2019,Delhi,Cochin,DEL → BOM → COK,08:45,19:15,10h 30m,1 stop,No info,8266,2019-05-15,15,5,2,630,1,8,19
IndiGo,6/05/2019,Banglore,Delhi,BLR → DEL,07:10,10:05,2h 55m,non-stop,No info,4823,2019-05-06,6,5,0,175,0,7,10
Air India,21/05/2019,Delhi,Cochin,DEL → COK,18:05,21:10,3h 5m,non-stop,No info,6094,2019-05-21,21,5,1,185,0,18,21
Jet Airways,24/05/2019,Kolkata,Banglore,CCU → BOM → BLR,21:10,04:40 25 May,7h 30m,1 stop,No info,14178,2019-05-24,24,5,4,450,1,21,4
Jet Airways,9/06/2019,Delhi,Cochin,DEL → NAG → BOM → COK,06:45,12:35 10 Jun,29h 50m,2 stops,No info,13376,2019-06-09,9,6,6,1790,2,6,12
Air India,24/03/2019,Mumbai,Hyderabad,BOM → HYD,21:05,22:25,1h 20m,non-stop,No info,2575,2019-03-24,24,3,6,80,0,21,22
Vistara,6/03/2019,Mumbai,Hyderabad,BOM → DEL → HYD,07:30,19:55,12h 25m,1 stop,No info,12395,2019-03-06,6,3,2,745,1,7,19
IndiGo,27/03/2019,Delhi,Cochin,DEL → BOM → COK,09:10,21:00,11h 50m,1 stop,No info,10351,2019-03-27,27,3,2,710,1,9,21
Air Asia,21/05/2019,Kolkata,Banglore,CCU → DEL → BLR,07:35,23:30,15h 55m,1 stop,No info,5192,2019-05-21,21,5,1,955,1,7,23
Multiple carriers,15/05/2019,Delhi,Cochin,DEL → BOM → COK,12:50,21:00,8h 10m,1 stop,No info,7670,2019-05-15,15,5,2,490,1,12,21
Air India,18/03/2019,Banglore,New Delhi,BLR → CCU → GAU → DEL,11:05,22:10 16 Mar,35h 5m,2 stops,No info,11161,2019-03-18,18,3,0,2105,2,11,22
Jet Airways,24/05/2019,Kolkata,Banglore,CCU → DEL → BLR,20:25,18:00 25 May,21h 35m,1 stop,No info,14151,2019-05-24,24,5,4,1295,1,20,18
IndiGo,6/05/2019,Kolkata,Banglore,CCU → HYD → BLR,15:15,20:05,4h 50m,1 stop,No info,4775,2019-05-06,6,5,0,290,1,15,20
Air India,6/03/2019,Delhi,Cochin,DEL → HYD → MAA → COK,13:05,09:25 07 Mar,20h 20m,2 stops,No info,12865,2019-03-06,6,3,2,1220,2,13,9
Air India,6/03/2019,Mumbai,Hyderabad,BOM → HYD,19:30,20:45,1h 15m,non-stop,No info,5462,2019-03-06,6,3,2,75,0,19,20
SpiceJet,9/03/2019,Delhi,Cochin,DEL → MAA → COK,06:10,11:20,5h 10m,1 stop,No info,8382,2019-03-09,9,3,5,310,1,6,11
Jet Airways,24/04/2019,Banglore,Delhi,BLR → DEL,17:45,20:45,3h,non-stop,In-flight meal not included,4544,2019-04-24,24,4,2,180,0,17,20
Jet Airways,1/04/2019,Banglore,Delhi,BLR → DEL,15:15,18:10,2h 55m,non-stop,In-flight meal not included,4544,2019-04-01,1,4,0,175,0,15,18
Jet Airways,18/05/2019,Kolkata,Banglore,CCU → BOM → BLR,16:30,23:35,7h 5m,1 stop,No info,14781,2019-05-18,18,5,5,425,1,16,23
SpiceJet,27/05/2019,Delhi,Cochin,DEL → PNQ → COK,08:45,13:15,4h 30m,1 stop,No check-in baggage included,5158,2019-05-27,27,5,0,270,1,8,13
Jet Airways,21/03/2019,Mumbai,Hyderabad,BOM → HYD,15:50,17:20,1h 30m,non-stop,No info,5678,2019-03-21,21,3,3,90,0,15,17
Jet Airways,9/06/2019,Delhi,Cochin,DEL → JDH → BOM → COK,11:40,19:00,7h 20m,2 stops,No info,18804,2019-06-09,9,6,6,440,2,11,19
IndiGo,3/06/2019,Mumbai,Hyderabad,BOM → HYD,09:10,10:40,1h 30m,non-stop,No info,4049,2019-06-03,3,6,0,90,0,9,10
IndiGo,24/03/2019,Kolkata,Banglore,CCU → BLR,10:10,12:55,2h 45m,non-stop,No info,6565,2019-03-24,24,3,6,165,0,10,12
Jet Airways,18/05/2019,Delhi,Cochin,DEL → BOM → COK,18:15,12:35 19 May,18h 20m,1 stop,In-flight meal not included,12373,2019-05-18,18,5,5,1100,1,18,12
Air India,18/03/2019,Banglore,New Delhi,BLR → DEL,17:00,19:45,2h 45m,non-stop,No info,4441,2019-03-18,18,3,0,165,0,17,19
SpiceJet,18/05/2019,Chennai,Kolkata,MAA → CCU,17:45,20:05,2h 20m,non-stop,No info,3597,2019-05-18,18,5,5,140,0,17,20
Jet Airways,18/06/2019,Mumbai,Hyderabad,BOM → HYD,19:35,21:05,1h 30m,non-stop,No info,5678,2019-06-18,18,6,1,90,0,19,21
Air India,9/03/2019,Delhi,Cochin,DEL → HYD → MAA → COK,09:45,09:25 10 Mar,23h 40m,2 stops,No info,10660,2019-03-09,9,3,5,1420,2,9,9
Jet Airways,21/04/2019,Banglore,Delhi,BLR → DEL,06:00,08:45,2h 45m,non-stop,In-flight meal not included,4544,2019-04-21,21,4,6,165,0,6,8
IndiGo,24/05/2019,Banglore,Delhi,BLR → DEL,08:30,11:20,2h 50m,non-stop,No info,4823,2019-05-24,24,5,4,170,0,8,11
Air India,9/05/2019,Kolkata,Banglore,CCU → VNS → DEL → BLR,14:30,23:15,8h 45m,2 stops,No info,14214,2019-05-09,9,5,3,525,2,14,23
Jet Airways,1/05/2019,Kolkata,Banglore,CCU → BOM → BLR,08:25,16:20,7h 55m,1 stop,No info,14781,2019-05-01,1,5,2,475,1,8,16
Multiple carriers,1/03/2019,Delhi,Cochin,DEL → BOM → COK,19:00,01:35 02 Mar,6h 35m,1 stop,No info,23533,2019-03-01,1,3,4,395,1,19,1
Jet Airways,9/03/2019,Delhi,Cochin,DEL → BOM → COK,19:15,18:50 10 Mar,23h 35m,1 stop,In-flight meal not included,14053,2019-03-09,9,3,5,1415,1,19,18
Jet Airways,27/06/2019,Delhi,Cochin,DEL → BOM → COK,21:50,19:00 28 Jun,21h 10m,1 stop,In-flight meal not included,10262,2019-06-27,27,6,3,1270,1,21,19
IndiGo,21/06/2019,Banglore,Delhi,BLR → DEL,20:00,22:50,2h 50m,non-stop,No info,4823,2019-06-21,21,6,4,170,0,20,22
Air India,18/05/2019,Delhi,Cochin,DEL → BLR → COK,17:40,08:15 19 May,14h 35m,1 stop,No info,8361,2019-05-18,18,5,5,875,1,17,8
Air India,9/06/2019,Delhi,Cochin,DEL → NAG → BOM → COK,05:55,19:15 10 Jun,37h 20m,2 stops,No info,10493,2019-06-09,9,6,6,2240,2,5,19
Multiple carriers,3/03/2019,Delhi,Cochin,DEL → BOM → COK,07:05,13:20,6h 15m,1 stop,No info,17057,2019-03-03,3,3,6,375,1,7,13
Air India,18/05/2019,Delhi,Cochin,DEL → HYD → BOM → COK,17:15,19:15 19 May,26h,2 stops,No info,12392,2019-05-18,18,5,5,1560,2,17,19
IndiGo,12/06/2019,Delhi,Cochin,DEL → BOM → COK,11:25,01:30 13 Jun,14h 5m,1 stop,No info,5883,2019-06-12,12,6,2,845,1,11,1
Jet Airways,21/05/2019,Delhi,Cochin,DEL → BOM → COK,11:30,19:00,7h 30m,1 stop,In-flight meal not included,12898,2019-05-21,21,5,1,450,1,11,19
Jet Airways,21/05/2019,Delhi,Cochin,DEL → BOM → COK,02:15,19:00,16h 45m,1 stop,No info,16079,2019-05-21,21,5,1,1005,1,2,19
Multiple carriers,12/06/2019,Delhi,Cochin,DEL → BOM → COK,04:55,12:35,7h 40m,1 stop,No info,10678,2019-06-12,12,6,2,460,1,4,12
Air India,01/03/2019,Banglore,New Delhi,BLR → BOM → IDR → DEL,06:45,11:10 02 Mar,28h 25m,2 stops,No info,20999,2019-03-01,1,3,4,1705,2,6,11
IndiGo,21/03/2019,Banglore,New Delhi,BLR → BOM → DEL,19:35,00:35 19 Mar,5h,1 stop,No info,6575,2019-03-21,21,3,3,300,1,19,0
Jet Airways,21/05/2019,Delhi,Cochin,DEL → JAI → BOM → COK,19:30,04:25 22 May,8h 55m,2 stops,No info,15129,2019-05-21,21,5,1,535,2,19,4
Jet Airways,6/06/2019,Kolkata,Banglore,CCU → BOM → BLR,18:55,18:15 07 Jun,23h 20m,1 stop,In-flight meal not included,10844,2019-06-06,6,6,3,1400,1,18,18
Air India,03/03/2019,Banglore,New Delhi,BLR → BBI → DEL,09:30,23:45,14h 15m,1 stop,No info,11654,2019-03-03,3,3,6,855,1,9,23
IndiGo,1/04/2019,Kolkata,Banglore,CCU → MAA → BLR,08:10,13:00,4h 50m,1 stop,No info,5069,2019-04-01,1,4,0,290,1,8,13
Air India,1/04/2019,Banglore,Delhi,BLR → DEL,06:10,08:55,2h 45m,non-stop,No info,5176,2019-04-01,1,4,0,165,0,6,8
Jet Airways,9/06/2019,Delhi,Cochin,DEL → IDR → BOM → COK,05:30,04:25 10 Jun,22h 55m,2 stops,No info,13292,2019-06-09,9,6,6,1375,2,5,4
IndiGo,6/06/2019,Delhi,Cochin,DEL → BLR → COK,02:00,07:45,5h 45m,1 stop,No info,6386,2019-06-06,6,6,3,345,1,2,7
Jet Airways,21/05/2019,Delhi,Cochin,DEL → AMD → BOM → COK,13:25,19:00 22 May,29h 35m,2 stops,No info,15129,2019-05-21,21,5,1,1775,2,13,19
Air India,6/03/2019,Kolkata,Banglore,CCU → BLR,20:45,23:20,2h 35m,non-stop,No info,4435,2019-03-06,6,3,2,155,0,20,23
IndiGo,18/05/2019,Banglore,Delhi,BLR → DEL,23:30,02:20 19 May,2h 50m,non-stop,No info,4591,2019-05-18,18,5,5,170,0,23,2
Jet Airways,21/03/2019,Banglore,New Delhi,BLR → BOM → DEL,05:45,23:00,17h 15m,1 stop,In-flight meal not included,7832,2019-03-21,21,3,3,1035,1,5,23
IndiGo,12/04/2019,Kolkata,Banglore,CCU → BLR,04:40,07:15,2h 35m,non-stop,No info,4174,2019-04-12,12,4,4,155,0,4,7
Multiple carriers,27/03/2019,Delhi,Cochin,DEL → BOM → COK,07:00,15:30,8h 30m,1 stop,No info,6148,2019-03-27,27,3,2,510,1,7,15
Multiple carriers,27/05/2019,Delhi,Cochin,DEL → BOM → COK,09:15,19:15,10h,1 stop,No info,9149,2019-05-27,27,5,0,600,1,9,19
Multiple carriers,27/03/2019,Delhi,Cochin,DEL → HYD → MAA → COK,13:05,21:20,8h 15m,2 stops,No info,6128,2019-03-27,27,3,2,495,2,13,21
IndiGo,27/03/2019,Delhi,Cochin,DEL → HYD → COK,16:10,22:20,6h 10m,1 stop,No info,6412,2019-03-27,27,3,2,370,1,16,22
Multiple carriers,18/05/2019,Delhi,Cochin,DEL → BOM → COK,08:00,21:00,13h,1 stop,No info,8073,2019-05-18,18,5,5,780,1,8,21
Jet Airways,24/06/2019,Delhi,Cochin,DEL → COK,11:00,14:15,3h 15m,non-stop,In-flight meal not included,4256,2019-06-24,24,6,0,195,0,11,14
Air India,12/05/2019,Kolkata,Banglore,CCU → DEL → AMD → BLR,10:00,05:25 13 May,19h 25m,2 stops,No info,14634,2019-05-12,12,5,6,1165,2,10,5
Multiple carriers,21/05/2019,Delhi,Cochin,DEL → BOM → COK,13:00,21:00,8h,1 stop,No info,14067,2019-05-21,21,5,1,480,1,13,21
IndiGo,6/05/2019,Kolkata,Banglore,CCU → BLR,15:30,18:05,2h 35m,non-stop,No info,4804,2019-05-06,6,5,0,155,0,15,18
SpiceJet,21/04/2019,Kolkata,Banglore,CCU → BLR,17:10,19:40,2h 30m,non-stop,No info,4911,2019-04-21,21,4,6,150,0,17,19
IndiGo,9/06/2019,Delhi,Cochin,DEL → HYD → COK,16:10,22:30,6h 20m,1 stop,No info,6412,2019-06-09,9,6,6,380,1,16,22
SpiceJet,15/06/2019,Chennai,Kolkata,MAA → CCU,08:20,10:35,2h 15m,non-stop,No check-in baggage included,3543,2019-06-15,15,6,5,135,0,8,10
IndiGo,6/06/2019,Chennai,Kolkata,MAA → CCU,11:35,14:00,2h 25m,non-stop,No info,3858,2019-06-06,6,6,3,145,0,11,14
Air India,15/05/2019,Kolkata,Banglore,CCU → BBI → BOM → BLR,12:00,07:55 16 May,19h 55m,2 stops,No info,9941,2019-05-15,15,5,2,1195,2,12,7
Jet Airways,9/04/2019,Banglore,Delhi,BLR → DEL,08:20,11:20,3h,non-stop,No info,7229,2019-04-09,9,4,1,180,0,8,11
GoAir,03/03/2019,Banglore,New Delhi,BLR → GOI → DEL,15:45,20:15,4h 30m,1 stop,No info,8352,2019-03-03,3,3,6,270,1,15,20
Jet Airways,12/05/2019,Kolkata,Banglore,CCU → DEL → BLR,09:35,22:05,12h 30m,1 stop,No info,14151,2019-05-12,12,5,6,750,1,9,22
Multiple carriers,6/06/2019,Delhi,Cochin,DEL → BOM → COK,17:45,01:30 07 Jun,7h 45m,1 stop,No info,6795,2019-06-06,6,6,3,465,1,17,1
IndiGo,3/05/2019,Kolkata,Banglore,CCU → BLR,20:20,22:55,2h 35m,non-stop,No info,4804,2019-05-03,3,5,4,155,0,20,22
Air India,6/06/2019,Delhi,Cochin,DEL → TRV → COK,05:15,06:50 07 Jun,25h 35m,1 stop,No info,6587,2019-06-06,6,6,3,1535,1,5,6
GoAir,3/04/2019,Delhi,Cochin,DEL → AMD → COK,07:25,13:35,6h 10m,1 stop,No info,4106,2019-04-03,3,4,2,370,1,7,13
Air India,18/04/2019,Kolkata,Banglore,CCU → BLR,14:15,16:45,2h 30m,non-stop,No info,5510,2019-04-18,18,4,3,150,0,14,16
Jet Airways,9/05/2019,Delhi,Cochin,DEL → JAI → BOM → COK,09:40,19:00,9h 20m,2 stops,No info,15129,2019-05-09,9,5,3,560,2,9,19
Jet Airways,9/05/2019,Delhi,Cochin,DEL → JAI → BOM → COK,09:40,04:25 10 May,18h 45m,2 stops,In-flight meal not included,13029,2019-05-09,9,5,3,1125,2,9,4
IndiGo,15/06/2019,Delhi,Cochin,DEL → MAA → COK,07:15,12:30,5h 15m,1 stop,No info,6582,2019-06-15,15,6,5,315,1,7,12
Multiple carriers,27/06/2019,Delhi,Cochin,DEL → BOM → COK,17:45,01:30 28 Jun,7h 45m,1 stop,In-flight meal not included,5797,2019-06-27,27,6,3,465,1,17,1
Jet Airways,12/06/2019,Kolkata,Banglore,CCU → DEL → BLR,20:25,10:55 13 Jun,14h 30m,1 stop,No info,12692,2019-06-12,12,6,2,870,1,20,10
SpiceJet,27/03/2019,Chennai,Kolkata,MAA → CCU,08:20,10:35,2h 15m,non-stop,No check-in baggage included,3332,2019-03-27,27,3,2,135,0,8,10
Air India,9/06/2019,Kolkata,Banglore,CCU → BBI → BOM → BLR,12:00,07:55 10 Jun,19h 55m,2 stops,No info,10151,2019-06-09,9,6,6,1195,2,12,7
IndiGo,6/04/2019,Delhi,Cochin,DEL → MAA → COK,02:00,07:25,5h 25m,1 stop,No info,5046,2019-04-06,6,4,5,325,1,2,7
Air India,15/06/2019,Delhi,Cochin,DEL → BLR → COK,06:10,23:00,16h 50m,1 stop,No info,8907,2019-06-15,15,6,5,1010,1,6,23
Air India,6/05/2019,Banglore,Delhi,BLR → DEL,21:05,23:55,2h 50m,non-stop,No info,5228,2019-05-06,6,5,0,170,0,21,23
IndiGo,3/03/2019,Delhi,Cochin,DEL → LKO → COK,05:35,10:10,4h 35m,1 stop,No info,13753,2019-03-03,3,3,6,275,1,5,10
Jet Airways,09/03/2019,Banglore,New Delhi,BLR → BOM → DEL,08:55,21:20,12h 25m,1 stop,In-flight meal not included,11087,2019-03-09,9,3,5,745,1,8,21
Jet Airways,18/05/2019,Kolkata,Banglore,CCU → BOM → BLR,14:05,23:35,9h 30m,1 stop,No info,14781,2019-05-18,18,5,5,570,1,14,23
IndiGo,6/05/2019,Kolkata,Banglore,CCU → BLR,11:30,14:05,2h 35m,non-stop,No info,5224,2019-05-06,6,5,0,155,0,11,14
Jet Airways,6/05/2019,Banglore,Delhi,BLR → DEL,15:15,18:10,2h 55m,non-stop,In-flight meal not included,3702,2019-05-06,6,5,0,175,0,15,18
IndiGo,18/03/2019,Mumbai,Hyderabad,BOM → HYD,19:05,20:30,1h 25m,non-stop,No info,2754,2019-03-18,18,3,0,85,0,19,20
Air Asia,24/05/2019,Banglore,Delhi,BLR → DEL,11:10,13:55,2h 45m,non-stop,No info,3383,2019-05-24,24,5,4,165,0,11,13
Air India,15/04/2019,Banglore,Delhi,BLR → DEL,13:20,16:10,2h 50m,non-stop,No info,5228,2019-04-15,15,4,0,170,0,13,16
IndiGo,27/05/2019,Delhi,Cochin,DEL → BOM → COK,20:25,01:30 28 May,5h 5m,1 stop,No info,5054,2019-05-27,27,5,0,305,1,20,1
Jet Airways,18/03/2019,Banglore,New Delhi,BLR → BOM → DEL,08:55,19:10,10h 15m,1 stop,No info,13555,2019-03-18,18,3,0,615,1,8,19
Multiple carriers,1/06/2019,Delhi,Cochin,DEL → BOM → COK,17:00,01:30 02 Jun,8h 30m,1 stop,No info,7408,2019-06-01,1,6,5,510,1,17,1
IndiGo,24/05/2019,Kolkata,Banglore,CCU → BLR,14:25,16:55,2h 30m,non-stop,No info,5224,2019-05-24,24,5,4,150,0,14,16
IndiGo,01/03/2019,Banglore,New Delhi,BLR → HYD → DEL,12:10,17:05,4h 55m,1 stop,No info,9694,2019-03-01,1,3,4,295,1,12,17
IndiGo,21/03/2019,Delhi,Cochin,DEL → BOM → COK,17:10,01:35 22 Mar,8h 25m,1 stop,No info,7318,2019-03-21,21,3,3,505,1,17,1
IndiGo,21/05/2019,Delhi,Cochin,DEL → HYD → COK,07:35,12:10,4h 35m,1 stop,No info,5054,2019-05-21,21,5,1,275,1,7,12
Jet Airways,1/05/2019,Banglore,Delhi,BLR → DEL,18:55,22:00,3h 5m,non-stop,In-flight meal not included,4030,2019-05-01,1,5,2,185,0,18,22
Jet Airways,06/03/2019,Banglore,New Delhi,BLR → BOM → DEL,08:00,18:25,10h 25m,1 stop,No info,16736,2019-03-06,6,3,2,625,1,8,18
Air India,18/03/2019,Mumbai,Hyderabad,BOM → HYD,19:30,20:45,1h 15m,non-stop,No info,2050,2019-03-18,18,3,0,75,0,19,20
Air India,12/03/2019,Mumbai,Hyderabad,BOM → AMD → ISK → HYD,01:35,14:50,13h 15m,2 stops,No info,9977,2019-03-12,12,3,1,795,2,1,14
Jet Airways,6/06/2019,Delhi,Cochin,DEL → JAI → BOM → COK,05:30,04:25 07 Jun,22h 55m,2 stops,In-flight meal not included,10368,2019-06-06,6,6,3,1375,2,5,4
IndiGo,9/03/2019,Delhi,Cochin,DEL → AMD → COK,07:45,13:40,5h 55m,1 stop,No info,6755,2019-03-09,9,3,5,355,1,7,13
Jet Airways,15/05/2019,Banglore,Delhi,BLR → DEL,15:15,18:10,2h 55m,non-stop,In-flight meal not included,3502,2019-05-15,15,5,2,175,0,15,18
Air India,24/06/2019,Banglore,Delhi,BLR → DEL,10:00,12:45,2h 45m,non-stop,No info,6961,2019-06-24,24,6,0,165,0,10,12
Jet Airways,9/04/2019,Banglore,Delhi,BLR → DEL,15:50,18:45,2h 55m,non-stop,In-flight meal not included,4544,2019-04-09,9,4,1,175,0,15,18
SpiceJet,18/05/2019,Kolkata,Banglore,CCU → BLR,14:55,17:25,2h 30m,non-stop,No check-in baggage included,3841,2019-05-18,18,5,5,150,0,14,17
Jet Airways,6/03/2019,Mumbai,Hyderabad,BOM → DED → DEL → HYD,14:20,16:50 07 Mar,26h 30m,2 stops,No info,24115,2019-03-06,6,3,2,1590,2,14,16
Vistara,24/05/2019,Kolkata,Banglore,CCU → DEL → BLR,07:10,09:05 25 May,25h 55m,1 stop,No info,9502,2019-05-24,24,5,4,1555,1,7,9
Air India,1/04/2019,Mumbai,Hyderabad,BOM → HYD,06:20,07:40,1h 20m,non-stop,No info,3100,2019-04-01,1,4,0,80,0,6,7
SpiceJet,15/04/2019,Banglore,Delhi,BLR → DEL,05:55,08:35,2h 40m,non-stop,No check-in baggage included,4319,2019-04-15,15,4,0,160,0,5,8
IndiGo,1/05/2019,Mumbai,Hyderabad,BOM → HYD,20:05,21:40,1h 35m,non-stop,No info,2227,2019-05-01,1,5,2,95,0,20,21
SpiceJet,24/03/2019,Kolkata,Banglore,CCU → BLR,22:20,00:40 25 Mar,2h 20m,non-stop,No info,5831,2019-03-24,24,3,6,140,0,22,0
IndiGo,9/06/2019,Kolkata,Banglore,CCU → BLR,21:25,00:05 10 Jun,2h 40m,non-stop,No info,4804,2019-06-09,9,6,6,160,0,21,0
IndiGo,6/06/2019,Delhi,Cochin,DEL → HYD → COK,07:35,12:10,4h 35m,1 stop,No info,5458,2019-06-06,6,6,3,275,1,7,12
Jet Airways,9/06/2019,Banglore,Delhi,BLR → DEL,18:55,22:00,3h 5m,non-stop,In-flight meal not included,7229,2019-06-09,9,6,6,185,0,18,22
Jet Airways,6/06/2019,Kolkata,Banglore,CCU → BOM → BLR,18:55,10:05 07 Jun,15h 10m,1 stop,No info,14571,2019-06-06,6,6,3,910,1,18,10
SpiceJet,9/06/2019,Banglore,Delhi,BLR → DEL,21:10,00:05 10 Jun,2h 55m,non-stop,No check-in baggage included,3919,2019-06-09,9,6,6,175,0,21,0
Multiple carriers,9/03/2019,Delhi,Cochin,DEL → HYD → COK,07:05,16:10,9h 5m,1 stop,No info,6916,2019-03-09,9,3,5,545,1,7,16
Jet Airways,27/03/2019,Delhi,Cochin,DEL → BOM → COK,13:00,04:25 28 Mar,15h 25m,1 stop,In-flight meal not included,6960,2019-03-27,27,3,2,925,1,13,4
Jet Airways,06/03/2019,Banglore,New Delhi,BLR → MAA → DEL,09:45,14:25,4h 40m,1 stop,No info,16757,2019-03-06,6,3,2,280,1,9,14
IndiGo,6/03/2019,Delhi,Cochin,DEL → BOM → COK,16:00,01:35 07 Mar,9h 35m,1 stop,No info,14871,2019-03-06,6,3,2,575,1,16,1
IndiGo,12/06/2019,Delhi,Cochin,DEL → HYD → COK,07:35,12:10,4h 35m,1 stop,No info,5054,2019-06-12,12,6,2,275,1,7,12
Air India,3/06/2019,Delhi,Cochin,DEL → LKO → BOM → COK,12:20,19:15 04 Jun,30h 55m,2 stops,No info,12488,2019-06-03,3,6,0,1855,2,12,19
IndiGo,15/04/2019,Banglore,Delhi,BLR → DEL,18:25,21:20,2h 55m,non-stop,No info,4823,2019-04-15,15,4,0,175,0,18,21
Air India,9/03/2019,Delhi,Cochin,DEL → BHO → BOM → COK,05:55,19:15 10 Mar,37h 20m,2 stops,No info,14483,2019-03-09,9,3,5,2240,2,5,19
Air India,24/06/2019,Delhi,Cochin,DEL → HYD → BOM → COK,17:15,19:15 25 Jun,26h,2 stops,No info,11989,2019-06-24,24,6,0,1560,2,17,19
Jet Airways,21/05/2019,Delhi,Cochin,DEL → BOM → COK,22:50,19:00 22 May,20h 10m,1 stop,No info,16079,2019-05-21,21,5,1,1210,1,22,19
Jet Airways,6/05/2019,Kolkata,Banglore,CCU → DEL → BLR,09:35,10:55 07 May,25h 20m,1 stop,No info,13067,2019-05-06,6,5,0,1520,1,9,10
IndiGo,12/06/2019,Delhi,Cochin,DEL → HYD → COK,05:05,16:10,11h 5m,1 stop,No info,6818,2019-06-12,12,6,2,665,1,5,16
Jet Airways,12/05/2019,Kolkata,Banglore,CCU → BOM → BLR,08:25,08:15 13 May,23h 50m,1 stop,No info,13941,2019-05-12,12,5,6,1430,1,8,8
Multiple carriers,24/06/2019,Delhi,Cochin,DEL → BOM → COK,09:00,19:00,10h,1 stop,No info,12927,2019-06-24,24,6,0,600,1,9,19
IndiGo,15/05/2019,Kolkata,Banglore,CCU → BLR,22:15,00:50 16 May,2h 35m,non-stop,No info,4804,2019-05-15,15,5,2,155,0,22,0
Jet Airways,1/04/2019,Delhi,Cochin,DEL → BOM → COK,16:00,12:35 02 Apr,20h 35m,1 stop,In-flight meal not included,5406,2019-04-01,1,4,0,1235,1,16,12
IndiGo,21/03/2019,Delhi,Cochin,DEL → BOM → COK,10:45,01:35 22 Mar,14h 50m,1 stop,No info,7318,2019-03-21,21,3,3,890,1,10,1
IndiGo,21/03/2019,Chennai,Kolkata,MAA → CCU,07:55,10:15,2h 20m,non-stop,No info,3384,2019-03-21,21,3,3,140,0,7,10
Air Asia,3/06/2019,Delhi,Cochin,DEL → BLR → COK,20:45,06:35 04 Jun,9h 50m,1 stop,No info,11410,2019-06-03,3,6,0,590,1,20,6
Jet Airways,15/03/2019,Banglore,New Delhi,BLR → BOM → DEL,05:45,13:15,7h 30m,1 stop,In-flight meal not included,9134,2019-03-15,15,3,4,450,1,5,13
Jet Airways,21/03/2019,Banglore,New Delhi,BLR → BOM → DEL,14:05,21:20,7h 15m,1 stop,In-flight meal not included,7832,2019-03-21,21,3,3,435,1,14,21
Jet Airways,06/03/2019,Banglore,New Delhi,BLR → BOM → DEL,08:55,07:40 07 Mar,22h 45m,1 stop,No info,14815,2019-03-06,6,3,2,1365,1,8,7
IndiGo,3/06/2019,Banglore,Delhi,BLR → DEL,23:30,02:20 04 Jun,2h 50m,non-stop,No info,4591,2019-06-03,3,6,0,170,0,23,2
Jet Airways,9/05/2019,Delhi,Cochin,DEL → BOM → COK,22:50,19:00 10 May,20h 10m,1 stop,In-flight meal not included,12373,2019-05-09,9,5,3,1210,1,22,19
Air Asia,09/03/2019,Banglore,New Delhi,BLR → DEL,05:50,08:40,2h 50m,non-stop,No info,4284,2019-03-09,9,3,5,170,0,5,8
Jet Airways,18/05/2019,Kolkata,Banglore,CCU → BOM → BLR,05:45,04:40 19 May,22h 55m,1 stop,No info,13941,2019-05-18,18,5,5,1375,1,5,4
Jet Airways,9/03/2019,Delhi,Cochin,DEL → BOM → COK,17:25,18:50 10 Mar,25h 25m,1 stop,No info,16289,2019-03-09,9,3,5,1525,1,17,18
IndiGo,24/06/2019,Delhi,Cochin,DEL → PNQ → COK,23:30,04:35 25 Jun,5h 5m,1 stop,No info,9165,2019-06-24,24,6,0,305,1,23,4
Jet Airways,21/06/2019,Banglore,Delhi,BLR → DEL,06:00,08:45,2h 45m,non-stop,No info,8016,2019-06-21,21,6,4,165,0,6,8
Air Asia,1/04/2019,Kolkata,Banglore,CCU → DEL → BLR,22:40,10:40 02 Apr,12h,1 stop,No info,5192,2019-04-01,1,4,0,720,1,22,10
Jet Airways,9/06/2019,Kolkata,Banglore,CCU → BOM → BLR,21:10,08:15 10 Jun,11h 5m,1 stop,No info,14939,2019-06-09,9,6,6,665,1,21,8
Jet Airways,01/03/2019,Banglore,New Delhi,BLR → BOM → DEL,11:40,09:30 02 Mar,21h 50m,1 stop,No info,25735,2019-03-01,1,3,4,1310,1,11,9
Multiple carriers,3/06/2019,Delhi,Cochin,DEL → BOM → COK,10:00,19:00,9h,1 stop,No info,14502,2019-06-03,3,6,0,540,1,10,19
Jet Airways,12/03/2019,Banglore,New Delhi,BLR → BOM → DEL,22:55,12:25 13 Mar,13h 30m,1 stop,No info,13817,2019-03-12,12,3,1,810,1,22,12
Jet Airways,24/05/2019,Kolkata,Banglore,CCU → DEL → BLR,09:35,18:00,8h 25m,1 stop,No info,14151,2019-05-24,24,5,4,505,1,9,18
Multiple carriers,6/03/2019,Delhi,Cochin,DEL → BOM → COK,10:45,19:15,8h 30m,1 stop,No info,15077,2019-03-06,6,3,2,510,1,10,19
Multiple carriers,12/06/2019,Delhi,Cochin,DEL → BOM → COK,09:00,19:00,10h,1 stop,No info,12192,2019-06-12,12,6,2,600,1,9,19
SpiceJet,21/05/2019,Mumbai,Hyderabad,BOM → HYD,13:15,14:45,1h 30m,non-stop,No check-in baggage included,1965,2019-05-21,21,5,1,90,0,13,14
IndiGo,18/05/2019,Chennai,Kolkata,MAA → CCU,07:55,10:15,2h 20m,non-stop,No info,3850,2019-05-18,18,5,5,140,0,7,10
IndiGo,1/06/2019,Mumbai,Hyderabad,BOM → HYD,16:55,18:25,1h 30m,non-stop,No info,3175,2019-06-01,1,6,5,90,0,16,18
Jet Airways,21/05/2019,Banglore,Delhi,BLR → DEL,18:55,22:00,3h 5m,non-stop,No info,7229,2019-05-21,21,5,1,185,0,18,22
Jet Airways,27/05/2019,Delhi,Cochin,DEL → BOM → COK,19:15,19:00 28 May,23h 45m,1 stop,No info,16079,2019-05-27,27,5,0,1425,1,19,19
IndiGo,27/03/2019,Mumbai,Hyderabad,BOM → HYD,09:10,10:40,1h 30m,non-stop,No info,4392,2019-03-27,27,3,2,90,0,9,10
Jet Airways,18/03/2019,Banglore,New Delhi,BLR → BOM → DEL,18:40,00:45 16 Mar,6h 5m,1 stop,No info,54826,2019-03-18,18,3,0,365,1,18,0
Jet Airways,15/06/2019,Delhi,Cochin,DEL → JAI → BOM → COK,09:40,19:00,9h 20m,2 stops,In-flight meal not included,10368,2019-06-15,15,6,5,560,2,9,19
Jet Airways,27/05/2019,Delhi,Cochin,DEL → BOM → COK,22:50,19:00 28 May,20h 10m,1 stop,In-flight meal not included,12898,2019-05-27,27,5,0,1210,1,22,19
Air India,1/05/2019,Kolkata,Banglore,CCU → GAU → DEL → BLR,16:45,12:30 02 May,19h 45m,2 stops,No info,14960,2019-05-01,1,5,2,1185,2,16,12
IndiGo,27/05/2019,Delhi,Cochin,DEL → HYD → COK,08:35,22:30,13h 55m,1 stop,No info,6442,2019-05-27,27,5,0,835,1,8,22
SpiceJet,21/05/2019,Chennai,Kolkata,MAA → CCU,08:20,10:35,2h 15m,non-stop,No info,3597,2019-05-21,21,5,1,135,0,8,10
Jet Airways,6/06/2019,Delhi,Cochin,DEL → JDH → BOM → COK,11:40,19:00,7h 20m,2 stops,No info,18804,2019-06-06,6,6,3,440,2,11,19
Vistara,15/03/2019,Delhi,Cochin,DEL → COK,06:00,09:10,3h 10m,non-stop,No info,6111,2019-03-15,15,3,4,190,0,6,9
IndiGo,9/06/2019,Delhi,Cochin,DEL → COK,21:05,00:20 10 Jun,3h 15m,non-stop,No info,6015,2019-06-09,9,6,6,195,0,21,0
Air India,18/05/2019,Banglore,Delhi,BLR → DEL,13:20,16:10,2h 50m,non-stop,No info,6121,2019-05-18,18,5,5,170,0,13,16
Jet Airways,24/05/2019,Kolkata,Banglore,CCU → GAU → BLR,10:20,17:35,7h 15m,1 stop,In-flight meal not included,6287,2019-05-24,24,5,4,435,1,10,17
Jet Airways,9/05/2019,Banglore,Delhi,BLR → DEL,15:15,18:10,2h 55m,non-stop,No info,7229,2019-05-09,9,5,3,175,0,15,18
IndiGo,12/06/2019,Delhi,Cochin,DEL → HYD → COK,08:35,16:10,7h 35m,1 stop,No info,6442,2019-06-12,12,6,2,455,1,8,16
Jet Airways,27/04/2019,Banglore,Delhi,BLR → DEL,15:15,18:10,2h 55m,non-stop,In-flight meal not included,4544,2019-04-27,27,4,5,175,0,15,18
Air India,12/06/2019,Kolkata,Banglore,CCU → BOM → COK → BLR,09:25,13:45 13 Jun,28h 20m,2 stops,No info,11542,2019-06-12,12,6,2,1700,2,9,13
Jet Airways,21/05/2019,Delhi,Cochin,DEL → BOM → COK,19:45,04:25 22 May,8h 40m,1 stop,No info,16079,2019-05-21,21,5,1,520,1,19,4
Multiple carriers,27/03/2019,Delhi,Cochin,DEL → HYD → COK,07:05,16:10,9h 5m,1 stop,No info,6076,2019-03-27,27,3,2,545,1,7,16
Air India,1/04/2019,Kolkata,Banglore,CCU → DEL → COK → BLR,10:00,01:20 02 Apr,15h 20m,2 stops,No info,10408,2019-04-01,1,4,0,920,2,10,1
Air India,27/03/2019,Delhi,Cochin,DEL → NAG → BOM → COK,05:55,19:15 28 Mar,37h 20m,2 stops,No info,8446,2019-03-27,27,3,2,2240,2,5,19
GoAir,01/03/2019,Banglore,New Delhi,BLR → DEL,07:45,10:40,2h 55m,non-stop,No info,13663,2019-03-01,1,3,4,175,0,7,10
Air India,15/05/2019,Delhi,Cochin,DEL → BLR → COK,20:30,08:15 16 May,11h 45m,1 stop,No info,10671,2019-05-15,15,5,2,705,1,20,8
Air Asia,18/06/2019,Banglore,Delhi,BLR → DEL,23:55,02:45 19 Jun,2h 50m,non-stop,No info,3383,2019-06-18,18,6,1,170,0,23,2
Multiple carriers,9/05/2019,Delhi,Cochin,DEL → BOM → COK,10:20,01:30 10 May,15h 10m,1 stop,No info,9021,2019-05-09,9,5,3,910,1,10,1
Multiple carriers,18/05/2019,Delhi,Cochin,DEL → BOM → COK,09:00,19:15,10h 15m,1 stop,No info,14533,2019-05-18,18,5,5,615,1,9,19
Jet Airways,6/06/2019,Delhi,Cochin,DEL → LKO → BOM → COK,11:45,04:25 07 Jun,16h 40m,2 stops,In-flight meal not included,11992,2019-06-06,6,6,3,1000,2,11,4
IndiGo,12/05/2019,Chennai,Kolkata,MAA → CCU,13:15,15:35,2h 20m,non-stop,No info,3597,2019-05-12,12,5,6,140,0,13,15
IndiGo,9/06/2019,Banglore,Delhi,BLR → DEL,01:30,04:15,2h 45m,non-stop,No info,4077,2019-06-09,9,6,6,165,0,1,4
Multiple carriers,12/06/2019,Delhi,Cochin,DEL → HYD → COK,07:05,16:10,9h 5m,1 stop,No info,9646,2019-06-12,12,6,2,545,1,7,16
SpiceJet,1/04/2019,Kolkata,Banglore,CCU → BLR,22:20,00:40 02 Apr,2h 20m,non-stop,No info,3873,2019-04-01,1,4,0,140,0,22,0
Jet Airways,9/05/2019,Delhi,Cochin,DEL → AMD → BOM → COK,19:10,19:00 10 May,23h 50m,2 stops,No info,15129,2019-05-09,9,5,3,1430,2,19,19
IndiGo,9/06/2019,Delhi,Cochin,DEL → BOM → COK,17:30,01:30 10 Jun,8h,1 stop,No info,6104,2019-06-09,9,6,6,480,1,17,1
Jet Airways,6/03/2019,Delhi,Cochin,DEL → AMD → BOM → COK,19:10,04:25 08 Mar,33h 15m,2 stops,In-flight meal not included,16022,2019-03-06,6,3,2,1995,2,19,4
Jet Airways,09/03/2019,Banglore,New Delhi,BLR → MAA → DEL,09:45,00:30 13 Mar,14h 45m,1 stop,In-flight meal not included,10562,2019-03-09,9,3,5,885,1,9,0
Air India,9/03/2019,Delhi,Cochin,DEL → MAA → COK,06:05,09:25 10 Mar,27h 20m,1 stop,No info,10945,2019-03-09,9,3,5,1640,1,6,9
SpiceJet,27/05/2019,Kolkata,Banglore,CCU → BLR,09:00,11:25,2h 25m,non-stop,No info,3873,2019-05-27,27,5,0,145,0,9,11
Jet Airways,27/03/2019,Mumbai,Hyderabad,BOM → HYD,02:55,04:25,1h 30m,non-stop,In-flight meal not included,1840,2019-03-27,27,3,2,90,0,2,4
IndiGo,3/03/2019,Delhi,Cochin,DEL → HYD → COK,04:55,12:00,7h 5m,1 stop,No info,9585,2019-03-03,3,3,6,425,1,4,12
Jet Airways,18/05/2019,Mumbai,Hyderabad,BOM → HYD,19:35,21:05,1h 30m,non-stop,In-flight meal not included,3210,2019-05-18,18,5,5,90,0,19,21
IndiGo,9/05/2019,Delhi,Cochin,DEL → BLR → COK,15:10,20:00,4h 50m,1 stop,No info,6147,2019-05-09,9,5,3,290,1,15,20
Jet Airways,9/05/2019,Kolkata,Banglore,CCU → DEL → BLR,17:00,23:35,6h 35m,1 stop,In-flight meal not included,7341,2019-05-09,9,5,3,395,1,17,23
Air India,21/05/2019,Delhi,Cochin,DEL → BOM → COK,09:00,19:15,10h 15m,1 stop,No info,8372,2019-05-21,21,5,1,615,1,9,19
Multiple carriers,27/06/2019,Delhi,Cochin,DEL → BOM → COK,07:30,19:00,11h 30m,1 stop,No info,10877,2019-06-27,27,6,3,690,1,7,19
Air India,9/05/2019,Delhi,Cochin,DEL → GOI → BOM → COK,22:00,19:15 10 May,21h 15m,2 stops,No info,10441,2019-05-09,9,5,3,1275,2,22,19
IndiGo,6/03/2019,Delhi,Cochin,DEL → BOM → COK,04:45,21:00,16h 15m,1 stop,No info,13611,2019-03-06,6,3,2,975,1,4,21
Jet Airways,09/03/2019,Banglore,New Delhi,BLR → BOM → DEL,08:55,10:45 13 Mar,25h 50m,1 stop,In-flight meal not included,11087,2019-03-09,9,3,5,1550,1,8,10
Jet Airways,27/03/2019,Delhi,Cochin,DEL → BOM → COK,19:15,19:45 28 Mar,24h 30m,1 stop,In-flight meal not included,5963,2019-03-27,27,3,2,1470,1,19,19
IndiGo,24/05/2019,Chennai,Kolkata,MAA → CCU,13:15,15:35,2h 20m,non-stop,No info,3597,2019-05-24,24,5,4,140,0,13,15
Jet Airways,12/06/2019,Kolkata,Banglore,CCU → BOM → BLR,18:55,10:05 13 Jun,15h 10m,1 stop,In-flight meal not included,8529,2019-06-12,12,6,2,910,1,18,10
Multiple carriers,12/06/2019,Delhi,Cochin,DEL → BOM → COK,04:55,19:00,14h 5m,1 stop,No info,10678,2019-06-12,12,6,2,845,1,4,19
IndiGo,27/03/2019,Delhi,Cochin,DEL → BOM → COK,08:25,21:00,12h 35m,1 stop,No info,8285,2019-03-27,27,3,2,755,1,8,21
Jet Airways,12/06/2019,Delhi,Cochin,DEL → BOM → COK,02:15,12:35,10h 20m,1 stop,No info,18371,2019-06-12,12,6,2,620,1,2,12
Jet Airways,6/06/2019,Kolkata,Banglore,CCU → DEL → BLR,20:25,09:45 07 Jun,13h 20m,1 stop,No info,12692,2019-06-06,6,6,3,800,1,20,9
IndiGo,24/04/2019,Banglore,Delhi,BLR → DEL,06:05,08:50,2h 45m,non-stop,No info,4423,2019-04-24,24,4,2,165,0,6,8
Jet Airways,9/06/2019,Banglore,Delhi,BLR → DEL,19:50,22:50,3h,non-stop,In-flight meal not included,7229,2019-06-09,9,6,6,180,0,19,22
IndiGo,03/03/2019,Banglore,New Delhi,BLR → DEL,23:30,02:20 04 Mar,2h 50m,non-stop,No info,6144,2019-03-03,3,3,6,170,0,23,2
Jet Airways,1/06/2019,Delhi,Cochin,DEL → NAG → BOM → COK,06:45,04:25 02 Jun,21h 40m,2 stops,In-flight meal not included,10919,2019-06-01,1,6,5,1300,2,6,4
IndiGo,27/03/2019,Kolkata,Banglore,CCU → BLR,21:25,00:05 28 Mar,2h 40m,non-stop,No info,4148,2019-03-27,27,3,2,160,0,21,0
SpiceJet,24/03/2019,Banglore,New Delhi,BLR → DEL,20:30,23:20,2h 50m,non-stop,No check-in baggage included,3873,2019-03-24,24,3,6,170,0,20,23
Jet Airways,21/03/2019,Delhi,Cochin,DEL → JAI → BOM → COK,09:40,18:50,9h 10m,2 stops,No info,11702,2019-03-21,21,3,3,550,2,9,18
IndiGo,6/03/2019,Delhi,Cochin,DEL → BOM → COK,17:10,01:35 07 Mar,8h 25m,1 stop,No info,14871,2019-03-06,6,3,2,505,1,17,1
Air India,18/03/2019,Banglore,New Delhi,BLR → BOM → IDR → DEL,06:45,11:10 16 Mar,28h 25m,2 stops,No info,11234,2019-03-18,18,3,0,1705,2,6,11
IndiGo,6/06/2019,Delhi,Cochin,DEL → HYD → COK,14:20,22:30,8h 10m,1 stop,No info,6938,2019-06-06,6,6,3,490,1,14,22
IndiGo,12/06/2019,Delhi,Cochin,DEL → BOM → COK,08:30,21:00,12h 30m,1 stop,No info,6093,2019-06-12,12,6,2,750,1,8,21
IndiGo,15/05/2019,Banglore,Delhi,BLR → DEL,10:10,13:00,2h 50m,non-stop,No info,3943,2019-05-15,15,5,2,170,0,10,13
Jet Airways,6/06/2019,Mumbai,Hyderabad,BOM → HYD,10:20,11:50,1h 30m,non-stop,No info,8040,2019-06-06,6,6,3,90,0,10,11
Jet Airways,9/05/2019,Delhi,Cochin,DEL → AMD → BOM → COK,23:05,12:35 10 May,13h 30m,2 stops,No info,15129,2019-05-09,9,5,3,810,2,23,12
SpiceJet,9/05/2019,Chennai,Kolkata,MAA → CCU,17:45,20:05,2h 20m,non-stop,No info,3597,2019-05-09,9,5,3,140,0,17,20
Vistara,6/05/2019,Kolkata,Banglore,CCU → DEL → BLR,07:10,18:50,11h 40m,1 stop,No info,8610,2019-05-06,6,5,0,700,1,7,18
Jet Airways,1/05/2019,Kolkata,Banglore,CCU → DEL → BLR,17:00,23:35,6h 35m,1 stop,No info,13067,2019-05-01,1,5,2,395,1,17,23
SpiceJet,9/05/2019,Banglore,Delhi,BLR → DEL,09:30,12:20,2h 50m,non-stop,No info,4991,2019-05-09,9,5,3,170,0,9,12
SpiceJet,1/04/2019,Kolkata,Banglore,CCU → MAA → BLR,15:05,20:20,5h 15m,1 stop,No info,4649,2019-04-01,1,4,0,315,1,15,20
SpiceJet,18/05/2019,Chennai,Kolkata,MAA → CCU,08:20,10:35,2h 15m,non-stop,No info,3597,2019-05-18,18,5,5,135,0,8,10
Jet Airways,21/05/2019,Delhi,Cochin,DEL → BOM → COK,08:00,19:00,11h,1 stop,In-flight meal not included,12898,2019-05-21,21,5,1,660,1,8,19
Jet Airways,27/03/2019,Delhi,Cochin,DEL → IXC → BOM → COK,06:20,19:45 28 Mar,37h 25m,2 stops,In-flight meal not included,9296,2019-03-27,27,3,2,2245,2,6,19
IndiGo,03/03/2019,Banglore,New Delhi,BLR → DEL,16:55,19:45,2h 50m,non-stop,No info,8855,2019-03-03,3,3,6,170,0,16,19
Jet Airways,6/06/2019,Delhi,Cochin,DEL → BOM → COK,21:50,19:00 07 Jun,21h 10m,1 stop,In-flight meal not included,10262,2019-06-06,6,6,3,1270,1,21,19
IndiGo,24/06/2019,Banglore,Delhi,BLR → DEL,06:05,08:50,2h 45m,non-stop,No info,3943,2019-06-24,24,6,0,165,0,6,8
Multiple carriers,3/06/2019,Delhi,Cochin,DEL → BOM → COK,12:50,19:15,6h 25m,1 stop,No info,9001,2019-06-03,3,6,0,385,1,12,19
Multiple carriers,18/05/2019,Delhi,Cochin,DEL → BOM → COK,10:20,01:30 19 May,15h 10m,1 stop,No info,7670,2019-05-18,18,5,5,910,1,10,1
Multiple carriers,3/06/2019,Delhi,Cochin,DEL → BOM → COK,17:45,01:30 04 Jun,7h 45m,1 stop,No info,7530,2019-06-03,3,6,0,465,1,17,1
IndiGo,1/05/2019,Kolkata,Banglore,CCU → PAT → BLR,09:20,14:15,4h 55m,1 stop,No info,8443,2019-05-01,1,5,2,295,1,9,14
SpiceJet,1/04/2019,Delhi,Cochin,DEL → MAA → COK,06:05,11:20,5h 15m,1 stop,No info,5351,2019-04-01,1,4,0,315,1,6,11
Vistara,21/03/2019,Delhi,Cochin,DEL → COK,06:00,09:10,3h 10m,non-stop,No info,6688,2019-03-21,21,3,3,190,0,6,9
Jet Airways,12/03/2019,Banglore,New Delhi,BLR → BOM → DEL,20:35,19:10 13 Mar,22h 35m,1 stop,In-flight meal not included,11087,2019-03-12,12,3,1,1355,1,20,19
Air India,15/03/2019,Banglore,New Delhi,BLR → CCU → BBI → DEL,05:50,12:05 16 Mar,30h 15m,2 stops,No info,7664,2019-03-15,15,3,4,1815,2,5,12
IndiGo,15/04/2019,Kolkata,Banglore,CCU → HYD → BLR,15:15,20:30,5h 15m,1 stop,No info,4775,2019-04-15,15,4,0,315,1,15,20
GoAir,27/06/2019,Kolkata,Banglore,CCU → BLR,15:20,17:55,2h 35m,non-stop,No info,3514,2019-06-27,27,6,3,155,0,15,17
Jet Airways,24/06/2019,Delhi,Cochin,DEL → NAG → BOM → COK,06:45,04:25 25 Jun,21h 40m,2 stops,No info,13376,2019-06-24,24,6,0,1300,2,6,4
Jet Airways,12/06/2019,Delhi,Cochin,DEL → ATQ → BOM → COK,08:10,12:35 13 Jun,28h 25m,2 stops,No info,14300,2019-06-12,12,6,2,1705,2,8,12
Air India,27/06/2019,Delhi,Cochin,DEL → MAA → COK,20:40,09:25 28 Jun,12h 45m,1 stop,No info,7480,2019-06-27,27,6,3,765,1,20,9
IndiGo,12/05/2019,Mumbai,Hyderabad,BOM → HYD,21:20,22:50,1h 30m,non-stop,No info,2227,2019-05-12,12,5,6,90,0,21,22
Air Asia,18/05/2019,Delhi,Cochin,DEL → BLR → COK,07:55,22:25,14h 30m,1 stop,No info,7452,2019-05-18,18,5,5,870,1,7,22
Air Asia,24/05/2019,Kolkata,Banglore,CCU → BLR,10:20,12:55,2h 35m,non-stop,No info,4409,2019-05-24,24,5,4,155,0,10,12
Air India,3/04/2019,Kolkata,Banglore,CCU → BBI → HYD → BLR,09:10,11:05 04 Apr,25h 55m,2 stops,No info,4647,2019-04-03,3,4,2,1555,2,9,11
SpiceJet,21/03/2019,Chennai,Kolkata,MAA → CCU,09:30,12:05,2h 35m,non-stop,No check-in baggage included,3332,2019-03-21,21,3,3,155,0,9,12
Air India,27/03/2019,Delhi,Cochin,DEL → BOM → COK,10:00,19:15,9h 15m,1 stop,No info,6902,2019-03-27,27,3,2,555,1,10,19
Air Asia,6/06/2019,Kolkata,Banglore,CCU → BBI → BLR,19:55,23:30,3h 35m,1 stop,No info,6857,2019-06-06,6,6,3,215,1,19,23
Jet Airways,9/05/2019,Delhi,Cochin,DEL → BOM → COK,19:15,04:25 10 May,9h 10m,1 stop,In-flight meal not included,12373,2019-05-09,9,5,3,550,1,19,4
Multiple carriers,15/06/2019,Delhi,Cochin,DEL → BOM → COK,11:40,19:00,7h 20m,1 stop,No info,11789,2019-06-15,15,6,5,440,1,11,19
Air India,9/05/2019,Delhi,Cochin,DEL → HYD → BOM → COK,17:15,07:40 10 May,14h 25m,2 stops,No info,13039,2019-05-09,9,5,3,865,2,17,7
Jet Airways,12/03/2019,Banglore,New Delhi,BLR → BOM → DEL,22:55,11:25 13 Mar,12h 30m,1 stop,In-flight meal not included,11087,2019-03-12,12,3,1,750,1,22,11
Vistara,18/05/2019,Kolkata,Banglore,CCU → DEL → BLR,20:20,23:25 19 May,27h 5m,1 stop,No info,9345,2019-05-18,18,5,5,1625,1,20,23
SpiceJet,24/06/2019,Mumbai,Hyderabad,BOM → HYD,22:45,00:15 25 Jun,1h 30m,non-stop,No check-in baggage included,1965,2019-06-24,24,6,0,90,0,22,0
IndiGo,3/06/2019,Delhi,Cochin,DEL → BOM → COK,07:30,21:00,13h 30m,1 stop,No info,6093,2019-06-03,3,6,0,810,1,7,21
Jet Airways,9/06/2019,Kolkata,Banglore,CCU → BOM → BLR,18:55,08:15 10 Jun,13h 20m,1 stop,In-flight meal not included,11841,2019-06-09,9,6,6,800,1,18,8
Jet Airways,9/05/2019,Kolkata,Banglore,CCU → BOM → BLR,21:10,10:05 10 May,12h 55m,1 stop,In-flight meal not included,9663,2019-05-09,9,5,3,775,1,21,10
Jet Airways,6/06/2019,Delhi,Cochin,DEL → BOM → COK,19:15,19:00 07 Jun,23h 45m,1 stop,No info,14714,2019-06-06,6,6,3,1425,1,19,19
Jet Airways,12/06/2019,Kolkata,Banglore,CCU → BOM → BLR,18:55,22:35 13 Jun,27h 40m,1 stop,In-flight meal not included,8529,2019-06-12,12,6,2,1660,1,18,22
IndiGo,6/04/2019,Delhi,Cochin,DEL → HYD → COK,07:35,12:10,4h 35m,1 stop,No info,5073,2019-04-06,6,4,5,275,1,7,12
Jet Airways,24/04/2019,Banglore,Delhi,BLR → DEL,07:10,10:10,3h,non-stop,No info,7229,2019-04-24,24,4,2,180,0,7,10
Air India,6/06/2019,Delhi,Cochin,DEL → BOM → COK,10:00,19:15,9h 15m,1 stop,No info,9194,2019-06-06,6,6,3,555,1,10,19
Multiple carriers,12/06/2019,Delhi,Cochin,DEL → BOM → COK,11:40,19:00,7h 20m,1 stop,No info,11789,2019-06-12,12,6,2,440,1,11,19
SpiceJet,12/06/2019,Mumbai,Hyderabad,BOM → HYD,13:15,14:45,1h 30m,non-stop,No info,2017,2019-06-12,12,6,2,90,0,13,14
Air India,6/06/2019,Kolkata,Banglore,CCU → VNS → DEL → BLR,14:30,12:30 07 Jun,22h,2 stops,No info,15894,2019-06-06,6,6,3,1320,2,14,12
IndiGo,9/05/2019,Banglore,Delhi,BLR → DEL,01:30,04:15,2h 45m,non-stop,No info,3419,2019-05-09,9,5,3,165,0,1,4
Jet Airways,9/06/2019,Delhi,Cochin,DEL → JAI → BOM → COK,05:30,04:25 10 Jun,22h 55m,2 stops,In-flight meal not included,10368,2019-06-09,9,6,6,1375,2,5,4
IndiGo,24/04/2019,Delhi,Cochin,DEL → BLR → COK,15:10,20:00,4h 50m,1 stop,No info,6027,2019-04-24,24,4,2,290,1,15,20
Air India,18/05/2019,Delhi,Cochin,DEL → MAA → COK,20:40,09:25 19 May,12h 45m,1 stop,No info,7480,2019-05-18,18,5,5,765,1,20,9
SpiceJet,12/06/2019,Kolkata,Banglore,CCU → PNQ → BLR,08:35,17:15,8h 40m,1 stop,No info,7189,2019-06-12,12,6,2,520,1,8,17
Air India,15/03/2019,Banglore,New Delhi,BLR → DEL,10:00,12:45,2h 45m,non-stop,No info,7276,2019-03-15,15,3,4,165,0,10,12
Jet Airways,6/03/2019,Delhi,Cochin,DEL → BOM → COK,11:30,04:25 07 Mar,16h 55m,1 stop,No info,15764,2019-03-06,6,3,2,1015,1,11,4
Jet Airways,6/06/2019,Delhi,Cochin,DEL → BOM → COK,19:15,04:25 07 Jun,9h 10m,1 stop,No info,14714,2019-06-06,6,6,3,550,1,19,4
Multiple carriers,21/05/2019,Delhi,Cochin,DEL → BOM → COK,17:00,01:30 22 May,8h 30m,1 stop,No info,7888,2019-05-21,21,5,1,510,1,17,1
Jet Airways,6/06/2019,Delhi,Cochin,DEL → BOM → COK,08:00,04:25 07 Jun,20h 25m,1 stop,In-flight meal not included,10262,2019-06-06,6,6,3,1225,1,8,4
Jet Airways,18/05/2019,Delhi,Cochin,DEL → ATQ → BOM → COK,20:00,04:25 19 May,8h 25m,2 stops,In-flight meal not included,15318,2019-05-18,18,5,5,505,2,20,4
Jet Airways,1/05/2019,Kolkata,Banglore,CCU → GAU → BLR,10:20,17:35,7h 15m,1 stop,In-flight meal not included,5608,2019-05-01,1,5,2,435,1,10,17
Jet Airways,1/04/2019,Kolkata,Banglore,CCU → BOM → BLR,08:25,18:15,9h 50m,1 stop,No info,12681,2019-04-01,1,4,0,590,1,8,18
Air India,6/03/2019,Delhi,Cochin,DEL → HYD → MAA → COK,17:15,09:25 07 Mar,16h 10m,2 stops,No info,9417,2019-03-06,6,3,2,970,2,17,9
Multiple carriers,3/03/2019,Delhi,Cochin,DEL → BOM → COK,07:05,21:00,13h 55m,1 stop,No info,17057,2019-03-03,3,3,6,835,1,7,21
Multiple carriers,27/03/2019,Delhi,Cochin,DEL → BOM → COK,13:00,21:00,8h,1 stop,No info,12537,2019-03-27,27,3,2,480,1,13,21
Air India,27/05/2019,Delhi,Cochin,DEL → GOI → BOM → COK,22:00,19:15 28 May,21h 15m,2 stops,No info,10651,2019-05-27,27,5,0,1275,2,22,19
Vistara,1/06/2019,Delhi,Cochin,DEL → COK,06:00,09:10,3h 10m,non-stop,No info,6741,2019-06-01,1,6,5,190,0,6,9
Jet Airways,24/05/2019,Kolkata,Banglore,CCU → BOM → BLR,20:00,22:35 25 May,26h 35m,1 stop,In-flight meal not included,10844,2019-05-24,24,5,4,1595,1,20,22
Air India,27/05/2019,Delhi,Cochin,DEL → CCU → BOM → COK,14:25,19:15 28 May,28h 50m,2 stops,No info,13381,2019-05-27,27,5,0,1730,2,14,19
IndiGo,6/04/2019,Banglore,Delhi,BLR → DEL,06:05,08:50,2h 45m,non-stop,No info,4423,2019-04-06,6,4,5,165,0,6,8
Jet Airways,27/05/2019,Mumbai,Hyderabad,BOM → HYD,19:35,21:05,1h 30m,non-stop,No info,5678,2019-05-27,27,5,0,90,0,19,21
Jet Airways,21/05/2019,Delhi,Cochin,DEL → IDR → BOM → COK,09:35,12:35 22 May,27h,2 stops,In-flight meal not included,12719,2019-05-21,21,5,1,1620,2,9,12
IndiGo,1/06/2019,Delhi,Cochin,DEL → HYD → COK,07:35,12:10,4h 35m,1 stop,No info,5054,2019-06-01,1,6,5,275,1,7,12
Air India,24/05/2019,Delhi,Cochin,DEL → MAA → COK,09:45,09:25 25 May,23h 40m,1 stop,No info,7480,2019-05-24,24,5,4,1420,1,9,9
Air India,3/06/2019,Banglore,Delhi,BLR → DEL,17:00,19:45,2h 45m,non-stop,No info,6961,2019-06-03,3,6,0,165,0,17,19
SpiceJet,24/04/2019,Kolkata,Banglore,CCU → BLR,17:10,19:40,2h 30m,non-stop,No check-in baggage included,3841,2019-04-24,24,4,2,150,0,17,19
IndiGo,3/06/2019,Banglore,Delhi,BLR → DEL,21:15,00:15 04 Jun,3h,non-stop,No info,3943,2019-06-03,3,6,0,180,0,21,0
Jet Airways,3/05/2019,Banglore,Delhi,BLR → DEL,08:20,11:20,3h,non-stop,No info,7229,2019-05-03,3,5,4,180,0,8,11
SpiceJet,15/05/2019,Banglore,Delhi,BLR → DEL,09:30,12:20,2h 50m,non-stop,No check-in baggage included,4319,2019-05-15,15,5,2,170,0,9,12
IndiGo,24/04/2019,Banglore,Delhi,BLR → DEL,13:00,15:50,2h 50m,non-stop,No info,4423,2019-04-24,24,4,2,170,0,13,15
Jet Airways,21/05/2019,Delhi,Cochin,DEL → BOM → COK,22:50,04:25 22 May,5h 35m,1 stop,No info,16079,2019-05-21,21,5,1,335,1,22,4
Jet Airways,21/06/2019,Banglore,Delhi,BLR → DEL,19:50,22:50,3h,non-stop,In-flight meal not included,7754,2019-06-21,21,6,4,180,0,19,22
Air India,1/06/2019,Delhi,Cochin,DEL → HYD → MAA → COK,13:15,09:25 02 Jun,20h 10m,2 stops,No info,10467,2019-06-01,1,6,5,1210,2,13,9
Jet Airways,3/06/2019,Delhi,Cochin,DEL → BOM → COK,17:30,12:35 04 Jun,19h 5m,1 stop,No info,14714,2019-06-03,3,6,0,1145,1,17,12
Air India,1/05/2019,Kolkata,Banglore,CCU → GAU → BLR,16:45,21:05 02 May,28h 20m,1 stop,No info,7452,2019-05-01,1,5,2,1700,1,16,21
Air India,21/05/2019,Delhi,Cochin,DEL → UDR → BOM → COK,13:20,19:15 22 May,29h 55m,2 stops,No info,13276,2019-05-21,21,5,1,1795,2,13,19
Air India,01/03/2019,Banglore,New Delhi,BLR → BOM → NAG → DEL,08:50,10:35 02 Mar,25h 45m,2 stops,No info,31783,2019-03-01,1,3,4,1545,2,8,10
Air India,1/05/2019,Chennai,Kolkata,MAA → CCU,11:40,13:55,2h 15m,non-stop,No info,4667,2019-05-01,1,5,2,135,0,11,13
Jet Airways,15/06/2019,Banglore,Delhi,BLR → DEL,15:15,18:10,2h 55m,non-stop,In-flight meal not included,7229,2019-06-15,15,6,5,175,0,15,18
Jet Airways,15/06/2019,Delhi,Cochin,DEL → BDQ → BOM → COK,18:25,12:35 16 Jun,18h 10m,2 stops,No info,14237,2019-06-15,15,6,5,1090,2,18,12
Multiple carriers,15/05/2019,Delhi,Cochin,DEL → BOM → COK,10:20,19:15,8h 55m,1 stop,No info,8266,2019-05-15,15,5,2,535,1,10,19
Jet Airways,24/06/2019,Delhi,Cochin,DEL → LKO → BOM → COK,09:25,04:25 25 Jun,19h,2 stops,No info,13882,2019-06-24,24,6,0,1140,2,9,4
IndiGo,6/05/2019,Banglore,Delhi,BLR → DEL,20:00,22:50,2h 50m,non-stop,No info,4823,2019-05-06,6,5,0,170,0,20,22
Air Asia,24/05/2019,Banglore,Delhi,BLR → DEL,23:55,02:45 25 May,2h 50m,non-stop,No info,4483,2019-05-24,24,5,4,170,0,23,2
Air India,12/06/2019,Banglore,Delhi,BLR → DEL,06:10,08:55,2h 45m,non-stop,No info,6961,2019-06-12,12,6,2,165,0,6,8
Jet Airways,12/05/2019,Kolkata,Banglore,CCU → BOM → BLR,18:55,10:05 13 May,15h 10m,1 stop,In-flight meal not included,9663,2019-05-12,12,5,6,910,1,18,10
Jet Airways,18/05/2019,Delhi,Cochin,DEL → AMD → BOM → COK,23:05,04:25 20 May,29h 20m,2 stops,No info,16704,2019-05-18,18,5,5,1760,2,23,4
IndiGo,12/05/2019,Mumbai,Hyderabad,BOM → HYD,09:10,10:40,1h 30m,non-stop,No info,4049,2019-05-12,12,5,6,90,0,9,10
SpiceJet,24/03/2019,Chennai,Kolkata,MAA → CCU,08:20,10:35,2h 15m,non-stop,No check-in baggage included,3807,2019-03-24,24,3,6,135,0,8,10
IndiGo,9/06/2019,Delhi,Cochin,DEL → HYD → COK,06:50,22:30,15h 40m,1 stop,No info,6442,2019-06-09,9,6,6,940,1,6,22
Jet Airways,15/03/2019,Banglore,New Delhi,BLR → BOM → DEL,07:00,07:40 16 Mar,24h 40m,1 stop,In-flight meal not included,7832,2019-03-15,15,3,4,1480,1,7,7
IndiGo,24/06/2019,Delhi,Cochin,DEL → HYD → COK,08:35,22:30,13h 55m,1 stop,No info,6442,2019-06-24,24,6,0,835,1,8,22
IndiGo,21/04/2019,Banglore,Delhi,BLR → DEL,20:00,22:50,2h 50m,non-stop,No info,4823,2019-04-21,21,4,6,170,0,20,22
Jet Airways,06/03/2019,Banglore,New Delhi,BLR → BOM → DEL,05:45,05:05 07 Mar,23h 20m,1 stop,No info,13555,2019-03-06,6,3,2,1400,1,5,5
GoAir,6/04/2019,Delhi,Cochin,DEL → BOM → COK,10:35,19:35,9h,1 stop,No info,5135,2019-04-06,6,4,5,540,1,10,19
Air Asia,15/05/2019,Banglore,Delhi,BLR → DEL,23:55,02:45 16 May,2h 50m,non-stop,No info,3383,2019-05-15,15,5,2,170,0,23,2
GoAir,15/06/2019,Delhi,Cochin,DEL → AMD → COK,07:25,13:35,6h 10m,1 stop,No info,5842,2019-06-15,15,6,5,370,1,7,13
Jet Airways,18/05/2019,Delhi,Cochin,DEL → AMD → BOM → COK,13:25,04:25 19 May,15h,2 stops,No info,16704,2019-05-18,18,5,5,900,2,13,4
Air India,1/05/2019,Kolkata,Banglore,CCU → BOM → BLR,16:50,07:55 02 May,15h 5m,1 stop,No info,8366,2019-05-01,1,5,2,905,1,16,7
SpiceJet,9/05/2019,Mumbai,Hyderabad,BOM → HYD,05:45,07:15,1h 30m,non-stop,No check-in baggage included,1965,2019-05-09,9,5,3,90,0,5,7
SpiceJet,6/06/2019,Kolkata,Banglore,CCU → BLR,17:10,19:40,2h 30m,non-stop,No info,3873,2019-06-06,6,6,3,150,0,17,19
Jet Airways,01/03/2019,Banglore,New Delhi,BLR → BOM → DEL,08:00,20:20,12h 20m,1 stop,No info,27992,2019-03-01,1,3,4,740,1,8,20
Multiple carriers,6/06/2019,Delhi,Cochin,DEL → BOM → COK,04:55,12:35,7h 40m,1 stop,No info,10678,2019-06-06,6,6,3,460,1,4,12
Air India,21/03/2019,Banglore,New Delhi,BLR → BOM → DEL,08:50,23:15,14h 25m,1 stop,No info,6824,2019-03-21,21,3,3,865,1,8,23
Air India,12/06/2019,Delhi,Cochin,DEL → AMD → BOM → COK,05:00,19:15 13 Jun,38h 15m,2 stops,No info,9443,2019-06-12,12,6,2,2295,2,5,19
Multiple carriers,21/03/2019,Delhi,Cochin,DEL → BOM → COK,07:05,19:15,12h 10m,1 stop,No info,13378,2019-03-21,21,3,3,730,1,7,19
IndiGo,1/05/2019,Banglore,Delhi,BLR → DEL,04:00,06:50,2h 50m,non-stop,No info,3943,2019-05-01,1,5,2,170,0,4,6
IndiGo,18/05/2019,Delhi,Cochin,DEL → BOM → COK,11:25,21:00,9h 35m,1 stop,No info,7191,2019-05-18,18,5,5,575,1,11,21
SpiceJet,27/06/2019,Banglore,Delhi,BLR → DEL,05:55,08:35,2h 40m,non-stop,No info,3625,2019-06-27,27,6,3,160,0,5,8
GoAir,27/05/2019,Delhi,Cochin,DEL → AMD → COK,07:25,13:35,6h 10m,1 stop,No info,6841,2019-05-27,27,5,0,370,1,7,13
Jet Airways,24/03/2019,Kolkata,Banglore,CCU → BOM → BLR,16:55,23:25,6h 30m,1 stop,In-flight meal not included,11134,2019-03-24,24,3,6,390,1,16,23
Jet Airways,6/06/2019,Kolkata,Banglore,CCU → BOM → BLR,18:55,20:45 07 Jun,25h 50m,1 stop,No info,14571,2019-06-06,6,6,3,1550,1,18,20
Air India,01/03/2019,Banglore,New Delhi,BLR → CCU → BBI → HYD → DEL,05:50,12:15 02 Mar,30h 25m,3 stops,No info,12346,2019-03-01,1,3,4,1825,3,5,12
Jet Airways,21/04/2019,Banglore,Delhi,BLR → DEL,17:45,20:45,3h,non-stop,In-flight meal not included,4544,2019-04-21,21,4,6,180,0,17,20
Jet Airways,9/06/2019,Delhi,Cochin,DEL → NAG → BOM → COK,14:35,04:25 10 Jun,13h 50m,2 stops,No info,13376,2019-06-09,9,6,6,830,2,14,4
Jet Airways,12/03/2019,Banglore,New Delhi,BLR → BOM → DEL,18:55,12:25 13 Mar,17h 30m,1 stop,In-flight meal not included,11087,2019-03-12,12,3,1,1050,1,18,12
SpiceJet,3/03/2019,Kolkata,Banglore,CCU → BLR,09:00,11:30,2h 30m,non-stop,No info,5515,2019-03-03,3,3,6,150,0,9,11
IndiGo,27/06/2019,Kolkata,Banglore,CCU → BLR,04:40,07:15,2h 35m,non-stop,No info,4804,2019-06-27,27,6,3,155,0,4,7
IndiGo,12/06/2019,Chennai,Kolkata,MAA → CCU,13:15,15:35,2h 20m,non-stop,No info,3597,2019-06-12,12,6,2,140,0,13,15
Multiple carriers,6/03/2019,Delhi,Cochin,DEL → BOM → COK,06:00,19:15,13h 15m,1 stop,No info,15353,2019-03-06,6,3,2,795,1,6,19
Jet Airways,12/06/2019,Kolkata,Banglore,CCU → BOM → BLR,06:30,16:20,9h 50m,1 stop,In-flight meal not included,9899,2019-06-12,12,6,2,590,1,6,16
IndiGo,24/03/2019,Banglore,New Delhi,BLR → DEL,18:25,21:20,2h 55m,non-stop,No info,7303,2019-03-24,24,3,6,175,0,18,21
Jet Airways,12/03/2019,Banglore,New Delhi,BLR → BOM → DEL,08:55,21:20,12h 25m,1 stop,No info,13817,2019-03-12,12,3,1,745,1,8,21
Jet Airways,6/03/2019,Delhi,Cochin,DEL → AMD → BOM → COK,19:10,19:45 07 Mar,24h 35m,2 stops,No info,19329,2019-03-06,6,3,2,1475,2,19,19
Jet Airways,12/06/2019,Delhi,Cochin,DEL → BOM → COK,07:05,12:35,5h 30m,1 stop,No info,16289,2019-06-12,12,6,2,330,1,7,12
Jet Airways,15/05/2019,Kolkata,Banglore,CCU → BOM → BLR,18:55,10:05 16 May,15h 10m,1 stop,In-flight meal not included,9663,2019-05-15,15,5,2,910,1,18,10
Air India,3/06/2019,Delhi,Cochin,DEL → HYD → MAA → COK,09:45,09:25 04 Jun,23h 40m,2 stops,No info,10975,2019-06-03,3,6,0,1420,2,9,9
Air Asia,18/03/2019,Kolkata,Banglore,CCU → BLR,10:20,12:55,2h 35m,non-stop,No info,4384,2019-03-18,18,3,0,155,0,10,12
Jet Airways,12/06/2019,Delhi,Cochin,DEL → BOM → COK,09:00,19:00,10h,1 stop,No info,14714,2019-06-12,12,6,2,600,1,9,19
Jet Airways,12/06/2019,Delhi,Cochin,DEL → NAG → BOM → COK,14:35,04:25 13 Jun,13h 50m,2 stops,In-flight meal not included,10919,2019-06-12,12,6,2,830,2,14,4
Jet Airways,21/05/2019,Kolkata,Banglore,CCU → BOM → BLR,14:05,04:40 22 May,14h 35m,1 stop,No info,14388,2019-05-21,21,5,1,875,1,14,4
Multiple carriers,15/06/2019,Delhi,Cochin,DEL → BOM → COK,11:25,19:00,7h 35m,1 stop,No info,10877,2019-06-15,15,6,5,455,1,11,19
Jet Airways,9/05/2019,Delhi,Cochin,DEL → AMD → BOM → COK,23:05,12:35 10 May,13h 30m,2 stops,No info,15129,2019-05-09,9,5,3,810,2,23,12
IndiGo,6/05/2019,Delhi,Cochin,DEL → BOM → COK,07:30,21:00,13h 30m,1 stop,No info,7191,2019-05-06,6,5,0,810,1,7,21
GoAir,1/05/2019,Kolkata,Banglore,CCU → BOM → BLR,23:30,07:45 02 May,8h 15m,1 stop,No info,6686,2019-05-01,1,5,2,495,1,23,7
Multiple carriers,3/06/2019,Delhi,Cochin,DEL → BOM → COK,12:50,01:30 04 Jun,12h 40m,1 stop,No info,7530,2019-06-03,3,6,0,760,1,12,1
IndiGo,15/06/2019,Delhi,Cochin,DEL → HYD → COK,07:35,22:30,14h 55m,1 stop,No info,6442,2019-06-15,15,6,5,895,1,7,22
Jet Airways,27/06/2019,Delhi,Cochin,DEL → BOM → COK,09:00,12:35 28 Jun,27h 35m,1 stop,In-flight meal not included,10262,2019-06-27,27,6,3,1655,1,9,12
Jet Airways,12/03/2019,Banglore,New Delhi,BLR → BOM → DEL,18:55,09:30 13 Mar,14h 35m,1 stop,No info,13817,2019-03-12,12,3,1,875,1,18,9
Jet Airways,12/06/2019,Kolkata,Banglore,CCU → BOM → BLR,14:05,23:35,9h 30m,1 stop,No info,13626,2019-06-12,12,6,2,570,1,14,23
Jet Airways,12/05/2019,Kolkata,Banglore,CCU → BOM → BLR,18:55,10:05 13 May,15h 10m,1 stop,No info,14388,2019-05-12,12,5,6,910,1,18,10
IndiGo,27/04/2019,Kolkata,Banglore,CCU → BLR,04:40,07:15,2h 35m,non-stop,No info,4804,2019-04-27,27,4,5,155,0,4,7
IndiGo,21/03/2019,Delhi,Cochin,DEL → COK,14:30,17:35,3h 5m,non-stop,No info,5406,2019-03-21,21,3,3,185,0,14,17
SpiceJet,3/04/2019,Delhi,Cochin,DEL → BLR → COK,17:55,22:50,4h 55m,1 stop,No info,4611,2019-04-03,3,4,2,295,1,17,22
IndiGo,9/06/2019,Kolkata,Banglore,CCU → MAA → BLR,08:10,13:00,4h 50m,1 stop,No info,5069,2019-06-09,9,6,6,290,1,8,13
GoAir,6/06/2019,Banglore,Delhi,BLR → DEL,07:45,10:40,2h 55m,non-stop,No info,3898,2019-06-06,6,6,3,175,0,7,10
IndiGo,6/06/2019,Mumbai,Hyderabad,BOM → HYD,12:00,13:30,1h 30m,non-stop,No info,2754,2019-06-06,6,6,3,90,0,12,13
Multiple carriers,27/05/2019,Delhi,Cochin,DEL → BOM → COK,15:00,01:30 28 May,10h 30m,1 stop,In-flight meal not included,6943,2019-05-27,27,5,0,630,1,15,1
Jet Airways,18/05/2019,Kolkata,Banglore,CCU → BOM → BLR,05:45,18:15,12h 30m,1 stop,No info,14781,2019-05-18,18,5,5,750,1,5,18
Jet Airways,21/05/2019,Delhi,Cochin,DEL → BOM → COK,13:00,19:00,6h,1 stop,No info,16079,2019-05-21,21,5,1,360,1,13,19
IndiGo,15/03/2019,Banglore,New Delhi,BLR → DEL,16:55,19:45,2h 50m,non-stop,No info,8033,2019-03-15,15,3,4,170,0,16,19
IndiGo,09/03/2019,Banglore,New Delhi,BLR → DEL,18:25,21:20,2h 55m,non-stop,No info,6860,2019-03-09,9,3,5,175,0,18,21
Multiple carriers,27/03/2019,Delhi,Cochin,DEL → BOM → COK,11:40,19:15,7h 35m,1 stop,No info,6953,2019-03-27,27,3,2,455,1,11,19
IndiGo,12/05/2019,Banglore,Delhi,BLR → DEL,07:10,10:05,2h 55m,non-stop,No info,4823,2019-05-12,12,5,6,175,0,7,10
IndiGo,9/04/2019,Kolkata,Banglore,CCU → BLR,04:40,07:15,2h 35m,non-stop,No info,4174,2019-04-09,9,4,1,155,0,4,7
Jet Airways,27/06/2019,Delhi,Cochin,DEL → AMD → BOM → COK,13:25,19:00 28 Jun,29h 35m,2 stops,No info,12819,2019-06-27,27,6,3,1775,2,13,19
Jet Airways,15/05/2019,Kolkata,Banglore,CCU → BOM → BLR,21:10,04:40 16 May,7h 30m,1 stop,In-flight meal not included,9663,2019-05-15,15,5,2,450,1,21,4
SpiceJet,3/05/2019,Kolkata,Banglore,CCU → BLR,06:55,09:30,2h 35m,non-stop,No check-in baggage included,3841,2019-05-03,3,5,4,155,0,6,9
IndiGo,27/06/2019,Delhi,Cochin,DEL → COK,05:35,08:50,3h 15m,non-stop,No info,5000,2019-06-27,27,6,3,195,0,5,8
Air India,01/03/2019,Banglore,New Delhi,BLR → CCU → GAU → DEL,05:50,22:10,16h 20m,2 stops,Change airports,13366,2019-03-01,1,3,4,980,2,5,22
Vistara,6/03/2019,Mumbai,Hyderabad,BOM → DEL → HYD,21:55,16:45 07 Mar,18h 50m,1 stop,No info,12395,2019-03-06,6,3,2,1130,1,21,16
Air India,15/05/2019,Kolkata,Banglore,CCU → GAU → BLR,16:45,21:05 16 May,28h 20m,1 stop,No info,7452,2019-05-15,15,5,2,1700,1,16,21
Jet Airways,18/05/2019,Delhi,Cochin,DEL → BOM → COK,19:45,19:00 19 May,23h 15m,1 stop,No info,15554,2019-05-18,18,5,5,1395,1,19,19
Jet Airways,6/05/2019,Kolkata,Banglore,CCU → DEL → BLR,17:00,15:05 07 May,22h 5m,1 stop,No info,13067,2019-05-06,6,5,0,1325,1,17,15
IndiGo,1/03/2019,Kolkata,Banglore,CCU → BLR,15:10,17:45,2h 35m,non-stop,No info,6565,2019-03-01,1,3,4,155,0,15,17
SpiceJet,24/05/2019,Mumbai,Hyderabad,BOM → HYD,05:45,07:15,1h 30m,non-stop,No check-in baggage included,1965,2019-05-24,24,5,4,90,0,5,7
SpiceJet,27/03/2019,Chennai,Kolkata,MAA → CCU,09:30,12:05,2h 35m,non-stop,No check-in baggage included,3332,2019-03-27,27,3,2,155,0,9,12
IndiGo,21/03/2019,Banglore,New Delhi,BLR → LKO → DEL,05:25,10:10,4h 45m,1 stop,No info,6208,2019-03-21,21,3,3,285,1,5,10
Air India,18/03/2019,Banglore,New Delhi,BLR → GAU → DEL,13:50,18:40 16 Mar,28h 50m,1 stop,No info,11161,2019-03-18,18,3,0,1730,1,13,18
Air India,12/06/2019,Kolkata,Banglore,CCU → DEL → COK → BLR,10:00,13:45 13 Jun,27h 45m,2 stops,No info,12224,2019-06-12,12,6,2,1665,2,10,13
Jet Airways,1/05/2019,Kolkata,Banglore,CCU → BOM → BLR,18:55,12:00 02 May,17h 5m,1 stop,In-flight meal not included,9663,2019-05-01,1,5,2,1025,1,18,12
Jet Airways,18/03/2019,Banglore,New Delhi,BLR → BOM → DEL,08:55,15:15,6h 20m,1 stop,No info,12284,2019-03-18,18,3,0,380,1,8,15
Air India,27/05/2019,Delhi,Cochin,DEL → MAA → COK,17:20,09:25 28 May,16h 5m,1 stop,No info,7480,2019-05-27,27,5,0,965,1,17,9
Jet Airways,6/03/2019,Delhi,Cochin,DEL → BOM → COK,19:15,04:25 07 Mar,9h 10m,1 stop,No info,17024,2019-03-06,6,3,2,550,1,19,4
Jet Airways,6/06/2019,Kolkata,Banglore,CCU → DEL → BLR,20:25,19:10 07 Jun,22h 45m,1 stop,No info,14151,2019-06-06,6,6,3,1365,1,20,19
IndiGo,21/06/2019,Kolkata,Banglore,CCU → BLR,17:15,19:50,2h 35m,non-stop,No info,4804,2019-06-21,21,6,4,155,0,17,19
IndiGo,18/05/2019,Delhi,Cochin,DEL → BOM → COK,16:00,21:00,5h,1 stop,No info,6069,2019-05-18,18,5,5,300,1,16,21
Vistara,21/03/2019,Banglore,New Delhi,BLR → AMD → DEL,06:40,21:55,15h 15m,1 stop,No info,6065,2019-03-21,21,3,3,915,1,6,21
Jet Airways,18/05/2019,Kolkata,Banglore,CCU → DEL → BLR,20:25,09:45 19 May,13h 20m,1 stop,No info,14151,2019-05-18,18,5,5,800,1,20,9
Jet Airways,24/03/2019,Kolkata,Banglore,CCU → BOM → BLR,18:55,12:00 25 Mar,17h 5m,1 stop,No info,14231,2019-03-24,24,3,6,1025,1,18,12
Vistara,6/03/2019,Mumbai,Hyderabad,BOM → DEL → HYD,15:40,09:25 07 Mar,17h 45m,1 stop,No info,12395,2019-03-06,6,3,2,1065,1,15,9
IndiGo,24/04/2019,Delhi,Cochin,DEL → MAA → COK,02:00,07:25,5h 25m,1 stop,No info,5636,2019-04-24,24,4,2,325,1,2,7
Air India,6/04/2019,Delhi,Cochin,DEL → BLR → COK,17:40,23:00,5h 20m,1 stop,No info,5232,2019-04-06,6,4,5,320,1,17,23
Jet Airways,1/06/2019,Delhi,Cochin,DEL → BOM → COK,14:00,04:25 02 Jun,14h 25m,1 stop,No info,14714,2019-06-01,1,6,5,865,1,14,4
IndiGo,6/05/2019,Chennai,Kolkata,MAA → CCU,07:55,10:15,2h 20m,non-stop,No info,3850,2019-05-06,6,5,0,140,0,7,10
Air India,27/05/2019,Delhi,Cochin,DEL → BLR → COK,17:40,09:35 28 May,15h 55m,1 stop,No info,7258,2019-05-27,27,5,0,955,1,17,9
Jet Airways,06/03/2019,Banglore,New Delhi,BLR → BOM → DEL,21:25,20:20 07 Mar,22h 55m,1 stop,No info,17471,2019-03-06,6,3,2,1375,1,21,20
SpiceJet,9/05/2019,Banglore,Delhi,BLR → DEL,21:10,00:05 10 May,2h 55m,non-stop,No info,4423,2019-05-09,9,5,3,175,0,21,0
IndiGo,18/06/2019,Mumbai,Hyderabad,BOM → HYD,21:20,22:50,1h 30m,non-stop,No info,2227,2019-06-18,18,6,1,90,0,21,22
Multiple carriers,24/06/2019,Delhi,Cochin,DEL → BOM → COK,10:00,01:30 25 Jun,15h 30m,1 stop,No info,13377,2019-06-24,24,6,0,930,1,10,1
Jet Airways,12/06/2019,Banglore,Delhi,BLR → DEL,08:20,11:20,3h,non-stop,No info,8016,2019-06-12,12,6,2,180,0,8,11
Air India,09/03/2019,Banglore,New Delhi,BLR → HYD → DEL,06:50,08:50 13 Mar,26h,1 stop,No info,5626,2019-03-09,9,3,5,1560,1,6,8
IndiGo,21/03/2019,Banglore,New Delhi,BLR → DEL,16:55,19:45,2h 50m,non-stop,No info,6860,2019-03-21,21,3,3,170,0,16,19
IndiGo,1/06/2019,Delhi,Cochin,DEL → BOM → COK,18:35,01:30 02 Jun,6h 55m,1 stop,No info,6628,2019-06-01,1,6,5,415,1,18,1
Jet Airways,6/06/2019,Delhi,Cochin,DEL → BOM → COK,13:00,12:35 07 Jun,23h 35m,1 stop,In-flight meal not included,11627,2019-06-06,6,6,3,1415,1,13,12
SpiceJet,9/06/2019,Kolkata,Banglore,CCU → BLR,17:10,19:40,2h 30m,non-stop,No info,4174,2019-06-09,9,6,6,150,0,17,19
Jet Airways,1/06/2019,Delhi,Cochin,DEL → BOM → COK,18:15,04:25 02 Jun,10h 10m,1 stop,No info,14714,2019-06-01,1,6,5,610,1,18,4
Jet Airways,12/05/2019,Kolkata,Banglore,CCU → DEL → BLR,09:35,21:05,11h 30m,1 stop,No info,14151,2019-05-12,12,5,6,690,1,9,21
Jet Airways,27/05/2019,Delhi,Cochin,DEL → BOM → COK,16:00,19:00 28 May,27h,1 stop,In-flight meal not included,12898,2019-05-27,27,5,0,1620,1,16,19
Jet Airways,18/05/2019,Delhi,Cochin,DEL → BOM → COK,21:50,04:25 19 May,6h 35m,1 stop,In-flight meal not included,12373,2019-05-18,18,5,5,395,1,21,4
IndiGo,18/06/2019,Banglore,Delhi,BLR → DEL,10:10,13:00,2h 50m,non-stop,No info,3943,2019-06-18,18,6,1,170,0,10,13
Air Asia,9/06/2019,Kolkata,Banglore,CCU → IXR → DEL → BLR,15:10,23:30,8h 20m,2 stops,No info,7870,2019-06-09,9,6,6,500,2,15,23
Jet Airways,18/06/2019,Banglore,Delhi,BLR → DEL,18:55,22:00,3h 5m,non-stop,No info,8016,2019-06-18,18,6,1,185,0,18,22
Air India,15/05/2019,Delhi,Cochin,DEL → HYD → MAA → COK,13:05,09:25 16 May,20h 20m,2 stops,No info,10975,2019-05-15,15,5,2,1220,2,13,9
IndiGo,27/05/2019,Chennai,Kolkata,MAA → CCU,07:55,10:15,2h 20m,non-stop,No info,3850,2019-05-27,27,5,0,140,0,7,10
IndiGo,18/06/2019,Kolkata,Banglore,CCU → BLR,20:25,23:10,2h 45m,non-stop,No info,4804,2019-06-18,18,6,1,165,0,20,23
Jet Airways,9/03/2019,Delhi,Cochin,DEL → BOM → COK,20:50,04:25 10 Mar,7h 35m,1 stop,No info,15554,2019-03-09,9,3,5,455,1,20,4
SpiceJet,18/03/2019,Kolkata,Banglore,CCU → BLR,06:55,09:35,2h 40m,non-stop,No info,4465,2019-03-18,18,3,0,160,0,6,9
Jet Airways,9/06/2019,Kolkata,Banglore,CCU → BOM → BLR,21:10,10:05 10 Jun,12h 55m,1 stop,In-flight meal not included,11841,2019-06-09,9,6,6,775,1,21,10
Multiple carriers,9/03/2019,Delhi,Cochin,DEL → BOM → COK,08:00,19:15,11h 15m,1 stop,No info,19332,2019-03-09,9,3,5,675,1,8,19
SpiceJet,21/06/2019,Kolkata,Banglore,CCU → BLR,17:10,19:40,2h 30m,non-stop,No check-in baggage included,3841,2019-06-21,21,6,4,150,0,17,19
IndiGo,12/04/2019,Banglore,Delhi,BLR → DEL,10:10,13:00,2h 50m,non-stop,No info,4591,2019-04-12,12,4,4,170,0,10,13
IndiGo,24/05/2019,Kolkata,Banglore,CCU → HYD → BLR,15:15,20:05,4h 50m,1 stop,No info,5192,2019-05-24,24,5,4,290,1,15,20
Jet Airways,9/06/2019,Delhi,Cochin,DEL → BOM → COK,18:15,12:35 10 Jun,18h 20m,1 stop,In-flight meal not included,10577,2019-06-09,9,6,6,1100,1,18,12
Jet Airways,18/05/2019,Delhi,Cochin,DEL → JAI → BOM → COK,19:30,04:25 19 May,8h 55m,2 stops,No info,15129,2019-05-18,18,5,5,535,2,19,4
Multiple carriers,6/06/2019,Delhi,Cochin,DEL → BOM → COK,06:00,19:00,13h,1 stop,No info,11789,2019-06-06,6,6,3,780,1,6,19
Air India,15/06/2019,Delhi,Cochin,DEL → BOM → COK,21:00,07:40 16 Jun,10h 40m,1 stop,No info,8372,2019-06-15,15,6,5,640,1,21,7
Multiple carriers,9/05/2019,Delhi,Cochin,DEL → BOM → COK,06:00,19:15,13h 15m,1 stop,No info,8266,2019-05-09,9,5,3,795,1,6,19
Jet Airways,6/05/2019,Kolkata,Banglore,CCU → BOM → BLR,06:30,19:50,13h 20m,1 stop,No info,14781,2019-05-06,6,5,0,800,1,6,19
Vistara,21/04/2019,Banglore,Delhi,BLR → DEL,17:00,19:35,2h 35m,non-stop,No info,5613,2019-04-21,21,4,6,155,0,17,19
Jet Airways,24/04/2019,Banglore,Delhi,BLR → DEL,15:15,18:10,2h 55m,non-stop,No info,7229,2019-04-24,24,4,2,175,0,15,18
IndiGo,24/06/2019,Delhi,Cochin,DEL → BOM → COK,08:30,21:00,12h 30m,1 stop,No info,6093,2019-06-24,24,6,0,750,1,8,21
Jet Airways,21/05/2019,Delhi,Cochin,DEL → BHO → BOM → COK,05:30,12:35,7h 5m,2 stops,In-flight meal not included,15544,2019-05-21,21,5,1,425,2,5,12
GoAir,18/05/2019,Delhi,Cochin,DEL → AMD → COK,07:25,13:35,6h 10m,1 stop,No info,6296,2019-05-18,18,5,5,370,1,7,13
IndiGo,27/04/2019,Kolkata,Banglore,CCU → BLR,09:35,12:20,2h 45m,non-stop,No info,4804,2019-04-27,27,4,5,165,0,9,12
Air Asia,18/03/2019,Banglore,New Delhi,BLR → DEL,05:50,08:40,2h 50m,non-stop,No info,4284,2019-03-18,18,3,0,170,0,5,8
IndiGo,21/03/2019,Delhi,Cochin,DEL → HYD → COK,07:35,22:20,14h 45m,1 stop,No info,6558,2019-03-21,21,3,3,885,1,7,22
IndiGo,24/06/2019,Delhi,Cochin,DEL → LKO → COK,21:50,03:35 25 Jun,5h 45m,1 stop,No info,5775,2019-06-24,24,6,0,345,1,21,3
SpiceJet,21/06/2019,Chennai,Kolkata,MAA → CCU,08:20,10:35,2h 15m,non-stop,No check-in baggage included,3543,2019-06-21,21,6,4,135,0,8,10
Jet Airways,6/03/2019,Delhi,Cochin,DEL → BOM → COK,09:55,18:50,8h 55m,1 stop,No info,17024,2019-03-06,6,3,2,535,1,9,18
Jet Airways,9/06/2019,Mumbai,Hyderabad,BOM → HYD,07:05,08:30,1h 25m,non-stop,In-flight meal not included,4050,2019-06-09,9,6,6,85,0,7,8
Air India,6/03/2019,Mumbai,Hyderabad,BOM → BHO → DEL → HYD,06:00,15:15 07 Mar,33h 15m,2 stops,No info,14219,2019-03-06,6,3,2,1995,2,6,15
Jet Airways,01/03/2019,Banglore,New Delhi,BLR → BOM → DEL,11:40,18:25,6h 45m,1 stop,No info,26890,2019-03-01,1,3,4,405,1,11,18
Air India,15/06/2019,Delhi,Cochin,DEL → AMD → BOM → COK,19:45,19:15 16 Jun,23h 30m,2 stops,No info,9653,2019-06-15,15,6,5,1410,2,19,19
IndiGo,21/06/2019,Banglore,Delhi,BLR → DEL,06:05,08:50,2h 45m,non-stop,No info,3943,2019-06-21,21,6,4,165,0,6,8
Jet Airways,18/05/2019,Kolkata,Banglore,CCU → BOM → BLR,14:05,16:20 19 May,26h 15m,1 stop,In-flight meal not included,10844,2019-05-18,18,5,5,1575,1,14,16
Jet Airways,1/04/2019,Kolkata,Banglore,CCU → BOM → BLR,21:10,04:40 02 Apr,7h 30m,1 stop,In-flight meal not included,8849,2019-04-01,1,4,0,450,1,21,4
IndiGo,12/06/2019,Mumbai,Hyderabad,BOM → HYD,01:40,03:10,1h 30m,non-stop,No info,2754,2019-06-12,12,6,2,90,0,1,3
Air India,21/03/2019,Delhi,Cochin,DEL → CCU → BOM → COK,06:50,19:15 22 Mar,36h 25m,2 stops,No info,10756,2019-03-21,21,3,3,2185,2,6,19
Jet Airways,21/05/2019,Kolkata,Banglore,CCU → DEL → BLR,17:00,21:05 22 May,28h 5m,1 stop,No info,14151,2019-05-21,21,5,1,1685,1,17,21
Jet Airways,12/06/2019,Kolkata,Banglore,CCU → BOM → BLR,08:25,20:45,12h 20m,1 stop,In-flight meal not included,9899,2019-06-12,12,6,2,740,1,8,20
Jet Airways,21/03/2019,Delhi,Cochin,DEL → BOM → COK,22:00,04:25 22 Mar,6h 25m,1 stop,No info,12242,2019-03-21,21,3,3,385,1,22,4
Jet Airways,9/06/2019,Delhi,Cochin,DEL → JAI → BOM → COK,19:30,12:35 10 Jun,17h 5m,2 stops,In-flight meal not included,10368,2019-06-09,9,6,6,1025,2,19,12
IndiGo,24/05/2019,Mumbai,Hyderabad,BOM → HYD,09:10,10:40,1h 30m,non-stop,No info,5755,2019-05-24,24,5,4,90,0,9,10
Jet Airways,15/06/2019,Delhi,Cochin,DEL → BOM → COK,18:15,04:25 16 Jun,10h 10m,1 stop,In-flight meal not included,10262,2019-06-15,15,6,5,610,1,18,4
SpiceJet,6/06/2019,Kolkata,Banglore,CCU → PNQ → BLR,08:35,17:15,8h 40m,1 stop,No info,6643,2019-06-06,6,6,3,520,1,8,17
Multiple carriers Premium economy,21/03/2019,Delhi,Cochin,DEL → BOM → COK,07:30,21:00,13h 30m,1 stop,No info,9845,2019-03-21,21,3,3,810,1,7,21
Jet Airways,24/03/2019,Kolkata,Banglore,CCU → BOM → BLR,18:55,12:00 25 Mar,17h 5m,1 stop,In-flight meal not included,11134,2019-03-24,24,3,6,1025,1,18,12
SpiceJet,1/06/2019,Delhi,Cochin,DEL → MAA → COK,06:05,11:20,5h 15m,1 stop,No info,5583,2019-06-01,1,6,5,315,1,6,11
IndiGo,15/05/2019,Delhi,Cochin,DEL → BOM → COK,16:00,21:00,5h,1 stop,No info,6069,2019-05-15,15,5,2,300,1,16,21
Jet Airways,12/03/2019,Banglore,New Delhi,BLR → BOM → DEL,05:45,20:20,14h 35m,1 stop,No info,13817,2019-03-12,12,3,1,875,1,5,20
Air India,6/03/2019,Delhi,Cochin,DEL → AMD → BOM → COK,05:00,19:15 07 Mar,38h 15m,2 stops,No info,10283,2019-03-06,6,3,2,2295,2,5,19
Air India,24/03/2019,Kolkata,Banglore,CCU → GAU → BLR,09:50,21:05,11h 15m,1 stop,No info,7795,2019-03-24,24,3,6,675,1,9,21
Multiple carriers,9/03/2019,Delhi,Cochin,DEL → BOM → COK,00:20,07:40,7h 20m,1 stop,In-flight meal not included,13977,2019-03-09,9,3,5,440,1,0,7
Jet Airways,1/06/2019,Delhi,Cochin,DEL → NAG → BOM → COK,06:45,04:25 02 Jun,21h 40m,2 stops,In-flight meal not included,10919,2019-06-01,1,6,5,1300,2,6,4
IndiGo,3/03/2019,Kolkata,Banglore,CCU → BLR,20:25,23:05,2h 40m,non-stop,No info,6038,2019-03-03,3,3,6,160,0,20,23
IndiGo,21/05/2019,Delhi,Cochin,DEL → COK,05:35,08:50,3h 15m,non-stop,No info,5601,2019-05-21,21,5,1,195,0,5,8
IndiGo,9/03/2019,Delhi,Cochin,DEL → BOM → COK,07:30,21:00,13h 30m,1 stop,No info,12351,2019-03-09,9,3,5,810,1,7,21
Air India,15/04/2019,Delhi,Cochin,DEL → COK,05:10,08:00,2h 50m,non-stop,No info,6094,2019-04-15,15,4,0,170,0,5,8
Multiple carriers,15/05/2019,Delhi,Cochin,DEL → BOM → COK,10:35,19:15,8h 40m,1 stop,No info,7575,2019-05-15,15,5,2,520,1,10,19
Jet Airways,27/05/2019,Delhi,Cochin,DEL → BOM → COK,21:50,04:25 28 May,6h 35m,1 stop,No info,16079,2019-05-27,27,5,0,395,1,21,4
Jet Airways,15/06/2019,Delhi,Cochin,DEL → BOM → COK,19:15,19:00 16 Jun,23h 45m,1 stop,In-flight meal not included,10262,2019-06-15,15,6,5,1425,1,19,19
Air Asia,9/06/2019,Delhi,Cochin,DEL → BLR → COK,16:45,22:25,5h 40m,1 stop,No info,13470,2019-06-09,9,6,6,340,1,16,22
Jet Airways,27/06/2019,Banglore,Delhi,BLR → DEL,11:10,14:05,2h 55m,non-stop,No info,8016,2019-06-27,27,6,3,175,0,11,14
Jet Airways,9/03/2019,Delhi,Cochin,DEL → BOM → COK,18:15,18:50 10 Mar,24h 35m,1 stop,No info,16289,2019-03-09,9,3,5,1475,1,18,18
Jet Airways,6/06/2019,Delhi,Cochin,DEL → BOM → COK,19:45,04:25 07 Jun,8h 40m,1 stop,In-flight meal not included,10262,2019-06-06,6,6,3,520,1,19,4
IndiGo,27/06/2019,Banglore,Delhi,BLR → DEL,18:25,21:20,2h 55m,non-stop,No info,4823,2019-06-27,27,6,3,175,0,18,21
Vistara,9/04/2019,Banglore,Delhi,BLR → DEL,09:45,12:35,2h 50m,non-stop,No info,5403,2019-04-09,9,4,1,170,0,9,12
Jet Airways,18/05/2019,Delhi,Cochin,DEL → BOM → COK,17:30,19:00 19 May,25h 30m,1 stop,In-flight meal not included,12373,2019-05-18,18,5,5,1530,1,17,19
SpiceJet,6/03/2019,Mumbai,Hyderabad,BOM → JLR → HYD,14:10,22:25,8h 15m,1 stop,No info,13552,2019-03-06,6,3,2,495,1,14,22
Jet Airways,9/05/2019,Kolkata,Banglore,CCU → BOM → BLR,08:25,20:45,12h 20m,1 stop,In-flight meal not included,10844,2019-05-09,9,5,3,740,1,8,20
Air India,6/03/2019,Mumbai,Hyderabad,BOM → JDH → DEL → HYD,09:40,23:45,14h 5m,2 stops,No info,22619,2019-03-06,6,3,2,845,2,9,23
Multiple carriers,27/05/2019,Delhi,Cochin,DEL → BOM → COK,10:35,19:15,8h 40m,1 stop,No info,8625,2019-05-27,27,5,0,520,1,10,19
IndiGo,24/03/2019,Banglore,New Delhi,BLR → DEL,06:00,08:45,2h 45m,non-stop,No info,4777,2019-03-24,24,3,6,165,0,6,8
IndiGo,21/06/2019,Delhi,Cochin,DEL → COK,05:35,08:50,3h 15m,non-stop,No info,5000,2019-06-21,21,6,4,195,0,5,8
Jet Airways,6/03/2019,Delhi,Cochin,DEL → AMD → BOM → COK,19:10,19:45 07 Mar,24h 35m,2 stops,No info,21954,2019-03-06,6,3,2,1475,2,19,19
Jet Airways,3/06/2019,Delhi,Cochin,DEL → BOM → COK,11:30,04:25 04 Jun,16h 55m,1 stop,In-flight meal not included,11627,2019-06-03,3,6,0,1015,1,11,4
Jet Airways,24/05/2019,Kolkata,Banglore,CCU → BOM → BLR,14:05,04:40 25 May,14h 35m,1 stop,No info,13731,2019-05-24,24,5,4,875,1,14,4
IndiGo,3/04/2019,Banglore,Delhi,BLR → DEL,22:10,01:00 04 Apr,2h 50m,non-stop,No info,3943,2019-04-03,3,4,2,170,0,22,1
Jet Airways,21/03/2019,Banglore,New Delhi,BLR → BOM → DEL,08:55,23:00,14h 5m,1 stop,In-flight meal not included,6992,2019-03-21,21,3,3,845,1,8,23
Jet Airways,6/05/2019,Kolkata,Banglore,CCU → BOM → BLR,18:55,04:40 07 May,9h 45m,1 stop,No info,13941,2019-05-06,6,5,0,585,1,18,4
Jet Airways,12/06/2019,Delhi,Cochin,DEL → BOM → COK,08:00,19:00,11h,1 stop,No info,14924,2019-06-12,12,6,2,660,1,8,19
Jet Airways,27/06/2019,Delhi,Cochin,DEL → BOM → COK,02:15,12:35,10h 20m,1 stop,No info,18371,2019-06-27,27,6,3,620,1,2,12
IndiGo,3/03/2019,Chennai,Kolkata,MAA → CCU,19:35,21:55,2h 20m,non-stop,No info,7295,2019-03-03,3,3,6,140,0,19,21
Air India,09/03/2019,Banglore,New Delhi,BLR → GOI → DEL,17:00,16:40 13 Mar,23h 40m,1 stop,No info,9292,2019-03-09,9,3,5,1420,1,17,16
Jet Airways,1/05/2019,Kolkata,Banglore,CCU → BOM → BLR,20:00,08:15 02 May,12h 15m,1 stop,No info,13941,2019-05-01,1,5,2,735,1,20,8
IndiGo,24/03/2019,Kolkata,Banglore,CCU → HYD → BLR,04:15,09:50,5h 35m,1 stop,No info,4150,2019-03-24,24,3,6,335,1,4,9
Jet Airways,1/04/2019,Kolkata,Banglore,CCU → BOM → BLR,20:00,23:35 02 Apr,27h 35m,1 stop,No info,12681,2019-04-01,1,4,0,1655,1,20,23
IndiGo,3/06/2019,Delhi,Cochin,DEL → COK,05:35,08:50,3h 15m,non-stop,No info,5601,2019-06-03,3,6,0,195,0,5,8
Air India,21/05/2019,Kolkata,Banglore,CCU → GAU → DEL → BLR,09:50,08:55 22 May,23h 5m,2 stops,No info,14960,2019-05-21,21,5,1,1385,2,9,8
Multiple carriers,6/06/2019,Delhi,Cochin,DEL → BOM → COK,16:00,01:30 07 Jun,9h 30m,1 stop,No info,13377,2019-06-06,6,6,3,570,1,16,1
IndiGo,21/03/2019,Mumbai,Hyderabad,BOM → HYD,12:00,13:25,1h 25m,non-stop,No info,3342,2019-03-21,21,3,3,85,0,12,13
Jet Airways,6/06/2019,Banglore,Delhi,BLR → DEL,11:10,14:05,2h 55m,non-stop,No info,8016,2019-06-06,6,6,3,175,0,11,14
Jet Airways,06/03/2019,Banglore,New Delhi,BLR → BOM → DEL,05:45,23:00,17h 15m,1 stop,No info,16736,2019-03-06,6,3,2,1035,1,5,23
Jet Airways,24/03/2019,Kolkata,Banglore,CCU → BOM → BLR,21:10,19:40 25 Mar,22h 30m,1 stop,In-flight meal not included,10031,2019-03-24,24,3,6,1350,1,21,19
Air India,21/04/2019,Delhi,Cochin,DEL → BLR → COK,20:30,08:15 22 Apr,11h 45m,1 stop,No info,7258,2019-04-21,21,4,6,705,1,20,8
Jet Airways,15/05/2019,Banglore,Delhi,BLR → DEL,06:00,08:45,2h 45m,non-stop,In-flight meal not included,4030,2019-05-15,15,5,2,165,0,6,8
Air India,24/06/2019,Delhi,Cochin,DEL → CCU → BOM → COK,14:25,19:15 25 Jun,28h 50m,2 stops,No info,13381,2019-06-24,24,6,0,1730,2,14,19
Jet Airways,24/05/2019,Delhi,Cochin,DEL → AMD → BOM → COK,23:05,04:25 26 May,29h 20m,2 stops,No info,16704,2019-05-24,24,5,4,1760,2,23,4
Multiple carriers,24/06/2019,Delhi,Cochin,DEL → BOM → COK,09:00,21:00,12h,1 stop,No info,13587,2019-06-24,24,6,0,720,1,9,21
Jet Airways,24/05/2019,Mumbai,Hyderabad,BOM → HYD,02:55,04:20,1h 25m,non-stop,No info,5678,2019-05-24,24,5,4,85,0,2,4
Jet Airways,1/04/2019,Kolkata,Banglore,CCU → BOM → BLR,06:30,09:20 02 Apr,26h 50m,1 stop,In-flight meal not included,7064,2019-04-01,1,4,0,1610,1,6,9
IndiGo,3/06/2019,Mumbai,Hyderabad,BOM → HYD,01:40,03:10,1h 30m,non-stop,No info,2754,2019-06-03,3,6,0,90,0,1,3
Vistara,1/05/2019,Banglore,Delhi,BLR → DEL,09:45,12:35,2h 50m,non-stop,No info,4668,2019-05-01,1,5,2,170,0,9,12
Air Asia,21/06/2019,Kolkata,Banglore,CCU → BLR,19:55,22:25,2h 30m,non-stop,No info,4107,2019-06-21,21,6,4,150,0,19,22
IndiGo,12/06/2019,Delhi,Cochin,DEL → BOM → COK,04:55,21:00,16h 5m,1 stop,No info,5894,2019-06-12,12,6,2,965,1,4,21
Jet Airways,6/06/2019,Delhi,Cochin,DEL → BOM → COK,17:30,04:25 07 Jun,10h 55m,1 stop,In-flight meal not included,10262,2019-06-06,6,6,3,655,1,17,4
Jet Airways,9/05/2019,Kolkata,Banglore,CCU → BOM → BLR,16:30,08:15 10 May,15h 45m,1 stop,No info,13941,2019-05-09,9,5,3,945,1,16,8
Air Asia,27/04/2019,Delhi,Cochin,DEL → BLR → COK,16:45,07:10 28 Apr,14h 25m,1 stop,No info,6451,2019-04-27,27,4,5,865,1,16,7
Air India,27/06/2019,Delhi,Cochin,DEL → HYD → MAA → COK,09:45,09:25 28 Jun,23h 40m,2 stops,No info,10975,2019-06-27,27,6,3,1420,2,9,9
Air India,6/03/2019,Delhi,Cochin,DEL → JAI → BOM → COK,12:00,07:40 07 Mar,19h 40m,2 stops,No info,14746,2019-03-06,6,3,2,1180,2,12,7
Air Asia,6/06/2019,Delhi,Cochin,DEL → BLR → COK,20:45,07:10 07 Jun,10h 25m,1 stop,No info,11410,2019-06-06,6,6,3,625,1,20,7
SpiceJet,1/05/2019,Kolkata,Banglore,CCU → BLR,06:55,09:30,2h 35m,non-stop,No check-in baggage included,3841,2019-05-01,1,5,2,155,0,6,9
Air India,3/06/2019,Delhi,Cochin,DEL → CCU → BOM → COK,06:50,07:40 04 Jun,24h 50m,2 stops,No info,13381,2019-06-03,3,6,0,1490,2,6,7
Multiple carriers,9/05/2019,Delhi,Cochin,DEL → BOM → COK,11:30,01:30 10 May,14h,1 stop,No info,15078,2019-05-09,9,5,3,840,1,11,1
Air India,9/05/2019,Kolkata,Banglore,CCU → BOM → BLR,09:25,18:30,9h 5m,1 stop,No info,8891,2019-05-09,9,5,3,545,1,9,18
Jet Airways,9/05/2019,Kolkata,Banglore,CCU → BOM → BLR,14:05,10:05 10 May,20h,1 stop,In-flight meal not included,7757,2019-05-09,9,5,3,1200,1,14,10
Air India,9/04/2019,Banglore,Delhi,BLR → DEL,05:45,08:45,3h,non-stop,No info,4441,2019-04-09,9,4,1,180,0,5,8
Jet Airways,24/03/2019,Kolkata,Banglore,CCU → BOM → BLR,19:45,18:10 25 Mar,22h 25m,1 stop,In-flight meal not included,10031,2019-03-24,24,3,6,1345,1,19,18
IndiGo,12/04/2019,Banglore,Delhi,BLR → DEL,13:00,15:50,2h 50m,non-stop,No info,4823,2019-04-12,12,4,4,170,0,13,15
Air India,24/05/2019,Kolkata,Banglore,CCU → BOM → BLR,09:25,18:30,9h 5m,1 stop,No info,8576,2019-05-24,24,5,4,545,1,9,18
Jet Airways,12/03/2019,Banglore,New Delhi,BLR → BOM → DEL,20:35,16:10 13 Mar,19h 35m,1 stop,In-flight meal not included,11087,2019-03-12,12,3,1,1175,1,20,16
Jet Airways,18/05/2019,Delhi,Cochin,DEL → BOM → COK,10:00,12:35 19 May,26h 35m,1 stop,In-flight meal not included,12373,2019-05-18,18,5,5,1595,1,10,12
Air India,21/05/2019,Kolkata,Banglore,CCU → BOM → GOI → BLR,09:25,05:35 22 May,20h 10m,2 stops,No info,11432,2019-05-21,21,5,1,1210,2,9,5
IndiGo,15/06/2019,Mumbai,Hyderabad,BOM → HYD,16:55,18:25,1h 30m,non-stop,No info,3175,2019-06-15,15,6,5,90,0,16,18
IndiGo,12/05/2019,Kolkata,Banglore,CCU → BLR,09:35,12:20,2h 45m,non-stop,No info,4804,2019-05-12,12,5,6,165,0,9,12
Jet Airways,27/06/2019,Delhi,Cochin,DEL → JAI → BOM → COK,09:40,12:35 28 Jun,26h 55m,2 stops,No info,13014,2019-06-27,27,6,3,1615,2,9,12
Multiple carriers,6/03/2019,Delhi,Cochin,DEL → HYD → COK,07:10,22:20,15h 10m,1 stop,In-flight meal not included,7563,2019-03-06,6,3,2,910,1,7,22
SpiceJet,27/06/2019,Kolkata,Banglore,CCU → BLR,09:00,11:25,2h 25m,non-stop,No info,3873,2019-06-27,27,6,3,145,0,9,11
IndiGo,21/05/2019,Delhi,Cochin,DEL → HYD → COK,11:55,00:55 22 May,13h,1 stop,No info,6282,2019-05-21,21,5,1,780,1,11,0
Multiple carriers,1/06/2019,Delhi,Cochin,DEL → BOM → COK,08:30,19:00,10h 30m,1 stop,No info,11200,2019-06-01,1,6,5,630,1,8,19
Vistara,24/04/2019,Banglore,Delhi,BLR → DEL,19:30,22:15,2h 45m,non-stop,No info,5613,2019-04-24,24,4,2,165,0,19,22
IndiGo,9/06/2019,Delhi,Cochin,DEL → COK,14:20,17:35,3h 15m,non-stop,No info,5601,2019-06-09,9,6,6,195,0,14,17
Jet Airways,15/06/2019,Delhi,Cochin,DEL → BOM → COK,14:00,12:35 16 Jun,22h 35m,1 stop,In-flight meal not included,10262,2019-06-15,15,6,5,1355,1,14,12
IndiGo,01/03/2019,Banglore,New Delhi,BLR → DEL,20:00,22:55,2h 55m,non-stop,No info,14306,2019-03-01,1,3,4,175,0,20,22
Jet Airways,1/04/2019,Kolkata,Banglore,CCU → BOM → BLR,20:00,20:45 02 Apr,24h 45m,1 stop,In-flight meal not included,7064,2019-04-01,1,4,0,1485,1,20,20
Jet Airways,27/06/2019,Delhi,Cochin,DEL → BOM → COK,07:05,19:00,11h 55m,1 stop,No info,18371,2019-06-27,27,6,3,715,1,7,19
Air India,18/05/2019,Delhi,Cochin,DEL → CCU → BOM → COK,20:15,19:15 19 May,23h,2 stops,No info,13591,2019-05-18,18,5,5,1380,2,20,19
Jet Airways,1/06/2019,Delhi,Cochin,DEL → JAI → BOM → COK,09:40,12:35 02 Jun,26h 55m,2 stops,In-flight meal not included,10368,2019-06-01,1,6,5,1615,2,9,12
Multiple carriers,12/06/2019,Delhi,Cochin,DEL → IXU → BOM → COK,17:50,01:30 13 Jun,7h 40m,2 stops,No info,18275,2019-06-12,12,6,2,460,2,17,1
IndiGo,27/05/2019,Banglore,Delhi,BLR → DEL,22:10,01:00 28 May,2h 50m,non-stop,No info,3749,2019-05-27,27,5,0,170,0,22,1
Air Asia,6/06/2019,Kolkata,Banglore,CCU → IXR → DEL → BLR,15:10,23:30,8h 20m,2 stops,No info,6810,2019-06-06,6,6,3,500,2,15,23
Multiple carriers,21/05/2019,Delhi,Cochin,DEL → BOM → COK,11:40,21:00,9h 20m,1 stop,No info,7485,2019-05-21,21,5,1,560,1,11,21
Air India,27/05/2019,Kolkata,Banglore,CCU → BLR,14:15,16:45,2h 30m,non-stop,No info,5510,2019-05-27,27,5,0,150,0,14,16
Jet Airways,3/06/2019,Delhi,Cochin,DEL → BOM → COK,18:15,04:25 04 Jun,10h 10m,1 stop,In-flight meal not included,10262,2019-06-03,3,6,0,610,1,18,4
Multiple carriers,24/06/2019,Delhi,Cochin,DEL → HYD → COK,07:10,16:10,9h,1 stop,No info,6723,2019-06-24,24,6,0,540,1,7,16
Multiple carriers,21/03/2019,Delhi,Cochin,DEL → BOM → COK,08:00,15:30,7h 30m,1 stop,No info,8307,2019-03-21,21,3,3,450,1,8,15
GoAir,21/04/2019,Delhi,Cochin,DEL → HYD → COK,05:55,13:35,7h 40m,1 stop,No info,6146,2019-04-21,21,4,6,460,1,5,13
Jet Airways,27/05/2019,Delhi,Cochin,DEL → AMD → BOM → COK,13:25,12:35 28 May,23h 10m,2 stops,No info,15129,2019-05-27,27,5,0,1390,2,13,12
Jet Airways,1/05/2019,Kolkata,Banglore,CCU → BOM → BLR,06:30,12:00,5h 30m,1 stop,No info,14388,2019-05-01,1,5,2,330,1,6,12
Jet Airways,6/04/2019,Banglore,Delhi,BLR → DEL,06:00,08:45,2h 45m,non-stop,In-flight meal not included,4544,2019-04-06,6,4,5,165,0,6,8
Jet Airways,12/04/2019,Banglore,Delhi,BLR → DEL,11:10,14:05,2h 55m,non-stop,In-flight meal not included,5198,2019-04-12,12,4,4,175,0,11,14
IndiGo,18/05/2019,Delhi,Cochin,DEL → BOM → COK,09:15,01:30 19 May,16h 15m,1 stop,No info,7503,2019-05-18,18,5,5,975,1,9,1
GoAir,01/03/2019,Banglore,New Delhi,BLR → GOI → DEL,15:45,20:15,4h 30m,1 stop,No info,12314,2019-03-01,1,3,4,270,1,15,20
Air India,15/05/2019,Delhi,Cochin,DEL → BOM → COK,13:00,19:15,6h 15m,1 stop,No info,8372,2019-05-15,15,5,2,375,1,13,19
Jet Airways,21/05/2019,Kolkata,Banglore,CCU → BOM → BLR,16:30,23:35,7h 5m,1 stop,No info,14781,2019-05-21,21,5,1,425,1,16,23
Jet Airways,24/06/2019,Banglore,Delhi,BLR → DEL,19:50,22:50,3h,non-stop,No info,8016,2019-06-24,24,6,0,180,0,19,22
IndiGo,12/03/2019,Chennai,Kolkata,MAA → CCU,07:55,10:15,2h 20m,non-stop,No info,6297,2019-03-12,12,3,1,140,0,7,10
Jet Airways,1/05/2019,Kolkata,Banglore,CCU → BOM → BLR,08:25,09:20 02 May,24h 55m,1 stop,No info,14388,2019-05-01,1,5,2,1495,1,8,9
GoAir,1/06/2019,Delhi,Cochin,DEL → AMD → COK,07:25,13:35,6h 10m,1 stop,No info,6393,2019-06-01,1,6,5,370,1,7,13
Jet Airways,9/06/2019,Kolkata,Banglore,CCU → BOM → BLR,21:10,10:05 10 Jun,12h 55m,1 stop,No info,14939,2019-06-09,9,6,6,775,1,21,10
Jet Airways,21/05/2019,Kolkata,Banglore,CCU → BOM → BLR,08:25,19:50,11h 25m,1 stop,No info,14781,2019-05-21,21,5,1,685,1,8,19
IndiGo,6/03/2019,Delhi,Cochin,DEL → BOM → COK,07:30,21:00,13h 30m,1 stop,No info,14871,2019-03-06,6,3,2,810,1,7,21
SpiceJet,6/04/2019,Banglore,Delhi,BLR → DEL,09:30,12:20,2h 50m,non-stop,No check-in baggage included,4319,2019-04-06,6,4,5,170,0,9,12
Jet Airways,15/05/2019,Kolkata,Banglore,CCU → DEL → BLR,17:00,09:45 16 May,16h 45m,1 stop,No info,13067,2019-05-15,15,5,2,1005,1,17,9
Jet Airways,01/03/2019,Banglore,New Delhi,BLR → BOM → DEL,16:55,08:15 02 Mar,15h 20m,1 stop,No info,26890,2019-03-01,1,3,4,920,1,16,8
Jet Airways,15/03/2019,Banglore,New Delhi,BLR → BOM → DEL,07:00,13:15,6h 15m,1 stop,In-flight meal not included,9134,2019-03-15,15,3,4,375,1,7,13
IndiGo,3/04/2019,Banglore,Delhi,BLR → DEL,21:15,00:15 04 Apr,3h,non-stop,No info,3943,2019-04-03,3,4,2,180,0,21,0
Air India,24/06/2019,Delhi,Cochin,DEL → BOM → COK,07:00,19:15,12h 15m,1 stop,No info,8879,2019-06-24,24,6,0,735,1,7,19
Jet Airways,24/05/2019,Kolkata,Banglore,CCU → BOM → BLR,18:55,12:00 25 May,17h 5m,1 stop,No info,14571,2019-05-24,24,5,4,1025,1,18,12
IndiGo,15/06/2019,Kolkata,Banglore,CCU → BLR,09:35,12:10,2h 35m,non-stop,No info,5644,2019-06-15,15,6,5,155,0,9,12
Jet Airways,9/06/2019,Kolkata,Banglore,CCU → BOM → BLR,06:30,04:40 10 Jun,22h 10m,1 stop,In-flight meal not included,9663,2019-06-09,9,6,6,1330,1,6,4
Jet Airways,9/06/2019,Kolkata,Banglore,CCU → BOM → BLR,14:05,23:35,9h 30m,1 stop,No info,14571,2019-06-09,9,6,6,570,1,14,23
SpiceJet,9/06/2019,Banglore,Delhi,BLR → DEL,21:10,00:05 10 Jun,2h 55m,non-stop,No info,3971,2019-06-09,9,6,6,175,0,21,0
Jet Airways,6/03/2019,Delhi,Cochin,DEL → BOM → COK,09:00,18:50,9h 50m,1 stop,No info,17024,2019-03-06,6,3,2,590,1,9,18
SpiceJet,15/05/2019,Kolkata,Banglore,CCU → BLR,17:10,19:40,2h 30m,non-stop,No check-in baggage included,3841,2019-05-15,15,5,2,150,0,17,19
Jet Airways,27/05/2019,Delhi,Cochin,DEL → BOM → COK,19:45,19:00 28 May,23h 15m,1 stop,In-flight meal not included,12898,2019-05-27,27,5,0,1395,1,19,19
Jet Airways,6/06/2019,Delhi,Cochin,DEL → NAG → BOM → COK,14:35,04:25 07 Jun,13h 50m,2 stops,No info,13376,2019-06-06,6,6,3,830,2,14,4
Jet Airways,15/06/2019,Delhi,Cochin,DEL → IDR → BOM → COK,21:25,12:35 16 Jun,15h 10m,2 stops,In-flight meal not included,9905,2019-06-15,15,6,5,910,2,21,12
Multiple carriers,15/06/2019,Delhi,Cochin,DEL → BOM → COK,08:00,21:00,13h,1 stop,No info,13587,2019-06-15,15,6,5,780,1,8,21
Multiple carriers,24/06/2019,Delhi,Cochin,DEL → BOM → COK,06:00,21:00,15h,1 stop,No info,7740,2019-06-24,24,6,0,900,1,6,21
Multiple carriers,21/05/2019,Delhi,Cochin,DEL → BOM → COK,06:00,12:35,6h 35m,1 stop,No info,9794,2019-05-21,21,5,1,395,1,6,12
Jet Airways,06/03/2019,Banglore,New Delhi,BLR → BOM → DEL,22:50,21:20 07 Mar,22h 30m,1 stop,No info,17471,2019-03-06,6,3,2,1350,1,22,21
Jet Airways,9/03/2019,Delhi,Cochin,DEL → IXC → BOM → COK,13:45,04:25 10 Mar,14h 40m,2 stops,In-flight meal not included,15129,2019-03-09,9,3,5,880,2,13,4
Jet Airways,1/05/2019,Kolkata,Banglore,CCU → DEL → BLR,09:35,14:25 02 May,28h 50m,1 stop,No info,11467,2019-05-01,1,5,2,1730,1,9,14
Air India,12/06/2019,Kolkata,Banglore,CCU → MAA → BLR,14:35,14:35 13 Jun,24h,1 stop,No info,6528,2019-06-12,12,6,2,1440,1,14,14
Multiple carriers,27/06/2019,Delhi,Cochin,DEL → BOM → COK,07:30,19:15,11h 45m,1 stop,No info,8266,2019-06-27,27,6,3,705,1,7,19
IndiGo,6/03/2019,Delhi,Cochin,DEL → HYD → COK,06:40,22:20,15h 40m,1 stop,No info,6442,2019-03-06,6,3,2,940,1,6,22
Jet Airways,12/06/2019,Delhi,Cochin,DEL → BOM → COK,22:50,12:35 13 Jun,13h 45m,1 stop,In-flight meal not included,10262,2019-06-12,12,6,2,825,1,22,12
Jet Airways,1/03/2019,Mumbai,Hyderabad,BOM → HYD,07:10,08:35,1h 25m,non-stop,No info,17501,2019-03-01,1,3,4,85,0,7,8
Air India,24/05/2019,Banglore,Delhi,BLR → DEL,06:10,08:55,2h 45m,non-stop,No info,8273,2019-05-24,24,5,4,165,0,6,8
Air India,21/03/2019,Delhi,Cochin,DEL → LKO → BOM → COK,18:30,19:15 22 Mar,24h 45m,2 stops,No info,10703,2019-03-21,21,3,3,1485,2,18,19
Multiple carriers,15/06/2019,Delhi,Cochin,DEL → BOM → COK,10:00,01:30 16 Jun,15h 30m,1 stop,No info,8510,2019-06-15,15,6,5,930,1,10,1
IndiGo,15/03/2019,Mumbai,Hyderabad,BOM → HYD,20:05,21:35,1h 30m,non-stop,No info,2754,2019-03-15,15,3,4,90,0,20,21
IndiGo,18/05/2019,Mumbai,Hyderabad,BOM → HYD,21:20,22:50,1h 30m,non-stop,No info,2227,2019-05-18,18,5,5,90,0,21,22
Multiple carriers,27/06/2019,Delhi,Cochin,DEL → IXU → BOM → COK,17:50,01:30 28 Jun,7h 40m,2 stops,No info,18275,2019-06-27,27,6,3,460,2,17,1
SpiceJet,21/04/2019,Delhi,Cochin,DEL → PNQ → COK,08:45,13:15,4h 30m,1 stop,No check-in baggage included,6356,2019-04-21,21,4,6,270,1,8,13
Jet Airways,15/05/2019,Kolkata,Banglore,CCU → BOM → BLR,14:05,20:45,6h 40m,1 stop,No info,14781,2019-05-15,15,5,2,400,1,14,20
Jet Airways,27/05/2019,Delhi,Cochin,DEL → JAI → BOM → COK,09:40,12:35 28 May,26h 55m,2 stops,In-flight meal not included,13029,2019-05-27,27,5,0,1615,2,9,12
GoAir,1/05/2019,Banglore,Delhi,BLR → DEL,11:40,14:30,2h 50m,non-stop,No info,4340,2019-05-01,1,5,2,170,0,11,14
Air India,12/06/2019,Kolkata,Banglore,CCU → DEL → COK → BLR,17:30,13:45 13 Jun,20h 15m,2 stops,No info,12224,2019-06-12,12,6,2,1215,2,17,13
Jet Airways,24/05/2019,Kolkata,Banglore,CCU → BOM → BLR,16:30,18:15 25 May,25h 45m,1 stop,In-flight meal not included,10844,2019-05-24,24,5,4,1545,1,16,18
IndiGo,15/04/2019,Kolkata,Banglore,CCU → BLR,09:35,12:20,2h 45m,non-stop,No info,4174,2019-04-15,15,4,0,165,0,9,12
Air India,01/03/2019,Banglore,New Delhi,BLR → HYD → VGA → DEL,17:00,22:55 02 Mar,29h 55m,2 stops,No info,14887,2019-03-01,1,3,4,1795,2,17,22
Multiple carriers,9/04/2019,Delhi,Cochin,DEL → BOM → COK,09:00,19:15,10h 15m,1 stop,No info,12853,2019-04-09,9,4,1,615,1,9,19
Air Asia,15/05/2019,Banglore,Delhi,BLR → DEL,11:10,13:55,2h 45m,non-stop,No info,3383,2019-05-15,15,5,2,165,0,11,13
GoAir,01/03/2019,Banglore,New Delhi,BLR → DEL,11:40,14:35,2h 55m,non-stop,No info,11111,2019-03-01,1,3,4,175,0,11,14
Jet Airways,1/04/2019,Banglore,Delhi,BLR → DEL,17:45,20:45,3h,non-stop,No info,7229,2019-04-01,1,4,0,180,0,17,20
Jet Airways,6/05/2019,Banglore,Delhi,BLR → DEL,17:45,20:45,3h,non-stop,In-flight meal not included,4030,2019-05-06,6,5,0,180,0,17,20
IndiGo,3/03/2019,Delhi,Cochin,DEL → BOM → COK,15:00,01:35 04 Mar,10h 35m,1 stop,No info,14871,2019-03-03,3,3,6,635,1,15,1
Jet Airways,27/05/2019,Delhi,Cochin,DEL → BOM → COK,19:45,04:25 28 May,8h 40m,1 stop,In-flight meal not included,12898,2019-05-27,27,5,0,520,1,19,4
Multiple carriers,18/05/2019,Delhi,Cochin,DEL → BOM → COK,11:30,19:15,7h 45m,1 stop,No info,14533,2019-05-18,18,5,5,465,1,11,19
Air India,6/06/2019,Delhi,Cochin,DEL → BLR → COK,17:40,08:15 07 Jun,14h 35m,1 stop,No info,7258,2019-06-06,6,6,3,875,1,17,8
SpiceJet,1/04/2019,Delhi,Cochin,DEL → PNQ → COK,08:45,13:15,4h 30m,1 stop,No info,4812,2019-04-01,1,4,0,270,1,8,13
Jet Airways,9/05/2019,Kolkata,Banglore,CCU → DEL → BLR,09:35,21:05,11h 30m,1 stop,In-flight meal not included,12384,2019-05-09,9,5,3,690,1,9,21
Air India,6/06/2019,Delhi,Cochin,DEL → JAI → BOM → COK,12:00,07:40 07 Jun,19h 40m,2 stops,No info,8603,2019-06-06,6,6,3,1180,2,12,7
Air India,6/06/2019,Delhi,Cochin,DEL → JAI → BOM → COK,12:00,19:15,7h 15m,2 stops,No info,8603,2019-06-06,6,6,3,435,2,12,19
Jet Airways,24/03/2019,Kolkata,Banglore,CCU → BOM → BLR,13:55,23:25,9h 30m,1 stop,No info,14231,2019-03-24,24,3,6,570,1,13,23
Jet Airways,9/05/2019,Delhi,Cochin,DEL → AMD → BOM → COK,23:05,04:25 11 May,29h 20m,2 stops,No info,15129,2019-05-09,9,5,3,1760,2,23,4
Air Asia,1/06/2019,Delhi,Cochin,DEL → BLR → COK,20:45,07:10 02 Jun,10h 25m,1 stop,No info,11410,2019-06-01,1,6,5,625,1,20,7
Air India,12/03/2019,Banglore,New Delhi,BLR → BOM → BHO → DEL,08:50,09:25 13 Mar,24h 35m,2 stops,No info,12725,2019-03-12,12,3,1,1475,2,8,9
Jet Airways,9/06/2019,Delhi,Cochin,DEL → IDR → BOM → COK,09:35,12:35 10 Jun,27h,2 stops,No info,13292,2019-06-09,9,6,6,1620,2,9,12
SpiceJet,24/04/2019,Kolkata,Banglore,CCU → BLR,06:55,09:30,2h 35m,non-stop,No info,3873,2019-04-24,24,4,2,155,0,6,9
IndiGo,15/06/2019,Chennai,Kolkata,MAA → CCU,07:55,10:15,2h 20m,non-stop,No info,3850,2019-06-15,15,6,5,140,0,7,10
SpiceJet,9/06/2019,Kolkata,Banglore,CCU → KNU → BLR,11:35,18:50,7h 15m,1 stop,No info,8479,2019-06-09,9,6,6,435,1,11,18
Jet Airways,24/05/2019,Kolkata,Banglore,CCU → DEL → BLR,09:35,23:35,14h,1 stop,No info,14151,2019-05-24,24,5,4,840,1,9,23
Air India,24/04/2019,Banglore,Delhi,BLR → DEL,06:10,08:55,2h 45m,non-stop,No info,5228,2019-04-24,24,4,2,165,0,6,8
Vistara,9/06/2019,Kolkata,Banglore,CCU → DEL → BLR,07:10,09:05 10 Jun,25h 55m,1 stop,No info,9397,2019-06-09,9,6,6,1555,1,7,9
Jet Airways,18/06/2019,Mumbai,Hyderabad,BOM → HYD,07:05,08:30,1h 25m,non-stop,In-flight meal not included,4995,2019-06-18,18,6,1,85,0,7,8
Air India,1/06/2019,Delhi,Cochin,DEL → AMD → BOM → COK,19:45,19:15 02 Jun,23h 30m,2 stops,No info,10651,2019-06-01,1,6,5,1410,2,19,19
Air Asia,3/04/2019,Banglore,Delhi,BLR → DEL,04:55,07:45,2h 50m,non-stop,No info,4282,2019-04-03,3,4,2,170,0,4,7
Air India,21/05/2019,Kolkata,Banglore,CCU → JAI → BOM → BLR,08:20,21:50,13h 30m,2 stops,No info,10697,2019-05-21,21,5,1,810,2,8,21
Jet Airways,21/05/2019,Kolkata,Banglore,CCU → DEL → BLR,09:35,14:25 22 May,28h 50m,1 stop,In-flight meal not included,9314,2019-05-21,21,5,1,1730,1,9,14
IndiGo,27/06/2019,Chennai,Kolkata,MAA → CCU,05:15,07:40,2h 25m,non-stop,No info,3540,2019-06-27,27,6,3,145,0,5,7
Air India,12/06/2019,Delhi,Cochin,DEL → AMD → BOM → COK,16:40,19:15 13 Jun,26h 35m,2 stops,No info,9443,2019-06-12,12,6,2,1595,2,16,19
Multiple carriers,6/03/2019,Delhi,Cochin,DEL → BOM → COK,07:30,15:30,8h,1 stop,No info,15147,2019-03-06,6,3,2,480,1,7,15
Jet Airways,27/06/2019,Banglore,Delhi,BLR → DEL,08:20,11:20,3h,non-stop,No info,8016,2019-06-27,27,6,3,180,0,8,11
IndiGo,24/05/2019,Mumbai,Hyderabad,BOM → HYD,21:20,22:50,1h 30m,non-stop,No info,2437,2019-05-24,24,5,4,90,0,21,22
IndiGo,27/05/2019,Delhi,Cochin,DEL → BOM → COK,10:35,01:30 28 May,14h 55m,1 stop,No info,6104,2019-05-27,27,5,0,895,1,10,1
SpiceJet,6/06/2019,Mumbai,Hyderabad,BOM → HYD,22:45,00:15 07 Jun,1h 30m,non-stop,No check-in baggage included,1965,2019-06-06,6,6,3,90,0,22,0
Multiple carriers,12/06/2019,Delhi,Cochin,DEL → BOM → COK,13:00,21:00,8h,1 stop,No info,7408,2019-06-12,12,6,2,480,1,13,21
IndiGo,18/06/2019,Mumbai,Hyderabad,BOM → HYD,06:25,07:55,1h 30m,non-stop,No info,4049,2019-06-18,18,6,1,90,0,6,7
Jet Airways,1/06/2019,Banglore,Delhi,BLR → DEL,19:50,22:50,3h,non-stop,No info,8016,2019-06-01,1,6,5,180,0,19,22
Multiple carriers,9/05/2019,Delhi,Cochin,DEL → BOM → COK,07:00,19:00,12h,1 stop,No info,10197,2019-05-09,9,5,3,720,1,7,19
Jet Airways,1/05/2019,Kolkata,Banglore,CCU → BOM → BLR,21:10,08:15 02 May,11h 5m,1 stop,In-flight meal not included,10844,2019-05-01,1,5,2,665,1,21,8
Jet Airways,9/06/2019,Kolkata,Banglore,CCU → DEL → BLR,17:00,19:10 10 Jun,26h 10m,1 stop,No info,12692,2019-06-09,9,6,6,1570,1,17,19
Jet Airways,6/05/2019,Kolkata,Banglore,CCU → BOM → BLR,08:25,16:20,7h 55m,1 stop,No info,14781,2019-05-06,6,5,0,475,1,8,16
GoAir,24/05/2019,Kolkata,Banglore,CCU → BOM → BLR,23:30,07:45 25 May,8h 15m,1 stop,No info,7335,2019-05-24,24,5,4,495,1,23,7
Jet Airways,27/05/2019,Banglore,Delhi,BLR → DEL,08:20,11:20,3h,non-stop,No info,7229,2019-05-27,27,5,0,180,0,8,11
Vistara,24/03/2019,Banglore,New Delhi,BLR → DEL,21:10,00:05 28 Mar,2h 55m,non-stop,No info,4353,2019-03-24,24,3,6,175,0,21,0
Jet Airways,18/05/2019,Kolkata,Banglore,CCU → BOM → BLR,20:00,08:15 19 May,12h 15m,1 stop,No info,13941,2019-05-18,18,5,5,735,1,20,8
Jet Airways,12/03/2019,Banglore,New Delhi,BLR → MAA → DEL,09:45,14:25,4h 40m,1 stop,No info,12295,2019-03-12,12,3,1,280,1,9,14
Jet Airways,27/05/2019,Delhi,Cochin,DEL → BOM → COK,22:50,12:35 28 May,13h 45m,1 stop,In-flight meal not included,12898,2019-05-27,27,5,0,825,1,22,12
Vistara,9/05/2019,Kolkata,Banglore,CCU → DEL → BLR,07:10,22:40,15h 30m,1 stop,No info,7927,2019-05-09,9,5,3,930,1,7,22
Air Asia,15/04/2019,Banglore,Delhi,BLR → DEL,23:55,02:45 16 Apr,2h 50m,non-stop,No info,4483,2019-04-15,15,4,0,170,0,23,2
Jet Airways,06/03/2019,Banglore,New Delhi,BLR → BOM → DEL,11:40,18:25,6h 45m,1 stop,No info,19225,2019-03-06,6,3,2,405,1,11,18
GoAir,24/04/2019,Delhi,Cochin,DEL → AMD → COK,07:25,13:35,6h 10m,1 stop,No info,4692,2019-04-24,24,4,2,370,1,7,13
Jet Airways,18/03/2019,Banglore,New Delhi,BLR → BOM → DEL,21:25,09:30 16 Mar,12h 5m,1 stop,No info,13555,2019-03-18,18,3,0,725,1,21,9
IndiGo,9/04/2019,Delhi,Cochin,DEL → BOM → COK,15:00,01:30 10 Apr,10h 30m,1 stop,No info,6270,2019-04-09,9,4,1,630,1,15,1
Jet Airways,6/05/2019,Kolkata,Banglore,CCU → BOM → BLR,18:55,16:20 07 May,21h 25m,1 stop,No info,13584,2019-05-06,6,5,0,1285,1,18,16
Jet Airways,21/03/2019,Delhi,Cochin,DEL → MAA → BOM → COK,16:10,18:50 22 Mar,26h 40m,2 stops,No info,13180,2019-03-21,21,3,3,1600,2,16,18
Jet Airways,12/05/2019,Kolkata,Banglore,CCU → DEL → BLR,20:25,18:00 13 May,21h 35m,1 stop,No info,14151,2019-05-12,12,5,6,1295,1,20,18
Vistara,12/05/2019,Delhi,Cochin,DEL → COK,06:00,09:10,3h 10m,non-stop,No info,6216,2019-05-12,12,5,6,190,0,6,9
Multiple carriers,3/03/2019,Delhi,Cochin,DEL → BOM → COK,07:30,18:50,11h 20m,1 stop,No info,15135,2019-03-03,3,3,6,680,1,7,18
Multiple carriers,6/03/2019,Delhi,Cochin,DEL → BOM → COK,11:30,21:00,9h 30m,1 stop,In-flight meal not included,15136,2019-03-06,6,3,2,570,1,11,21
Jet Airways,27/06/2019,Delhi,Cochin,DEL → BOM → COK,02:15,19:00,16h 45m,1 stop,In-flight meal not included,10262,2019-06-27,27,6,3,1005,1,2,19
Jet Airways,18/05/2019,Kolkata,Banglore,CCU → DEL → BLR,09:35,22:05,12h 30m,1 stop,In-flight meal not included,12384,2019-05-18,18,5,5,750,1,9,22
Jet Airways,1/04/2019,Kolkata,Banglore,CCU → DEL → BLR,09:35,19:10,9h 35m,1 stop,In-flight meal not included,9314,2019-04-01,1,4,0,575,1,9,19
Jet Airways,6/05/2019,Kolkata,Banglore,CCU → DEL → BLR,17:00,18:00 07 May,25h,1 stop,In-flight meal not included,9314,2019-05-06,6,5,0,1500,1,17,18
Air India,1/06/2019,Delhi,Cochin,DEL → BOM → COK,09:00,19:15,10h 15m,1 stop,No info,10454,2019-06-01,1,6,5,615,1,9,19
Air India,18/05/2019,Delhi,Cochin,DEL → BOM → COK,23:00,07:40 19 May,8h 40m,1 stop,No info,8372,2019-05-18,18,5,5,520,1,23,7
Jet Airways,9/03/2019,Delhi,Cochin,DEL → BOM → COK,19:45,04:25 10 Mar,8h 40m,1 stop,In-flight meal not included,11848,2019-03-09,9,3,5,520,1,19,4
IndiGo,1/06/2019,Delhi,Cochin,DEL → BOM → COK,08:30,21:00,12h 30m,1 stop,No info,6416,2019-06-01,1,6,5,750,1,8,21
IndiGo,1/04/2019,Mumbai,Hyderabad,BOM → HYD,09:10,10:40,1h 30m,non-stop,No info,3342,2019-04-01,1,4,0,90,0,9,10
Jet Airways,6/06/2019,Kolkata,Banglore,CCU → BOM → PNQ → BLR,06:30,07:25 07 Jun,24h 55m,2 stops,In-flight meal not included,10118,2019-06-06,6,6,3,1495,2,6,7
Air India,12/06/2019,Kolkata,Banglore,CCU → GAU → DEL → BLR,16:45,12:30 13 Jun,19h 45m,2 stops,No info,14960,2019-06-12,12,6,2,1185,2,16,12
IndiGo,15/06/2019,Delhi,Cochin,DEL → HYD → COK,05:05,16:10,11h 5m,1 stop,No info,6818,2019-06-15,15,6,5,665,1,5,16
Air India,12/06/2019,Kolkata,Banglore,CCU → BLR,14:15,16:45,2h 30m,non-stop,No info,5510,2019-06-12,12,6,2,150,0,14,16
Jet Airways,21/05/2019,Kolkata,Banglore,CCU → BOM → BLR,06:30,09:20 22 May,26h 50m,1 stop,No info,14388,2019-05-21,21,5,1,1610,1,6,9
Multiple carriers,3/06/2019,Delhi,Cochin,DEL → HYD → COK,14:55,22:30,7h 35m,1 stop,No info,7038,2019-06-03,3,6,0,455,1,14,22
Multiple carriers,9/05/2019,Delhi,Cochin,DEL → BOM → COK,08:45,19:15,10h 30m,1 stop,No info,8266,2019-05-09,9,5,3,630,1,8,19
Jet Airways,27/06/2019,Delhi,Cochin,DEL → ATQ → BOM → COK,18:20,19:00 28 Jun,24h 40m,2 stops,No info,14300,2019-06-27,27,6,3,1480,2,18,19
Air India,9/05/2019,Kolkata,Banglore,CCU → BOM → BLR,09:25,07:55 10 May,22h 30m,1 stop,No info,8366,2019-05-09,9,5,3,1350,1,9,7
Jet Airways,06/03/2019,Banglore,New Delhi,BLR → BOM → DEL,22:50,10:25 07 Mar,11h 35m,1 stop,No info,17261,2019-03-06,6,3,2,695,1,22,10
Vistara,6/06/2019,Kolkata,Banglore,CCU → DEL → BLR,07:10,09:05 07 Jun,25h 55m,1 stop,No info,8452,2019-06-06,6,6,3,1555,1,7,9
IndiGo,1/04/2019,Kolkata,Banglore,CCU → GAU → BLR,15:10,20:30,5h 20m,1 stop,No info,8567,2019-04-01,1,4,0,320,1,15,20
Multiple carriers,15/06/2019,Delhi,Cochin,DEL → HYD → COK,07:05,22:30,15h 25m,1 stop,No info,9646,2019-06-15,15,6,5,925,1,7,22
Air India,9/04/2019,Delhi,Cochin,DEL → GOI → BOM → COK,22:00,19:15 10 Apr,21h 15m,2 stops,No info,8341,2019-04-09,9,4,1,1275,2,22,19
Jet Airways,9/05/2019,Delhi,Cochin,DEL → BOM → COK,17:30,19:00 10 May,25h 30m,1 stop,In-flight meal not included,12373,2019-05-09,9,5,3,1530,1,17,19
SpiceJet,21/06/2019,Chennai,Kolkata,MAA → CCU,17:45,20:05,2h 20m,non-stop,No check-in baggage included,3543,2019-06-21,21,6,4,140,0,17,20
Jet Airways,9/06/2019,Kolkata,Banglore,CCU → DEL → BLR,17:00,23:35,6h 35m,1 stop,In-flight meal not included,13994,2019-06-09,9,6,6,395,1,17,23
IndiGo,24/03/2019,Banglore,New Delhi,BLR → DEL,04:00,06:50,2h 50m,non-stop,No info,4777,2019-03-24,24,3,6,170,0,4,6
Multiple carriers,1/06/2019,Delhi,Cochin,DEL → HYD → COK,14:55,22:30,7h 35m,1 stop,No info,7038,2019-06-01,1,6,5,455,1,14,22
IndiGo,3/04/2019,Mumbai,Hyderabad,BOM → HYD,16:55,18:25,1h 30m,non-stop,No info,3175,2019-04-03,3,4,2,90,0,16,18
Multiple carriers,9/06/2019,Delhi,Cochin,DEL → BOM → COK,10:00,21:00,11h,1 stop,No info,7408,2019-06-09,9,6,6,660,1,10,21
IndiGo,15/06/2019,Banglore,Delhi,BLR → DEL,21:15,00:15 16 Jun,3h,non-stop,No info,3943,2019-06-15,15,6,5,180,0,21,0
Jet Airways,6/03/2019,Delhi,Cochin,DEL → BOM → COK,08:00,04:25 07 Mar,20h 25m,1 stop,No info,15974,2019-03-06,6,3,2,1225,1,8,4
SpiceJet,27/05/2019,Kolkata,Banglore,CCU → BLR,06:55,09:30,2h 35m,non-stop,No info,3873,2019-05-27,27,5,0,155,0,6,9
IndiGo,15/04/2019,Banglore,Delhi,BLR → DEL,10:10,13:00,2h 50m,non-stop,No info,4423,2019-04-15,15,4,0,170,0,10,13
Jet Airways,27/05/2019,Delhi,Cochin,DEL → JAI → BOM → COK,09:40,04:25 28 May,18h 45m,2 stops,No info,15129,2019-05-27,27,5,0,1125,2,9,4
IndiGo,21/03/2019,Delhi,Cochin,DEL → BOM → COK,08:25,21:00,12h 35m,1 stop,No info,8285,2019-03-21,21,3,3,755,1,8,21
Air India,6/06/2019,Mumbai,Hyderabad,BOM → HYD,06:20,07:40,1h 20m,non-stop,No info,3100,2019-06-06,6,6,3,80,0,6,7
Air India,01/03/2019,Banglore,New Delhi,BLR → BOM → BHO → DEL,08:50,09:25 02 Mar,24h 35m,2 stops,No info,25430,2019-03-01,1,3,4,1475,2,8,9
SpiceJet,18/03/2019,Mumbai,Hyderabad,BOM → HYD,13:10,14:30,1h 20m,non-stop,No check-in baggage included,2385,2019-03-18,18,3,0,80,0,13,14
Jet Airways,6/06/2019,Kolkata,Banglore,CCU → GAU → BLR,10:20,17:35,7h 15m,1 stop,No info,11316,2019-06-06,6,6,3,435,1,10,17
Jet Airways,15/06/2019,Delhi,Cochin,DEL → BOM → COK,02:15,19:00,16h 45m,1 stop,In-flight meal not included,10262,2019-06-15,15,6,5,1005,1,2,19
Air India,24/05/2019,Kolkata,Banglore,CCU → IXR → BBI → BLR,05:50,13:15,7h 25m,2 stops,No info,7662,2019-05-24,24,5,4,445,2,5,13
Jet Airways,24/03/2019,Kolkata,Banglore,CCU → BOM → BLR,16:55,19:40 25 Mar,26h 45m,1 stop,No info,14231,2019-03-24,24,3,6,1605,1,16,19
IndiGo,9/06/2019,Delhi,Cochin,DEL → BOM → COK,09:15,21:00,11h 45m,1 stop,No info,6838,2019-06-09,9,6,6,705,1,9,21
Jet Airways,15/06/2019,Delhi,Cochin,DEL → NAG → BOM → COK,06:45,04:25 16 Jun,21h 40m,2 stops,No info,13376,2019-06-15,15,6,5,1300,2,6,4
Jet Airways,24/06/2019,Delhi,Cochin,DEL → BOM → COK,15:00,19:00 25 Jun,28h,1 stop,In-flight meal not included,10262,2019-06-24,24,6,0,1680,1,15,19
IndiGo,27/03/2019,Delhi,Cochin,DEL → BOM → COK,07:30,15:30,8h,1 stop,No info,8574,2019-03-27,27,3,2,480,1,7,15
Jet Airways,09/03/2019,Banglore,New Delhi,BLR → BOM → DEL,21:25,07:40 13 Mar,10h 15m,1 stop,In-flight meal not included,7832,2019-03-09,9,3,5,615,1,21,7
Multiple carriers,24/06/2019,Delhi,Cochin,DEL → BOM → COK,03:50,19:00,15h 10m,1 stop,No info,12192,2019-06-24,24,6,0,910,1,3,19
Jet Airways,15/06/2019,Mumbai,Hyderabad,BOM → HYD,10:20,11:50,1h 30m,non-stop,In-flight meal not included,4050,2019-06-15,15,6,5,90,0,10,11
GoAir,12/04/2019,Banglore,Delhi,BLR → DEL,07:45,10:40,2h 55m,non-stop,No info,6722,2019-04-12,12,4,4,175,0,7,10
Jet Airways,9/06/2019,Kolkata,Banglore,CCU → BOM → BLR,20:00,16:20 10 Jun,20h 20m,1 stop,In-flight meal not included,10844,2019-06-09,9,6,6,1220,1,20,16
Multiple carriers,15/06/2019,Delhi,Cochin,DEL → BOM → COK,07:00,21:00,14h,1 stop,No info,7408,2019-06-15,15,6,5,840,1,7,21
Jet Airways,21/03/2019,Delhi,Cochin,DEL → BOM → COK,20:50,04:25 22 Mar,7h 35m,1 stop,No info,14189,2019-03-21,21,3,3,455,1,20,4
SpiceJet,24/05/2019,Kolkata,Banglore,CCU → BLR,17:10,19:40,2h 30m,non-stop,No check-in baggage included,3841,2019-05-24,24,5,4,150,0,17,19
Jet Airways,9/05/2019,Kolkata,Banglore,CCU → BOM → BLR,14:05,04:40 10 May,14h 35m,1 stop,In-flight meal not included,8586,2019-05-09,9,5,3,875,1,14,4
Multiple carriers,27/06/2019,Delhi,Cochin,DEL → BOM → COK,10:35,19:15,8h 40m,1 stop,No info,7155,2019-06-27,27,6,3,520,1,10,19
Jet Airways,12/06/2019,Kolkata,Banglore,CCU → BOM → BLR,08:25,18:15,9h 50m,1 stop,In-flight meal not included,9899,2019-06-12,12,6,2,590,1,8,18
Jet Airways,6/06/2019,Kolkata,Banglore,CCU → BOM → BLR,08:25,19:50,11h 25m,1 stop,No info,14571,2019-06-06,6,6,3,685,1,8,19
IndiGo,18/05/2019,Banglore,Delhi,BLR → DEL,18:55,21:50,2h 55m,non-stop,No info,4823,2019-05-18,18,5,5,175,0,18,21
Jet Airways,9/05/2019,Banglore,Delhi,BLR → DEL,08:20,11:20,3h,non-stop,In-flight meal not included,4544,2019-05-09,9,5,3,180,0,8,11
Air India,01/03/2019,Banglore,New Delhi,BLR → AMD → DEL,00:30,20:30,20h,1 stop,1 Long layover,14752,2019-03-01,1,3,4,1200,1,0,20
Air India,9/05/2019,Kolkata,Banglore,CCU → BOM → COK → BLR,09:25,13:45 10 May,28h 20m,2 stops,No info,11542,2019-05-09,9,5,3,1700,2,9,13
Jet Airways,21/05/2019,Delhi,Cochin,DEL → COK,09:50,13:05,3h 15m,non-stop,In-flight meal not included,7202,2019-05-21,21,5,1,195,0,9,13
Multiple carriers,9/06/2019,Delhi,Cochin,DEL → BOM → COK,10:35,19:00,8h 25m,1 stop,No info,11098,2019-06-09,9,6,6,505,1,10,19
Air India,27/03/2019,Mumbai,Hyderabad,BOM → HYD,19:30,20:45,1h 15m,non-stop,No info,2575,2019-03-27,27,3,2,75,0,19,20
Multiple carriers,27/03/2019,Delhi,Cochin,DEL → BOM → COK,13:00,01:35 28 Mar,12h 35m,1 stop,No info,6673,2019-03-27,27,3,2,755,1,13,1
IndiGo,01/03/2019,Banglore,New Delhi,BLR → DEL,18:55,21:45,2h 50m,non-stop,No info,14306,2019-03-01,1,3,4,170,0,18,21
Jet Airways,18/05/2019,Delhi,Cochin,DEL → BOM → COK,21:50,04:25 19 May,6h 35m,1 stop,No info,15554,2019-05-18,18,5,5,395,1,21,4
Jet Airways,15/05/2019,Kolkata,Banglore,CCU → DEL → BLR,09:35,14:25 16 May,28h 50m,1 stop,In-flight meal not included,9314,2019-05-15,15,5,2,1730,1,9,14
Jet Airways,9/03/2019,Mumbai,Hyderabad,BOM → HYD,06:30,08:00,1h 30m,non-stop,In-flight meal not included,4995,2019-03-09,9,3,5,90,0,6,8
Jet Airways,21/03/2019,Banglore,New Delhi,BLR → BOM → DEL,11:40,07:40 19 Mar,20h,1 stop,In-flight meal not included,7832,2019-03-21,21,3,3,1200,1,11,7
Jet Airways,21/05/2019,Kolkata,Banglore,CCU → BOM → BLR,08:25,08:15 22 May,23h 50m,1 stop,In-flight meal not included,8586,2019-05-21,21,5,1,1430,1,8,8
Air India,27/04/2019,Delhi,Cochin,DEL → COK,05:10,08:00,2h 50m,non-stop,No info,6094,2019-04-27,27,4,5,170,0,5,8
Jet Airways,24/06/2019,Delhi,Cochin,DEL → IDR → BOM → COK,05:30,19:00,13h 30m,2 stops,No info,13292,2019-06-24,24,6,0,810,2,5,19
Jet Airways,9/06/2019,Delhi,Cochin,DEL → JAI → BOM → COK,05:30,04:25 10 Jun,22h 55m,2 stops,In-flight meal not included,10368,2019-06-09,9,6,6,1375,2,5,4
Multiple carriers,27/05/2019,Delhi,Cochin,DEL → BOM → COK,10:00,21:00,11h,1 stop,No info,9718,2019-05-27,27,5,0,660,1,10,21
Jet Airways,21/03/2019,Banglore,New Delhi,BLR → BOM → DEL,08:55,07:40 19 Mar,22h 45m,1 stop,In-flight meal not included,7412,2019-03-21,21,3,3,1365,1,8,7
Air India,6/06/2019,Delhi,Cochin,DEL → GOI → BOM → COK,22:00,19:15 07 Jun,21h 15m,2 stops,No info,10441,2019-06-06,6,6,3,1275,2,22,19
IndiGo,3/03/2019,Delhi,Cochin,DEL → BOM → COK,10:45,01:35 04 Mar,14h 50m,1 stop,No info,14871,2019-03-03,3,3,6,890,1,10,1
Jet Airways,18/05/2019,Delhi,Cochin,DEL → BOM → COK,08:00,19:00,11h,1 stop,No info,15554,2019-05-18,18,5,5,660,1,8,19
Jet Airways,01/03/2019,Banglore,New Delhi,BLR → BOM → DEL,14:05,19:10,5h 5m,1 stop,No info,36235,2019-03-01,1,3,4,305,1,14,19
IndiGo,24/03/2019,Mumbai,Hyderabad,BOM → HYD,16:55,18:25,1h 30m,non-stop,No info,3175,2019-03-24,24,3,6,90,0,16,18
SpiceJet,24/05/2019,Chennai,Kolkata,MAA → CCU,17:45,20:05,2h 20m,non-stop,No info,3597,2019-05-24,24,5,4,140,0,17,20
SpiceJet,27/06/2019,Mumbai,Hyderabad,BOM → HYD,13:15,14:45,1h 30m,non-stop,No check-in baggage included,1965,2019-06-27,27,6,3,90,0,13,14
Multiple carriers,24/06/2019,Delhi,Cochin,DEL → BOM → COK,10:00,19:00,9h,1 stop,No info,12717,2019-06-24,24,6,0,540,1,10,19
IndiGo,3/06/2019,Delhi,Cochin,DEL → COK,14:25,17:40,3h 15m,non-stop,No info,6015,2019-06-03,3,6,0,195,0,14,17
Air Asia,09/03/2019,Banglore,New Delhi,BLR → DEL,23:25,02:10 10 Mar,2h 45m,non-stop,No info,5615,2019-03-09,9,3,5,165,0,23,2
Multiple carriers,27/03/2019,Delhi,Cochin,DEL → BOM → COK,19:00,01:35 28 Mar,6h 35m,1 stop,No info,7845,2019-03-27,27,3,2,395,1,19,1
Jet Airways,9/06/2019,Kolkata,Banglore,CCU → BOM → BLR,21:10,22:35 10 Jun,25h 25m,1 stop,In-flight meal not included,10844,2019-06-09,9,6,6,1525,1,21,22
Jet Airways,15/03/2019,Banglore,New Delhi,BLR → BOM → DEL,21:25,05:05 13 Mar,7h 40m,1 stop,No info,27210,2019-03-15,15,3,4,460,1,21,5
IndiGo,6/04/2019,Kolkata,Banglore,CCU → BLR,14:25,16:55,2h 30m,non-stop,No info,4174,2019-04-06,6,4,5,150,0,14,16
Multiple carriers,21/03/2019,Delhi,Cochin,DEL → BOM → COK,08:00,21:00,13h,1 stop,No info,6883,2019-03-21,21,3,3,780,1,8,21
Multiple carriers,21/03/2019,Delhi,Cochin,DEL → BOM → COK,09:00,21:00,12h,1 stop,No info,6883,2019-03-21,21,3,3,720,1,9,21
Jet Airways,21/05/2019,Kolkata,Banglore,CCU → GAU → BLR,10:20,17:35,7h 15m,1 stop,No info,8355,2019-05-21,21,5,1,435,1,10,17
SpiceJet,24/03/2019,Banglore,New Delhi,BLR → DEL,20:30,23:20,2h 50m,non-stop,No check-in baggage included,5469,2019-03-24,24,3,6,170,0,20,23
Jet Airways,27/06/2019,Banglore,Delhi,BLR → DEL,06:00,08:45,2h 45m,non-stop,In-flight meal not included,6478,2019-06-27,27,6,3,165,0,6,8
Vistara,03/03/2019,Banglore,New Delhi,BLR → DEL,19:40,22:20,2h 40m,non-stop,No info,11913,2019-03-03,3,3,6,160,0,19,22
IndiGo,21/05/2019,Delhi,Cochin,DEL → BOM → COK,18:35,01:30 22 May,6h 55m,1 stop,No info,7006,2019-05-21,21,5,1,415,1,18,1
Jet Airways,1/04/2019,Kolkata,Banglore,CCU → BOM → BLR,16:30,22:35,6h 5m,1 stop,No info,12681,2019-04-01,1,4,0,365,1,16,22
Jet Airways,21/05/2019,Delhi,Cochin,DEL → AMD → BOM → COK,23:05,19:00 22 May,19h 55m,2 stops,No info,15129,2019-05-21,21,5,1,1195,2,23,19
Multiple carriers,15/06/2019,Delhi,Cochin,DEL → BOM → COK,14:00,21:00,7h,1 stop,No info,13587,2019-06-15,15,6,5,420,1,14,21
Jet Airways,1/06/2019,Delhi,Cochin,DEL → BOM → COK,19:15,19:00 02 Jun,23h 45m,1 stop,No info,14714,2019-06-01,1,6,5,1425,1,19,19
IndiGo,03/03/2019,Banglore,New Delhi,BLR → HYD → DEL,07:30,12:20,4h 50m,1 stop,No info,6220,2019-03-03,3,3,6,290,1,7,12
Jet Airways,6/06/2019,Delhi,Cochin,DEL → BOM → COK,07:05,12:35,5h 30m,1 stop,In-flight meal not included,10262,2019-06-06,6,6,3,330,1,7,12
Air India,12/05/2019,Kolkata,Banglore,CCU → BOM → BLR,09:25,18:30,9h 5m,1 stop,No info,8576,2019-05-12,12,5,6,545,1,9,18
Jet Airways,24/03/2019,Kolkata,Banglore,CCU → BOM → BLR,19:45,20:40 25 Mar,24h 55m,1 stop,In-flight meal not included,10031,2019-03-24,24,3,6,1495,1,19,20
Jet Airways,24/06/2019,Delhi,Cochin,DEL → AMD → BOM → COK,19:10,19:00 25 Jun,23h 50m,2 stops,No info,12819,2019-06-24,24,6,0,1430,2,19,19
GoAir,15/04/2019,Delhi,Cochin,DEL → AMD → COK,07:25,13:35,6h 10m,1 stop,No info,5052,2019-04-15,15,4,0,370,1,7,13
Jet Airways,01/03/2019,Banglore,New Delhi,BLR → BOM → DEL,08:00,08:15 02 Mar,24h 15m,1 stop,No info,22270,2019-03-01,1,3,4,1455,1,8,8
Vistara,27/04/2019,Banglore,Delhi,BLR → DEL,07:00,09:40,2h 40m,non-stop,No info,5613,2019-04-27,27,4,5,160,0,7,9
SpiceJet,1/04/2019,Kolkata,Banglore,CCU → BLR,09:00,11:25,2h 25m,non-stop,No info,3873,2019-04-01,1,4,0,145,0,9,11
IndiGo,15/05/2019,Delhi,Cochin,DEL → COK,05:35,08:50,3h 15m,non-stop,No info,6015,2019-05-15,15,5,2,195,0,5,8
Jet Airways,9/06/2019,Kolkata,Banglore,CCU → BOM → BLR,06:30,12:00,5h 30m,1 stop,In-flight meal not included,10844,2019-06-09,9,6,6,330,1,6,12
SpiceJet,12/05/2019,Mumbai,Hyderabad,BOM → HYD,13:15,14:45,1h 30m,non-stop,No info,2227,2019-05-12,12,5,6,90,0,13,14
Jet Airways,1/04/2019,Banglore,Delhi,BLR → DEL,19:50,22:50,3h,non-stop,No info,7229,2019-04-01,1,4,0,180,0,19,22
Jet Airways,6/06/2019,Delhi,Cochin,DEL → JAI → BOM → COK,05:30,19:00,13h 30m,2 stops,In-flight meal not included,10368,2019-06-06,6,6,3,810,2,5,19
Jet Airways,21/05/2019,Delhi,Cochin,DEL → BOM → COK,17:30,04:25 22 May,10h 55m,1 stop,In-flight meal not included,12898,2019-05-21,21,5,1,655,1,17,4
Multiple carriers,12/06/2019,Delhi,Cochin,DEL → BOM → COK,07:00,19:00,12h,1 stop,No info,12192,2019-06-12,12,6,2,720,1,7,19
Jet Airways,9/05/2019,Kolkata,Banglore,CCU → DEL → BLR,09:35,23:35,14h,1 stop,No info,12121,2019-05-09,9,5,3,840,1,9,23
Air India,27/05/2019,Delhi,Cochin,DEL → CCU → BOM → COK,06:50,07:40 28 May,24h 50m,2 stops,No info,16163,2019-05-27,27,5,0,1490,2,6,7
Jet Airways,18/03/2019,Banglore,New Delhi,BLR → BOM → DEL,05:45,18:25,12h 40m,1 stop,No info,12284,2019-03-18,18,3,0,760,1,5,18
IndiGo,21/06/2019,Banglore,Delhi,BLR → DEL,19:30,22:15,2h 45m,non-stop,No info,5780,2019-06-21,21,6,4,165,0,19,22
Jet Airways,9/05/2019,Mumbai,Hyderabad,BOM → HYD,10:20,11:50,1h 30m,non-stop,In-flight meal not included,4995,2019-05-09,9,5,3,90,0,10,11
IndiGo,9/06/2019,Delhi,Cochin,DEL → BLR → COK,05:10,10:05,4h 55m,1 stop,No info,6496,2019-06-09,9,6,6,295,1,5,10
Air India,12/06/2019,Delhi,Cochin,DEL → LKO → BOM → COK,12:20,19:15 13 Jun,30h 55m,2 stops,No info,12488,2019-06-12,12,6,2,1855,2,12,19
IndiGo,15/05/2019,Banglore,Delhi,BLR → DEL,07:10,10:05,2h 55m,non-stop,No info,4823,2019-05-15,15,5,2,175,0,7,10
SpiceJet,18/06/2019,Mumbai,Hyderabad,BOM → HYD,05:45,07:15,1h 30m,non-stop,No check-in baggage included,2647,2019-06-18,18,6,1,90,0,5,7
IndiGo,03/03/2019,Banglore,New Delhi,BLR → DEL,13:00,15:50,2h 50m,non-stop,No info,12649,2019-03-03,3,3,6,170,0,13,15
Multiple carriers,12/06/2019,Delhi,Cochin,DEL → BOM → COK,11:40,19:15,7h 35m,1 stop,No info,8266,2019-06-12,12,6,2,455,1,11,19
Vistara,15/05/2019,Delhi,Cochin,DEL → COK,06:00,09:10,3h 10m,non-stop,No info,6216,2019-05-15,15,5,2,190,0,6,9
IndiGo,1/04/2019,Banglore,Delhi,BLR → DEL,01:30,04:15,2h 45m,non-stop,No info,4423,2019-04-01,1,4,0,165,0,1,4
Jet Airways,06/03/2019,Banglore,New Delhi,BLR → BOM → DEL,08:00,08:15 07 Mar,24h 15m,1 stop,No info,17996,2019-03-06,6,3,2,1455,1,8,8
SpiceJet,15/04/2019,Delhi,Cochin,DEL → PNQ → COK,08:45,13:15,4h 30m,1 stop,No check-in baggage included,5726,2019-04-15,15,4,0,270,1,8,13
Multiple carriers,6/03/2019,Delhi,Cochin,DEL → BOM → COK,06:00,15:30,9h 30m,1 stop,No info,15147,2019-03-06,6,3,2,570,1,6,15
Jet Airways,18/05/2019,Delhi,Cochin,DEL → BOM → COK,20:55,19:00 19 May,22h 5m,1 stop,No info,15554,2019-05-18,18,5,5,1325,1,20,19
Jet Airways,24/06/2019,Delhi,Cochin,DEL → AMD → BOM → COK,23:05,04:25 26 Jun,29h 20m,2 stops,No info,12819,2019-06-24,24,6,0,1760,2,23,4
Multiple carriers,27/06/2019,Delhi,Cochin,DEL → BOM → COK,18:00,01:30 28 Jun,7h 30m,1 stop,No info,7198,2019-06-27,27,6,3,450,1,18,1
IndiGo,3/04/2019,Delhi,Cochin,DEL → BOM → COK,16:00,21:00,5h,1 stop,No info,5073,2019-04-03,3,4,2,300,1,16,21
IndiGo,27/06/2019,Banglore,Delhi,BLR → DEL,21:15,00:15 28 Jun,3h,non-stop,No info,3943,2019-06-27,27,6,3,180,0,21,0
Jet Airways,27/03/2019,Mumbai,Hyderabad,BOM → HYD,07:10,08:35,1h 25m,non-stop,In-flight meal not included,3205,2019-03-27,27,3,2,85,0,7,8
SpiceJet,12/05/2019,Banglore,Delhi,BLR → DEL,05:55,08:35,2h 40m,non-stop,No check-in baggage included,3257,2019-05-12,12,5,6,160,0,5,8
IndiGo,3/06/2019,Kolkata,Banglore,CCU → BLR,22:15,00:50 04 Jun,2h 35m,non-stop,No info,4804,2019-06-03,3,6,0,155,0,22,0
IndiGo,09/03/2019,Banglore,New Delhi,BLR → NAG → DEL,16:50,21:35,4h 45m,1 stop,No info,10231,2019-03-09,9,3,5,285,1,16,21
Jet Airways,21/05/2019,Delhi,Cochin,DEL → BOM → COK,20:55,04:25 22 May,7h 30m,1 stop,In-flight meal not included,12898,2019-05-21,21,5,1,450,1,20,4
IndiGo,21/03/2019,Mumbai,Hyderabad,BOM → HYD,21:20,22:45,1h 25m,non-stop,No info,2227,2019-03-21,21,3,3,85,0,21,22
Air India,1/04/2019,Kolkata,Banglore,CCU → BBI → BOM → BLR,12:00,11:10 02 Apr,23h 10m,2 stops,No info,9258,2019-04-01,1,4,0,1390,2,12,11
Jet Airways,24/05/2019,Kolkata,Banglore,CCU → BOM → BLR,16:30,09:20 25 May,16h 50m,1 stop,In-flight meal not included,9663,2019-05-24,24,5,4,1010,1,16,9
Jet Airways,21/05/2019,Mumbai,Hyderabad,BOM → HYD,07:05,08:30,1h 25m,non-stop,No info,8040,2019-05-21,21,5,1,85,0,7,8
GoAir,6/06/2019,Banglore,Delhi,BLR → DEL,20:55,23:40,2h 45m,non-stop,No info,3419,2019-06-06,6,6,3,165,0,20,23
Jet Airways,1/06/2019,Banglore,Delhi,BLR → DEL,07:10,10:10,3h,non-stop,No info,8016,2019-06-01,1,6,5,180,0,7,10
Jet Airways,6/04/2019,Banglore,Delhi,BLR → DEL,17:45,20:45,3h,non-stop,No info,7229,2019-04-06,6,4,5,180,0,17,20
GoAir,6/06/2019,Delhi,Cochin,DEL → BOM → COK,10:35,19:35,9h,1 stop,No info,4959,2019-06-06,6,6,3,540,1,10,19
Air India,9/06/2019,Kolkata,Banglore,CCU → BBI → BOM → BLR,12:00,11:10 10 Jun,23h 10m,2 stops,No info,10151,2019-06-09,9,6,6,1390,2,12,11
Air India,18/05/2019,Delhi,Cochin,DEL → RPR → NAG → BOM → COK,05:15,19:15 19 May,38h,3 stops,No info,10703,2019-05-18,18,5,5,2280,3,5,19
Jet Airways,9/06/2019,Kolkata,Banglore,CCU → BOM → BLR,08:25,18:15,9h 50m,1 stop,In-flight meal not included,10844,2019-06-09,9,6,6,590,1,8,18
IndiGo,6/03/2019,Delhi,Cochin,DEL → HYD → COK,16:10,22:20,6h 10m,1 stop,No info,7205,2019-03-06,6,3,2,370,1,16,22
Jet Airways,18/03/2019,Banglore,New Delhi,BLR → BOM → DEL,08:55,18:25,9h 30m,1 stop,No info,12284,2019-03-18,18,3,0,570,1,8,18
Jet Airways,9/06/2019,Kolkata,Banglore,CCU → DEL → BLR,09:35,22:05,12h 30m,1 stop,In-flight meal not included,13994,2019-06-09,9,6,6,750,1,9,22
IndiGo,15/04/2019,Delhi,Cochin,DEL → COK,14:25,17:40,3h 15m,non-stop,No info,6015,2019-04-15,15,4,0,195,0,14,17
IndiGo,3/04/2019,Kolkata,Banglore,CCU → MAA → BLR,06:15,10:30,4h 15m,1 stop,No info,4226,2019-04-03,3,4,2,255,1,6,10
Jet Airways,21/03/2019,Delhi,Cochin,DEL → AMD → BOM → COK,19:10,18:50 22 Mar,23h 40m,2 stops,No info,9483,2019-03-21,21,3,3,1420,2,19,18
Jet Airways,15/05/2019,Banglore,Delhi,BLR → DEL,07:10,10:10,3h,non-stop,In-flight meal not included,5198,2019-05-15,15,5,2,180,0,7,10
Jet Airways,27/06/2019,Delhi,Cochin,DEL → JAI → BOM → COK,05:30,19:00,13h 30m,2 stops,In-flight meal not included,10368,2019-06-27,27,6,3,810,2,5,19
Vistara,3/06/2019,Chennai,Kolkata,MAA → CCU,17:45,20:05,2h 20m,non-stop,No info,11982,2019-06-03,3,6,0,140,0,17,20
Air India,15/03/2019,Banglore,New Delhi,BLR → MAA → DEL,11:50,13:00 16 Mar,25h 10m,1 stop,No info,8032,2019-03-15,15,3,4,1510,1,11,13
Air India,15/05/2019,Kolkata,Banglore,CCU → BLR,14:15,16:45,2h 30m,non-stop,No info,5510,2019-05-15,15,5,2,150,0,14,16
IndiGo,9/05/2019,Delhi,Cochin,DEL → PNQ → COK,23:30,04:35 10 May,5h 5m,1 stop,No info,8177,2019-05-09,9,5,3,305,1,23,4
Air Asia,1/06/2019,Delhi,Cochin,DEL → BLR → COK,16:45,22:25,5h 40m,1 stop,No info,11410,2019-06-01,1,6,5,340,1,16,22
GoAir,21/03/2019,Delhi,Cochin,DEL → BOM → COK,07:00,12:50,5h 50m,1 stop,No info,9385,2019-03-21,21,3,3,350,1,7,12
Jet Airways,6/06/2019,Delhi,Cochin,DEL → BOM → COK,10:00,19:00,9h,1 stop,In-flight meal not included,10262,2019-06-06,6,6,3,540,1,10,19
SpiceJet,18/06/2019,Kolkata,Banglore,CCU → BLR,09:00,11:25,2h 25m,non-stop,No info,3873,2019-06-18,18,6,1,145,0,9,11
Multiple carriers,21/03/2019,Delhi,Cochin,DEL → BOM → COK,11:40,18:50,7h 10m,1 stop,No info,11999,2019-03-21,21,3,3,430,1,11,18
Jet Airways,27/06/2019,Delhi,Cochin,DEL → ATQ → BOM → COK,18:20,12:35 28 Jun,18h 15m,2 stops,No info,14300,2019-06-27,27,6,3,1095,2,18,12
SpiceJet,12/05/2019,Mumbai,Hyderabad,BOM → HYD,13:15,14:45,1h 30m,non-stop,No check-in baggage included,2175,2019-05-12,12,5,6,90,0,13,14
Air India,9/05/2019,Delhi,Cochin,DEL → CCU → BOM → COK,06:50,07:40 10 May,24h 50m,2 stops,No info,14431,2019-05-09,9,5,3,1490,2,6,7
Jet Airways,21/05/2019,Banglore,Delhi,BLR → DEL,06:00,08:45,2h 45m,non-stop,No info,7229,2019-05-21,21,5,1,165,0,6,8
IndiGo,24/05/2019,Kolkata,Banglore,CCU → HYD → BLR,19:20,23:45,4h 25m,1 stop,No info,3809,2019-05-24,24,5,4,265,1,19,23
Multiple carriers,24/06/2019,Delhi,Cochin,DEL → BOM → COK,07:30,19:15,11h 45m,1 stop,No info,7354,2019-06-24,24,6,0,705,1,7,19
Multiple carriers,27/03/2019,Delhi,Cochin,DEL → BOM → COK,08:00,15:30,7h 30m,1 stop,No info,12537,2019-03-27,27,3,2,450,1,8,15
Air India,27/05/2019,Delhi,Cochin,DEL → BOM → COK,13:00,19:15,6h 15m,1 stop,No info,9719,2019-05-27,27,5,0,375,1,13,19
Jet Airways,24/05/2019,Mumbai,Hyderabad,BOM → HYD,10:20,11:50,1h 30m,non-stop,No info,8040,2019-05-24,24,5,4,90,0,10,11
Jet Airways,24/05/2019,Mumbai,Hyderabad,BOM → HYD,07:05,08:30,1h 25m,non-stop,In-flight meal not included,4995,2019-05-24,24,5,4,85,0,7,8
IndiGo,6/04/2019,Banglore,Delhi,BLR → DEL,23:30,02:20 07 Apr,2h 50m,non-stop,No info,4591,2019-04-06,6,4,5,170,0,23,2
Air India,6/06/2019,Kolkata,Banglore,CCU → GAU → BLR,16:45,21:05 07 Jun,28h 20m,1 stop,No info,7662,2019-06-06,6,6,3,1700,1,16,21
IndiGo,24/06/2019,Chennai,Kolkata,MAA → CCU,07:55,10:15,2h 20m,non-stop,No info,3850,2019-06-24,24,6,0,140,0,7,10
IndiGo,3/06/2019,Delhi,Cochin,DEL → HYD → COK,08:35,22:30,13h 55m,1 stop,No info,6442,2019-06-03,3,6,0,835,1,8,22
IndiGo,3/06/2019,Delhi,Cochin,DEL → PNQ → COK,23:30,04:35 04 Jun,5h 5m,1 stop,No info,11378,2019-06-03,3,6,0,305,1,23,4
Multiple carriers,27/06/2019,Delhi,Cochin,DEL → BOM → COK,15:00,01:30 28 Jun,10h 30m,1 stop,No info,13377,2019-06-27,27,6,3,630,1,15,1
Jet Airways,21/05/2019,Kolkata,Banglore,CCU → BOM → BLR,08:25,20:45,12h 20m,1 stop,In-flight meal not included,10844,2019-05-21,21,5,1,740,1,8,20
Jet Airways,9/05/2019,Mumbai,Hyderabad,BOM → HYD,07:05,08:30,1h 25m,non-stop,In-flight meal not included,4995,2019-05-09,9,5,3,85,0,7,8
Air India,27/03/2019,Delhi,Cochin,DEL → HYD → MAA → COK,17:15,09:25 28 Mar,16h 10m,2 stops,No info,6057,2019-03-27,27,3,2,970,2,17,9
Air India,6/04/2019,Banglore,Delhi,BLR → DEL,10:00,12:45,2h 45m,non-stop,No info,5176,2019-04-06,6,4,5,165,0,10,12
Jet Airways,9/06/2019,Delhi,Cochin,DEL → JAI → BOM → COK,09:40,04:25 10 Jun,18h 45m,2 stops,No info,13014,2019-06-09,9,6,6,1125,2,9,4
IndiGo,01/03/2019,Banglore,New Delhi,BLR → HYD → DEL,16:15,20:35,4h 20m,1 stop,No Info,7917,2019-03-01,1,3,4,260,1,16,20
SpiceJet,9/06/2019,Delhi,Cochin,DEL → MAA → COK,06:05,11:20,5h 15m,1 stop,No info,5583,2019-06-09,9,6,6,315,1,6,11
Jet Airways,9/04/2019,Banglore,Delhi,BLR → DEL,06:00,08:45,2h 45m,non-stop,No info,7229,2019-04-09,9,4,1,165,0,6,8
IndiGo,18/05/2019,Delhi,Cochin,DEL → BOM → COK,16:00,01:30 19 May,9h 30m,1 stop,No info,7191,2019-05-18,18,5,5,570,1,16,1
Jet Airways,12/06/2019,Mumbai,Hyderabad,BOM → HYD,19:35,21:05,1h 30m,non-stop,In-flight meal not included,3210,2019-06-12,12,6,2,90,0,19,21
IndiGo,6/03/2019,Delhi,Cochin,DEL → BOM → COK,15:00,01:35 07 Mar,10h 35m,1 stop,No info,14871,2019-03-06,6,3,2,635,1,15,1
Multiple carriers,15/05/2019,Delhi,Cochin,DEL → BOM → COK,08:30,19:15,10h 45m,1 stop,No info,8099,2019-05-15,15,5,2,645,1,8,19
Air India,21/05/2019,Kolkata,Banglore,CCU → BOM → BLR,09:25,18:30,9h 5m,1 stop,No info,8366,2019-05-21,21,5,1,545,1,9,18
IndiGo,9/03/2019,Chennai,Kolkata,MAA → CCU,22:05,00:25 10 Mar,2h 20m,non-stop,No info,6297,2019-03-09,9,3,5,140,0,22,0
Multiple carriers,3/03/2019,Delhi,Cochin,DEL → BOM → COK,13:00,21:00,8h,1 stop,No info,18286,2019-03-03,3,3,6,480,1,13,21
Jet Airways,6/03/2019,Delhi,Cochin,DEL → BOM → COK,23:05,19:45 07 Mar,20h 40m,1 stop,No info,17024,2019-03-06,6,3,2,1240,1,23,19
Jet Airways,24/04/2019,Banglore,Delhi,BLR → DEL,07:10,10:10,3h,non-stop,In-flight meal not included,6144,2019-04-24,24,4,2,180,0,7,10
Multiple carriers,9/03/2019,Delhi,Cochin,DEL → BOM → COK,06:00,19:45,13h 45m,1 stop,No info,13941,2019-03-09,9,3,5,825,1,6,19
Jet Airways,9/05/2019,Banglore,Delhi,BLR → DEL,18:55,22:00,3h 5m,non-stop,In-flight meal not included,3702,2019-05-09,9,5,3,185,0,18,22
SpiceJet,15/05/2019,Delhi,Cochin,DEL → MAA → COK,06:05,11:20,5h 15m,1 stop,No info,5583,2019-05-15,15,5,2,315,1,6,11
Air India,12/03/2019,Mumbai,Hyderabad,BOM → DEL → HYD,19:40,09:10 13 Mar,13h 30m,1 stop,No info,10208,2019-03-12,12,3,1,810,1,19,9
Jet Airways,6/05/2019,Kolkata,Banglore,CCU → DEL → BLR,09:35,18:00,8h 25m,1 stop,In-flight meal not included,12384,2019-05-06,6,5,0,505,1,9,18
Air India,6/05/2019,Kolkata,Banglore,CCU → DEL → AMD → BLR,10:00,05:25 07 May,19h 25m,2 stops,No info,17049,2019-05-06,6,5,0,1165,2,10,5
IndiGo,24/05/2019,Delhi,Cochin,DEL → BOM → COK,07:30,21:00,13h 30m,1 stop,No info,7006,2019-05-24,24,5,4,810,1,7,21
Air India,12/06/2019,Kolkata,Banglore,CCU → IXR → DEL → BLR,05:50,20:25,14h 35m,2 stops,No info,12723,2019-06-12,12,6,2,875,2,5,20
Jet Airways,12/06/2019,Delhi,Cochin,DEL → BOM → COK,08:00,04:25 13 Jun,20h 25m,1 stop,In-flight meal not included,10577,2019-06-12,12,6,2,1225,1,8,4
Jet Airways,06/03/2019,Banglore,New Delhi,BLR → BOM → DEL,07:00,19:10,12h 10m,1 stop,No info,16736,2019-03-06,6,3,2,730,1,7,19
Jet Airways,24/06/2019,Delhi,Cochin,DEL → BOM → COK,13:00,04:25 25 Jun,15h 25m,1 stop,In-flight meal not included,10262,2019-06-24,24,6,0,925,1,13,4
Multiple carriers,24/06/2019,Delhi,Cochin,DEL → BOM → COK,11:25,19:15,7h 50m,1 stop,No info,7155,2019-06-24,24,6,0,470,1,11,19
Multiple carriers,3/03/2019,Delhi,Cochin,DEL → BOM → COK,10:20,01:35 04 Mar,15h 15m,1 stop,No info,15147,2019-03-03,3,3,6,915,1,10,1
IndiGo,12/06/2019,Banglore,Delhi,BLR → DEL,07:10,10:05,2h 55m,non-stop,No info,4823,2019-06-12,12,6,2,175,0,7,10
Air India,15/03/2019,Banglore,New Delhi,BLR → BBI → DEL,09:30,16:20,6h 50m,1 stop,No info,8714,2019-03-15,15,3,4,410,1,9,16
Jet Airways,6/05/2019,Kolkata,Banglore,CCU → DEL → BLR,09:35,09:45 07 May,24h 10m,1 stop,No info,10953,2019-05-06,6,5,0,1450,1,9,9
Air India,12/06/2019,Kolkata,Banglore,CCU → DEL → BLR,20:30,20:25 13 Jun,23h 55m,1 stop,No info,10203,2019-06-12,12,6,2,1435,1,20,20
Jet Airways,18/05/2019,Delhi,Cochin,DEL → BOM → COK,13:00,12:35 19 May,23h 35m,1 stop,In-flight meal not included,12373,2019-05-18,18,5,5,1415,1,13,12
Jet Airways,12/05/2019,Kolkata,Banglore,CCU → DEL → BLR,09:35,23:35,14h,1 stop,No info,14151,2019-05-12,12,5,6,840,1,9,23
Jet Airways,24/05/2019,Kolkata,Banglore,CCU → DEL → BLR,09:35,14:25 25 May,28h 50m,1 stop,No info,12121,2019-05-24,24,5,4,1730,1,9,14
Vistara,9/04/2019,Delhi,Cochin,DEL → COK,06:00,09:10,3h 10m,non-stop,No info,5586,2019-04-09,9,4,1,190,0,6,9
Jet Airways,18/05/2019,Kolkata,Banglore,CCU → BOM → BLR,08:25,12:00 19 May,27h 35m,1 stop,In-flight meal not included,10844,2019-05-18,18,5,5,1655,1,8,12
Jet Airways,21/05/2019,Kolkata,Banglore,CCU → BOM → BLR,21:10,04:40 22 May,7h 30m,1 stop,In-flight meal not included,8586,2019-05-21,21,5,1,450,1,21,4
SpiceJet,6/06/2019,Delhi,Cochin,DEL → BLR → COK,17:55,22:50,4h 55m,1 stop,No info,5409,2019-06-06,6,6,3,295,1,17,22
Multiple carriers,21/03/2019,Delhi,Cochin,DEL → HYD → MAA → COK,09:45,21:20,11h 35m,2 stops,No info,7178,2019-03-21,21,3,3,695,2,9,21
Multiple carriers,24/06/2019,Delhi,Cochin,DEL → BOM → COK,10:20,01:30 25 Jun,15h 10m,1 stop,In-flight meal not included,5797,2019-06-24,24,6,0,910,1,10,1
Jet Airways,24/03/2019,Kolkata,Banglore,CCU → BOM → BLR,19:45,19:40 25 Mar,23h 55m,1 stop,No info,13759,2019-03-24,24,3,6,1435,1,19,19
Air India,24/05/2019,Kolkata,Banglore,CCU → DEL → COK → BLR,07:00,01:20 25 May,18h 20m,2 stops,No info,13873,2019-05-24,24,5,4,1100,2,7,1
Jet Airways,21/05/2019,Delhi,Cochin,DEL → BOM → COK,20:55,19:00 22 May,22h 5m,1 stop,No info,16079,2019-05-21,21,5,1,1325,1,20,19
SpiceJet,27/06/2019,Mumbai,Hyderabad,BOM → HYD,13:15,14:45,1h 30m,non-stop,No info,2017,2019-06-27,27,6,3,90,0,13,14
Jet Airways,18/05/2019,Kolkata,Banglore,CCU → BOM → BLR,20:00,18:15 19 May,22h 15m,1 stop,In-flight meal not included,10844,2019-05-18,18,5,5,1335,1,20,18
SpiceJet,24/04/2019,Banglore,Delhi,BLR → DEL,21:10,00:05 25 Apr,2h 55m,non-stop,No check-in baggage included,3573,2019-04-24,24,4,2,175,0,21,0
Jet Airways,6/05/2019,Kolkata,Banglore,CCU → DEL → BLR,09:35,09:45 07 May,24h 10m,1 stop,In-flight meal not included,8066,2019-05-06,6,5,0,1450,1,9,9
Jet Airways,9/03/2019,Delhi,Cochin,DEL → BOM → COK,20:50,18:50 10 Mar,22h,1 stop,In-flight meal not included,14053,2019-03-09,9,3,5,1320,1,20,18
Jet Airways,18/03/2019,Banglore,New Delhi,BLR → BOM → DEL,08:00,15:15,7h 15m,1 stop,No info,12284,2019-03-18,18,3,0,435,1,8,15
SpiceJet,9/04/2019,Delhi,Cochin,DEL → MAA → COK,06:05,11:20,5h 15m,1 stop,No info,5351,2019-04-09,9,4,1,315,1,6,11
Jet Airways,1/04/2019,Kolkata,Banglore,CCU → BOM → BLR,16:30,16:20 02 Apr,23h 50m,1 stop,In-flight meal not included,7064,2019-04-01,1,4,0,1430,1,16,16
IndiGo,3/03/2019,Delhi,Cochin,DEL → MAA → COK,02:05,07:25,5h 20m,1 stop,No info,10394,2019-03-03,3,3,6,320,1,2,7
Jet Airways,15/05/2019,Kolkata,Banglore,CCU → BOM → BLR,18:55,09:20 16 May,14h 25m,1 stop,In-flight meal not included,9663,2019-05-15,15,5,2,865,1,18,9
Multiple carriers,18/05/2019,Delhi,Cochin,DEL → BOM → COK,17:30,01:30 19 May,8h,1 stop,No info,13727,2019-05-18,18,5,5,480,1,17,1
Jet Airways,12/06/2019,Delhi,Cochin,DEL → BOM → COK,19:15,12:35 13 Jun,17h 20m,1 stop,In-flight meal not included,10262,2019-06-12,12,6,2,1040,1,19,12
IndiGo,9/04/2019,Banglore,Delhi,BLR → DEL,07:10,10:05,2h 55m,non-stop,No info,4823,2019-04-09,9,4,1,175,0,7,10
Air Asia,03/03/2019,Banglore,New Delhi,BLR → DEL,05:50,08:40,2h 50m,non-stop,No info,7074,2019-03-03,3,3,6,170,0,5,8
Multiple carriers,6/03/2019,Delhi,Cochin,DEL → BOM → COK,07:05,21:00,13h 55m,1 stop,No info,17267,2019-03-06,6,3,2,835,1,7,21
Multiple carriers,21/05/2019,Delhi,Cochin,DEL → BOM → COK,15:00,01:30 22 May,10h 30m,1 stop,No info,14067,2019-05-21,21,5,1,630,1,15,1
IndiGo,1/05/2019,Banglore,Delhi,BLR → DEL,08:30,11:20,2h 50m,non-stop,No info,4823,2019-05-01,1,5,2,170,0,8,11
IndiGo,27/04/2019,Banglore,Delhi,BLR → DEL,20:00,22:50,2h 50m,non-stop,No info,4823,2019-04-27,27,4,5,170,0,20,22
Air Asia,12/05/2019,Banglore,Delhi,BLR → DEL,23:55,02:45 13 May,2h 50m,non-stop,No info,4483,2019-05-12,12,5,6,170,0,23,2
Air India,6/06/2019,Kolkata,Banglore,CCU → GAU → DEL → BLR,09:50,23:15,13h 25m,2 stops,No info,14960,2019-06-06,6,6,3,805,2,9,23
Air India,1/06/2019,Banglore,Delhi,BLR → DEL,17:00,19:45,2h 45m,non-stop,No info,7171,2019-06-01,1,6,5,165,0,17,19
Air India,24/03/2019,Kolkata,Banglore,CCU → DEL → BLR,20:30,08:55 25 Mar,12h 25m,1 stop,No info,12173,2019-03-24,24,3,6,745,1,20,8
Air India,03/03/2019,Banglore,New Delhi,BLR → AMD → DEL,00:30,08:45,8h 15m,1 stop,No info,11392,2019-03-03,3,3,6,495,1,0,8
Air India,15/05/2019,Kolkata,Banglore,CCU → DEL → COK → BLR,10:00,13:45 16 May,27h 45m,2 stops,No info,16057,2019-05-15,15,5,2,1665,2,10,13
Jet Airways,9/06/2019,Kolkata,Banglore,CCU → DEL → BLR,17:00,10:55 10 Jun,17h 55m,1 stop,No info,14151,2019-06-09,9,6,6,1075,1,17,10
Jet Airways,21/05/2019,Banglore,Delhi,BLR → DEL,11:10,14:05,2h 55m,non-stop,In-flight meal not included,4030,2019-05-21,21,5,1,175,0,11,14
IndiGo,6/05/2019,Kolkata,Banglore,CCU → BBI → BLR,19:35,23:15,3h 40m,1 stop,No info,4226,2019-05-06,6,5,0,220,1,19,23
Air India,9/03/2019,Delhi,Cochin,DEL → BOM → COK,04:00,19:15,15h 15m,1 stop,No info,11050,2019-03-09,9,3,5,915,1,4,19
Air India,21/05/2019,Banglore,Delhi,BLR → DEL,10:00,12:45,2h 45m,non-stop,No info,6961,2019-05-21,21,5,1,165,0,10,12
Jet Airways,24/03/2019,Kolkata,Banglore,CCU → BOM → BLR,21:10,09:15 25 Mar,12h 5m,1 stop,No info,14231,2019-03-24,24,3,6,725,1,21,9
Jet Airways,27/06/2019,Delhi,Cochin,DEL → NAG → BOM → COK,14:35,12:35 28 Jun,22h,2 stops,In-flight meal not included,10919,2019-06-27,27,6,3,1320,2,14,12
Air India,27/03/2019,Delhi,Cochin,DEL → LKO → BOM → COK,07:00,19:15,12h 15m,2 stops,No info,10913,2019-03-27,27,3,2,735,2,7,19
IndiGo,27/06/2019,Chennai,Kolkata,MAA → CCU,22:05,00:25 28 Jun,2h 20m,non-stop,No info,5277,2019-06-27,27,6,3,140,0,22,0
Multiple carriers,21/05/2019,Delhi,Cochin,DEL → BOM → COK,10:20,21:00,10h 40m,1 stop,No info,7485,2019-05-21,21,5,1,640,1,10,21
Jet Airways,24/03/2019,Kolkata,Banglore,CCU → BOM → BLR,16:55,16:20 25 Mar,23h 25m,1 stop,No info,14231,2019-03-24,24,3,6,1405,1,16,16
GoAir,6/04/2019,Delhi,Cochin,DEL → AMD → COK,07:25,13:35,6h 10m,1 stop,No info,4201,2019-04-06,6,4,5,370,1,7,13
Air India,6/03/2019,Delhi,Cochin,DEL → COK,14:10,17:10,3h,non-stop,No info,7931,2019-03-06,6,3,2,180,0,14,17
Multiple carriers,15/05/2019,Delhi,Cochin,DEL → HYD → COK,14:55,22:30,7h 35m,1 stop,No info,6513,2019-05-15,15,5,2,455,1,14,22
Jet Airways,6/06/2019,Delhi,Cochin,DEL → BOM → COK,15:00,19:00 07 Jun,28h,1 stop,No info,14714,2019-06-06,6,6,3,1680,1,15,19
IndiGo,9/05/2019,Kolkata,Banglore,CCU → NAG → BLR,18:05,23:30,5h 25m,1 stop,No info,6218,2019-05-09,9,5,3,325,1,18,23
Air India,27/06/2019,Delhi,Cochin,DEL → JAI → BOM → COK,12:00,19:15,7h 15m,2 stops,No info,8603,2019-06-27,27,6,3,435,2,12,19
IndiGo,21/05/2019,Delhi,Cochin,DEL → BOM → COK,08:30,21:00,12h 30m,1 stop,No info,7318,2019-05-21,21,5,1,750,1,8,21
Multiple carriers,15/06/2019,Delhi,Cochin,DEL → BOM → COK,10:00,19:00,9h,1 stop,No info,13504,2019-06-15,15,6,5,540,1,10,19
Multiple carriers,15/05/2019,Delhi,Cochin,DEL → HYD → COK,07:05,22:30,15h 25m,1 stop,No info,9646,2019-05-15,15,5,2,925,1,7,22
IndiGo,27/05/2019,Kolkata,Banglore,CCU → BLR,11:30,14:05,2h 35m,non-stop,No info,5224,2019-05-27,27,5,0,155,0,11,14
Jet Airways,12/06/2019,Kolkata,Banglore,CCU → DEL → BLR,09:35,18:00,8h 25m,1 stop,No info,12692,2019-06-12,12,6,2,505,1,9,18
Jet Airways,6/06/2019,Kolkata,Banglore,CCU → GAU → BLR,10:20,17:35,7h 15m,1 stop,In-flight meal not included,9689,2019-06-06,6,6,3,435,1,10,17
Air India,9/05/2019,Kolkata,Banglore,CCU → DEL → COK → BLR,10:00,01:20 10 May,15h 20m,2 stops,No info,13033,2019-05-09,9,5,3,920,2,10,1
Jet Airways,12/06/2019,Kolkata,Banglore,CCU → BOM → BLR,06:30,16:20,9h 50m,1 stop,No info,13626,2019-06-12,12,6,2,590,1,6,16
IndiGo,18/05/2019,Mumbai,Hyderabad,BOM → HYD,19:05,20:35,1h 30m,non-stop,No info,2754,2019-05-18,18,5,5,90,0,19,20
Jet Airways,9/05/2019,Kolkata,Banglore,CCU → DEL → BLR,17:00,09:45 10 May,16h 45m,1 stop,No info,12121,2019-05-09,9,5,3,1005,1,17,9
IndiGo,24/04/2019,Banglore,Delhi,BLR → DEL,01:30,04:15,2h 45m,non-stop,No info,3419,2019-04-24,24,4,2,165,0,1,4
Air India,21/05/2019,Kolkata,Banglore,CCU → DEL → COK → BLR,10:00,01:20 22 May,15h 20m,2 stops,No info,13033,2019-05-21,21,5,1,920,2,10,1
IndiGo,6/04/2019,Kolkata,Banglore,CCU → BLR,04:40,07:15,2h 35m,non-stop,No info,4174,2019-04-06,6,4,5,155,0,4,7
Air Asia,27/06/2019,Delhi,Cochin,DEL → BLR → COK,07:55,22:25,14h 30m,1 stop,No info,6152,2019-06-27,27,6,3,870,1,7,22
Air India,27/06/2019,Delhi,Cochin,DEL → COK,05:10,08:00,2h 50m,non-stop,No info,5201,2019-06-27,27,6,3,170,0,5,8
Jet Airways,15/03/2019,Banglore,New Delhi,BLR → BOM → DEL,07:00,16:10,9h 10m,1 stop,In-flight meal not included,9134,2019-03-15,15,3,4,550,1,7,16
Air India,18/05/2019,Kolkata,Banglore,CCU → DEL → COK → BLR,07:00,01:20 19 May,18h 20m,2 stops,No info,13243,2019-05-18,18,5,5,1100,2,7,1
Jet Airways,27/05/2019,Delhi,Cochin,DEL → JAI → BOM → COK,05:30,04:25 28 May,22h 55m,2 stops,No info,15129,2019-05-27,27,5,0,1375,2,5,4
Jet Airways,9/05/2019,Mumbai,Hyderabad,BOM → HYD,19:35,21:05,1h 30m,non-stop,In-flight meal not included,2759,2019-05-09,9,5,3,90,0,19,21
IndiGo,15/05/2019,Banglore,Delhi,BLR → DEL,06:05,08:50,2h 45m,non-stop,No info,4423,2019-05-15,15,5,2,165,0,6,8
Vistara,18/05/2019,Kolkata,Banglore,CCU → DEL → BLR,07:10,22:40,15h 30m,1 stop,No info,9187,2019-05-18,18,5,5,930,1,7,22
Multiple carriers,18/05/2019,Delhi,Cochin,DEL → HYD → COK,07:10,22:30,15h 20m,1 stop,No info,7740,2019-05-18,18,5,5,920,1,7,22
Jet Airways,24/05/2019,Banglore,Delhi,BLR → DEL,19:50,22:50,3h,non-stop,In-flight meal not included,6144,2019-05-24,24,5,4,180,0,19,22
Multiple carriers,9/06/2019,Delhi,Cochin,DEL → BOM → COK,04:55,12:35,7h 40m,1 stop,No info,10877,2019-06-09,9,6,6,460,1,4,12
IndiGo,15/06/2019,Delhi,Cochin,DEL → HYD → COK,11:55,22:30,10h 35m,1 stop,No info,6442,2019-06-15,15,6,5,635,1,11,22
IndiGo,27/03/2019,Delhi,Cochin,DEL → BOM → COK,04:45,15:30,10h 45m,1 stop,No info,7048,2019-03-27,27,3,2,645,1,4,15
Multiple carriers,27/06/2019,Delhi,Cochin,DEL → BOM → COK,15:15,01:30 28 Jun,10h 15m,1 stop,In-flight meal not included,5797,2019-06-27,27,6,3,615,1,15,1
Air India,03/03/2019,Banglore,New Delhi,BLR → BOM → AMD → DEL,06:45,23:55,17h 10m,2 stops,No info,10573,2019-03-03,3,3,6,1030,2,6,23
IndiGo,15/05/2019,Delhi,Cochin,DEL → BOM → COK,08:30,21:00,12h 30m,1 stop,No info,7503,2019-05-15,15,5,2,750,1,8,21
IndiGo,12/06/2019,Delhi,Cochin,DEL → BOM → COK,17:30,01:30 13 Jun,8h,1 stop,No info,6104,2019-06-12,12,6,2,480,1,17,1
Jet Airways,9/05/2019,Kolkata,Banglore,CCU → BOM → BLR,21:10,08:15 10 May,11h 5m,1 stop,In-flight meal not included,9663,2019-05-09,9,5,3,665,1,21,8
Jet Airways,3/06/2019,Banglore,Delhi,BLR → DEL,11:10,14:05,2h 55m,non-stop,In-flight meal not included,5769,2019-06-03,3,6,0,175,0,11,14
Air India,15/06/2019,Mumbai,Hyderabad,BOM → HYD,13:55,15:25,1h 30m,non-stop,No info,3100,2019-06-15,15,6,5,90,0,13,15
Jet Airways,18/05/2019,Delhi,Cochin,DEL → BOM → COK,17:30,04:25 19 May,10h 55m,1 stop,In-flight meal not included,12373,2019-05-18,18,5,5,655,1,17,4
SpiceJet,15/03/2019,Kolkata,Banglore,CCU → BLR,09:00,11:30,2h 30m,non-stop,No check-in baggage included,3815,2019-03-15,15,3,4,150,0,9,11
Jet Airways,15/06/2019,Delhi,Cochin,DEL → ATQ → BOM → COK,12:15,12:35 16 Jun,24h 20m,2 stops,No info,14300,2019-06-15,15,6,5,1460,2,12,12
IndiGo,1/06/2019,Banglore,Delhi,BLR → DEL,07:10,10:05,2h 55m,non-stop,No info,4823,2019-06-01,1,6,5,175,0,7,10
IndiGo,18/06/2019,Mumbai,Hyderabad,BOM → HYD,19:05,20:35,1h 30m,non-stop,No info,2754,2019-06-18,18,6,1,90,0,19,20
Multiple carriers,3/06/2019,Delhi,Cochin,DEL → BOM → COK,06:00,19:15,13h 15m,1 stop,No info,9736,2019-06-03,3,6,0,795,1,6,19
Jet Airways,21/03/2019,Banglore,New Delhi,BLR → MAA → DEL,09:45,14:25,4h 40m,1 stop,In-flight meal not included,7280,2019-03-21,21,3,3,280,1,9,14
Multiple carriers,9/06/2019,Delhi,Cochin,DEL → BOM → COK,08:00,21:00,13h,1 stop,No info,7408,2019-06-09,9,6,6,780,1,8,21
Jet Airways,12/06/2019,Kolkata,Banglore,CCU → BOM → BLR,20:00,12:00 13 Jun,16h,1 stop,No info,13044,2019-06-12,12,6,2,960,1,20,12
Air India,24/05/2019,Kolkata,Banglore,CCU → IXR → DEL → BLR,05:50,23:15,17h 25m,2 stops,No info,12723,2019-05-24,24,5,4,1045,2,5,23
Jet Airways,6/05/2019,Kolkata,Banglore,CCU → BOM → BLR,16:30,04:40 07 May,12h 10m,1 stop,In-flight meal not included,8586,2019-05-06,6,5,0,730,1,16,4
IndiGo,12/06/2019,Delhi,Cochin,DEL → BOM → COK,16:00,01:30 13 Jun,9h 30m,1 stop,No info,6316,2019-06-12,12,6,2,570,1,16,1
Jet Airways,9/05/2019,Delhi,Cochin,DEL → BOM → COK,09:00,19:00,10h,1 stop,No info,15554,2019-05-09,9,5,3,600,1,9,19
SpiceJet,15/03/2019,Mumbai,Hyderabad,BOM → HYD,13:10,14:30,1h 20m,non-stop,No check-in baggage included,2385,2019-03-15,15,3,4,80,0,13,14
Multiple carriers,9/06/2019,Delhi,Cochin,DEL → BOM → COK,13:00,21:00,8h,1 stop,No info,13587,2019-06-09,9,6,6,480,1,13,21
IndiGo,3/03/2019,Delhi,Cochin,DEL → BBI → COK,02:35,08:30,5h 55m,1 stop,No info,13790,2019-03-03,3,3,6,355,1,2,8
Air India,15/05/2019,Delhi,Cochin,DEL → HYD → MAA → COK,09:45,09:25 16 May,23h 40m,2 stops,No info,10975,2019-05-15,15,5,2,1420,2,9,9
Jet Airways,21/05/2019,Kolkata,Banglore,CCU → BOM → BLR,08:25,09:20 22 May,24h 55m,1 stop,No info,14388,2019-05-21,21,5,1,1495,1,8,9
Multiple carriers,6/06/2019,Delhi,Cochin,DEL → BOM → COK,18:00,01:30 07 Jun,7h 30m,1 stop,No info,7198,2019-06-06,6,6,3,450,1,18,1
Jet Airways,9/05/2019,Delhi,Cochin,DEL → JAI → BOM → COK,09:40,12:35 10 May,26h 55m,2 stops,In-flight meal not included,13029,2019-05-09,9,5,3,1615,2,9,12
Multiple carriers,27/05/2019,Delhi,Cochin,DEL → BOM → COK,07:05,19:15,12h 10m,1 stop,In-flight meal not included,12717,2019-05-27,27,5,0,730,1,7,19
IndiGo,3/03/2019,Delhi,Cochin,DEL → BOM → COK,06:40,13:20,6h 40m,1 stop,No info,14871,2019-03-03,3,3,6,400,1,6,13
Jet Airways,6/06/2019,Kolkata,Banglore,CCU → BOM → PNQ → BLR,06:30,20:50,14h 20m,2 stops,In-flight meal not included,10118,2019-06-06,6,6,3,860,2,6,20
Jet Airways,6/06/2019,Delhi,Cochin,DEL → BOM → COK,22:50,04:25 07 Jun,5h 35m,1 stop,In-flight meal not included,10262,2019-06-06,6,6,3,335,1,22,4
Jet Airways,24/03/2019,Mumbai,Hyderabad,BOM → HYD,02:55,04:25,1h 30m,non-stop,In-flight meal not included,2071,2019-03-24,24,3,6,90,0,2,4
Air India,27/04/2019,Banglore,Delhi,BLR → DEL,21:05,23:55,2h 50m,non-stop,No info,5228,2019-04-27,27,4,5,170,0,21,23
Jet Airways,21/03/2019,Banglore,New Delhi,BLR → BOM → DEL,16:55,11:25 19 Mar,18h 30m,1 stop,In-flight meal not included,7832,2019-03-21,21,3,3,1110,1,16,11
Multiple carriers,6/06/2019,Delhi,Cochin,DEL → BOM → COK,11:40,21:00,9h 20m,1 stop,No info,7005,2019-06-06,6,6,3,560,1,11,21
Jet Airways,9/06/2019,Delhi,Cochin,DEL → BDQ → BOM → COK,18:25,12:35 10 Jun,18h 10m,2 stops,No info,14237,2019-06-09,9,6,6,1090,2,18,12
SpiceJet,6/04/2019,Banglore,Delhi,BLR → DEL,21:10,00:05 07 Apr,2h 55m,non-stop,No info,3971,2019-04-06,6,4,5,175,0,21,0
IndiGo,21/06/2019,Banglore,Delhi,BLR → DEL,22:10,01:00 22 Jun,2h 50m,non-stop,No info,3943,2019-06-21,21,6,4,170,0,22,1
IndiGo,27/03/2019,Delhi,Cochin,DEL → BOM → COK,06:40,15:30,8h 50m,1 stop,No info,8574,2019-03-27,27,3,2,530,1,6,15
Air India,15/06/2019,Delhi,Cochin,DEL → BHO → BOM → COK,05:55,19:15,13h 20m,2 stops,No info,12646,2019-06-15,15,6,5,800,2,5,19
Jet Airways,21/03/2019,Delhi,Cochin,DEL → UDR → BOM → COK,13:00,18:50 22 Mar,29h 50m,2 stops,No info,13082,2019-03-21,21,3,3,1790,2,13,18
Jet Airways,21/05/2019,Kolkata,Banglore,CCU → BOM → BLR,08:25,08:15 22 May,23h 50m,1 stop,No info,13941,2019-05-21,21,5,1,1430,1,8,8
GoAir,6/04/2019,Delhi,Cochin,DEL → BOM → COK,07:00,12:55,5h 55m,1 stop,No info,5135,2019-04-06,6,4,5,355,1,7,12
Air India,21/05/2019,Kolkata,Banglore,CCU → DEL → BLR,10:00,20:25,10h 25m,1 stop,No info,11096,2019-05-21,21,5,1,625,1,10,20
Jet Airways,18/03/2019,Banglore,New Delhi,BLR → BOM → DEL,22:50,09:30 16 Mar,10h 40m,1 stop,No info,13555,2019-03-18,18,3,0,640,1,22,9
Vistara,12/04/2019,Banglore,Delhi,BLR → DEL,09:45,12:35,2h 50m,non-stop,No info,5403,2019-04-12,12,4,4,170,0,9,12
Jet Airways,24/06/2019,Delhi,Cochin,DEL → JDH → BOM → COK,11:40,19:00,7h 20m,2 stops,In-flight meal not included,15812,2019-06-24,24,6,0,440,2,11,19
Jet Airways,21/05/2019,Kolkata,Banglore,CCU → BOM → BLR,20:00,08:15 22 May,12h 15m,1 stop,No info,14781,2019-05-21,21,5,1,735,1,20,8
Air India,6/06/2019,Delhi,Cochin,DEL → BLR → COK,13:30,23:00,9h 30m,1 stop,No info,8907,2019-06-06,6,6,3,570,1,13,23
Air India,3/05/2019,Kolkata,Banglore,CCU → BLR,20:45,23:20,2h 35m,non-stop,No info,4145,2019-05-03,3,5,4,155,0,20,23
Jet Airways,9/06/2019,Kolkata,Banglore,CCU → DEL → BLR,20:25,09:45 10 Jun,13h 20m,1 stop,No info,14151,2019-06-09,9,6,6,800,1,20,9
Multiple carriers,27/03/2019,Delhi,Cochin,DEL → BOM → COK,06:00,15:30,9h 30m,1 stop,No info,7845,2019-03-27,27,3,2,570,1,6,15
Multiple carriers,15/05/2019,Delhi,Cochin,DEL → BOM → COK,09:15,19:15,10h,1 stop,No info,8099,2019-05-15,15,5,2,600,1,9,19
Multiple carriers,27/05/2019,Delhi,Cochin,DEL → BOM → COK,15:00,01:30 28 May,10h 30m,1 stop,No info,13377,2019-05-27,27,5,0,630,1,15,1
Air India,12/03/2019,Banglore,New Delhi,BLR → HYD → VGA → DEL,06:50,11:20 13 Mar,28h 30m,2 stops,No info,12734,2019-03-12,12,3,1,1710,2,6,11
Jet Airways,3/06/2019,Delhi,Cochin,DEL → BOM → COK,22:50,04:25 04 Jun,5h 35m,1 stop,In-flight meal not included,10262,2019-06-03,3,6,0,335,1,22,4
Jet Airways,15/05/2019,Banglore,Delhi,BLR → DEL,18:55,22:00,3h 5m,non-stop,No info,7229,2019-05-15,15,5,2,185,0,18,22
Vistara,6/03/2019,Mumbai,Hyderabad,BOM → DEL → HYD,08:45,09:25 07 Mar,24h 40m,1 stop,No info,12395,2019-03-06,6,3,2,1480,1,8,9
Jet Airways,24/03/2019,Kolkata,Banglore,CCU → BOM → BLR,19:45,09:15 25 Mar,13h 30m,1 stop,In-flight meal not included,11134,2019-03-24,24,3,6,810,1,19,9
Jet Airways,21/03/2019,Delhi,Cochin,DEL → BOM → COK,13:00,18:50,5h 50m,1 stop,In-flight meal not included,6540,2019-03-21,21,3,3,350,1,13,18
Multiple carriers,6/06/2019,Delhi,Cochin,DEL → BOM → COK,06:40,19:15,12h 35m,1 stop,No info,7354,2019-06-06,6,6,3,755,1,6,19
Air India,24/06/2019,Delhi,Cochin,DEL → JAI → BOM → COK,12:00,07:40 25 Jun,19h 40m,2 stops,No info,9548,2019-06-24,24,6,0,1180,2,12,7
Vistara,1/05/2019,Kolkata,Banglore,CCU → DEL → BLR,07:10,10:45 02 May,27h 35m,1 stop,No info,9187,2019-05-01,1,5,2,1655,1,7,10
IndiGo,9/05/2019,Delhi,Cochin,DEL → HYD → COK,07:35,12:10,4h 35m,1 stop,No info,5054,2019-05-09,9,5,3,275,1,7,12
Air India,9/06/2019,Kolkata,Banglore,CCU → DEL → BLR,10:00,20:25,10h 25m,1 stop,No info,10413,2019-06-09,9,6,6,625,1,10,20
IndiGo,27/05/2019,Kolkata,Banglore,CCU → BLR,21:25,00:05 28 May,2h 40m,non-stop,No info,4804,2019-05-27,27,5,0,160,0,21,0
IndiGo,15/06/2019,Mumbai,Hyderabad,BOM → HYD,06:25,07:55,1h 30m,non-stop,No info,4049,2019-06-15,15,6,5,90,0,6,7
Multiple carriers,27/06/2019,Delhi,Cochin,DEL → BOM → COK,19:00,01:30 28 Jun,6h 30m,1 stop,No info,6795,2019-06-27,27,6,3,390,1,19,1
Air India,21/03/2019,Kolkata,Banglore,CCU → BLR,20:45,23:20,2h 35m,non-stop,No info,4435,2019-03-21,21,3,3,155,0,20,23
Jet Airways,12/06/2019,Kolkata,Banglore,CCU → BOM → BLR,16:30,04:40 13 Jun,12h 10m,1 stop,In-flight meal not included,6224,2019-06-12,12,6,2,730,1,16,4
IndiGo,12/06/2019,Kolkata,Banglore,CCU → BLR,20:20,22:55,2h 35m,non-stop,No info,4804,2019-06-12,12,6,2,155,0,20,22
IndiGo,15/04/2019,Delhi,Cochin,DEL → HYD → COK,05:05,16:10,11h 5m,1 stop,No info,6171,2019-04-15,15,4,0,665,1,5,16
IndiGo,3/06/2019,Delhi,Cochin,DEL → BOM → COK,11:25,21:00,9h 35m,1 stop,No info,6093,2019-06-03,3,6,0,575,1,11,21
IndiGo,12/04/2019,Kolkata,Banglore,CCU → BLR,17:15,19:50,2h 35m,non-stop,No info,4174,2019-04-12,12,4,4,155,0,17,19
IndiGo,6/05/2019,Mumbai,Hyderabad,BOM → HYD,02:35,04:05,1h 30m,non-stop,No info,3342,2019-05-06,6,5,0,90,0,2,4
Multiple carriers,3/06/2019,Delhi,Cochin,DEL → BOM → COK,10:00,21:00,11h,1 stop,No info,13587,2019-06-03,3,6,0,660,1,10,21
Jet Airways,21/05/2019,Delhi,Cochin,DEL → BOM → COK,21:50,04:25 22 May,6h 35m,1 stop,No info,16079,2019-05-21,21,5,1,395,1,21,4
IndiGo,18/04/2019,Delhi,Cochin,DEL → COK,05:35,08:50,3h 15m,non-stop,No info,6015,2019-04-18,18,4,3,195,0,5,8
Jet Airways,24/05/2019,Kolkata,Banglore,CCU → DEL → BLR,17:00,19:10 25 May,26h 10m,1 stop,No info,13067,2019-05-24,24,5,4,1570,1,17,19
Multiple carriers,15/05/2019,Delhi,Cochin,DEL → BOM → COK,04:55,12:35,7h 40m,1 stop,No info,9103,2019-05-15,15,5,2,460,1,4,12
Jet Airways,24/05/2019,Kolkata,Banglore,CCU → DEL → BLR,20:25,23:35 25 May,27h 10m,1 stop,No info,14151,2019-05-24,24,5,4,1630,1,20,23
Jet Airways,27/03/2019,Delhi,Cochin,DEL → IXC → BOM → COK,06:20,18:50,12h 30m,2 stops,No info,11538,2019-03-27,27,3,2,750,2,6,18
IndiGo,9/03/2019,Delhi,Cochin,DEL → HYD → MAA → COK,08:35,21:20,12h 45m,2 stops,No info,8146,2019-03-09,9,3,5,765,2,8,21
Air India,6/05/2019,Kolkata,Banglore,CCU → HYD → BLR,19:00,04:40 07 May,9h 40m,1 stop,No info,6117,2019-05-06,6,5,0,580,1,19,4
Jet Airways,3/03/2019,Delhi,Cochin,DEL → BOM → COK,02:15,04:25 04 Mar,26h 10m,1 stop,No info,17024,2019-03-03,3,3,6,1570,1,2,4
Jet Airways,01/03/2019,Banglore,New Delhi,BLR → BOM → DEL,14:05,07:40 02 Mar,17h 35m,1 stop,1 Long layover,22270,2019-03-01,1,3,4,1055,1,14,7
Jet Airways,9/06/2019,Kolkata,Banglore,CCU → DEL → BLR,20:25,21:05 10 Jun,24h 40m,1 stop,No info,12692,2019-06-09,9,6,6,1480,1,20,21
Vistara,12/06/2019,Kolkata,Banglore,CCU → DEL → BLR,07:10,20:20,13h 10m,1 stop,No info,8610,2019-06-12,12,6,2,790,1,7,20
Multiple carriers,24/06/2019,Delhi,Cochin,DEL → HYD → COK,07:10,22:30,15h 20m,1 stop,No info,6723,2019-06-24,24,6,0,920,1,7,22
Vistara,12/05/2019,Banglore,Delhi,BLR → DEL,17:00,19:35,2h 35m,non-stop,No info,4878,2019-05-12,12,5,6,155,0,17,19
Jet Airways,06/03/2019,Banglore,New Delhi,BLR → BOM → DEL,20:35,07:40 07 Mar,11h 5m,1 stop,No info,16736,2019-03-06,6,3,2,665,1,20,7
Jet Airways,24/03/2019,Kolkata,Banglore,CCU → BOM → BLR,13:55,09:15 25 Mar,19h 20m,1 stop,In-flight meal not included,11134,2019-03-24,24,3,6,1160,1,13,9
IndiGo,3/05/2019,Banglore,Delhi,BLR → DEL,04:00,06:50,2h 50m,non-stop,No info,3943,2019-05-03,3,5,4,170,0,4,6
Multiple carriers,12/06/2019,Delhi,Cochin,DEL → BOM → COK,09:00,21:00,12h,1 stop,No info,13587,2019-06-12,12,6,2,720,1,9,21
Jet Airways,6/03/2019,Delhi,Cochin,DEL → IDR → BOM → COK,05:25,04:25 07 Mar,23h,2 stops,No info,16914,2019-03-06,6,3,2,1380,2,5,4
SpiceJet,18/05/2019,Mumbai,Hyderabad,BOM → HYD,22:45,00:15 19 May,1h 30m,non-stop,No check-in baggage included,1965,2019-05-18,18,5,5,90,0,22,0
Multiple carriers,9/05/2019,Delhi,Cochin,DEL → BOM → COK,13:00,21:00,8h,1 stop,No info,8073,2019-05-09,9,5,3,480,1,13,21
IndiGo,3/06/2019,Banglore,Delhi,BLR → DEL,13:00,15:50,2h 50m,non-stop,No info,3943,2019-06-03,3,6,0,170,0,13,15
IndiGo,12/05/2019,Kolkata,Banglore,CCU → HYD → BLR,15:15,20:05,4h 50m,1 stop,No info,5170,2019-05-12,12,5,6,290,1,15,20
GoAir,15/05/2019,Banglore,Delhi,BLR → DEL,11:40,14:30,2h 50m,non-stop,No info,3398,2019-05-15,15,5,2,170,0,11,14
Air Asia,18/04/2019,Kolkata,Banglore,CCU → BLR,10:20,12:55,2h 35m,non-stop,No info,4409,2019-04-18,18,4,3,155,0,10,12
Jet Airways,21/06/2019,Banglore,Delhi,BLR → DEL,17:45,20:45,3h,non-stop,No info,8541,2019-06-21,21,6,4,180,0,17,20
IndiGo,21/03/2019,Banglore,New Delhi,BLR → DEL,04:00,06:50,2h 50m,non-stop,No info,4777,2019-03-21,21,3,3,170,0,4,6
SpiceJet,18/03/2019,Kolkata,Banglore,CCU → BLR,22:20,00:40 19 Mar,2h 20m,non-stop,No info,3847,2019-03-18,18,3,0,140,0,22,0
Jet Airways,1/04/2019,Kolkata,Banglore,CCU → BOM → BLR,18:55,12:00 02 Apr,17h 5m,1 stop,In-flight meal not included,7064,2019-04-01,1,4,0,1025,1,18,12
Vistara,27/05/2019,Banglore,Delhi,BLR → DEL,21:00,23:50,2h 50m,non-stop,No info,4668,2019-05-27,27,5,0,170,0,21,23
SpiceJet,18/03/2019,Mumbai,Hyderabad,BOM → HYD,22:45,00:10 19 Mar,1h 25m,non-stop,No check-in baggage included,1965,2019-03-18,18,3,0,85,0,22,0
Jet Airways,21/05/2019,Kolkata,Banglore,CCU → BOM → BLR,06:30,16:20,9h 50m,1 stop,No info,14781,2019-05-21,21,5,1,590,1,6,16
IndiGo,15/06/2019,Mumbai,Hyderabad,BOM → HYD,09:10,10:40,1h 30m,non-stop,No info,4049,2019-06-15,15,6,5,90,0,9,10
Jet Airways,18/05/2019,Kolkata,Banglore,CCU → BOM → BLR,18:55,08:15 19 May,13h 20m,1 stop,No info,13584,2019-05-18,18,5,5,800,1,18,8
Jet Airways,18/05/2019,Delhi,Cochin,DEL → BOM → COK,20:55,12:35 19 May,15h 40m,1 stop,In-flight meal not included,12373,2019-05-18,18,5,5,940,1,20,12
Jet Airways,27/05/2019,Delhi,Cochin,DEL → BOM → COK,16:00,19:00 28 May,27h,1 stop,No info,16079,2019-05-27,27,5,0,1620,1,16,19
Jet Airways,24/05/2019,Banglore,Delhi,BLR → DEL,08:20,11:20,3h,non-stop,No info,7229,2019-05-24,24,5,4,180,0,8,11
Jet Airways,06/03/2019,Banglore,New Delhi,BLR → BOM → DEL,21:25,21:20 07 Mar,23h 55m,1 stop,No info,17471,2019-03-06,6,3,2,1435,1,21,21
Jet Airways,12/05/2019,Kolkata,Banglore,CCU → BOM → BLR,06:30,16:20,9h 50m,1 stop,No info,14781,2019-05-12,12,5,6,590,1,6,16
Jet Airways,9/06/2019,Kolkata,Banglore,CCU → BOM → BLR,06:30,19:50,13h 20m,1 stop,No info,14571,2019-06-09,9,6,6,800,1,6,19
Multiple carriers,18/05/2019,Delhi,Cochin,DEL → BOM → COK,03:50,12:35,8h 45m,1 stop,No info,10197,2019-05-18,18,5,5,525,1,3,12
SpiceJet,1/06/2019,Delhi,Cochin,DEL → BLR → COK,17:55,22:50,4h 55m,1 stop,No info,5975,2019-06-01,1,6,5,295,1,17,22
Multiple carriers,9/04/2019,Delhi,Cochin,DEL → BOM → COK,17:45,01:30 10 Apr,7h 45m,1 stop,No info,8535,2019-04-09,9,4,1,465,1,17,1
Multiple carriers,27/03/2019,Delhi,Cochin,DEL → BOM → COK,09:55,21:00,11h 5m,1 stop,No info,12537,2019-03-27,27,3,2,665,1,9,21
Air India,24/05/2019,Kolkata,Banglore,CCU → BLR,20:45,23:20,2h 35m,non-stop,No info,4145,2019-05-24,24,5,4,155,0,20,23
IndiGo,15/03/2019,Mumbai,Hyderabad,BOM → HYD,09:10,10:40,1h 30m,non-stop,No info,4049,2019-03-15,15,3,4,90,0,9,10
Air Asia,9/05/2019,Kolkata,Banglore,CCU → DEL → BLR,22:40,10:40 10 May,12h,1 stop,No info,5192,2019-05-09,9,5,3,720,1,22,10
Air India,9/05/2019,Banglore,Delhi,BLR → DEL,21:05,23:55,2h 50m,non-stop,No info,6121,2019-05-09,9,5,3,170,0,21,23
Air India,24/06/2019,Delhi,Cochin,DEL → BOM → COK,03:50,19:15,15h 25m,1 stop,No info,8669,2019-06-24,24,6,0,925,1,3,19
Multiple carriers,18/05/2019,Delhi,Cochin,DEL → BOM → COK,06:00,19:15,13h 15m,1 stop,No info,8476,2019-05-18,18,5,5,795,1,6,19
SpiceJet,21/06/2019,Mumbai,Hyderabad,BOM → HYD,05:45,07:15,1h 30m,non-stop,No check-in baggage included,2647,2019-06-21,21,6,4,90,0,5,7
Jet Airways,6/06/2019,Delhi,Cochin,DEL → BOM → COK,20:55,19:00 07 Jun,22h 5m,1 stop,No info,14714,2019-06-06,6,6,3,1325,1,20,19
Air India,6/03/2019,Delhi,Cochin,DEL → BLR → COK,20:30,08:15 07 Mar,11h 45m,1 stop,No info,10566,2019-03-06,6,3,2,705,1,20,8
Jet Airways,15/06/2019,Delhi,Cochin,DEL → BOM → COK,11:30,19:00,7h 30m,1 stop,In-flight meal not included,10262,2019-06-15,15,6,5,450,1,11,19
Multiple carriers,21/03/2019,Delhi,Cochin,DEL → BOM → COK,10:00,01:35 22 Mar,15h 35m,1 stop,No info,8098,2019-03-21,21,3,3,935,1,10,1
Multiple carriers,27/03/2019,Delhi,Cochin,DEL → BOM → COK,10:00,21:00,11h,1 stop,No info,6883,2019-03-27,27,3,2,660,1,10,21
Multiple carriers,15/06/2019,Delhi,Cochin,DEL → BOM → COK,10:00,19:15,9h 15m,1 stop,No info,16108,2019-06-15,15,6,5,555,1,10,19
SpiceJet,18/03/2019,Kolkata,Banglore,CCU → BLR,17:15,19:45,2h 30m,non-stop,No check-in baggage included,4413,2019-03-18,18,3,0,150,0,17,19
Jet Airways,1/06/2019,Delhi,Cochin,DEL → NAG → BOM → COK,14:35,12:35 02 Jun,22h,2 stops,In-flight meal not included,10919,2019-06-01,1,6,5,1320,2,14,12
IndiGo,9/05/2019,Kolkata,Banglore,CCU → BLR,21:25,00:05 10 May,2h 40m,non-stop,No info,4804,2019-05-09,9,5,3,160,0,21,0
Jet Airways,6/06/2019,Kolkata,Banglore,CCU → DEL → BLR,20:25,10:55 07 Jun,14h 30m,1 stop,In-flight meal not included,10539,2019-06-06,6,6,3,870,1,20,10
IndiGo,09/03/2019,Banglore,New Delhi,BLR → DEL,22:20,01:10 13 Mar,2h 50m,non-stop,No info,4377,2019-03-09,9,3,5,170,0,22,1
Air India,6/06/2019,Banglore,Delhi,BLR → DEL,06:10,08:55,2h 45m,non-stop,No info,6961,2019-06-06,6,6,3,165,0,6,8
Multiple carriers,27/05/2019,Delhi,Cochin,DEL → BOM → COK,13:00,21:00,8h,1 stop,No info,7408,2019-05-27,27,5,0,480,1,13,21
IndiGo,9/05/2019,Banglore,Delhi,BLR → DEL,18:55,21:50,2h 55m,non-stop,No info,4823,2019-05-09,9,5,3,175,0,18,21
IndiGo,21/03/2019,Kolkata,Banglore,CCU → BLR,14:20,16:55,2h 35m,non-stop,No info,5198,2019-03-21,21,3,3,155,0,14,16
Jet Airways,1/06/2019,Delhi,Cochin,DEL → BOM → COK,17:30,19:00 02 Jun,25h 30m,1 stop,In-flight meal not included,10262,2019-06-01,1,6,5,1530,1,17,19
Vistara,27/04/2019,Banglore,Delhi,BLR → DEL,17:00,19:35,2h 35m,non-stop,No info,5613,2019-04-27,27,4,5,155,0,17,19
Jet Airways,12/06/2019,Delhi,Cochin,DEL → BOM → COK,20:55,04:25 13 Jun,7h 30m,1 stop,In-flight meal not included,10262,2019-06-12,12,6,2,450,1,20,4
IndiGo,3/05/2019,Mumbai,Hyderabad,BOM → HYD,09:10,10:40,1h 30m,non-stop,No info,5755,2019-05-03,3,5,4,90,0,9,10
Vistara,21/05/2019,Chennai,Kolkata,MAA → CCU,07:05,09:20,2h 15m,non-stop,No info,3687,2019-05-21,21,5,1,135,0,7,9
Jet Airways,3/06/2019,Mumbai,Hyderabad,BOM → HYD,19:35,21:05,1h 30m,non-stop,No info,5678,2019-06-03,3,6,0,90,0,19,21
Multiple carriers,21/03/2019,Delhi,Cochin,DEL → BOM → COK,18:15,01:35 22 Mar,7h 20m,1 stop,No info,13542,2019-03-21,21,3,3,440,1,18,1
Jet Airways,21/03/2019,Delhi,Cochin,DEL → BOM → COK,19:15,18:50 22 Mar,23h 35m,1 stop,No info,12347,2019-03-21,21,3,3,1415,1,19,18
Jet Airways,21/05/2019,Kolkata,Banglore,CCU → DEL → BLR,09:35,19:10,9h 35m,1 stop,In-flight meal not included,12384,2019-05-21,21,5,1,575,1,9,19
Jet Airways,9/04/2019,Delhi,Cochin,DEL → JAI → BOM → COK,05:30,04:25 10 Apr,22h 55m,2 stops,No info,10909,2019-04-09,9,4,1,1375,2,5,4
IndiGo,3/06/2019,Banglore,Delhi,BLR → DEL,16:55,19:55,3h,non-stop,No info,4823,2019-06-03,3,6,0,180,0,16,19
IndiGo,12/06/2019,Delhi,Cochin,DEL → BOM → COK,16:00,21:00,5h,1 stop,No info,6069,2019-06-12,12,6,2,300,1,16,21
Jet Airways,21/05/2019,Delhi,Cochin,DEL → BOM → COK,16:00,19:00 22 May,27h,1 stop,In-flight meal not included,12898,2019-05-21,21,5,1,1620,1,16,19
IndiGo,15/06/2019,Kolkata,Banglore,CCU → BLR,04:40,07:15,2h 35m,non-stop,No info,4804,2019-06-15,15,6,5,155,0,4,7
Jet Airways,24/03/2019,Kolkata,Banglore,CCU → BOM → BLR,08:25,04:45 25 Mar,20h 20m,1 stop,In-flight meal not included,10031,2019-03-24,24,3,6,1220,1,8,4
IndiGo,9/06/2019,Delhi,Cochin,DEL → HYD → COK,07:35,22:30,14h 55m,1 stop,No info,6442,2019-06-09,9,6,6,895,1,7,22
Air India,21/05/2019,Delhi,Cochin,DEL → JAI → BOM → COK,12:00,07:40 22 May,19h 40m,2 stops,No info,9653,2019-05-21,21,5,1,1180,2,12,7
Vistara,9/06/2019,Kolkata,Banglore,CCU → DEL → BLR,17:00,20:20 10 Jun,27h 20m,1 stop,No info,8610,2019-06-09,9,6,6,1640,1,17,20
Jet Airways,12/06/2019,Delhi,Cochin,DEL → BOM → COK,14:00,19:00,5h,1 stop,No info,14714,2019-06-12,12,6,2,300,1,14,19
Air India,01/03/2019,Banglore,New Delhi,BLR → AMD → DEL,00:30,23:55,23h 25m,1 stop,1 Long layover,12599,2019-03-01,1,3,4,1405,1,0,23
Multiple carriers,9/05/2019,Delhi,Cochin,DEL → BOM → COK,04:55,19:00,14h 5m,1 stop,No info,9103,2019-05-09,9,5,3,845,1,4,19
Jet Airways,21/05/2019,Delhi,Cochin,DEL → BOM → COK,22:50,04:25 22 May,5h 35m,1 stop,In-flight meal not included,12898,2019-05-21,21,5,1,335,1,22,4
SpiceJet,6/06/2019,Mumbai,Hyderabad,BOM → HYD,05:45,07:15,1h 30m,non-stop,No check-in baggage included,2647,2019-06-06,6,6,3,90,0,5,7
Jet Airways,3/03/2019,Mumbai,Hyderabad,BOM → HYD,07:10,08:35,1h 25m,non-stop,No info,5678,2019-03-03,3,3,6,85,0,7,8
Jet Airways,18/05/2019,Delhi,Cochin,DEL → BOM → COK,19:15,12:35 19 May,17h 20m,1 stop,In-flight meal not included,12373,2019-05-18,18,5,5,1040,1,19,12
SpiceJet,27/03/2019,Kolkata,Banglore,CCU → BLR,17:15,19:45,2h 30m,non-stop,No info,3847,2019-03-27,27,3,2,150,0,17,19
Jet Airways,21/05/2019,Kolkata,Banglore,CCU → DEL → BLR,17:00,18:00 22 May,25h,1 stop,No info,14151,2019-05-21,21,5,1,1500,1,17,18
Jet Airways,6/03/2019,Delhi,Cochin,DEL → BOM → COK,08:00,04:25 07 Mar,20h 25m,1 stop,In-flight meal not included,13843,2019-03-06,6,3,2,1225,1,8,4
Jet Airways,18/05/2019,Banglore,Delhi,BLR → DEL,15:15,18:10,2h 55m,non-stop,No info,7229,2019-05-18,18,5,5,175,0,15,18
Jet Airways,18/06/2019,Mumbai,Hyderabad,BOM → HYD,02:55,04:20,1h 25m,non-stop,In-flight meal not included,4995,2019-06-18,18,6,1,85,0,2,4
Jet Airways,6/06/2019,Delhi,Cochin,DEL → BOM → COK,20:55,04:25 07 Jun,7h 30m,1 stop,In-flight meal not included,10262,2019-06-06,6,6,3,450,1,20,4
Jet Airways,9/05/2019,Delhi,Cochin,DEL → JAI → BOM → COK,05:30,04:25 10 May,22h 55m,2 stops,In-flight meal not included,13029,2019-05-09,9,5,3,1375,2,5,4
Jet Airways,9/03/2019,Delhi,Cochin,DEL → BOM → COK,19:15,04:25 10 Mar,9h 10m,1 stop,In-flight meal not included,14053,2019-03-09,9,3,5,550,1,19,4
Jet Airways,01/03/2019,Banglore,New Delhi,BLR → BOM → DEL,16:55,07:40 02 Mar,14h 45m,1 stop,1 Long layover,26890,2019-03-01,1,3,4,885,1,16,7
SpiceJet,1/04/2019,Kolkata,Banglore,CCU → BLR,17:10,19:40,2h 30m,non-stop,No check-in baggage included,3841,2019-04-01,1,4,0,150,0,17,19
Air India,01/03/2019,Banglore,New Delhi,BLR → VGA → DEL,10:30,22:55,12h 25m,1 stop,No info,11003,2019-03-01,1,3,4,745,1,10,22
Vistara,9/04/2019,Banglore,Delhi,BLR → DEL,11:30,14:20,2h 50m,non-stop,No info,5403,2019-04-09,9,4,1,170,0,11,14
Multiple carriers,3/03/2019,Delhi,Cochin,DEL → BOM → COK,08:00,18:50,10h 50m,1 stop,No info,15342,2019-03-03,3,3,6,650,1,8,18
Air India,12/06/2019,Kolkata,Banglore,CCU → DEL → COK → BLR,20:30,13:45 13 Jun,17h 15m,2 stops,No info,12224,2019-06-12,12,6,2,1035,2,20,13
IndiGo,15/03/2019,Chennai,Kolkata,MAA → CCU,19:35,21:55,2h 20m,non-stop,No info,6297,2019-03-15,15,3,4,140,0,19,21
SpiceJet,1/05/2019,Kolkata,Banglore,CCU → IXB → BLR,15:55,21:25,5h 30m,1 stop,No info,8844,2019-05-01,1,5,2,330,1,15,21
Multiple carriers,1/06/2019,Delhi,Cochin,DEL → BOM → COK,14:00,01:30 02 Jun,11h 30m,1 stop,No info,13377,2019-06-01,1,6,5,690,1,14,1
GoAir,09/03/2019,Banglore,New Delhi,BLR → DEL,20:55,23:50,2h 55m,non-stop,No info,5706,2019-03-09,9,3,5,175,0,20,23
Air India,12/06/2019,Delhi,Cochin,DEL → BOM → COK,21:00,07:40 13 Jun,10h 40m,1 stop,No info,8372,2019-06-12,12,6,2,640,1,21,7
IndiGo,27/05/2019,Delhi,Cochin,DEL → BOM → COK,06:40,21:00,14h 20m,1 stop,No info,6526,2019-05-27,27,5,0,860,1,6,21
IndiGo,1/06/2019,Banglore,Delhi,BLR → DEL,16:55,19:45,2h 50m,non-stop,No info,4823,2019-06-01,1,6,5,170,0,16,19
IndiGo,24/06/2019,Mumbai,Hyderabad,BOM → HYD,16:55,18:25,1h 30m,non-stop,No info,3175,2019-06-24,24,6,0,90,0,16,18
Multiple carriers,6/05/2019,Delhi,Cochin,DEL → BOM → COK,09:00,19:00,10h,1 stop,No info,10407,2019-05-06,6,5,0,600,1,9,19
IndiGo,18/04/2019,Banglore,Delhi,BLR → DEL,04:00,06:50,2h 50m,non-stop,No info,4423,2019-04-18,18,4,3,170,0,4,6
Vistara,9/05/2019,Kolkata,Banglore,CCU → DEL → BLR,17:00,20:20 10 May,27h 20m,1 stop,No info,9555,2019-05-09,9,5,3,1640,1,17,20
Jet Airways,1/04/2019,Kolkata,Banglore,CCU → BOM → BLR,16:30,16:20 02 Apr,23h 50m,1 stop,No info,12681,2019-04-01,1,4,0,1430,1,16,16
Jet Airways,6/06/2019,Kolkata,Banglore,CCU → BOM → BLR,14:05,04:40 07 Jun,14h 35m,1 stop,No info,13059,2019-06-06,6,6,3,875,1,14,4
Jet Airways,9/05/2019,Kolkata,Banglore,CCU → BOM → BLR,16:30,10:05 10 May,17h 35m,1 stop,In-flight meal not included,8586,2019-05-09,9,5,3,1055,1,16,10
GoAir,6/04/2019,Banglore,Delhi,BLR → DEL,20:55,23:40,2h 45m,non-stop,No info,3419,2019-04-06,6,4,5,165,0,20,23
SpiceJet,3/06/2019,Kolkata,Banglore,CCU → BLR,17:10,19:40,2h 30m,non-stop,No info,3873,2019-06-03,3,6,0,150,0,17,19
Air India,6/06/2019,Kolkata,Banglore,CCU → DEL → BLR,10:00,20:25,10h 25m,1 stop,No info,10203,2019-06-06,6,6,3,625,1,10,20
Jet Airways,27/05/2019,Delhi,Cochin,DEL → JAI → BOM → COK,19:30,04:25 28 May,8h 55m,2 stops,In-flight meal not included,13029,2019-05-27,27,5,0,535,2,19,4
Jet Airways,15/05/2019,Kolkata,Banglore,CCU → BOM → BLR,16:30,22:35,6h 5m,1 stop,In-flight meal not included,10844,2019-05-15,15,5,2,365,1,16,22
Jet Airways,24/03/2019,Kolkata,Banglore,CCU → BOM → BLR,18:55,08:10 25 Mar,13h 15m,1 stop,In-flight meal not included,11134,2019-03-24,24,3,6,795,1,18,8
Vistara,12/06/2019,Kolkata,Banglore,CCU → DEL → BLR,20:20,18:50 13 Jun,22h 30m,1 stop,No info,8610,2019-06-12,12,6,2,1350,1,20,18
IndiGo,15/04/2019,Kolkata,Banglore,CCU → BLR,20:20,22:55,2h 35m,non-stop,No info,4174,2019-04-15,15,4,0,155,0,20,22
Jet Airways,09/03/2019,Banglore,New Delhi,BLR → BOM → DEL,08:00,09:30 13 Mar,25h 30m,1 stop,In-flight meal not included,11087,2019-03-09,9,3,5,1530,1,8,9
SpiceJet,18/06/2019,Banglore,Delhi,BLR → DEL,21:10,00:05 19 Jun,2h 55m,non-stop,No info,3971,2019-06-18,18,6,1,175,0,21,0
Jet Airways,9/04/2019,Delhi,Cochin,DEL → BOM → COK,07:05,19:00,11h 55m,1 stop,No info,17531,2019-04-09,9,4,1,715,1,7,19
SpiceJet,6/06/2019,Banglore,Delhi,BLR → DEL,05:55,08:35,2h 40m,non-stop,No check-in baggage included,3573,2019-06-06,6,6,3,160,0,5,8
Air India,1/05/2019,Kolkata,Banglore,CCU → BOM → BLR,09:25,07:55 02 May,22h 30m,1 stop,No info,8366,2019-05-01,1,5,2,1350,1,9,7
Air India,3/03/2019,Kolkata,Banglore,CCU → BLR,14:15,16:45,2h 30m,non-stop,No info,13885,2019-03-03,3,3,6,150,0,14,16
Multiple carriers,9/06/2019,Delhi,Cochin,DEL → IXU → BOM → COK,17:50,01:30 10 Jun,7h 40m,2 stops,No info,18485,2019-06-09,9,6,6,460,2,17,1
Air Asia,27/04/2019,Kolkata,Banglore,CCU → BLR,19:55,22:25,2h 30m,non-stop,No info,4409,2019-04-27,27,4,5,150,0,19,22
Vistara,1/05/2019,Kolkata,Banglore,CCU → DEL → BLR,20:20,23:25 02 May,27h 5m,1 stop,No info,8085,2019-05-01,1,5,2,1625,1,20,23
Multiple carriers,6/06/2019,Delhi,Cochin,DEL → BOM → COK,17:30,01:30 07 Jun,8h,1 stop,No info,13377,2019-06-06,6,6,3,480,1,17,1
Air India,21/05/2019,Delhi,Cochin,DEL → UDR → BOM → COK,13:20,07:40 22 May,18h 20m,2 stops,No info,13538,2019-05-21,21,5,1,1100,2,13,7
Multiple carriers,6/03/2019,Delhi,Cochin,DEL → BOM → COK,19:00,01:35 07 Mar,6h 35m,1 stop,No info,15147,2019-03-06,6,3,2,395,1,19,1
Jet Airways,27/05/2019,Banglore,Delhi,BLR → DEL,11:10,14:05,2h 55m,non-stop,In-flight meal not included,4030,2019-05-27,27,5,0,175,0,11,14
Multiple carriers,6/06/2019,Delhi,Cochin,DEL → BOM → COK,08:00,19:15,11h 15m,1 stop,No info,14848,2019-06-06,6,6,3,675,1,8,19
Jet Airways,18/03/2019,Banglore,New Delhi,BLR → BOM → DEL,22:50,08:15 16 Mar,9h 25m,1 stop,No info,13555,2019-03-18,18,3,0,565,1,22,8
Air India,18/05/2019,Delhi,Cochin,DEL → HYD → MAA → COK,07:05,09:25 19 May,26h 20m,2 stops,No info,10975,2019-05-18,18,5,5,1580,2,7,9
Jet Airways,21/05/2019,Delhi,Cochin,DEL → JAI → BOM → COK,09:40,12:35 22 May,26h 55m,2 stops,In-flight meal not included,13029,2019-05-21,21,5,1,1615,2,9,12
Jet Airways,12/05/2019,Kolkata,Banglore,CCU → BOM → BLR,08:25,09:20 13 May,24h 55m,1 stop,In-flight meal not included,9663,2019-05-12,12,5,6,1495,1,8,9
Jet Airways,1/06/2019,Mumbai,Hyderabad,BOM → HYD,10:20,11:50,1h 30m,non-stop,In-flight meal not included,4050,2019-06-01,1,6,5,90,0,10,11
Jet Airways,3/06/2019,Delhi,Cochin,DEL → BOM → COK,17:30,04:25 04 Jun,10h 55m,1 stop,No info,14714,2019-06-03,3,6,0,655,1,17,4
Air India,01/03/2019,Banglore,New Delhi,BLR → VGA → HYD → DEL,10:30,21:25,10h 55m,2 stops,No info,11213,2019-03-01,1,3,4,655,2,10,21
Jet Airways,9/04/2019,Banglore,Delhi,BLR → DEL,06:00,08:45,2h 45m,non-stop,In-flight meal not included,4544,2019-04-09,9,4,1,165,0,6,8
SpiceJet,15/06/2019,Kolkata,Banglore,CCU → BLR,09:00,11:25,2h 25m,non-stop,No info,3873,2019-06-15,15,6,5,145,0,9,11
Multiple carriers,9/04/2019,Delhi,Cochin,DEL → BOM → COK,13:00,21:00,8h,1 stop,No info,12537,2019-04-09,9,4,1,480,1,13,21
Jet Airways,6/05/2019,Kolkata,Banglore,CCU → DEL → BLR,09:35,19:10,9h 35m,1 stop,No info,13067,2019-05-06,6,5,0,575,1,9,19
Jet Airways,9/05/2019,Delhi,Cochin,DEL → AMD → BOM → COK,23:05,04:25 11 May,29h 20m,2 stops,No info,16704,2019-05-09,9,5,3,1760,2,23,4
Air India,15/03/2019,Banglore,New Delhi,BLR → BOM → DEL,06:45,12:15,5h 30m,1 stop,No info,8714,2019-03-15,15,3,4,330,1,6,12
Jet Airways,3/06/2019,Delhi,Cochin,DEL → NAG → BOM → COK,14:35,12:35 04 Jun,22h,2 stops,No info,13376,2019-06-03,3,6,0,1320,2,14,12
SpiceJet,27/06/2019,Chennai,Kolkata,MAA → CCU,08:20,10:35,2h 15m,non-stop,No info,3597,2019-06-27,27,6,3,135,0,8,10
Multiple carriers,18/05/2019,Delhi,Cochin,DEL → BOM → COK,12:50,01:30 19 May,12h 40m,1 stop,No info,7670,2019-05-18,18,5,5,760,1,12,1
Air India,24/03/2019,Kolkata,Banglore,CCU → GAU → DEL → BLR,09:50,23:15 25 Mar,37h 25m,2 stops,No info,14410,2019-03-24,24,3,6,2245,2,9,23
Air India,15/05/2019,Delhi,Cochin,DEL → MAA → COK,09:45,09:25 16 May,23h 40m,1 stop,No info,7480,2019-05-15,15,5,2,1420,1,9,9
Jet Airways,9/05/2019,Kolkata,Banglore,CCU → BOM → BLR,20:00,18:15 10 May,22h 15m,1 stop,No info,13584,2019-05-09,9,5,3,1335,1,20,18
Jet Airways,01/03/2019,Banglore,New Delhi,BLR → BOM → DEL,16:55,10:25 02 Mar,17h 30m,1 stop,1 Long layover,25735,2019-03-01,1,3,4,1050,1,16,10
Jet Airways,1/04/2019,Banglore,Delhi,BLR → DEL,17:45,20:45,3h,non-stop,In-flight meal not included,4544,2019-04-01,1,4,0,180,0,17,20
Multiple carriers,21/05/2019,Delhi,Cochin,DEL → BOM → COK,09:15,19:15,10h,1 stop,No info,8099,2019-05-21,21,5,1,600,1,9,19
Jet Airways,15/05/2019,Kolkata,Banglore,CCU → BOM → BLR,16:30,04:40 16 May,12h 10m,1 stop,In-flight meal not included,10844,2019-05-15,15,5,2,730,1,16,4
Jet Airways,21/03/2019,Delhi,Cochin,DEL → BOM → COK,19:15,04:25 22 Mar,9h 10m,1 stop,No info,12557,2019-03-21,21,3,3,550,1,19,4
Jet Airways,9/05/2019,Delhi,Cochin,DEL → COK,11:00,14:15,3h 15m,non-stop,No info,9564,2019-05-09,9,5,3,195,0,11,14
Jet Airways,12/03/2019,Banglore,New Delhi,BLR → BOM → DEL,21:25,09:30 13 Mar,12h 5m,1 stop,No info,13817,2019-03-12,12,3,1,725,1,21,9
Jet Airways,18/05/2019,Kolkata,Banglore,CCU → DEL → BLR,09:35,19:10,9h 35m,1 stop,In-flight meal not included,12384,2019-05-18,18,5,5,575,1,9,19
Multiple carriers,21/05/2019,Delhi,Cochin,DEL → BOM → COK,04:55,19:15,14h 20m,1 stop,No info,7575,2019-05-21,21,5,1,860,1,4,19
Air India,6/05/2019,Kolkata,Banglore,CCU → GAU → DEL → BLR,16:45,12:00 07 May,19h 15m,2 stops,No info,14120,2019-05-06,6,5,0,1155,2,16,12
Multiple carriers,9/03/2019,Delhi,Cochin,DEL → HYD → COK,07:05,22:20,15h 15m,1 stop,No info,6916,2019-03-09,9,3,5,915,1,7,22
Multiple carriers,27/05/2019,Delhi,Cochin,DEL → HYD → COK,07:10,22:30,15h 20m,1 stop,No info,7878,2019-05-27,27,5,0,920,1,7,22
Jet Airways,18/03/2019,Banglore,New Delhi,BLR → BOM → DEL,22:50,20:20 16 Mar,21h 30m,1 stop,In-flight meal not included,11087,2019-03-18,18,3,0,1290,1,22,20
IndiGo,27/04/2019,Kolkata,Banglore,CCU → BLR,14:25,16:55,2h 30m,non-stop,No info,4804,2019-04-27,27,4,5,150,0,14,16
SpiceJet,15/06/2019,Chennai,Kolkata,MAA → CCU,09:45,12:00,2h 15m,non-stop,No info,3597,2019-06-15,15,6,5,135,0,9,12
Air India,15/05/2019,Kolkata,Banglore,CCU → IXR → DEL → BLR,05:50,16:15 16 May,34h 25m,2 stops,No info,12723,2019-05-15,15,5,2,2065,2,5,16
IndiGo,15/05/2019,Mumbai,Hyderabad,BOM → HYD,20:05,21:40,1h 35m,non-stop,No info,2227,2019-05-15,15,5,2,95,0,20,21
Air India,24/05/2019,Delhi,Cochin,DEL → BOM → COK,07:00,19:15,12h 15m,1 stop,No info,9929,2019-05-24,24,5,4,735,1,7,19
Jet Airways,9/06/2019,Kolkata,Banglore,CCU → BOM → BLR,21:10,09:20 10 Jun,12h 10m,1 stop,In-flight meal not included,11841,2019-06-09,9,6,6,730,1,21,9
Jet Airways,9/05/2019,Delhi,Cochin,DEL → BOM → COK,11:30,04:25 10 May,16h 55m,1 stop,In-flight meal not included,12373,2019-05-09,9,5,3,1015,1,11,4
Jet Airways,21/05/2019,Delhi,Cochin,DEL → BOM → COK,20:55,19:00 22 May,22h 5m,1 stop,In-flight meal not included,12898,2019-05-21,21,5,1,1325,1,20,19
Air India,3/03/2019,Delhi,Cochin,DEL → BHO → BOM → COK,05:55,07:40 04 Mar,25h 45m,2 stops,No info,15113,2019-03-03,3,3,6,1545,2,5,7
Multiple carriers,18/05/2019,Delhi,Cochin,DEL → BOM → COK,11:40,19:00,7h 20m,1 stop,No info,10529,2019-05-18,18,5,5,440,1,11,19
Air India,27/03/2019,Delhi,Cochin,DEL → HYD → BOM → COK,13:05,07:40 28 Mar,18h 35m,2 stops,No info,8875,2019-03-27,27,3,2,1115,2,13,7
Jet Airways,15/05/2019,Kolkata,Banglore,CCU → BOM → BLR,08:25,20:45,12h 20m,1 stop,In-flight meal not included,10844,2019-05-15,15,5,2,740,1,8,20
Air India,01/03/2019,Banglore,New Delhi,BLR → DEL,06:10,08:55,2h 45m,non-stop,No info,15676,2019-03-01,1,3,4,165,0,6,8
Jet Airways,1/04/2019,Kolkata,Banglore,CCU → BOM → BLR,08:25,23:35,15h 10m,1 stop,In-flight meal not included,7064,2019-04-01,1,4,0,910,1,8,23
Jet Airways,9/06/2019,Kolkata,Banglore,CCU → BOM → BLR,08:25,19:50,11h 25m,1 stop,In-flight meal not included,10844,2019-06-09,9,6,6,685,1,8,19
Jet Airways,6/03/2019,Mumbai,Hyderabad,BOM → DEL → HYD,14:00,16:50 07 Mar,26h 50m,1 stop,No info,19595,2019-03-06,6,3,2,1610,1,14,16
Jet Airways,1/05/2019,Kolkata,Banglore,CCU → BOM → BLR,14:05,08:15 02 May,18h 10m,1 stop,No info,13941,2019-05-01,1,5,2,1090,1,14,8
IndiGo,21/03/2019,Delhi,Cochin,DEL → HYD → COK,08:35,16:10,7h 35m,1 stop,No info,6790,2019-03-21,21,3,3,455,1,8,16
SpiceJet,27/04/2019,Kolkata,Banglore,CCU → BLR,09:00,11:25,2h 25m,non-stop,No check-in baggage included,3841,2019-04-27,27,4,5,145,0,9,11
Jet Airways,18/03/2019,Banglore,New Delhi,BLR → BOM → DEL,11:40,09:00 16 Mar,21h 20m,1 stop,In-flight meal not included,11087,2019-03-18,18,3,0,1280,1,11,9
Air India,15/05/2019,Delhi,Cochin,DEL → AMD → BOM → COK,19:45,19:15 16 May,23h 30m,2 stops,No info,11491,2019-05-15,15,5,2,1410,2,19,19
IndiGo,9/04/2019,Banglore,Delhi,BLR → DEL,05:30,08:20,2h 50m,non-stop,No info,3943,2019-04-09,9,4,1,170,0,5,8
Jet Airways,01/03/2019,Banglore,New Delhi,BLR → BOM → DEL,11:40,07:40 02 Mar,20h,1 stop,No info,22270,2019-03-01,1,3,4,1200,1,11,7
Vistara,9/06/2019,Banglore,Delhi,BLR → DEL,17:00,19:35,2h 35m,non-stop,No info,4878,2019-06-09,9,6,6,155,0,17,19
Jet Airways,9/06/2019,Delhi,Cochin,DEL → BOM → COK,22:50,04:25 10 Jun,5h 35m,1 stop,No info,14714,2019-06-09,9,6,6,335,1,22,4
Multiple carriers,24/06/2019,Delhi,Cochin,DEL → BOM → COK,06:40,19:00,12h 20m,1 stop,No info,10877,2019-06-24,24,6,0,740,1,6,19
Air India,15/06/2019,Delhi,Cochin,DEL → AMD → BOM → COK,19:45,19:15 16 Jun,23h 30m,2 stops,No info,9653,2019-06-15,15,6,5,1410,2,19,19
Jet Airways,24/05/2019,Kolkata,Banglore,CCU → BOM → BLR,20:00,12:00 25 May,16h,1 stop,No info,14571,2019-05-24,24,5,4,960,1,20,12
Jet Airways,1/04/2019,Kolkata,Banglore,CCU → BOM → BLR,18:55,20:45 02 Apr,25h 50m,1 stop,In-flight meal not included,7064,2019-04-01,1,4,0,1550,1,18,20
IndiGo,6/03/2019,Kolkata,Banglore,CCU → BLR,15:20,17:55,2h 35m,non-stop,No info,5618,2019-03-06,6,3,2,155,0,15,17
Multiple carriers,15/05/2019,Delhi,Cochin,DEL → BOM → COK,14:00,01:30 16 May,11h 30m,1 stop,No info,13727,2019-05-15,15,5,2,690,1,14,1
Vistara,1/04/2019,Delhi,Cochin,DEL → COK,14:40,17:50,3h 10m,non-stop,No info,4851,2019-04-01,1,4,0,190,0,14,17
Air India,24/03/2019,Kolkata,Banglore,CCU → BBI → BOM → BLR,09:10,21:50,12h 40m,2 stops,No info,15187,2019-03-24,24,3,6,760,2,9,21
GoAir,15/05/2019,Banglore,Delhi,BLR → DEL,07:45,10:40,2h 55m,non-stop,No info,3419,2019-05-15,15,5,2,175,0,7,10
IndiGo,1/04/2019,Banglore,Delhi,BLR → DEL,06:05,08:50,2h 45m,non-stop,No info,3943,2019-04-01,1,4,0,165,0,6,8
Jet Airways,18/05/2019,Delhi,Cochin,DEL → JAI → BOM → COK,09:40,12:35 19 May,26h 55m,2 stops,No info,15129,2019-05-18,18,5,5,1615,2,9,12
IndiGo,21/06/2019,Banglore,Delhi,BLR → DEL,00:25,03:15,2h 50m,non-stop,No info,3419,2019-06-21,21,6,4,170,0,0,3
Air India,21/05/2019,Delhi,Cochin,DEL → BHO → BOM → COK,20:00,19:15 22 May,23h 15m,2 stops,No info,10861,2019-05-21,21,5,1,1395,2,20,19
IndiGo,21/04/2019,Delhi,Cochin,DEL → BLR → COK,05:10,10:05,4h 55m,1 stop,No info,7074,2019-04-21,21,4,6,295,1,5,10
Air India,6/05/2019,Kolkata,Banglore,CCU → BOM → COK → BLR,09:25,15:05 07 May,29h 40m,2 stops,No info,11542,2019-05-06,6,5,0,1780,2,9,15
IndiGo,21/04/2019,Delhi,Cochin,DEL → HYD → COK,06:50,12:10,5h 20m,1 stop,No info,6968,2019-04-21,21,4,6,320,1,6,12
Jet Airways,12/06/2019,Banglore,Delhi,BLR → DEL,17:45,20:45,3h,non-stop,In-flight meal not included,5769,2019-06-12,12,6,2,180,0,17,20
Vistara,12/06/2019,Kolkata,Banglore,CCU → DEL → BLR,20:20,22:40 13 Jun,26h 20m,1 stop,No info,7927,2019-06-12,12,6,2,1580,1,20,22
Jet Airways,12/06/2019,Kolkata,Banglore,CCU → BOM → BLR,18:55,08:15 13 Jun,13h 20m,1 stop,No info,13044,2019-06-12,12,6,2,800,1,18,8
Jet Airways,21/05/2019,Delhi,Cochin,DEL → AMD → BOM → COK,23:05,12:35 22 May,13h 30m,2 stops,No info,15129,2019-05-21,21,5,1,810,2,23,12
SpiceJet,1/05/2019,Kolkata,Banglore,CCU → BLR,09:00,11:25,2h 25m,non-stop,No check-in baggage included,3841,2019-05-01,1,5,2,145,0,9,11
IndiGo,24/06/2019,Kolkata,Banglore,CCU → BLR,20:20,22:55,2h 35m,non-stop,No info,4804,2019-06-24,24,6,0,155,0,20,22
SpiceJet,12/04/2019,Banglore,Delhi,BLR → DEL,05:55,08:35,2h 40m,non-stop,No check-in baggage included,4319,2019-04-12,12,4,4,160,0,5,8
Jet Airways,27/05/2019,Delhi,Cochin,DEL → BOM → COK,21:50,19:00 28 May,21h 10m,1 stop,No info,16079,2019-05-27,27,5,0,1270,1,21,19
Jet Airways,18/03/2019,Banglore,New Delhi,BLR → BOM → DEL,22:50,05:05 16 Mar,6h 15m,1 stop,No info,54826,2019-03-18,18,3,0,375,1,22,5
IndiGo,9/03/2019,Delhi,Cochin,DEL → BOM → COK,17:30,01:35 10 Mar,8h 5m,1 stop,No info,12351,2019-03-09,9,3,5,485,1,17,1
Jet Airways,6/05/2019,Kolkata,Banglore,CCU → DEL → BLR,17:00,19:10 07 May,26h 10m,1 stop,No info,13067,2019-05-06,6,5,0,1570,1,17,19
Jet Airways,12/03/2019,Banglore,New Delhi,BLR → BOM → DEL,18:55,07:40 13 Mar,12h 45m,1 stop,No info,13817,2019-03-12,12,3,1,765,1,18,7
SpiceJet,21/05/2019,Banglore,Delhi,BLR → DEL,21:10,00:05 22 May,2h 55m,non-stop,No info,3625,2019-05-21,21,5,1,175,0,21,0
Air India,12/03/2019,Mumbai,Hyderabad,BOM → JDH → JAI → DEL → HYD,09:40,15:15 13 Mar,29h 35m,3 stops,No info,18293,2019-03-12,12,3,1,1775,3,9,15
Vistara,1/04/2019,Banglore,Delhi,BLR → DEL,19:30,22:15,2h 45m,non-stop,No info,5613,2019-04-01,1,4,0,165,0,19,22
Air India,6/03/2019,Delhi,Cochin,DEL → BLR → COK,06:10,08:15 07 Mar,26h 5m,1 stop,No info,11038,2019-03-06,6,3,2,1565,1,6,8
IndiGo,3/04/2019,Banglore,Delhi,BLR → DEL,06:05,08:50,2h 45m,non-stop,No info,4077,2019-04-03,3,4,2,165,0,6,8
Multiple carriers,27/03/2019,Delhi,Cochin,DEL → BOM → COK,08:00,21:00,13h,1 stop,No info,6883,2019-03-27,27,3,2,780,1,8,21
Air India,03/03/2019,Banglore,New Delhi,BLR → DEL,17:00,19:45,2h 45m,non-stop,No info,19508,2019-03-03,3,3,6,165,0,17,19
Air India,15/03/2019,Banglore,New Delhi,BLR → BOM → DEL,08:50,23:15,14h 25m,1 stop,No info,8714,2019-03-15,15,3,4,865,1,8,23
IndiGo,1/05/2019,Kolkata,Banglore,CCU → BLR,04:40,07:15,2h 35m,non-stop,No info,4804,2019-05-01,1,5,2,155,0,4,7
Multiple carriers,3/03/2019,Delhi,Cochin,DEL → BOM → COK,08:00,15:30,7h 30m,1 stop,No info,15078,2019-03-03,3,3,6,450,1,8,15
SpiceJet,21/04/2019,Kolkata,Banglore,CCU → BLR,17:10,19:40,2h 30m,non-stop,No check-in baggage included,4807,2019-04-21,21,4,6,150,0,17,19
Multiple carriers,6/03/2019,Delhi,Cochin,DEL → GWL → IDR → BOM → COK,11:35,21:00,9h 25m,3 stops,No info,21829,2019-03-06,6,3,2,565,3,11,21
Vistara,24/03/2019,Banglore,New Delhi,BLR → DEL,11:30,14:10,2h 40m,non-stop,No info,5403,2019-03-24,24,3,6,160,0,11,14
Jet Airways,01/03/2019,Banglore,New Delhi,BLR → BOM → DEL,07:00,16:10,9h 10m,1 stop,No info,26890,2019-03-01,1,3,4,550,1,7,16
GoAir,18/05/2019,Kolkata,Banglore,CCU → BOM → BLR,23:30,07:45 19 May,8h 15m,1 stop,No info,7335,2019-05-18,18,5,5,495,1,23,7
Jet Airways,27/03/2019,Delhi,Cochin,DEL → MAA → BOM → COK,17:35,04:25 28 Mar,10h 50m,2 stops,In-flight meal not included,9412,2019-03-27,27,3,2,650,2,17,4
Jet Airways,21/05/2019,Kolkata,Banglore,CCU → BOM → BLR,08:25,19:50,11h 25m,1 stop,In-flight meal not included,10844,2019-05-21,21,5,1,685,1,8,19
IndiGo,6/06/2019,Banglore,Delhi,BLR → DEL,18:55,21:50,2h 55m,non-stop,No info,4990,2019-06-06,6,6,3,175,0,18,21
Jet Airways,27/05/2019,Delhi,Cochin,DEL → AMD → BOM → COK,23:05,04:25 29 May,29h 20m,2 stops,No info,16704,2019-05-27,27,5,0,1760,2,23,4
Air India,9/04/2019,Delhi,Cochin,DEL → NAG → BOM → COK,05:55,19:15 10 Apr,37h 20m,2 stops,No info,7711,2019-04-09,9,4,1,2240,2,5,19
Jet Airways,3/06/2019,Delhi,Cochin,DEL → BOM → COK,17:30,04:25 04 Jun,10h 55m,1 stop,In-flight meal not included,10262,2019-06-03,3,6,0,655,1,17,4
Multiple carriers,24/06/2019,Delhi,Cochin,DEL → BOM → COK,12:50,21:00,8h 10m,1 stop,In-flight meal not included,6007,2019-06-24,24,6,0,490,1,12,21
Air India,1/04/2019,Kolkata,Banglore,CCU → BOM → AMD → BLR,09:25,05:25 02 Apr,20h,2 stops,No info,12219,2019-04-01,1,4,0,1200,2,9,5
GoAir,1/05/2019,Banglore,Delhi,BLR → DEL,20:55,23:40,2h 45m,non-stop,No info,3898,2019-05-01,1,5,2,165,0,20,23
Jet Airways,6/05/2019,Kolkata,Banglore,CCU → DEL → BLR,17:00,22:05 07 May,29h 5m,1 stop,No info,11467,2019-05-06,6,5,0,1745,1,17,22
Air India,18/05/2019,Kolkata,Banglore,CCU → JAI → DEL → BLR,08:20,20:25,12h 5m,2 stops,No info,12534,2019-05-18,18,5,5,725,2,8,20
Jet Airways,6/06/2019,Kolkata,Banglore,CCU → BOM → BLR,08:25,18:15,9h 50m,1 stop,In-flight meal not included,10844,2019-06-06,6,6,3,590,1,8,18
SpiceJet,24/03/2019,Banglore,New Delhi,BLR → DEL,05:45,08:35,2h 50m,non-stop,No info,4377,2019-03-24,24,3,6,170,0,5,8
Vistara,9/06/2019,Chennai,Kolkata,MAA → CCU,17:45,20:05,2h 20m,non-stop,No info,11982,2019-06-09,9,6,6,140,0,17,20
SpiceJet,9/06/2019,Banglore,Delhi,BLR → DEL,09:30,12:20,2h 50m,non-stop,No info,4423,2019-06-09,9,6,6,170,0,9,12
Jet Airways,3/03/2019,Delhi,Cochin,DEL → BOM → COK,19:15,04:25 04 Mar,9h 10m,1 stop,No info,17234,2019-03-03,3,3,6,550,1,19,4
Vistara,1/04/2019,Kolkata,Banglore,CCU → DEL → BLR,07:10,22:55,15h 45m,1 stop,No info,8295,2019-04-01,1,4,0,945,1,7,22
Jet Airways,6/03/2019,Delhi,Cochin,DEL → JAI → BOM → COK,05:30,19:45 07 Mar,38h 15m,2 stops,In-flight meal not included,15864,2019-03-06,6,3,2,2295,2,5,19
GoAir,27/05/2019,Banglore,Delhi,BLR → DEL,11:40,14:30,2h 50m,non-stop,No info,3398,2019-05-27,27,5,0,170,0,11,14
Multiple carriers,9/06/2019,Delhi,Cochin,DEL → BOM → COK,13:00,01:30 10 Jun,12h 30m,1 stop,No info,7198,2019-06-09,9,6,6,750,1,13,1
Jet Airways,6/04/2019,Banglore,Delhi,BLR → DEL,06:00,08:45,2h 45m,non-stop,No info,7229,2019-04-06,6,4,5,165,0,6,8
Jet Airways,12/06/2019,Delhi,Cochin,DEL → JAI → BOM → COK,05:30,04:25 13 Jun,22h 55m,2 stops,No info,13014,2019-06-12,12,6,2,1375,2,5,4
Air India,9/05/2019,Kolkata,Banglore,CCU → MAA → BLR,14:35,14:35 10 May,24h,1 stop,No info,6528,2019-05-09,9,5,3,1440,1,14,14
Jet Airways,12/06/2019,Delhi,Cochin,DEL → IDR → BOM → COK,09:35,12:35 13 Jun,27h,2 stops,No info,13292,2019-06-12,12,6,2,1620,2,9,12
Jet Airways,21/05/2019,Delhi,Cochin,DEL → AMD → BOM → COK,19:10,19:00 22 May,23h 50m,2 stops,No info,15129,2019-05-21,21,5,1,1430,2,19,19
Air India,15/06/2019,Delhi,Cochin,DEL → BHO → BOM → COK,20:00,19:15 16 Jun,23h 15m,2 stops,No info,11071,2019-06-15,15,6,5,1395,2,20,19
SpiceJet,21/04/2019,Kolkata,Banglore,CCU → BLR,06:55,09:30,2h 35m,non-stop,No info,4174,2019-04-21,21,4,6,155,0,6,9
Multiple carriers,27/03/2019,Delhi,Cochin,DEL → BOM → COK,04:00,18:50,14h 50m,1 stop,No info,11299,2019-03-27,27,3,2,890,1,4,18
Jet Airways,18/05/2019,Delhi,Cochin,DEL → BOM → COK,19:45,12:35 19 May,16h 50m,1 stop,In-flight meal not included,12373,2019-05-18,18,5,5,1010,1,19,12
Air India,01/03/2019,Banglore,New Delhi,BLR → CCU → DEL,05:50,09:15 02 Mar,27h 25m,1 stop,No info,13439,2019-03-01,1,3,4,1645,1,5,9
IndiGo,1/05/2019,Kolkata,Banglore,CCU → BLR,20:20,22:55,2h 35m,non-stop,No info,4804,2019-05-01,1,5,2,155,0,20,22
Air India,12/05/2019,Kolkata,Banglore,CCU → BOM → GOI → BLR,09:25,05:35 13 May,20h 10m,2 stops,No info,11642,2019-05-12,12,5,6,1210,2,9,5
IndiGo,18/06/2019,Banglore,Delhi,BLR → DEL,00:25,03:15,2h 50m,non-stop,No info,3419,2019-06-18,18,6,1,170,0,0,3
IndiGo,21/05/2019,Kolkata,Banglore,CCU → RPR → HYD → BLR,06:35,12:10,5h 35m,2 stops,No info,6103,2019-05-21,21,5,1,335,2,6,12
Air India,9/05/2019,Kolkata,Banglore,CCU → DEL → COK → BLR,07:00,01:20 10 May,18h 20m,2 stops,No info,13033,2019-05-09,9,5,3,1100,2,7,1
Jet Airways,18/03/2019,Banglore,New Delhi,BLR → BOM → JDH → DEL,08:55,15:55,7h,2 stops,In-flight meal not included,11245,2019-03-18,18,3,0,420,2,8,15
Jet Airways,1/04/2019,Kolkata,Banglore,CCU → BOM → BLR,06:30,12:00,5h 30m,1 stop,In-flight meal not included,10056,2019-04-01,1,4,0,330,1,6,12
Jet Airways,6/06/2019,Kolkata,Banglore,CCU → DEL → BLR,20:25,14:25 07 Jun,18h,1 stop,In-flight meal not included,10539,2019-06-06,6,6,3,1080,1,20,14
IndiGo,18/03/2019,Chennai,Kolkata,MAA → CCU,22:05,00:25 19 Mar,2h 20m,non-stop,No info,5277,2019-03-18,18,3,0,140,0,22,0
Air India,21/05/2019,Kolkata,Banglore,CCU → DEL → BLR,10:00,23:15,13h 15m,1 stop,No info,11936,2019-05-21,21,5,1,795,1,10,23
Jet Airways,9/06/2019,Delhi,Cochin,DEL → JAI → BOM → COK,05:30,04:25 10 Jun,22h 55m,2 stops,No info,13014,2019-06-09,9,6,6,1375,2,5,4
Vistara,6/06/2019,Kolkata,Banglore,CCU → DEL → BLR,17:00,20:20 07 Jun,27h 20m,1 stop,No info,8820,2019-06-06,6,6,3,1640,1,17,20
Jet Airways,9/05/2019,Delhi,Cochin,DEL → BOM → COK,15:00,12:35 10 May,21h 35m,1 stop,In-flight meal not included,12373,2019-05-09,9,5,3,1295,1,15,12
Jet Airways,1/06/2019,Delhi,Cochin,DEL → BOM → COK,09:00,12:35 02 Jun,27h 35m,1 stop,In-flight meal not included,10262,2019-06-01,1,6,5,1655,1,9,12
Jet Airways,3/06/2019,Mumbai,Hyderabad,BOM → HYD,07:05,08:30,1h 25m,non-stop,In-flight meal not included,4995,2019-06-03,3,6,0,85,0,7,8
Jet Airways,27/03/2019,Delhi,Cochin,DEL → BOM → COK,21:50,19:45 28 Mar,21h 55m,1 stop,In-flight meal not included,7438,2019-03-27,27,3,2,1315,1,21,19
IndiGo,21/03/2019,Kolkata,Banglore,CCU → BLR,05:30,08:20,2h 50m,non-stop,No info,4148,2019-03-21,21,3,3,170,0,5,8
IndiGo,27/05/2019,Chennai,Kolkata,MAA → CCU,14:45,17:05,2h 20m,non-stop,No info,3597,2019-05-27,27,5,0,140,0,14,17
Air Asia,1/05/2019,Kolkata,Banglore,CCU → DEL → BLR,07:35,23:30,15h 55m,1 stop,No info,5192,2019-05-01,1,5,2,955,1,7,23
Jet Airways,06/03/2019,Banglore,New Delhi,BLR → BOM → DEL,08:00,20:20,12h 20m,1 stop,No info,16736,2019-03-06,6,3,2,740,1,8,20
Multiple carriers,1/06/2019,Delhi,Cochin,DEL → BOM → COK,13:00,21:00,8h,1 stop,No info,7933,2019-06-01,1,6,5,480,1,13,21
Air India,18/05/2019,Delhi,Cochin,DEL → BOM → COK,08:00,19:15,11h 15m,1 stop,No info,8879,2019-05-18,18,5,5,675,1,8,19
IndiGo,12/05/2019,Delhi,Cochin,DEL → COK,14:25,17:40,3h 15m,non-stop,No info,5000,2019-05-12,12,5,6,195,0,14,17
Vistara,6/05/2019,Kolkata,Banglore,CCU → DEL → BLR,17:00,09:05 07 May,16h 5m,1 stop,No info,8137,2019-05-06,6,5,0,965,1,17,9
Air India,9/03/2019,Delhi,Cochin,DEL → CCU → BOM → COK,16:55,19:15 10 Mar,26h 20m,2 stops,No info,22096,2019-03-09,9,3,5,1580,2,16,19
SpiceJet,24/03/2019,Banglore,New Delhi,BLR → DEL,05:45,08:35,2h 50m,non-stop,No check-in baggage included,4273,2019-03-24,24,3,6,170,0,5,8
Jet Airways,01/03/2019,Banglore,New Delhi,BLR → BOM → DEL,18:40,00:45 02 Mar,6h 5m,1 stop,No info,35185,2019-03-01,1,3,4,365,1,18,0
IndiGo,15/04/2019,Kolkata,Banglore,CCU → BBI → BLR,19:35,23:15,3h 40m,1 stop,No info,4226,2019-04-15,15,4,0,220,1,19,23
Jet Airways,1/05/2019,Kolkata,Banglore,CCU → BOM → BLR,08:25,16:20,7h 55m,1 stop,In-flight meal not included,10844,2019-05-01,1,5,2,475,1,8,16
IndiGo,12/06/2019,Mumbai,Hyderabad,BOM → HYD,12:00,13:30,1h 30m,non-stop,No info,2754,2019-06-12,12,6,2,90,0,12,13
IndiGo,6/06/2019,Kolkata,Banglore,CCU → VTZ → BLR,10:30,16:05,5h 35m,1 stop,No info,6301,2019-06-06,6,6,3,335,1,10,16
Air India,18/05/2019,Kolkata,Banglore,CCU → BOM → COK → BLR,09:25,13:45 19 May,28h 20m,2 stops,No info,13222,2019-05-18,18,5,5,1700,2,9,13
Jet Airways,21/05/2019,Delhi,Cochin,DEL → BOM → COK,17:30,12:35 22 May,19h 5m,1 stop,In-flight meal not included,12898,2019-05-21,21,5,1,1145,1,17,12
Air India,12/03/2019,Banglore,New Delhi,BLR → BOM → DEL,06:45,20:35,13h 50m,1 stop,No info,12127,2019-03-12,12,3,1,830,1,6,20
Jet Airways,21/05/2019,Kolkata,Banglore,CCU → DEL → BLR,20:25,22:05 22 May,25h 40m,1 stop,No info,13067,2019-05-21,21,5,1,1540,1,20,22
Air India,1/04/2019,Kolkata,Banglore,CCU → GAU → DEL → BLR,16:45,20:25 02 Apr,27h 40m,2 stops,No info,9920,2019-04-01,1,4,0,1660,2,16,20
GoAir,1/04/2019,Banglore,Delhi,BLR → DEL,07:45,10:40,2h 55m,non-stop,No info,4239,2019-04-01,1,4,0,175,0,7,10
Jet Airways,6/06/2019,Delhi,Cochin,DEL → BOM → COK,21:50,19:00 07 Jun,21h 10m,1 stop,No info,14714,2019-06-06,6,6,3,1270,1,21,19
IndiGo,6/05/2019,Kolkata,Banglore,CCU → NAG → BLR,18:05,23:30,5h 25m,1 stop,No info,6218,2019-05-06,6,5,0,325,1,18,23
IndiGo,1/03/2019,Chennai,Kolkata,MAA → CCU,05:15,07:35,2h 20m,non-stop,No info,7295,2019-03-01,1,3,4,140,0,5,7
Multiple carriers,9/06/2019,Delhi,Cochin,DEL → BOM → COK,03:50,11:30,7h 40m,1 stop,No info,7408,2019-06-09,9,6,6,460,1,3,11
Jet Airways,9/06/2019,Kolkata,Banglore,CCU → DEL → BLR,09:35,18:00,8h 25m,1 stop,In-flight meal not included,13994,2019-06-09,9,6,6,505,1,9,18
IndiGo,15/05/2019,Kolkata,Banglore,CCU → BLR,14:25,16:55,2h 30m,non-stop,No info,5224,2019-05-15,15,5,2,150,0,14,16
SpiceJet,9/03/2019,Mumbai,Hyderabad,BOM → HYD,05:45,07:05,1h 20m,non-stop,No info,4391,2019-03-09,9,3,5,80,0,5,7
Air India,18/05/2019,Kolkata,Banglore,CCU → DEL → AMD → BLR,10:00,05:25 19 May,19h 25m,2 stops,No info,14109,2019-05-18,18,5,5,1165,2,10,5
SpiceJet,27/04/2019,Banglore,Delhi,BLR → DEL,09:30,12:20,2h 50m,non-stop,No check-in baggage included,4885,2019-04-27,27,4,5,170,0,9,12
Jet Airways,1/06/2019,Banglore,Delhi,BLR → DEL,08:20,11:20,3h,non-stop,No info,8016,2019-06-01,1,6,5,180,0,8,11
Multiple carriers,24/06/2019,Delhi,Cochin,DEL → BOM → COK,06:00,12:35,6h 35m,1 stop,No info,12524,2019-06-24,24,6,0,395,1,6,12
Jet Airways,27/03/2019,Delhi,Cochin,DEL → BOM → COK,02:15,18:50,16h 35m,1 stop,In-flight meal not included,6017,2019-03-27,27,3,2,995,1,2,18
Air India,9/05/2019,Delhi,Cochin,DEL → GOI → BOM → COK,22:00,19:15 10 May,21h 15m,2 stops,No info,10441,2019-05-09,9,5,3,1275,2,22,19
SpiceJet,1/04/2019,Banglore,Delhi,BLR → DEL,21:10,00:05 02 Apr,2h 55m,non-stop,No info,3625,2019-04-01,1,4,0,175,0,21,0
Air India,9/03/2019,Delhi,Cochin,DEL → RPR → NAG → BOM → COK,05:15,19:15 10 Mar,38h,3 stops,No info,15586,2019-03-09,9,3,5,2280,3,5,19
Air India,27/03/2019,Delhi,Cochin,DEL → BOM → COK,08:00,19:15,11h 15m,1 stop,No info,7199,2019-03-27,27,3,2,675,1,8,19
Jet Airways,21/03/2019,Delhi,Cochin,DEL → IXC → BOM → COK,06:20,04:25 22 Mar,22h 5m,2 stops,No info,12273,2019-03-21,21,3,3,1325,2,6,4
Multiple carriers,6/06/2019,Delhi,Cochin,DEL → BOM → COK,19:00,01:30 07 Jun,6h 30m,1 stop,No info,7530,2019-06-06,6,6,3,390,1,19,1
Jet Airways,21/05/2019,Mumbai,Hyderabad,BOM → HYD,19:35,21:05,1h 30m,non-stop,No info,5678,2019-05-21,21,5,1,90,0,19,21
Air India,24/06/2019,Delhi,Cochin,DEL → GOI → BOM → COK,10:55,07:40 25 Jun,20h 45m,2 stops,No info,11753,2019-06-24,24,6,0,1245,2,10,7
SpiceJet,21/05/2019,Mumbai,Hyderabad,BOM → HYD,22:45,00:15 22 May,1h 30m,non-stop,No check-in baggage included,1965,2019-05-21,21,5,1,90,0,22,0
IndiGo,21/03/2019,Delhi,Cochin,DEL → BOM → COK,06:40,13:20,6h 40m,1 stop,No info,10208,2019-03-21,21,3,3,400,1,6,13
IndiGo,21/05/2019,Delhi,Cochin,DEL → BOM → COK,20:25,01:30 22 May,5h 5m,1 stop,No info,5054,2019-05-21,21,5,1,305,1,20,1
IndiGo,3/03/2019,Delhi,Cochin,DEL → BOM → COK,08:25,15:30,7h 5m,1 stop,No info,14871,2019-03-03,3,3,6,425,1,8,15
Jet Airways,18/05/2019,Delhi,Cochin,DEL → BOM → COK,07:05,19:00,11h 55m,1 stop,In-flight meal not included,12373,2019-05-18,18,5,5,715,1,7,19
SpiceJet,15/06/2019,Mumbai,Hyderabad,BOM → HYD,22:45,00:15 16 Jun,1h 30m,non-stop,No info,2017,2019-06-15,15,6,5,90,0,22,0
Jet Airways,24/03/2019,Kolkata,Banglore,CCU → BOM → BLR,13:55,04:45 25 Mar,14h 50m,1 stop,In-flight meal not included,10661,2019-03-24,24,3,6,890,1,13,4
Multiple carriers,9/05/2019,Delhi,Cochin,DEL → BOM → COK,10:20,19:00,8h 40m,1 stop,No info,9794,2019-05-09,9,5,3,520,1,10,19
Jet Airways,9/05/2019,Kolkata,Banglore,CCU → DEL → BLR,20:25,23:35 10 May,27h 10m,1 stop,No info,13067,2019-05-09,9,5,3,1630,1,20,23
SpiceJet,3/03/2019,Chennai,Kolkata,MAA → CCU,17:45,20:05,2h 20m,non-stop,No info,7298,2019-03-03,3,3,6,140,0,17,20
IndiGo,03/03/2019,Banglore,New Delhi,BLR → DEL,10:05,13:00,2h 55m,non-stop,No info,7648,2019-03-03,3,3,6,175,0,10,13
Air India,12/05/2019,Kolkata,Banglore,CCU → BBI → BOM → BLR,12:00,21:50,9h 50m,2 stops,No info,10676,2019-05-12,12,5,6,590,2,12,21
Air India,3/06/2019,Banglore,Delhi,BLR → DEL,10:00,12:45,2h 45m,non-stop,No info,6961,2019-06-03,3,6,0,165,0,10,12
IndiGo,15/05/2019,Delhi,Cochin,DEL → BOM → COK,11:25,01:30 16 May,14h 5m,1 stop,No info,6979,2019-05-15,15,5,2,845,1,11,1
Multiple carriers,27/05/2019,Delhi,Cochin,DEL → BOM → COK,09:00,21:00,12h,1 stop,No info,13587,2019-05-27,27,5,0,720,1,9,21
Jet Airways,24/05/2019,Kolkata,Banglore,CCU → BOM → BLR,14:05,23:35,9h 30m,1 stop,In-flight meal not included,10844,2019-05-24,24,5,4,570,1,14,23
IndiGo,12/05/2019,Banglore,Delhi,BLR → DEL,10:10,13:00,2h 50m,non-stop,No info,3943,2019-05-12,12,5,6,170,0,10,13
IndiGo,12/06/2019,Delhi,Cochin,DEL → BOM → COK,09:15,21:00,11h 45m,1 stop,No info,6838,2019-06-12,12,6,2,705,1,9,21
Jet Airways,15/04/2019,Delhi,Cochin,DEL → BOM → COK,13:00,19:00,6h,1 stop,In-flight meal not included,6542,2019-04-15,15,4,0,360,1,13,19
Jet Airways,21/05/2019,Delhi,Cochin,DEL → BOM → COK,07:05,19:00,11h 55m,1 stop,In-flight meal not included,12239,2019-05-21,21,5,1,715,1,7,19
Jet Airways,12/05/2019,Kolkata,Banglore,CCU → BOM → BLR,16:30,04:40 13 May,12h 10m,1 stop,No info,14388,2019-05-12,12,5,6,730,1,16,4
IndiGo,12/03/2019,Kolkata,Banglore,CCU → BLR,05:30,08:20,2h 50m,non-stop,No info,4148,2019-03-12,12,3,1,170,0,5,8
Multiple carriers,18/05/2019,Delhi,Cochin,DEL → IDR → BOM → COK,15:05,01:30 19 May,10h 25m,2 stops,No info,16840,2019-05-18,18,5,5,625,2,15,1
Multiple carriers,3/06/2019,Delhi,Cochin,DEL → HYD → COK,09:45,22:30,12h 45m,1 stop,No info,9646,2019-06-03,3,6,0,765,1,9,22
Jet Airways,9/06/2019,Kolkata,Banglore,CCU → BOM → BLR,21:10,18:15 10 Jun,21h 5m,1 stop,No info,14571,2019-06-09,9,6,6,1265,1,21,18
IndiGo,15/05/2019,Delhi,Cochin,DEL → BOM → COK,16:00,01:30 16 May,9h 30m,1 stop,No info,7923,2019-05-15,15,5,2,570,1,16,1
Jet Airways,12/05/2019,Kolkata,Banglore,CCU → BOM → BLR,20:00,04:40 13 May,8h 40m,1 stop,In-flight meal not included,8586,2019-05-12,12,5,6,520,1,20,4
Multiple carriers,3/06/2019,Delhi,Cochin,DEL → HYD → COK,13:15,22:30,9h 15m,1 stop,No info,9646,2019-06-03,3,6,0,555,1,13,22
Jet Airways,18/05/2019,Kolkata,Banglore,CCU → BOM → BLR,14:05,12:00 19 May,21h 55m,1 stop,No info,14388,2019-05-18,18,5,5,1315,1,14,12
Jet Airways,12/06/2019,Kolkata,Banglore,CCU → BOM → BLR,16:30,16:20 13 Jun,23h 50m,1 stop,No info,13044,2019-06-12,12,6,2,1430,1,16,16
Multiple carriers,21/05/2019,Delhi,Cochin,DEL → BOM → COK,10:00,19:00,9h,1 stop,No info,10197,2019-05-21,21,5,1,540,1,10,19
Jet Airways,1/06/2019,Delhi,Cochin,DEL → BOM → COK,19:45,19:00 02 Jun,23h 15m,1 stop,No info,14714,2019-06-01,1,6,5,1395,1,19,19
Air India,1/06/2019,Delhi,Cochin,DEL → BOM → COK,10:00,19:15,9h 15m,1 stop,No info,9929,2019-06-01,1,6,5,555,1,10,19
Jet Airways,21/03/2019,Delhi,Cochin,DEL → BOM → COK,22:50,04:25 22 Mar,5h 35m,1 stop,In-flight meal not included,6017,2019-03-21,21,3,3,335,1,22,4
SpiceJet,27/06/2019,Chennai,Kolkata,MAA → CCU,09:45,12:00,2h 15m,non-stop,No info,3597,2019-06-27,27,6,3,135,0,9,12
Air India,21/03/2019,Delhi,Cochin,DEL → BLR → COK,13:30,23:00,9h 30m,1 stop,No info,5704,2019-03-21,21,3,3,570,1,13,23
Jet Airways,3/06/2019,Delhi,Cochin,DEL → BOM → COK,19:45,04:25 04 Jun,8h 40m,1 stop,No info,14714,2019-06-03,3,6,0,520,1,19,4
Air India,12/05/2019,Banglore,Delhi,BLR → DEL,10:00,12:45,2h 45m,non-stop,No info,5228,2019-05-12,12,5,6,165,0,10,12
Jet Airways,1/04/2019,Kolkata,Banglore,CCU → DEL → BLR,09:35,10:55 02 Apr,25h 20m,1 stop,No info,11467,2019-04-01,1,4,0,1520,1,9,10
Vistara,6/06/2019,Banglore,Delhi,BLR → DEL,09:45,12:35,2h 50m,non-stop,No info,4668,2019-06-06,6,6,3,170,0,9,12
IndiGo,18/04/2019,Banglore,Delhi,BLR → DEL,21:15,00:15 19 Apr,3h,non-stop,No info,4591,2019-04-18,18,4,3,180,0,21,0
IndiGo,12/05/2019,Banglore,Delhi,BLR → DEL,21:15,00:15 13 May,3h,non-stop,No info,3943,2019-05-12,12,5,6,180,0,21,0
Air India,21/04/2019,Banglore,Delhi,BLR → DEL,10:00,12:45,2h 45m,non-stop,No info,5228,2019-04-21,21,4,6,165,0,10,12
Jet Airways,27/03/2019,Delhi,Cochin,DEL → BOM → COK,02:15,18:50,16h 35m,1 stop,No info,12242,2019-03-27,27,3,2,995,1,2,18
Air India,9/06/2019,Delhi,Cochin,DEL → HYD → MAA → COK,07:05,09:25 10 Jun,26h 20m,2 stops,No info,11185,2019-06-09,9,6,6,1580,2,7,9
IndiGo,9/04/2019,Delhi,Cochin,DEL → BOM → COK,09:15,01:30 10 Apr,16h 15m,1 stop,No info,6573,2019-04-09,9,4,1,975,1,9,1
Jet Airways,15/05/2019,Kolkata,Banglore,CCU → BOM → BLR,16:30,22:35,6h 5m,1 stop,No info,14781,2019-05-15,15,5,2,365,1,16,22
Air India,12/06/2019,Kolkata,Banglore,CCU → GAU → DEL → BLR,16:45,08:55 13 Jun,16h 10m,2 stops,No info,14960,2019-06-12,12,6,2,970,2,16,8
IndiGo,15/05/2019,Chennai,Kolkata,MAA → CCU,11:35,14:00,2h 25m,non-stop,No info,4332,2019-05-15,15,5,2,145,0,11,14
Air Asia,03/03/2019,Banglore,New Delhi,BLR → DEL,05:50,08:40,2h 50m,non-stop,No info,7652,2019-03-03,3,3,6,170,0,5,8
Jet Airways,24/05/2019,Kolkata,Banglore,CCU → DEL → BLR,09:35,21:05,11h 30m,1 stop,No info,14151,2019-05-24,24,5,4,690,1,9,21
SpiceJet,12/06/2019,Banglore,Delhi,BLR → DEL,09:30,12:20,2h 50m,non-stop,No check-in baggage included,4319,2019-06-12,12,6,2,170,0,9,12
Jet Airways,21/03/2019,Delhi,Cochin,DEL → AMD → BOM → COK,19:10,18:50 22 Mar,23h 40m,2 stops,No info,10929,2019-03-21,21,3,3,1420,2,19,18
Air India,24/03/2019,Kolkata,Banglore,CCU → DEL → VGA → BLR,07:00,10:00 25 Mar,27h,2 stops,No info,11491,2019-03-24,24,3,6,1620,2,7,10
IndiGo,18/04/2019,Delhi,Cochin,DEL → COK,14:20,17:35,3h 15m,non-stop,No info,6015,2019-04-18,18,4,3,195,0,14,17
Jet Airways,12/06/2019,Kolkata,Banglore,CCU → DEL → BLR,09:35,21:05,11h 30m,1 stop,No info,12692,2019-06-12,12,6,2,690,1,9,21
Air Asia,9/03/2019,Kolkata,Banglore,CCU → BLR,22:50,01:20 10 Mar,2h 30m,non-stop,No info,4384,2019-03-09,9,3,5,150,0,22,1
IndiGo,3/06/2019,Banglore,Delhi,BLR → DEL,06:05,08:50,2h 45m,non-stop,No info,3943,2019-06-03,3,6,0,165,0,6,8
Jet Airways,18/05/2019,Delhi,Cochin,DEL → BOM → COK,09:00,19:00,10h,1 stop,In-flight meal not included,12373,2019-05-18,18,5,5,600,1,9,19
Jet Airways,06/03/2019,Banglore,New Delhi,BLR → BOM → DEL,08:00,13:15,5h 15m,1 stop,No info,19225,2019-03-06,6,3,2,315,1,8,13
Jet Airways,9/03/2019,Delhi,Cochin,DEL → BOM → COK,19:45,18:50 10 Mar,23h 5m,1 stop,In-flight meal not included,14053,2019-03-09,9,3,5,1385,1,19,18
Air India,12/04/2019,Banglore,Delhi,BLR → DEL,13:20,16:10,2h 50m,non-stop,No info,5911,2019-04-12,12,4,4,170,0,13,16
Multiple carriers,9/06/2019,Delhi,Cochin,DEL → BOM → COK,06:40,19:00,12h 20m,1 stop,No info,10877,2019-06-09,9,6,6,740,1,6,19
Jet Airways,6/06/2019,Kolkata,Banglore,CCU → BOM → BLR,18:55,04:40 07 Jun,9h 45m,1 stop,In-flight meal not included,7757,2019-06-06,6,6,3,585,1,18,4
IndiGo,21/03/2019,Delhi,Cochin,DEL → HYD → COK,07:35,16:10,8h 35m,1 stop,No info,6558,2019-03-21,21,3,3,515,1,7,16
IndiGo,21/04/2019,Kolkata,Banglore,CCU → BLR,09:35,12:20,2h 45m,non-stop,No info,4804,2019-04-21,21,4,6,165,0,9,12
Jet Airways,18/03/2019,Mumbai,Hyderabad,BOM → HYD,15:50,17:20,1h 30m,non-stop,No info,5678,2019-03-18,18,3,0,90,0,15,17
Jet Airways,9/05/2019,Delhi,Cochin,DEL → BOM → COK,10:00,04:25 10 May,18h 25m,1 stop,In-flight meal not included,12373,2019-05-09,9,5,3,1105,1,10,4
Jet Airways,6/05/2019,Banglore,Delhi,BLR → DEL,06:00,08:45,2h 45m,non-stop,In-flight meal not included,5198,2019-05-06,6,5,0,165,0,6,8
IndiGo,1/06/2019,Kolkata,Banglore,CCU → BLR,14:25,16:55,2h 30m,non-stop,No info,6064,2019-06-01,1,6,5,150,0,14,16
Jet Airways,9/03/2019,Delhi,Cochin,DEL → BOM → COK,21:50,04:25 10 Mar,6h 35m,1 stop,No info,15029,2019-03-09,9,3,5,395,1,21,4
Jet Airways,9/04/2019,Delhi,Cochin,DEL → JAI → BOM → COK,05:30,19:00,13h 30m,2 stops,No info,10909,2019-04-09,9,4,1,810,2,5,19
Multiple carriers,9/03/2019,Delhi,Cochin,DEL → BOM → COK,08:40,19:45,11h 5m,1 stop,No info,18492,2019-03-09,9,3,5,665,1,8,19
Jet Airways,24/06/2019,Delhi,Cochin,DEL → BOM → COK,02:15,04:25 25 Jun,26h 10m,1 stop,In-flight meal not included,10262,2019-06-24,24,6,0,1570,1,2,4
Jet Airways,18/05/2019,Kolkata,Banglore,CCU → GAU → BLR,11:50,17:35,5h 45m,1 stop,No info,8781,2019-05-18,18,5,5,345,1,11,17
IndiGo,27/05/2019,Delhi,Cochin,DEL → HYD → COK,08:35,16:10,7h 35m,1 stop,No info,6442,2019-05-27,27,5,0,455,1,8,16
Jet Airways,12/03/2019,Mumbai,Hyderabad,BOM → DEL → HYD,09:50,16:35,6h 45m,1 stop,No info,20120,2019-03-12,12,3,1,405,1,9,16
Vistara,27/05/2019,Banglore,Delhi,BLR → DEL,19:30,22:15,2h 45m,non-stop,No info,4878,2019-05-27,27,5,0,165,0,19,22
Jet Airways,06/03/2019,Banglore,New Delhi,BLR → BOM → DEL,05:45,18:25,12h 40m,1 stop,No info,16736,2019-03-06,6,3,2,760,1,5,18
SpiceJet,24/05/2019,Kolkata,Banglore,CCU → IXB → BLR,11:15,18:30,7h 15m,1 stop,No info,9630,2019-05-24,24,5,4,435,1,11,18
Vistara,9/05/2019,Kolkata,Banglore,CCU → DEL → BLR,07:10,18:50,11h 40m,1 stop,No info,8610,2019-05-09,9,5,3,700,1,7,18
Vistara,27/06/2019,Chennai,Kolkata,MAA → CCU,07:05,09:20,2h 15m,non-stop,No info,3687,2019-06-27,27,6,3,135,0,7,9
Vistara,15/05/2019,Kolkata,Banglore,CCU → DEL → BLR,20:20,09:05 16 May,12h 45m,1 stop,No info,8452,2019-05-15,15,5,2,765,1,20,9
IndiGo,18/05/2019,Banglore,Delhi,BLR → DEL,10:30,13:20,2h 50m,non-stop,No info,3943,2019-05-18,18,5,5,170,0,10,13
IndiGo,15/03/2019,Mumbai,Hyderabad,BOM → HYD,06:20,07:45,1h 25m,non-stop,No info,3342,2019-03-15,15,3,4,85,0,6,7
Jet Airways,12/05/2019,Kolkata,Banglore,CCU → DEL → BLR,20:25,14:25 13 May,18h,1 stop,No info,13067,2019-05-12,12,5,6,1080,1,20,14
Vistara,6/05/2019,Banglore,Delhi,BLR → DEL,19:30,22:15,2h 45m,non-stop,No info,4878,2019-05-06,6,5,0,165,0,19,22
Jet Airways,9/05/2019,Kolkata,Banglore,CCU → BOM → BLR,21:10,10:05 10 May,12h 55m,1 stop,No info,14388,2019-05-09,9,5,3,775,1,21,10
Jet Airways,27/05/2019,Delhi,Cochin,DEL → AMD → BOM → COK,13:25,04:25 28 May,15h,2 stops,No info,16704,2019-05-27,27,5,0,900,2,13,4
Air India,21/05/2019,Mumbai,Hyderabad,BOM → HYD,19:30,20:45,1h 15m,non-stop,No info,3100,2019-05-21,21,5,1,75,0,19,20
Air India,12/03/2019,Banglore,New Delhi,BLR → BOM → IDR → GWL → DEL,17:25,18:05 13 Mar,24h 40m,3 stops,No info,13387,2019-03-12,12,3,1,1480,3,17,18
IndiGo,9/06/2019,Mumbai,Hyderabad,BOM → HYD,09:10,10:40,1h 30m,non-stop,No info,4049,2019-06-09,9,6,6,90,0,9,10
Jet Airways,18/05/2019,Delhi,Cochin,DEL → JAI → BOM → COK,05:30,19:00,13h 30m,2 stops,In-flight meal not included,13029,2019-05-18,18,5,5,810,2,5,19
SpiceJet,9/04/2019,Banglore,Delhi,BLR → DEL,21:10,00:05 10 Apr,2h 55m,non-stop,No check-in baggage included,3919,2019-04-09,9,4,1,175,0,21,0
IndiGo,3/05/2019,Chennai,Kolkata,MAA → CCU,05:15,07:40,2h 25m,non-stop,No info,3850,2019-05-03,3,5,4,145,0,5,7
Air India,24/06/2019,Delhi,Cochin,DEL → HYD → MAA → COK,13:15,09:25 25 Jun,20h 10m,2 stops,No info,8839,2019-06-24,24,6,0,1210,2,13,9
Jet Airways,1/04/2019,Kolkata,Banglore,CCU → BOM → BLR,16:30,04:40 02 Apr,12h 10m,1 stop,In-flight meal not included,7064,2019-04-01,1,4,0,730,1,16,4
Jet Airways,12/05/2019,Kolkata,Banglore,CCU → BOM → BLR,20:00,08:15 13 May,12h 15m,1 stop,No info,13941,2019-05-12,12,5,6,735,1,20,8
Air India,24/05/2019,Kolkata,Banglore,CCU → DEL → COK → TRV → BLR,10:00,10:30 25 May,24h 30m,3 stops,No info,13007,2019-05-24,24,5,4,1470,3,10,10
Jet Airways,18/05/2019,Kolkata,Banglore,CCU → BOM → BLR,14:05,22:35,8h 30m,1 stop,No info,14781,2019-05-18,18,5,5,510,1,14,22
Jet Airways,18/03/2019,Mumbai,Hyderabad,BOM → HYD,19:35,21:05,1h 30m,non-stop,In-flight meal not included,2071,2019-03-18,18,3,0,90,0,19,21
Jet Airways,21/06/2019,Delhi,Cochin,DEL → COK,11:00,14:15,3h 15m,non-stop,In-flight meal not included,4256,2019-06-21,21,6,4,195,0,11,14
Vistara,09/03/2019,Banglore,New Delhi,BLR → DEL,16:00,18:35,2h 35m,non-stop,No info,7923,2019-03-09,9,3,5,155,0,16,18
Air Asia,15/03/2019,Kolkata,Banglore,CCU → BLR,22:50,01:20 16 Mar,2h 30m,non-stop,No info,3782,2019-03-15,15,3,4,150,0,22,1
Jet Airways,15/05/2019,Kolkata,Banglore,CCU → DEL → BLR,20:25,09:45 16 May,13h 20m,1 stop,In-flight meal not included,12384,2019-05-15,15,5,2,800,1,20,9
Multiple carriers,21/03/2019,Delhi,Cochin,DEL → BOM → COK,10:00,01:35 22 Mar,15h 35m,1 stop,In-flight meal not included,8565,2019-03-21,21,3,3,935,1,10,1
IndiGo,21/03/2019,Delhi,Cochin,DEL → BOM → COK,16:00,21:00,5h,1 stop,No info,6232,2019-03-21,21,3,3,300,1,16,21
IndiGo,09/03/2019,Banglore,New Delhi,BLR → DEL,05:30,08:20,2h 50m,non-stop,No info,4777,2019-03-09,9,3,5,170,0,5,8
Air India,1/06/2019,Kolkata,Banglore,CCU → BLR,20:45,23:20,2h 35m,non-stop,No info,4145,2019-06-01,1,6,5,155,0,20,23
Air Asia,15/05/2019,Kolkata,Banglore,CCU → DEL → BLR,22:40,10:40 16 May,12h,1 stop,No info,5192,2019-05-15,15,5,2,720,1,22,10
Air India,1/04/2019,Delhi,Cochin,DEL → COK,05:10,08:00,2h 50m,non-stop,No info,4729,2019-04-01,1,4,0,170,0,5,8
IndiGo,3/06/2019,Delhi,Cochin,DEL → BOM → COK,06:40,21:00,14h 20m,1 stop,No info,6093,2019-06-03,3,6,0,860,1,6,21
Air India,1/05/2019,Kolkata,Banglore,CCU → BOM → BLR,09:25,18:30,9h 5m,1 stop,No info,8891,2019-05-01,1,5,2,545,1,9,18
Jet Airways,27/03/2019,Delhi,Cochin,DEL → BOM → COK,16:00,04:25 28 Mar,12h 25m,1 stop,No info,12242,2019-03-27,27,3,2,745,1,16,4
Jet Airways,1/05/2019,Kolkata,Banglore,CCU → DEL → BLR,17:00,18:00 02 May,25h,1 stop,No info,11467,2019-05-01,1,5,2,1500,1,17,18
Jet Airways,21/05/2019,Kolkata,Banglore,CCU → BOM → BLR,21:10,09:20 22 May,12h 10m,1 stop,No info,14781,2019-05-21,21,5,1,730,1,21,9
Multiple carriers,18/05/2019,Delhi,Cochin,DEL → BOM → COK,07:00,19:00,12h,1 stop,No info,10197,2019-05-18,18,5,5,720,1,7,19
Jet Airways,06/03/2019,Banglore,New Delhi,BLR → BOM → DEL,21:25,09:30 07 Mar,12h 5m,1 stop,No info,17261,2019-03-06,6,3,2,725,1,21,9
Air India,1/05/2019,Delhi,Cochin,DEL → MAA → COK,20:40,09:25 02 May,12h 45m,1 stop,No info,7480,2019-05-01,1,5,2,765,1,20,9
IndiGo,21/05/2019,Kolkata,Banglore,CCU → BLR,15:30,18:05,2h 35m,non-stop,No info,4804,2019-05-21,21,5,1,155,0,15,18
SpiceJet,21/04/2019,Kolkata,Banglore,CCU → BLR,09:00,11:25,2h 25m,non-stop,No check-in baggage included,4439,2019-04-21,21,4,6,145,0,9,11
Jet Airways,6/06/2019,Delhi,Cochin,DEL → JAI → BOM → COK,05:30,04:25 07 Jun,22h 55m,2 stops,In-flight meal not included,10368,2019-06-06,6,6,3,1375,2,5,4
SpiceJet,21/03/2019,Delhi,Cochin,DEL → MAA → COK,06:10,11:20,5h 10m,1 stop,No info,6065,2019-03-21,21,3,3,310,1,6,11
Jet Airways,24/05/2019,Kolkata,Banglore,CCU → BOM → BLR,18:55,04:40 25 May,9h 45m,1 stop,In-flight meal not included,8586,2019-05-24,24,5,4,585,1,18,4
IndiGo,18/03/2019,Delhi,Cochin,DEL → COK,14:30,17:35,3h 5m,non-stop,No info,5406,2019-03-18,18,3,0,185,0,14,17
Jet Airways,6/06/2019,Delhi,Cochin,DEL → BDQ → BOM → COK,18:25,04:25 07 Jun,10h,2 stops,In-flight meal not included,12142,2019-06-06,6,6,3,600,2,18,4
Jet Airways,6/06/2019,Delhi,Cochin,DEL → BOM → COK,02:15,12:35,10h 20m,1 stop,No info,14714,2019-06-06,6,6,3,620,1,2,12
Jet Airways,15/06/2019,Delhi,Cochin,DEL → BOM → COK,02:15,04:25 16 Jun,26h 10m,1 stop,In-flight meal not included,10262,2019-06-15,15,6,5,1570,1,2,4
Air India,06/03/2019,Banglore,New Delhi,BLR → MAA → DEL,11:50,23:55,12h 5m,1 stop,No info,15434,2019-03-06,6,3,2,725,1,11,23
Air India,18/05/2019,Kolkata,Banglore,CCU → BBI → BOM → BLR,12:00,11:10 19 May,23h 10m,2 stops,No info,10676,2019-05-18,18,5,5,1390,2,12,11
IndiGo,21/04/2019,Kolkata,Banglore,CCU → BLR,20:20,22:55,2h 35m,non-stop,No info,4804,2019-04-21,21,4,6,155,0,20,22
Jet Airways,9/06/2019,Delhi,Cochin,DEL → JAI → BOM → COK,19:30,12:35 10 Jun,17h 5m,2 stops,No info,13014,2019-06-09,9,6,6,1025,2,19,12
IndiGo,3/05/2019,Banglore,Delhi,BLR → DEL,10:10,13:00,2h 50m,non-stop,No info,3943,2019-05-03,3,5,4,170,0,10,13
Air India,6/03/2019,Mumbai,Hyderabad,BOM → COK → MAA → HYD,05:30,22:00,16h 30m,2 stops,No info,9678,2019-03-06,6,3,2,990,2,5,22
Jet Airways,15/05/2019,Kolkata,Banglore,CCU → BOM → BLR,08:25,19:50,11h 25m,1 stop,No info,14781,2019-05-15,15,5,2,685,1,8,19
Multiple carriers,15/05/2019,Delhi,Cochin,DEL → BOM → COK,09:00,19:00,10h,1 stop,No info,10197,2019-05-15,15,5,2,600,1,9,19
Air India,9/05/2019,Delhi,Cochin,DEL → BHO → BOM → COK,05:55,19:15,13h 20m,2 stops,No info,10861,2019-05-09,9,5,3,800,2,5,19
Jet Airways,1/05/2019,Kolkata,Banglore,CCU → BOM → BLR,21:10,04:40 02 May,7h 30m,1 stop,In-flight meal not included,10844,2019-05-01,1,5,2,450,1,21,4
Air India,21/05/2019,Delhi,Cochin,DEL → MAA → COK,17:20,09:25 22 May,16h 5m,1 stop,No info,7480,2019-05-21,21,5,1,965,1,17,9
IndiGo,24/06/2019,Delhi,Cochin,DEL → BOM → COK,17:10,01:30 25 Jun,8h 20m,1 stop,No info,5684,2019-06-24,24,6,0,500,1,17,1
Jet Airways,6/06/2019,Delhi,Cochin,DEL → BOM → COK,16:00,19:00 07 Jun,27h,1 stop,No info,14714,2019-06-06,6,6,3,1620,1,16,19
Jet Airways,1/04/2019,Kolkata,Banglore,CCU → DEL → BLR,09:35,18:00,8h 25m,1 stop,In-flight meal not included,9314,2019-04-01,1,4,0,505,1,9,18
Air India,15/03/2019,Kolkata,Banglore,CCU → BLR,20:45,23:20,2h 35m,non-stop,No info,4435,2019-03-15,15,3,4,155,0,20,23
Multiple carriers,27/06/2019,Delhi,Cochin,DEL → BOM → COK,07:30,19:00,11h 30m,1 stop,No info,11789,2019-06-27,27,6,3,690,1,7,19
SpiceJet,3/04/2019,Banglore,Delhi,BLR → DEL,21:10,00:05 04 Apr,2h 55m,non-stop,No check-in baggage included,3919,2019-04-03,3,4,2,175,0,21,0
Jet Airways,6/04/2019,Banglore,Delhi,BLR → DEL,15:15,18:10,2h 55m,non-stop,In-flight meal not included,5198,2019-04-06,6,4,5,175,0,15,18
SpiceJet,24/03/2019,Banglore,New Delhi,BLR → DEL,05:45,08:35,2h 50m,non-stop,No check-in baggage included,4273,2019-03-24,24,3,6,170,0,5,8
Vistara,9/05/2019,Kolkata,Banglore,CCU → DEL → BLR,17:00,18:50 10 May,25h 50m,1 stop,No info,8820,2019-05-09,9,5,3,1550,1,17,18
IndiGo,6/05/2019,Mumbai,Hyderabad,BOM → HYD,12:00,13:30,1h 30m,non-stop,No info,2754,2019-05-06,6,5,0,90,0,12,13
Vistara,9/06/2019,Kolkata,Banglore,CCU → DEL → BLR,20:20,23:25 10 Jun,27h 5m,1 stop,No info,8085,2019-06-09,9,6,6,1625,1,20,23
Jet Airways,9/06/2019,Kolkata,Banglore,CCU → DEL → BLR,20:25,21:05 10 Jun,24h 40m,1 stop,In-flight meal not included,10539,2019-06-09,9,6,6,1480,1,20,21
Jet Airways,9/06/2019,Kolkata,Banglore,CCU → DEL → BLR,09:35,22:05,12h 30m,1 stop,No info,14676,2019-06-09,9,6,6,750,1,9,22
Jet Airways,27/03/2019,Delhi,Cochin,DEL → BOM → COK,02:15,04:25 28 Mar,26h 10m,1 stop,In-flight meal not included,6017,2019-03-27,27,3,2,1570,1,2,4
Jet Airways,1/04/2019,Banglore,Delhi,BLR → DEL,18:55,22:00,3h 5m,non-stop,In-flight meal not included,4544,2019-04-01,1,4,0,185,0,18,22
Trujet,6/03/2019,Mumbai,Hyderabad,BOM → NDC → HYD,13:05,16:20,3h 15m,1 stop,No info,4140,2019-03-06,6,3,2,195,1,13,16
Jet Airways,3/05/2019,Banglore,Delhi,BLR → DEL,11:10,14:05,2h 55m,non-stop,No info,7229,2019-05-03,3,5,4,175,0,11,14
Air India,9/03/2019,Delhi,Cochin,DEL → GOI → BOM → COK,22:00,19:15 10 Mar,21h 15m,2 stops,No info,16373,2019-03-09,9,3,5,1275,2,22,19
Air India,1/05/2019,Kolkata,Banglore,CCU → IXR → DEL → BLR,05:50,23:15,17h 25m,2 stops,No info,10991,2019-05-01,1,5,2,1045,2,5,23
Jet Airways,18/05/2019,Kolkata,Banglore,CCU → BOM → BLR,14:05,12:00 19 May,21h 55m,1 stop,In-flight meal not included,9663,2019-05-18,18,5,5,1315,1,14,12
Air India,01/03/2019,Banglore,New Delhi,BLR → COK → DEL,22:00,23:20 02 Mar,25h 20m,1 stop,Change airports,14305,2019-03-01,1,3,4,1520,1,22,23
Air Asia,15/05/2019,Delhi,Cochin,DEL → BLR → COK,16:45,07:10 16 May,14h 25m,1 stop,No info,6752,2019-05-15,15,5,2,865,1,16,7
Jet Airways,12/06/2019,Kolkata,Banglore,CCU → BOM → BLR,16:30,09:20 13 Jun,16h 50m,1 stop,In-flight meal not included,8529,2019-06-12,12,6,2,1010,1,16,9
IndiGo,27/03/2019,Delhi,Cochin,DEL → COK,05:35,08:50,3h 15m,non-stop,No info,4729,2019-03-27,27,3,2,195,0,5,8
Multiple carriers,18/05/2019,Delhi,Cochin,DEL → BOM → COK,08:45,21:00,12h 15m,1 stop,No info,7670,2019-05-18,18,5,5,735,1,8,21
Jet Airways,3/05/2019,Mumbai,Hyderabad,BOM → HYD,10:20,11:50,1h 30m,non-stop,In-flight meal not included,4995,2019-05-03,3,5,4,90,0,10,11
Jet Airways,1/05/2019,Banglore,Delhi,BLR → DEL,08:20,11:20,3h,non-stop,No info,7229,2019-05-01,1,5,2,180,0,8,11
IndiGo,27/04/2019,Banglore,Delhi,BLR → DEL,07:10,10:05,2h 55m,non-stop,No info,4823,2019-04-27,27,4,5,175,0,7,10
Air Asia,27/03/2019,Kolkata,Banglore,CCU → BLR,19:35,22:05,2h 30m,non-stop,No info,3782,2019-03-27,27,3,2,150,0,19,22
Jet Airways,21/05/2019,Delhi,Cochin,DEL → BOM → COK,18:15,19:00 22 May,24h 45m,1 stop,In-flight meal not included,12898,2019-05-21,21,5,1,1485,1,18,19
SpiceJet,24/05/2019,Kolkata,Banglore,CCU → BLR,22:20,00:40 25 May,2h 20m,non-stop,No check-in baggage included,3841,2019-05-24,24,5,4,140,0,22,0
Multiple carriers,18/05/2019,Delhi,Cochin,DEL → BOM → COK,10:35,19:00,8h 25m,1 stop,No info,9627,2019-05-18,18,5,5,505,1,10,19
Jet Airways,9/06/2019,Kolkata,Banglore,CCU → BOM → BLR,21:10,12:00 10 Jun,14h 50m,1 stop,No info,14571,2019-06-09,9,6,6,890,1,21,12
IndiGo,24/03/2019,Kolkata,Banglore,CCU → BLR,15:20,17:55,2h 35m,non-stop,No info,6985,2019-03-24,24,3,6,155,0,15,17
Jet Airways,21/06/2019,Mumbai,Hyderabad,BOM → HYD,07:05,08:30,1h 25m,non-stop,No info,8040,2019-06-21,21,6,4,85,0,7,8
IndiGo,21/06/2019,Kolkata,Banglore,CCU → BLR,22:15,00:50 22 Jun,2h 35m,non-stop,No info,4804,2019-06-21,21,6,4,155,0,22,0
Multiple carriers,27/06/2019,Delhi,Cochin,DEL → BOM → COK,04:55,19:00,14h 5m,1 stop,No info,10678,2019-06-27,27,6,3,845,1,4,19
Jet Airways,24/03/2019,Kolkata,Banglore,CCU → BOM → BLR,16:55,18:10 25 Mar,25h 15m,1 stop,No info,14231,2019-03-24,24,3,6,1515,1,16,18
Jet Airways,12/06/2019,Kolkata,Banglore,CCU → BOM → BLR,20:00,16:20 13 Jun,20h 20m,1 stop,In-flight meal not included,8529,2019-06-12,12,6,2,1220,1,20,16
Air India,24/06/2019,Delhi,Cochin,DEL → GOI → BOM → COK,10:55,19:15,8h 20m,2 stops,No info,11753,2019-06-24,24,6,0,500,2,10,19
Jet Airways,18/05/2019,Delhi,Cochin,DEL → AMD → BOM → COK,23:05,04:25 20 May,29h 20m,2 stops,No info,16704,2019-05-18,18,5,5,1760,2,23,4
Jet Airways,6/06/2019,Kolkata,Banglore,CCU → BOM → BLR,18:55,04:40 07 Jun,9h 45m,1 stop,No info,13374,2019-06-06,6,6,3,585,1,18,4
Air India,1/05/2019,Mumbai,Hyderabad,BOM → HYD,21:05,22:25,1h 20m,non-stop,No info,3625,2019-05-01,1,5,2,80,0,21,22
Jet Airways,21/05/2019,Delhi,Cochin,DEL → BOM → COK,16:00,19:00 22 May,27h,1 stop,No info,16079,2019-05-21,21,5,1,1620,1,16,19
Jet Airways,27/06/2019,Delhi,Cochin,DEL → BOM → COK,20:55,12:35 28 Jun,15h 40m,1 stop,In-flight meal not included,10262,2019-06-27,27,6,3,940,1,20,12
Jet Airways,15/05/2019,Kolkata,Banglore,CCU → BOM → BLR,06:30,12:00,5h 30m,1 stop,In-flight meal not included,9663,2019-05-15,15,5,2,330,1,6,12
Multiple carriers,18/05/2019,Delhi,Cochin,DEL → BOM → COK,18:00,01:30 19 May,7h 30m,1 stop,No info,9595,2019-05-18,18,5,5,450,1,18,1
IndiGo,24/06/2019,Kolkata,Banglore,CCU → BLR,17:15,19:50,2h 35m,non-stop,No info,4804,2019-06-24,24,6,0,155,0,17,19
Air India,9/06/2019,Kolkata,Banglore,CCU → DEL → AMD → BLR,10:00,05:25 10 Jun,19h 25m,2 stops,No info,12744,2019-06-09,9,6,6,1165,2,10,5
Air India,1/06/2019,Banglore,Delhi,BLR → DEL,13:20,16:10,2h 50m,non-stop,No info,6961,2019-06-01,1,6,5,170,0,13,16
Jet Airways,6/05/2019,Kolkata,Banglore,CCU → BOM → BLR,14:05,04:40 07 May,14h 35m,1 stop,In-flight meal not included,9663,2019-05-06,6,5,0,875,1,14,4
Multiple carriers,21/05/2019,Delhi,Cochin,DEL → BOM → COK,10:35,19:15,8h 40m,1 stop,No info,7575,2019-05-21,21,5,1,520,1,10,19
Air India,03/03/2019,Banglore,New Delhi,BLR → BOM → NAG → DEL,19:10,10:35 07 Mar,15h 25m,2 stops,No info,13355,2019-03-03,3,3,6,925,2,19,10
Air India,24/05/2019,Kolkata,Banglore,CCU → BOM → COK → BLR,09:25,13:45 25 May,28h 20m,2 stops,No info,12592,2019-05-24,24,5,4,1700,2,9,13
Air India,1/06/2019,Mumbai,Hyderabad,BOM → HYD,13:55,15:25,1h 30m,non-stop,No info,3625,2019-06-01,1,6,5,90,0,13,15
Jet Airways,24/06/2019,Delhi,Cochin,DEL → BOM → COK,15:00,04:25 25 Jun,13h 25m,1 stop,In-flight meal not included,10262,2019-06-24,24,6,0,805,1,15,4
Air India,21/05/2019,Delhi,Cochin,DEL → AMD → BOM → COK,19:45,19:15 22 May,23h 30m,2 stops,No info,9443,2019-05-21,21,5,1,1410,2,19,19
Air India,9/03/2019,Delhi,Cochin,DEL → BOM → COK,08:40,19:15,10h 35m,1 stop,No info,18959,2019-03-09,9,3,5,635,1,8,19
IndiGo,3/03/2019,Mumbai,Hyderabad,BOM → HYD,06:20,07:45,1h 25m,non-stop,No info,4784,2019-03-03,3,3,6,85,0,6,7
Air India,1/04/2019,Kolkata,Banglore,CCU → DEL → BLR,17:30,12:00 02 Apr,18h 30m,1 stop,No info,7893,2019-04-01,1,4,0,1110,1,17,12
Air India,27/06/2019,Delhi,Cochin,DEL → CCU → BOM → COK,06:50,07:40 28 Jun,24h 50m,2 stops,No info,14431,2019-06-27,27,6,3,1490,2,6,7
Jet Airways Business,01/03/2019,Banglore,New Delhi,BLR → BOM → DEL,05:45,11:25,5h 40m,1 stop,Business class,79512,2019-03-01,1,3,4,340,1,5,11
Jet Airways,24/05/2019,Mumbai,Hyderabad,BOM → HYD,19:35,21:05,1h 30m,non-stop,In-flight meal not included,3210,2019-05-24,24,5,4,90,0,19,21
Multiple carriers,9/03/2019,Delhi,Cochin,DEL → BOM → COK,06:00,21:00,15h,1 stop,No info,13677,2019-03-09,9,3,5,900,1,6,21
Air India,27/05/2019,Delhi,Cochin,DEL → MAA → COK,06:05,09:25 28 May,27h 20m,1 stop,No info,7480,2019-05-27,27,5,0,1640,1,6,9
Air India,24/06/2019,Delhi,Cochin,DEL → BOM → COK,19:00,07:40 25 Jun,12h 40m,1 stop,No info,8372,2019-06-24,24,6,0,760,1,19,7
Jet Airways,27/03/2019,Delhi,Cochin,DEL → IDR → BOM → COK,05:25,04:25 28 Mar,23h,2 stops,No info,11664,2019-03-27,27,3,2,1380,2,5,4
Air India,18/06/2019,Banglore,Delhi,BLR → DEL,10:00,12:45,2h 45m,non-stop,No info,6961,2019-06-18,18,6,1,165,0,10,12
Air India,24/04/2019,Banglore,Delhi,BLR → DEL,17:00,19:45,2h 45m,non-stop,No info,6121,2019-04-24,24,4,2,165,0,17,19
Air India,12/04/2019,Banglore,Delhi,BLR → DEL,06:10,08:55,2h 45m,non-stop,No info,5911,2019-04-12,12,4,4,165,0,6,8
GoAir,6/05/2019,Banglore,Delhi,BLR → DEL,11:40,14:30,2h 50m,non-stop,No info,3398,2019-05-06,6,5,0,170,0,11,14
Multiple carriers,9/06/2019,Delhi,Cochin,DEL → BOM → COK,19:00,01:30 10 Jun,6h 30m,1 stop,No info,7530,2019-06-09,9,6,6,390,1,19,1
GoAir,24/05/2019,Banglore,Delhi,BLR → DEL,20:55,23:40,2h 45m,non-stop,No info,3419,2019-05-24,24,5,4,165,0,20,23
Vistara,24/03/2019,Banglore,New Delhi,BLR → DEL,21:10,00:05 25 Mar,2h 55m,non-stop,No info,6558,2019-03-24,24,3,6,175,0,21,0
Air India,9/06/2019,Kolkata,Banglore,CCU → DEL → BLR,20:30,20:25 10 Jun,23h 55m,1 stop,No info,10203,2019-06-09,9,6,6,1435,1,20,20
Jet Airways,12/03/2019,Banglore,New Delhi,BLR → BOM → DEL,18:55,20:20 13 Mar,25h 25m,1 stop,In-flight meal not included,11087,2019-03-12,12,3,1,1525,1,18,20
SpiceJet,24/03/2019,Banglore,New Delhi,BLR → DEL,20:30,23:20,2h 50m,non-stop,No info,5575,2019-03-24,24,3,6,170,0,20,23
Air Asia,24/04/2019,Delhi,Cochin,DEL → BLR → COK,07:55,22:25,14h 30m,1 stop,No info,6152,2019-04-24,24,4,2,870,1,7,22
Jet Airways,9/05/2019,Kolkata,Banglore,CCU → GAU → BLR,10:20,17:35,7h 15m,1 stop,In-flight meal not included,5608,2019-05-09,9,5,3,435,1,10,17
Jet Airways,06/03/2019,Banglore,New Delhi,BLR → BOM → DEL,11:40,10:25 07 Mar,22h 45m,1 stop,No info,17261,2019-03-06,6,3,2,1365,1,11,10
Jet Airways,9/05/2019,Delhi,Cochin,DEL → JAI → BOM → COK,09:40,12:35 10 May,26h 55m,2 stops,No info,15129,2019-05-09,9,5,3,1615,2,9,12
GoAir,6/05/2019,Banglore,Delhi,BLR → DEL,20:55,23:40,2h 45m,non-stop,No info,3419,2019-05-06,6,5,0,165,0,20,23
IndiGo,21/03/2019,Delhi,Cochin,DEL → BOM → COK,10:45,15:30,4h 45m,1 stop,No info,6218,2019-03-21,21,3,3,285,1,10,15
Jet Airways,3/06/2019,Delhi,Cochin,DEL → BOM → COK,02:15,12:35,10h 20m,1 stop,No info,14714,2019-06-03,3,6,0,620,1,2,12
Multiple carriers,3/06/2019,Delhi,Cochin,DEL → BOM → COK,11:30,19:15,7h 45m,1 stop,No info,14848,2019-06-03,3,6,0,465,1,11,19
Jet Airways,12/05/2019,Kolkata,Banglore,CCU → GAU → BLR,10:20,17:35,7h 15m,1 stop,No info,9358,2019-05-12,12,5,6,435,1,10,17
Air India,6/05/2019,Kolkata,Banglore,CCU → BOM → BLR,09:25,07:55 07 May,22h 30m,1 stop,No info,8366,2019-05-06,6,5,0,1350,1,9,7
Multiple carriers,6/03/2019,Delhi,Cochin,DEL → BOM → COK,11:30,19:15,7h 45m,1 stop,In-flight meal not included,15342,2019-03-06,6,3,2,465,1,11,19
Jet Airways,21/03/2019,Mumbai,Hyderabad,BOM → HYD,03:05,04:25,1h 20m,non-stop,No info,5678,2019-03-21,21,3,3,80,0,3,4
IndiGo,6/05/2019,Kolkata,Banglore,CCU → BLR,22:15,00:50 07 May,2h 35m,non-stop,No info,4804,2019-05-06,6,5,0,155,0,22,0
Jet Airways,24/05/2019,Kolkata,Banglore,CCU → BOM → BLR,08:25,16:20,7h 55m,1 stop,No info,14571,2019-05-24,24,5,4,475,1,8,16
Jet Airways,1/04/2019,Kolkata,Banglore,CCU → BOM → BLR,08:25,20:45,12h 20m,1 stop,No info,12681,2019-04-01,1,4,0,740,1,8,20
Jet Airways,06/03/2019,Banglore,New Delhi,BLR → BOM → DEL,21:25,10:25 07 Mar,13h,1 stop,No info,17261,2019-03-06,6,3,2,780,1,21,10
Vistara,9/06/2019,Kolkata,Banglore,CCU → DEL → BLR,17:00,10:45 10 Jun,17h 45m,1 stop,No info,9922,2019-06-09,9,6,6,1065,1,17,10
Jet Airways,18/05/2019,Kolkata,Banglore,CCU → BOM → BLR,18:55,12:00 19 May,17h 5m,1 stop,In-flight meal not included,10844,2019-05-18,18,5,5,1025,1,18,12
SpiceJet,21/04/2019,Banglore,Delhi,BLR → DEL,05:55,08:35,2h 40m,non-stop,No info,4423,2019-04-21,21,4,6,160,0,5,8
IndiGo,24/05/2019,Banglore,Delhi,BLR → DEL,01:30,04:15,2h 45m,non-stop,No info,3419,2019-05-24,24,5,4,165,0,1,4
Jet Airways,24/06/2019,Delhi,Cochin,DEL → BOM → COK,22:50,04:25 25 Jun,5h 35m,1 stop,No info,14714,2019-06-24,24,6,0,335,1,22,4
Jet Airways,09/03/2019,Banglore,New Delhi,BLR → BOM → DEL,05:45,11:25,5h 40m,1 stop,In-flight meal not included,11087,2019-03-09,9,3,5,340,1,5,11
IndiGo,27/06/2019,Delhi,Cochin,DEL → BOM → COK,16:00,01:30 28 Jun,9h 30m,1 stop,No info,6316,2019-06-27,27,6,3,570,1,16,1
SpiceJet,27/05/2019,Chennai,Kolkata,MAA → CCU,09:45,12:00,2h 15m,non-stop,No check-in baggage included,3543,2019-05-27,27,5,0,135,0,9,12
Jet Airways,6/06/2019,Kolkata,Banglore,CCU → BOM → BLR,18:55,12:00 07 Jun,17h 5m,1 stop,No info,14571,2019-06-06,6,6,3,1025,1,18,12
Jet Airways,9/06/2019,Kolkata,Banglore,CCU → DEL → BLR,09:35,18:00,8h 25m,1 stop,No info,14676,2019-06-09,9,6,6,505,1,9,18
Jet Airways,06/03/2019,Banglore,New Delhi,BLR → BOM → DEL,16:55,09:30 07 Mar,16h 35m,1 stop,No info,17261,2019-03-06,6,3,2,995,1,16,9
Jet Airways,15/05/2019,Kolkata,Banglore,CCU → BOM → BLR,08:25,23:35,15h 10m,1 stop,No info,13941,2019-05-15,15,5,2,910,1,8,23
Air India,3/03/2019,Delhi,Cochin,DEL → BLR → COK,06:10,08:15 04 Mar,26h 5m,1 stop,No info,13348,2019-03-03,3,3,6,1565,1,6,8
Jet Airways,18/06/2019,Banglore,Delhi,BLR → DEL,11:10,14:05,2h 55m,non-stop,No info,8016,2019-06-18,18,6,1,175,0,11,14
Jet Airways,27/05/2019,Delhi,Cochin,DEL → BOM → COK,07:05,12:35,5h 30m,1 stop,In-flight meal not included,12898,2019-05-27,27,5,0,330,1,7,12
Jet Airways,9/04/2019,Banglore,Delhi,BLR → DEL,18:55,22:00,3h 5m,non-stop,No info,7229,2019-04-09,9,4,1,185,0,18,22
SpiceJet,27/06/2019,Mumbai,Hyderabad,BOM → HYD,05:45,07:15,1h 30m,non-stop,No info,2017,2019-06-27,27,6,3,90,0,5,7
Jet Airways,06/03/2019,Banglore,New Delhi,BLR → BOM → DEL,08:00,19:10,11h 10m,1 stop,No info,16736,2019-03-06,6,3,2,670,1,8,19
SpiceJet,18/06/2019,Kolkata,Banglore,CCU → BLR,17:10,19:40,2h 30m,non-stop,No info,3873,2019-06-18,18,6,1,150,0,17,19
IndiGo,9/05/2019,Delhi,Cochin,DEL → HYD → COK,14:20,22:30,8h 10m,1 stop,No info,6704,2019-05-09,9,5,3,490,1,14,22
Jet Airways,6/06/2019,Kolkata,Banglore,CCU → BOM → BLR,18:55,19:50 07 Jun,24h 55m,1 stop,In-flight meal not included,10844,2019-06-06,6,6,3,1495,1,18,19
Vistara,09/03/2019,Banglore,New Delhi,BLR → DEL,19:40,22:20,2h 40m,non-stop,No info,7450,2019-03-09,9,3,5,160,0,19,22
Jet Airways,06/03/2019,Banglore,New Delhi,BLR → BOM → DEL,16:55,05:05 07 Mar,12h 10m,1 stop,No info,16736,2019-03-06,6,3,2,730,1,16,5
Jet Airways,15/06/2019,Delhi,Cochin,DEL → BOM → COK,15:00,12:35 16 Jun,21h 35m,1 stop,In-flight meal not included,10262,2019-06-15,15,6,5,1295,1,15,12
Air India,1/05/2019,Kolkata,Banglore,CCU → IXR → DEL → BLR,05:50,16:15 02 May,34h 25m,2 stops,No info,10991,2019-05-01,1,5,2,2065,2,5,16
SpiceJet,6/06/2019,Banglore,Delhi,BLR → DEL,21:10,00:05 07 Jun,2h 55m,non-stop,No info,3311,2019-06-06,6,6,3,175,0,21,0
IndiGo,24/05/2019,Delhi,Cochin,DEL → BOM → COK,10:35,01:30 25 May,14h 55m,1 stop,No info,7081,2019-05-24,24,5,4,895,1,10,1
IndiGo,27/04/2019,Banglore,Delhi,BLR → DEL,21:15,00:15 28 Apr,3h,non-stop,No info,3943,2019-04-27,27,4,5,180,0,21,0
Air India,21/05/2019,Delhi,Cochin,DEL → BOM → COK,13:00,19:15,6h 15m,1 stop,No info,8372,2019-05-21,21,5,1,375,1,13,19
Air India,9/03/2019,Delhi,Cochin,DEL → AMD → BOM → COK,19:45,19:15 10 Mar,23h 30m,2 stops,No info,11701,2019-03-09,9,3,5,1410,2,19,19
Jet Airways,3/06/2019,Banglore,Delhi,BLR → DEL,15:15,18:10,2h 55m,non-stop,In-flight meal not included,5769,2019-06-03,3,6,0,175,0,15,18
Multiple carriers,12/06/2019,Delhi,Cochin,DEL → IDR → BOM → COK,15:05,01:30 13 Jun,10h 25m,2 stops,No info,15965,2019-06-12,12,6,2,625,2,15,1
SpiceJet,12/06/2019,Banglore,Delhi,BLR → DEL,09:30,12:20,2h 50m,non-stop,No info,4423,2019-06-12,12,6,2,170,0,9,12
Jet Airways,15/03/2019,Banglore,New Delhi,BLR → MAA → DEL,09:45,14:25,4h 40m,1 stop,In-flight meal not included,6136,2019-03-15,15,3,4,280,1,9,14
Jet Airways,12/03/2019,Banglore,New Delhi,BLR → BOM → DEL,16:55,23:00,6h 5m,1 stop,In-flight meal not included,11087,2019-03-12,12,3,1,365,1,16,23
IndiGo,3/06/2019,Chennai,Kolkata,MAA → CCU,05:15,07:40,2h 25m,non-stop,No info,3540,2019-06-03,3,6,0,145,0,5,7
Jet Airways,21/05/2019,Delhi,Cochin,DEL → BOM → COK,14:00,04:25 22 May,14h 25m,1 stop,In-flight meal not included,12898,2019-05-21,21,5,1,865,1,14,4
IndiGo,18/04/2019,Banglore,Delhi,BLR → DEL,06:05,08:50,2h 45m,non-stop,No info,4591,2019-04-18,18,4,3,165,0,6,8
Air India,24/03/2019,Delhi,Cochin,DEL → BOM → COK,04:00,07:40 25 Mar,27h 40m,1 stop,No info,8635,2019-03-24,24,3,6,1660,1,4,7
Jet Airways,27/06/2019,Delhi,Cochin,DEL → BOM → COK,09:00,19:00,10h,1 stop,No info,14714,2019-06-27,27,6,3,600,1,9,19
Jet Airways,18/05/2019,Kolkata,Banglore,CCU → DEL → BLR,20:25,19:10 19 May,22h 45m,1 stop,No info,14151,2019-05-18,18,5,5,1365,1,20,19
Multiple carriers,1/06/2019,Delhi,Cochin,DEL → BOM → COK,04:55,19:15,14h 20m,1 stop,No info,8835,2019-06-01,1,6,5,860,1,4,19
Air India,21/05/2019,Kolkata,Banglore,CCU → DEL → BLR,17:30,08:55 22 May,15h 25m,1 stop,No info,11936,2019-05-21,21,5,1,925,1,17,8
Jet Airways,9/06/2019,Delhi,Cochin,DEL → LKO → BOM → COK,21:35,12:35 10 Jun,15h,2 stops,No info,13882,2019-06-09,9,6,6,900,2,21,12
Air India,1/04/2019,Delhi,Cochin,DEL → MAA → COK,17:20,09:25 02 Apr,16h 5m,1 stop,No info,5117,2019-04-01,1,4,0,965,1,17,9
Jet Airways,24/05/2019,Banglore,Delhi,BLR → DEL,15:15,18:10,2h 55m,non-stop,In-flight meal not included,4544,2019-05-24,24,5,4,175,0,15,18
IndiGo,15/05/2019,Delhi,Cochin,DEL → HYD → COK,06:50,22:30,15h 40m,1 stop,No info,6442,2019-05-15,15,5,2,940,1,6,22
Air India,9/05/2019,Delhi,Cochin,DEL → GOI → BOM → COK,22:00,19:15 10 May,21h 15m,2 stops,No info,10441,2019-05-09,9,5,3,1275,2,22,19
IndiGo,21/05/2019,Mumbai,Hyderabad,BOM → HYD,20:05,21:40,1h 35m,non-stop,No info,2227,2019-05-21,21,5,1,95,0,20,21
Jet Airways,15/04/2019,Banglore,Delhi,BLR → DEL,06:00,08:45,2h 45m,non-stop,No info,7229,2019-04-15,15,4,0,165,0,6,8
Jet Airways,1/06/2019,Delhi,Cochin,DEL → BOM → COK,13:00,19:00,6h,1 stop,In-flight meal not included,10262,2019-06-01,1,6,5,360,1,13,19
Jet Airways,12/03/2019,Banglore,New Delhi,BLR → BOM → DEL,08:00,21:20,13h 20m,1 stop,No info,13817,2019-03-12,12,3,1,800,1,8,21
SpiceJet,21/05/2019,Delhi,Cochin,DEL → BLR → COK,17:55,22:50,4h 55m,1 stop,No info,5975,2019-05-21,21,5,1,295,1,17,22
IndiGo,21/03/2019,Kolkata,Banglore,CCU → BLR,21:25,00:05 22 Mar,2h 40m,non-stop,No info,4148,2019-03-21,21,3,3,160,0,21,0
Multiple carriers,6/06/2019,Delhi,Cochin,DEL → BOM → COK,11:30,21:00,9h 30m,1 stop,No info,13587,2019-06-06,6,6,3,570,1,11,21
Jet Airways,21/03/2019,Mumbai,Hyderabad,BOM → HYD,03:05,04:25,1h 20m,non-stop,In-flight meal not included,2759,2019-03-21,21,3,3,80,0,3,4
Jet Airways,15/05/2019,Banglore,Delhi,BLR → DEL,19:50,22:50,3h,non-stop,No info,7229,2019-05-15,15,5,2,180,0,19,22
Air India,9/05/2019,Delhi,Cochin,DEL → HYD → BOM → COK,07:05,07:40 10 May,24h 35m,2 stops,No info,13547,2019-05-09,9,5,3,1475,2,7,7
SpiceJet,21/06/2019,Kolkata,Banglore,CCU → BLR,06:55,09:30,2h 35m,non-stop,No info,3873,2019-06-21,21,6,4,155,0,6,9
Jet Airways,21/05/2019,Kolkata,Banglore,CCU → BOM → BLR,16:30,04:40 22 May,12h 10m,1 stop,No info,14388,2019-05-21,21,5,1,730,1,16,4
Jet Airways,24/05/2019,Kolkata,Banglore,CCU → BOM → BLR,18:55,10:05 25 May,15h 10m,1 stop,No info,13731,2019-05-24,24,5,4,910,1,18,10
SpiceJet,27/03/2019,Kolkata,Banglore,CCU → BLR,06:55,09:35,2h 40m,non-stop,No check-in baggage included,3815,2019-03-27,27,3,2,160,0,6,9
Jet Airways,15/03/2019,Mumbai,Hyderabad,BOM → HYD,15:50,17:20,1h 30m,non-stop,No info,5678,2019-03-15,15,3,4,90,0,15,17
Jet Airways,9/05/2019,Kolkata,Banglore,CCU → BOM → BLR,08:25,09:20 10 May,24h 55m,1 stop,In-flight meal not included,9663,2019-05-09,9,5,3,1495,1,8,9
GoAir,21/05/2019,Kolkata,Banglore,CCU → AMD → BLR,16:40,00:15 22 May,7h 35m,1 stop,No info,8855,2019-05-21,21,5,1,455,1,16,0
Jet Airways,9/05/2019,Delhi,Cochin,DEL → JAI → BOM → COK,09:40,04:25 10 May,18h 45m,2 stops,No info,15129,2019-05-09,9,5,3,1125,2,9,4
Jet Airways,18/03/2019,Banglore,New Delhi,BLR → BOM → DEL,16:55,23:00,6h 5m,1 stop,No info,13555,2019-03-18,18,3,0,365,1,16,23
Jet Airways,21/05/2019,Kolkata,Banglore,CCU → BOM → BLR,21:10,08:15 22 May,11h 5m,1 stop,In-flight meal not included,10844,2019-05-21,21,5,1,665,1,21,8
Jet Airways,21/03/2019,Banglore,New Delhi,BLR → BOM → DEL,11:40,21:20,9h 40m,1 stop,In-flight meal not included,7832,2019-03-21,21,3,3,580,1,11,21
Jet Airways,27/06/2019,Delhi,Cochin,DEL → AMD → BOM → COK,23:05,12:35 28 Jun,13h 30m,2 stops,In-flight meal not included,11150,2019-06-27,27,6,3,810,2,23,12
Vistara,9/05/2019,Kolkata,Banglore,CCU → DEL → BLR,20:20,10:45 10 May,14h 25m,1 stop,No info,8452,2019-05-09,9,5,3,865,1,20,10
Multiple carriers,9/06/2019,Delhi,Cochin,DEL → HYD → COK,09:45,16:10,6h 25m,1 stop,No info,9646,2019-06-09,9,6,6,385,1,9,16
IndiGo,24/06/2019,Banglore,Delhi,BLR → DEL,10:10,13:00,2h 50m,non-stop,No info,3943,2019-06-24,24,6,0,170,0,10,13
GoAir,12/06/2019,Delhi,Cochin,DEL → BOM → COK,07:00,12:55,5h 55m,1 stop,No info,5281,2019-06-12,12,6,2,355,1,7,12
Air India,1/06/2019,Delhi,Cochin,DEL → HYD → BOM → COK,17:15,07:40 02 Jun,14h 25m,2 stops,No info,14667,2019-06-01,1,6,5,865,2,17,7
Jet Airways,24/05/2019,Kolkata,Banglore,CCU → BOM → BLR,20:00,09:20 25 May,13h 20m,1 stop,No info,14571,2019-05-24,24,5,4,800,1,20,9
Jet Airways,01/03/2019,Banglore,New Delhi,BLR → BDQ → DEL,05:50,12:20,6h 30m,1 stop,Business class,28097,2019-03-01,1,3,4,390,1,5,12
Jet Airways,06/03/2019,Banglore,New Delhi,BLR → BOM → DEL,20:35,19:10 07 Mar,22h 35m,1 stop,No info,17471,2019-03-06,6,3,2,1355,1,20,19
Jet Airways,12/06/2019,Delhi,Cochin,DEL → BOM → COK,08:00,19:00,11h,1 stop,In-flight meal not included,10577,2019-06-12,12,6,2,660,1,8,19
Multiple carriers,24/06/2019,Delhi,Cochin,DEL → BOM → COK,11:30,19:15,7h 45m,1 stop,No info,14848,2019-06-24,24,6,0,465,1,11,19
IndiGo,15/04/2019,Banglore,Delhi,BLR → DEL,23:30,02:20 16 Apr,2h 50m,non-stop,No info,4591,2019-04-15,15,4,0,170,0,23,2
IndiGo,18/05/2019,Chennai,Kolkata,MAA → CCU,19:35,21:55,2h 20m,non-stop,No info,3597,2019-05-18,18,5,5,140,0,19,21
IndiGo,27/05/2019,Delhi,Cochin,DEL → HYD → COK,16:10,22:30,6h 20m,1 stop,No info,6938,2019-05-27,27,5,0,380,1,16,22
Air Asia,24/06/2019,Kolkata,Banglore,CCU → BLR,19:55,22:25,2h 30m,non-stop,No info,3807,2019-06-24,24,6,0,150,0,19,22
Jet Airways,12/06/2019,Delhi,Cochin,DEL → BOM → COK,09:00,19:00,10h,1 stop,In-flight meal not included,10262,2019-06-12,12,6,2,600,1,9,19
Air India,9/05/2019,Kolkata,Banglore,CCU → JAI → DEL → BLR,08:20,20:25,12h 5m,2 stops,No info,11432,2019-05-09,9,5,3,725,2,8,20
Jet Airways,21/03/2019,Banglore,New Delhi,BLR → DEL,19:55,22:35,2h 40m,non-stop,No info,7229,2019-03-21,21,3,3,160,0,19,22
Multiple carriers,21/05/2019,Delhi,Cochin,DEL → BOM → COK,11:30,19:15,7h 45m,1 stop,No info,14848,2019-05-21,21,5,1,465,1,11,19
Jet Airways,15/05/2019,Kolkata,Banglore,CCU → BOM → BLR,06:30,23:35,17h 5m,1 stop,In-flight meal not included,8586,2019-05-15,15,5,2,1025,1,6,23
Multiple carriers,9/04/2019,Delhi,Cochin,DEL → BOM → COK,10:35,19:15,8h 40m,1 stop,No info,6106,2019-04-09,9,4,1,520,1,10,19
SpiceJet,3/05/2019,Kolkata,Banglore,CCU → BLR,22:20,00:40 04 May,2h 20m,non-stop,No info,3873,2019-05-03,3,5,4,140,0,22,0
Jet Airways,15/06/2019,Delhi,Cochin,DEL → JDH → BOM → COK,11:40,19:00,7h 20m,2 stops,In-flight meal not included,15812,2019-06-15,15,6,5,440,2,11,19
Jet Airways,24/05/2019,Kolkata,Banglore,CCU → DEL → BLR,20:25,14:25 25 May,18h,1 stop,No info,12121,2019-05-24,24,5,4,1080,1,20,14
Jet Airways,12/05/2019,Kolkata,Banglore,CCU → BOM → BLR,06:30,19:50,13h 20m,1 stop,In-flight meal not included,8586,2019-05-12,12,5,6,800,1,6,19
Multiple carriers,12/06/2019,Delhi,Cochin,DEL → BOM → COK,07:30,19:15,11h 45m,1 stop,No info,7354,2019-06-12,12,6,2,705,1,7,19
IndiGo,6/03/2019,Kolkata,Banglore,CCU → BLR,21:25,00:05 07 Mar,2h 40m,non-stop,No info,4778,2019-03-06,6,3,2,160,0,21,0
IndiGo,9/06/2019,Delhi,Cochin,DEL → BOM → COK,08:30,21:00,12h 30m,1 stop,No info,6838,2019-06-09,9,6,6,750,1,8,21
Multiple carriers,6/03/2019,Delhi,Cochin,DEL → HYD → COK,09:45,22:20,12h 35m,1 stop,No info,10276,2019-03-06,6,3,2,755,1,9,22
Jet Airways,18/06/2019,Banglore,Delhi,BLR → DEL,08:20,11:20,3h,non-stop,No info,8016,2019-06-18,18,6,1,180,0,8,11
Air India,21/03/2019,Banglore,New Delhi,BLR → HYD → DEL,08:15,18:30,10h 15m,1 stop,No info,4943,2019-03-21,21,3,3,615,1,8,18
IndiGo,24/06/2019,Banglore,Delhi,BLR → DEL,08:30,11:20,2h 50m,non-stop,No info,4823,2019-06-24,24,6,0,170,0,8,11
Jet Airways,1/04/2019,Kolkata,Banglore,CCU → BOM → BLR,08:25,16:20,7h 55m,1 stop,No info,12996,2019-04-01,1,4,0,475,1,8,16
Air India,27/05/2019,Delhi,Cochin,DEL → BOM → COK,09:00,19:15,10h 15m,1 stop,No info,9929,2019-05-27,27,5,0,615,1,9,19
Multiple carriers,3/06/2019,Delhi,Cochin,DEL → BOM → COK,10:00,01:30 04 Jun,15h 30m,1 stop,No info,9508,2019-06-03,3,6,0,930,1,10,1
Air India,21/03/2019,Delhi,Cochin,DEL → COK,18:05,21:10,3h 5m,non-stop,No info,5674,2019-03-21,21,3,3,185,0,18,21
IndiGo,18/06/2019,Chennai,Kolkata,MAA → CCU,11:35,14:00,2h 25m,non-stop,No info,3858,2019-06-18,18,6,1,145,0,11,14
IndiGo,24/05/2019,Kolkata,Banglore,CCU → BLR,22:15,00:50 25 May,2h 35m,non-stop,No info,4804,2019-05-24,24,5,4,155,0,22,0
Multiple carriers,27/05/2019,Delhi,Cochin,DEL → BOM → COK,14:00,01:30 28 May,11h 30m,1 stop,No info,13377,2019-05-27,27,5,0,690,1,14,1
Jet Airways,27/05/2019,Delhi,Cochin,DEL → BOM → COK,15:00,04:25 28 May,13h 25m,1 stop,In-flight meal not included,12898,2019-05-27,27,5,0,805,1,15,4
Air Asia,1/06/2019,Kolkata,Banglore,CCU → BLR,10:20,12:55,2h 35m,non-stop,No info,4409,2019-06-01,1,6,5,155,0,10,12
Air Asia,1/06/2019,Delhi,Cochin,DEL → BLR → COK,07:55,22:25,14h 30m,1 stop,No info,8759,2019-06-01,1,6,5,870,1,7,22
Air India,03/03/2019,Banglore,New Delhi,BLR → AMD → DEL,00:30,23:55,23h 25m,1 stop,No info,10394,2019-03-03,3,3,6,1405,1,0,23
IndiGo,18/03/2019,Chennai,Kolkata,MAA → CCU,11:35,14:00,2h 25m,non-stop,No info,3858,2019-03-18,18,3,0,145,0,11,14
Air Asia,15/06/2019,Delhi,Cochin,DEL → BLR → COK,07:55,13:25,5h 30m,1 stop,No info,6253,2019-06-15,15,6,5,330,1,7,13
Jet Airways,27/05/2019,Delhi,Cochin,DEL → AMD → BOM → COK,19:10,12:35 28 May,17h 25m,2 stops,No info,15129,2019-05-27,27,5,0,1045,2,19,12
GoAir,24/03/2019,Kolkata,Banglore,CCU → HYD → BLR,06:35,14:25,7h 50m,1 stop,No info,4773,2019-03-24,24,3,6,470,1,6,14
Jet Airways,21/05/2019,Kolkata,Banglore,CCU → BOM → BLR,06:30,09:20 22 May,26h 50m,1 stop,In-flight meal not included,9663,2019-05-21,21,5,1,1610,1,6,9
Jet Airways,12/06/2019,Kolkata,Banglore,CCU → DEL → BLR,17:00,09:45 13 Jun,16h 45m,1 stop,No info,12692,2019-06-12,12,6,2,1005,1,17,9
IndiGo,6/06/2019,Banglore,Delhi,BLR → DEL,01:30,04:15,2h 45m,non-stop,No info,3943,2019-06-06,6,6,3,165,0,1,4
Jet Airways,12/05/2019,Kolkata,Banglore,CCU → DEL → BLR,17:00,21:05 13 May,28h 5m,1 stop,In-flight meal not included,10703,2019-05-12,12,5,6,1685,1,17,21
IndiGo,27/03/2019,Delhi,Cochin,DEL → BOM → COK,06:40,21:00,14h 20m,1 stop,No info,8784,2019-03-27,27,3,2,860,1,6,21
Multiple carriers,9/06/2019,Delhi,Cochin,DEL → BOM → COK,09:15,19:00,9h 45m,1 stop,No info,11622,2019-06-09,9,6,6,585,1,9,19
IndiGo,24/05/2019,Chennai,Kolkata,MAA → CCU,22:05,00:25 25 May,2h 20m,non-stop,No info,5277,2019-05-24,24,5,4,140,0,22,0
Air Asia,21/05/2019,Delhi,Cochin,DEL → BLR → COK,16:45,07:10 22 May,14h 25m,1 stop,No info,8327,2019-05-21,21,5,1,865,1,16,7
IndiGo,9/03/2019,Delhi,Cochin,DEL → COK,05:35,08:50,3h 15m,non-stop,No info,6885,2019-03-09,9,3,5,195,0,5,8
Jet Airways,12/06/2019,Banglore,Delhi,BLR → DEL,17:45,20:45,3h,non-stop,No info,8016,2019-06-12,12,6,2,180,0,17,20
IndiGo,1/06/2019,Delhi,Cochin,DEL → PNQ → COK,23:30,04:35 02 Jun,5h 5m,1 stop,No info,10112,2019-06-01,1,6,5,305,1,23,4
IndiGo,6/03/2019,Delhi,Cochin,DEL → BOM → COK,17:30,01:35 07 Mar,8h 5m,1 stop,No info,14871,2019-03-06,6,3,2,485,1,17,1
Jet Airways,9/06/2019,Delhi,Cochin,DEL → BOM → COK,09:00,19:00,10h,1 stop,In-flight meal not included,10262,2019-06-09,9,6,6,600,1,9,19
Jet Airways,24/03/2019,Mumbai,Hyderabad,BOM → HYD,19:35,21:05,1h 30m,non-stop,In-flight meal not included,2470,2019-03-24,24,3,6,90,0,19,21
Air India,9/03/2019,Delhi,Cochin,DEL → HYD → MAA → COK,13:15,09:25 10 Mar,20h 10m,2 stops,No info,11622,2019-03-09,9,3,5,1210,2,13,9
Vistara,6/05/2019,Kolkata,Banglore,CCU → DEL → BLR,20:20,10:45 07 May,14h 25m,1 stop,No info,8662,2019-05-06,6,5,0,865,1,20,10
Air India,24/06/2019,Delhi,Cochin,DEL → HYD → BOM → COK,17:15,19:15 25 Jun,26h,2 stops,No info,11972,2019-06-24,24,6,0,1560,2,17,19
Jet Airways,6/06/2019,Delhi,Cochin,DEL → LKO → BOM → COK,09:25,04:25 07 Jun,19h,2 stops,In-flight meal not included,11992,2019-06-06,6,6,3,1140,2,9,4
Jet Airways,18/05/2019,Delhi,Cochin,DEL → BOM → COK,10:00,04:25 19 May,18h 25m,1 stop,In-flight meal not included,12373,2019-05-18,18,5,5,1105,1,10,4
Multiple carriers,1/06/2019,Delhi,Cochin,DEL → BOM → COK,10:00,01:30 02 Jun,15h 30m,1 stop,No info,7198,2019-06-01,1,6,5,930,1,10,1
Jet Airways,15/06/2019,Delhi,Cochin,DEL → BOM → COK,07:05,12:35,5h 30m,1 stop,No info,14714,2019-06-15,15,6,5,330,1,7,12
IndiGo,9/06/2019,Delhi,Cochin,DEL → BOM → COK,16:00,01:30 10 Jun,9h 30m,1 stop,No info,6316,2019-06-09,9,6,6,570,1,16,1
Air India,27/03/2019,Delhi,Cochin,DEL → BLR → COK,17:40,08:15 28 Mar,14h 35m,1 stop,No info,5998,2019-03-27,27,3,2,875,1,17,8
Jet Airways,12/06/2019,Kolkata,Banglore,CCU → BOM → BLR,18:55,16:20 13 Jun,21h 25m,1 stop,No info,13044,2019-06-12,12,6,2,1285,1,18,16
Multiple carriers,12/06/2019,Delhi,Cochin,DEL → HYD → COK,13:05,22:30,9h 25m,1 stop,No info,9646,2019-06-12,12,6,2,565,1,13,22
Air Asia,27/06/2019,Delhi,Cochin,DEL → BLR → COK,16:45,07:10 28 Jun,14h 25m,1 stop,No info,6451,2019-06-27,27,6,3,865,1,16,7
GoAir,24/06/2019,Delhi,Cochin,DEL → BOM → COK,07:00,12:55,5h 55m,1 stop,No info,5281,2019-06-24,24,6,0,355,1,7,12
Jet Airways,1/05/2019,Mumbai,Hyderabad,BOM → HYD,19:35,21:05,1h 30m,non-stop,In-flight meal not included,2228,2019-05-01,1,5,2,90,0,19,21
IndiGo,1/06/2019,Banglore,Delhi,BLR → DEL,06:05,08:50,2h 45m,non-stop,No info,3943,2019-06-01,1,6,5,165,0,6,8
Air India,15/06/2019,Delhi,Cochin,DEL → GOI → BOM → COK,10:55,07:40 16 Jun,20h 45m,2 stops,No info,11753,2019-06-15,15,6,5,1245,2,10,7
Jet Airways,24/06/2019,Delhi,Cochin,DEL → AMD → BOM → COK,23:05,12:35 25 Jun,13h 30m,2 stops,No info,12819,2019-06-24,24,6,0,810,2,23,12
Jet Airways,21/03/2019,Delhi,Cochin,DEL → MAA → BOM → COK,13:55,18:50 22 Mar,28h 55m,2 stops,In-flight meal not included,8728,2019-03-21,21,3,3,1735,2,13,18
SpiceJet,9/05/2019,Delhi,Cochin,DEL → PNQ → COK,08:45,13:15,4h 30m,1 stop,No info,4812,2019-05-09,9,5,3,270,1,8,13
Jet Airways,1/05/2019,Kolkata,Banglore,CCU → DEL → BLR,17:00,22:05 02 May,29h 5m,1 stop,No info,14151,2019-05-01,1,5,2,1745,1,17,22
Vistara,1/05/2019,Kolkata,Banglore,CCU → DEL → BLR,20:20,09:05 02 May,12h 45m,1 stop,No info,8452,2019-05-01,1,5,2,765,1,20,9
IndiGo,24/03/2019,Kolkata,Banglore,CCU → HYD → BLR,15:10,20:15,5h 5m,1 stop,No info,6762,2019-03-24,24,3,6,305,1,15,20
Jet Airways,12/03/2019,Banglore,New Delhi,BLR → BOM → DEL,18:55,13:15 13 Mar,18h 20m,1 stop,No info,13817,2019-03-12,12,3,1,1100,1,18,13
Jet Airways,21/05/2019,Delhi,Cochin,DEL → BOM → COK,14:00,12:35 22 May,22h 35m,1 stop,In-flight meal not included,12898,2019-05-21,21,5,1,1355,1,14,12
IndiGo,6/04/2019,Kolkata,Banglore,CCU → HYD → BLR,19:20,23:45,4h 25m,1 stop,No info,3480,2019-04-06,6,4,5,265,1,19,23
Jet Airways,01/03/2019,Banglore,New Delhi,BLR → BOM → DEL,11:40,21:20,9h 40m,1 stop,1 Long layover,27992,2019-03-01,1,3,4,580,1,11,21
Jet Airways,21/03/2019,Delhi,Cochin,DEL → BDQ → BOM → COK,18:25,04:25 22 Mar,10h,2 stops,In-flight meal not included,7791,2019-03-21,21,3,3,600,2,18,4
Air India,21/03/2019,Delhi,Cochin,DEL → BLR → COK,06:10,23:00,16h 50m,1 stop,No info,5704,2019-03-21,21,3,3,1010,1,6,23
IndiGo,21/05/2019,Kolkata,Banglore,CCU → MAA → BLR,16:35,22:15,5h 40m,1 stop,No info,5268,2019-05-21,21,5,1,340,1,16,22
GoAir,6/06/2019,Banglore,Delhi,BLR → DEL,11:40,14:30,2h 50m,non-stop,No info,3898,2019-06-06,6,6,3,170,0,11,14
SpiceJet,15/03/2019,Kolkata,Banglore,CCU → BLR,09:00,11:30,2h 30m,non-stop,No info,3847,2019-03-15,15,3,4,150,0,9,11
Multiple carriers,12/06/2019,Delhi,Cochin,DEL → BOM → COK,07:30,19:00,11h 30m,1 stop,No info,10877,2019-06-12,12,6,2,690,1,7,19
Multiple carriers,9/04/2019,Delhi,Cochin,DEL → BOM → COK,08:45,19:15,10h 30m,1 stop,No info,8371,2019-04-09,9,4,1,630,1,8,19
Multiple carriers,6/06/2019,Delhi,Cochin,DEL → HYD → COK,07:10,22:30,15h 20m,1 stop,No info,7038,2019-06-06,6,6,3,920,1,7,22
Jet Airways,9/06/2019,Kolkata,Banglore,CCU → BOM → BLR,06:30,16:20,9h 50m,1 stop,No info,14571,2019-06-09,9,6,6,590,1,6,16
Jet Airways,9/06/2019,Kolkata,Banglore,CCU → BOM → BLR,20:00,09:20 10 Jun,13h 20m,1 stop,In-flight meal not included,11841,2019-06-09,9,6,6,800,1,20,9
Jet Airways,18/05/2019,Delhi,Cochin,DEL → AMD → BOM → COK,13:25,12:35 19 May,23h 10m,2 stops,No info,15129,2019-05-18,18,5,5,1390,2,13,12
SpiceJet,15/06/2019,Kolkata,Banglore,CCU → BLR,22:20,00:40 16 Jun,2h 20m,non-stop,No check-in baggage included,3841,2019-06-15,15,6,5,140,0,22,0
Jet Airways,24/06/2019,Delhi,Cochin,DEL → BOM → COK,11:30,12:35 25 Jun,25h 5m,1 stop,In-flight meal not included,10262,2019-06-24,24,6,0,1505,1,11,12
Air India,6/04/2019,Kolkata,Banglore,CCU → BLR,20:45,23:20,2h 35m,non-stop,No info,4460,2019-04-06,6,4,5,155,0,20,23
IndiGo,03/03/2019,Banglore,New Delhi,BLR → DEL,18:25,21:20,2h 55m,non-stop,No info,7648,2019-03-03,3,3,6,175,0,18,21
Vistara,6/06/2019,Kolkata,Banglore,CCU → DEL → BLR,07:10,20:20,13h 10m,1 stop,No info,8610,2019-06-06,6,6,3,790,1,7,20
IndiGo,18/06/2019,Chennai,Kolkata,MAA → CCU,13:15,15:35,2h 20m,non-stop,No info,3597,2019-06-18,18,6,1,140,0,13,15
IndiGo,24/06/2019,Delhi,Cochin,DEL → HYD → COK,07:35,16:10,8h 35m,1 stop,No info,6442,2019-06-24,24,6,0,515,1,7,16
IndiGo,9/03/2019,Delhi,Cochin,DEL → BOM → COK,06:40,21:00,14h 20m,1 stop,No info,12351,2019-03-09,9,3,5,860,1,6,21
Multiple carriers,21/05/2019,Delhi,Cochin,DEL → BOM → COK,17:30,01:30 22 May,8h,1 stop,No info,14067,2019-05-21,21,5,1,480,1,17,1
IndiGo,15/05/2019,Banglore,Delhi,BLR → DEL,20:00,22:50,2h 50m,non-stop,No info,4823,2019-05-15,15,5,2,170,0,20,22
Vistara,24/03/2019,Kolkata,Banglore,CCU → DEL → BLR,17:00,22:10 25 Mar,29h 10m,1 stop,No info,12102,2019-03-24,24,3,6,1750,1,17,22
Jet Airways,24/05/2019,Mumbai,Hyderabad,BOM → HYD,07:05,08:30,1h 25m,non-stop,No info,8040,2019-05-24,24,5,4,85,0,7,8
IndiGo,03/03/2019,Banglore,New Delhi,BLR → DEL,10:05,13:00,2h 55m,non-stop,No info,7648,2019-03-03,3,3,6,175,0,10,13
IndiGo,9/05/2019,Delhi,Cochin,DEL → MAA → COK,02:00,07:25,5h 25m,1 stop,No info,6582,2019-05-09,9,5,3,325,1,2,7
Vistara,12/06/2019,Banglore,Delhi,BLR → DEL,11:30,14:20,2h 50m,non-stop,No info,4668,2019-06-12,12,6,2,170,0,11,14
IndiGo,1/04/2019,Banglore,Delhi,BLR → DEL,20:00,22:50,2h 50m,non-stop,No info,4823,2019-04-01,1,4,0,170,0,20,22
SpiceJet,1/05/2019,Kolkata,Banglore,CCU → BLR,22:20,00:40 02 May,2h 20m,non-stop,No info,3873,2019-05-01,1,5,2,140,0,22,0
Multiple carriers,18/05/2019,Delhi,Cochin,DEL → BOM → COK,10:20,19:15,8h 55m,1 stop,No info,8476,2019-05-18,18,5,5,535,1,10,19
IndiGo,27/05/2019,Delhi,Cochin,DEL → MAA → COK,07:15,12:30,5h 15m,1 stop,No info,5636,2019-05-27,27,5,0,315,1,7,12
Jet Airways,12/05/2019,Kolkata,Banglore,CCU → BOM → BLR,08:25,19:50,11h 25m,1 stop,In-flight meal not included,8586,2019-05-12,12,5,6,685,1,8,19
IndiGo,6/06/2019,Banglore,Delhi,BLR → DEL,18:25,21:20,2h 55m,non-stop,No info,4823,2019-06-06,6,6,3,175,0,18,21
Air India,6/03/2019,Delhi,Cochin,DEL → COK,05:10,08:00,2h 50m,non-stop,No info,6881,2019-03-06,6,3,2,170,0,5,8
Jet Airways,9/05/2019,Kolkata,Banglore,CCU → BOM → BLR,14:05,22:35,8h 30m,1 stop,In-flight meal not included,10844,2019-05-09,9,5,3,510,1,14,22
IndiGo,24/04/2019,Kolkata,Banglore,CCU → BBI → BLR,19:35,23:15,3h 40m,1 stop,No info,4226,2019-04-24,24,4,2,220,1,19,23
Jet Airways,9/05/2019,Delhi,Cochin,DEL → BOM → COK,19:15,19:00 10 May,23h 45m,1 stop,In-flight meal not included,12373,2019-05-09,9,5,3,1425,1,19,19
Air India,6/06/2019,Kolkata,Banglore,CCU → JAI → BOM → BLR,08:20,21:50,13h 30m,2 stops,No info,10697,2019-06-06,6,6,3,810,2,8,21
Jet Airways,3/06/2019,Mumbai,Hyderabad,BOM → HYD,10:20,11:50,1h 30m,non-stop,In-flight meal not included,4995,2019-06-03,3,6,0,90,0,10,11
Air India,24/06/2019,Delhi,Cochin,DEL → AMD → BOM → COK,16:40,19:15 25 Jun,26h 35m,2 stops,No info,9443,2019-06-24,24,6,0,1595,2,16,19
Jet Airways,18/05/2019,Delhi,Cochin,DEL → JAI → BOM → COK,05:30,04:25 19 May,22h 55m,2 stops,In-flight meal not included,13029,2019-05-18,18,5,5,1375,2,5,4
Jet Airways,21/03/2019,Delhi,Cochin,DEL → BDQ → BOM → COK,18:25,04:25 23 Mar,34h,2 stops,No info,12347,2019-03-21,21,3,3,2040,2,18,4
Multiple carriers,9/06/2019,Delhi,Cochin,DEL → BOM → COK,13:00,21:00,8h,1 stop,No info,7408,2019-06-09,9,6,6,480,1,13,21
Jet Airways,1/04/2019,Kolkata,Banglore,CCU → BOM → BLR,18:55,09:20 02 Apr,14h 25m,1 stop,In-flight meal not included,7064,2019-04-01,1,4,0,865,1,18,9
Jet Airways,6/03/2019,Delhi,Cochin,DEL → BOM → COK,13:00,04:25 07 Mar,15h 25m,1 stop,In-flight meal not included,13843,2019-03-06,6,3,2,925,1,13,4
IndiGo,12/04/2019,Kolkata,Banglore,CCU → BLR,15:30,18:05,2h 35m,non-stop,No info,4174,2019-04-12,12,4,4,155,0,15,18
Multiple carriers,15/05/2019,Delhi,Cochin,DEL → GWL → IDR → BOM → COK,11:35,21:00,9h 25m,3 stops,No info,16294,2019-05-15,15,5,2,565,3,11,21
SpiceJet,18/05/2019,Kolkata,Banglore,CCU → BLR,06:55,09:30,2h 35m,non-stop,No check-in baggage included,3841,2019-05-18,18,5,5,155,0,6,9
IndiGo,15/06/2019,Banglore,Delhi,BLR → DEL,04:00,06:50,2h 50m,non-stop,No info,4423,2019-06-15,15,6,5,170,0,4,6
Air India,12/06/2019,Delhi,Cochin,DEL → COK,05:10,08:00,2h 50m,non-stop,No info,5201,2019-06-12,12,6,2,170,0,5,8
Air India,03/03/2019,Banglore,New Delhi,BLR → BOM → IDR → DEL,06:45,11:10 07 Mar,28h 25m,2 stops,No info,12599,2019-03-03,3,3,6,1705,2,6,11
IndiGo,21/05/2019,Mumbai,Hyderabad,BOM → HYD,06:25,07:55,1h 30m,non-stop,No info,4049,2019-05-21,21,5,1,90,0,6,7
Air India,24/05/2019,Kolkata,Banglore,CCU → BOM → TRV → BLR,09:25,10:30 25 May,25h 5m,2 stops,No info,12797,2019-05-24,24,5,4,1505,2,9,10
Jet Airways,24/05/2019,Kolkata,Banglore,CCU → DEL → BLR,20:25,10:55 25 May,14h 30m,1 stop,No info,13067,2019-05-24,24,5,4,870,1,20,10
Vistara,24/05/2019,Kolkata,Banglore,CCU → DEL → BLR,20:20,18:50 25 May,22h 30m,1 stop,No info,9345,2019-05-24,24,5,4,1350,1,20,18
IndiGo,21/05/2019,Delhi,Cochin,DEL → HYD → COK,05:05,12:10,7h 5m,1 stop,No info,6818,2019-05-21,21,5,1,425,1,5,12
Jet Airways,3/05/2019,Mumbai,Hyderabad,BOM → HYD,10:20,11:50,1h 30m,non-stop,No info,8040,2019-05-03,3,5,4,90,0,10,11
Jet Airways,12/06/2019,Delhi,Cochin,DEL → ATQ → BOM → COK,18:20,12:35 13 Jun,18h 15m,2 stops,No info,14300,2019-06-12,12,6,2,1095,2,18,12
Multiple carriers,15/05/2019,Delhi,Cochin,DEL → BOM → COK,18:15,01:30 16 May,7h 15m,1 stop,No info,13727,2019-05-15,15,5,2,435,1,18,1
Jet Airways,21/03/2019,Banglore,New Delhi,BLR → BOM → DEL,16:55,10:25 19 Mar,17h 30m,1 stop,In-flight meal not included,7832,2019-03-21,21,3,3,1050,1,16,10
Multiple carriers,9/03/2019,Delhi,Cochin,DEL → BOM → COK,04:00,12:55,8h 55m,1 stop,No info,16259,2019-03-09,9,3,5,535,1,4,12
IndiGo,27/06/2019,Banglore,Delhi,BLR → DEL,08:30,11:20,2h 50m,non-stop,No info,4823,2019-06-27,27,6,3,170,0,8,11
Jet Airways,06/03/2019,Banglore,New Delhi,BLR → BOM → DEL,11:40,08:15 07 Mar,20h 35m,1 stop,No info,16736,2019-03-06,6,3,2,1235,1,11,8
Air India,6/06/2019,Kolkata,Banglore,CCU → BOM → AMD → BLR,09:25,05:25 07 Jun,20h,2 stops,No info,13217,2019-06-06,6,6,3,1200,2,9,5
Multiple carriers,27/03/2019,Delhi,Cochin,DEL → BOM → COK,12:50,21:00,8h 10m,1 stop,No info,6637,2019-03-27,27,3,2,490,1,12,21
Jet Airways,9/06/2019,Kolkata,Banglore,CCU → BOM → BLR,18:55,12:00 10 Jun,17h 5m,1 stop,In-flight meal not included,10844,2019-06-09,9,6,6,1025,1,18,12
Multiple carriers,21/03/2019,Delhi,Cochin,DEL → BOM → COK,10:00,19:15,9h 15m,1 stop,In-flight meal not included,8401,2019-03-21,21,3,3,555,1,10,19
SpiceJet,12/04/2019,Kolkata,Banglore,CCU → BLR,09:00,11:25,2h 25m,non-stop,No info,3873,2019-04-12,12,4,4,145,0,9,11
Jet Airways,24/06/2019,Delhi,Cochin,DEL → ATQ → BOM → COK,20:00,04:25 25 Jun,8h 25m,2 stops,In-flight meal not included,12410,2019-06-24,24,6,0,505,2,20,4
Jet Airways,18/05/2019,Delhi,Cochin,DEL → AMD → BOM → COK,23:05,12:35 19 May,13h 30m,2 stops,No info,15129,2019-05-18,18,5,5,810,2,23,12
IndiGo,1/05/2019,Banglore,Delhi,BLR → DEL,13:00,15:50,2h 50m,non-stop,No info,4423,2019-05-01,1,5,2,170,0,13,15
Jet Airways,27/05/2019,Delhi,Cochin,DEL → BOM → COK,13:00,19:00,6h,1 stop,No info,16079,2019-05-27,27,5,0,360,1,13,19
Air India,6/06/2019,Kolkata,Banglore,CCU → VNS → DEL → BLR,14:30,08:55 07 Jun,18h 25m,2 stops,No info,15894,2019-06-06,6,6,3,1105,2,14,8
Multiple carriers,15/05/2019,Delhi,Cochin,DEL → BOM → COK,04:55,19:00,14h 5m,1 stop,No info,9103,2019-05-15,15,5,2,845,1,4,19
Air India,12/06/2019,Delhi,Cochin,DEL → BLR → COK,09:45,08:15 13 Jun,22h 30m,1 stop,No info,8991,2019-06-12,12,6,2,1350,1,9,8
Air India,1/04/2019,Kolkata,Banglore,CCU → BOM → HBX → BLR,16:50,18:20 02 Apr,25h 30m,2 stops,No info,7893,2019-04-01,1,4,0,1530,2,16,18
IndiGo,3/03/2019,Mumbai,Hyderabad,BOM → HYD,02:30,04:00,1h 30m,non-stop,No info,4575,2019-03-03,3,3,6,90,0,2,4
SpiceJet,3/05/2019,Kolkata,Banglore,CCU → BLR,09:00,11:25,2h 25m,non-stop,No info,3873,2019-05-03,3,5,4,145,0,9,11
Jet Airways,21/03/2019,Banglore,New Delhi,BLR → BOM → DEL,05:45,21:20,15h 35m,1 stop,In-flight meal not included,7832,2019-03-21,21,3,3,935,1,5,21
IndiGo,1/05/2019,Chennai,Kolkata,MAA → CCU,14:45,17:05,2h 20m,non-stop,No info,3597,2019-05-01,1,5,2,140,0,14,17
Jet Airways,24/03/2019,Kolkata,Banglore,CCU → BOM → BLR,21:10,23:25 25 Mar,26h 15m,1 stop,No info,13759,2019-03-24,24,3,6,1575,1,21,23
Jet Airways,27/05/2019,Banglore,Delhi,BLR → DEL,18:55,22:00,3h 5m,non-stop,No info,7229,2019-05-27,27,5,0,185,0,18,22
SpiceJet,15/04/2019,Kolkata,Banglore,CCU → BLR,06:55,09:30,2h 35m,non-stop,No info,3873,2019-04-15,15,4,0,155,0,6,9
Multiple carriers,15/05/2019,Delhi,Cochin,DEL → BOM → COK,06:00,19:00,13h,1 stop,No info,9794,2019-05-15,15,5,2,780,1,6,19
Air India,27/03/2019,Delhi,Cochin,DEL → BLR → COK,13:30,08:15 28 Mar,18h 45m,1 stop,No info,6681,2019-03-27,27,3,2,1125,1,13,8
IndiGo,21/04/2019,Banglore,Delhi,BLR → DEL,21:15,00:15 22 Apr,3h,non-stop,No info,4423,2019-04-21,21,4,6,180,0,21,0
Jet Airways,15/05/2019,Kolkata,Banglore,CCU → BOM → BLR,08:25,19:50,11h 25m,1 stop,In-flight meal not included,10844,2019-05-15,15,5,2,685,1,8,19
IndiGo,1/06/2019,Delhi,Cochin,DEL → BOM → COK,09:15,21:00,11h 45m,1 stop,No info,7258,2019-06-01,1,6,5,705,1,9,21
Jet Airways,12/06/2019,Mumbai,Hyderabad,BOM → HYD,10:20,11:50,1h 30m,non-stop,In-flight meal not included,4995,2019-06-12,12,6,2,90,0,10,11
Jet Airways,9/06/2019,Delhi,Cochin,DEL → BOM → COK,20:55,19:00 10 Jun,22h 5m,1 stop,No info,14924,2019-06-09,9,6,6,1325,1,20,19
Vistara,15/03/2019,Banglore,New Delhi,BLR → AMD → DEL,06:40,10:25 16 Mar,27h 45m,1 stop,No info,6590,2019-03-15,15,3,4,1665,1,6,10
Jet Airways,3/06/2019,Delhi,Cochin,DEL → BOM → COK,20:55,12:35 04 Jun,15h 40m,1 stop,In-flight meal not included,10262,2019-06-03,3,6,0,940,1,20,12
SpiceJet,9/03/2019,Kolkata,Banglore,CCU → BLR,09:00,11:30,2h 30m,non-stop,No info,5515,2019-03-09,9,3,5,150,0,9,11
Jet Airways,27/03/2019,Delhi,Cochin,DEL → AMD → BOM → COK,19:10,19:45 28 Mar,24h 35m,2 stops,In-flight meal not included,6643,2019-03-27,27,3,2,1475,2,19,19
IndiGo,24/06/2019,Mumbai,Hyderabad,BOM → HYD,19:05,20:35,1h 30m,non-stop,No info,2754,2019-06-24,24,6,0,90,0,19,20
IndiGo,9/06/2019,Delhi,Cochin,DEL → BLR → COK,17:05,22:15,5h 10m,1 stop,No info,6493,2019-06-09,9,6,6,310,1,17,22
IndiGo,24/05/2019,Kolkata,Banglore,CCU → NAG → BLR,18:05,23:30,5h 25m,1 stop,No info,6218,2019-05-24,24,5,4,325,1,18,23
Air India,6/06/2019,Delhi,Cochin,DEL → BHO → BOM → COK,05:55,19:15,13h 20m,2 stops,No info,10861,2019-06-06,6,6,3,800,2,5,19
IndiGo,6/03/2019,Delhi,Cochin,DEL → HYD → COK,07:35,16:10,8h 35m,1 stop,No info,7094,2019-03-06,6,3,2,515,1,7,16
SpiceJet,24/03/2019,Mumbai,Hyderabad,BOM → HYD,22:45,00:10 25 Mar,1h 25m,non-stop,No info,2227,2019-03-24,24,3,6,85,0,22,0
Jet Airways,21/04/2019,Banglore,Delhi,BLR → DEL,19:50,22:50,3h,non-stop,In-flight meal not included,4544,2019-04-21,21,4,6,180,0,19,22
Air India,21/03/2019,Banglore,New Delhi,BLR → CCU → BBI → DEL,05:50,16:20,10h 30m,2 stops,No info,7664,2019-03-21,21,3,3,630,2,5,16
Jet Airways,27/06/2019,Banglore,Delhi,BLR → DEL,17:45,20:45,3h,non-stop,No info,8016,2019-06-27,27,6,3,180,0,17,20
Air Asia,27/05/2019,Kolkata,Banglore,CCU → BLR,22:50,01:20 28 May,2h 30m,non-stop,No info,3807,2019-05-27,27,5,0,150,0,22,1
Air India,3/06/2019,Delhi,Cochin,DEL → LKO → BOM → COK,07:10,19:15,12h 5m,2 stops,No info,12698,2019-06-03,3,6,0,725,2,7,19
Jet Airways,24/05/2019,Kolkata,Banglore,CCU → BOM → BLR,06:30,04:40 25 May,22h 10m,1 stop,In-flight meal not included,8586,2019-05-24,24,5,4,1330,1,6,4
Jet Airways,1/04/2019,Kolkata,Banglore,CCU → BOM → BLR,06:30,04:40 02 Apr,22h 10m,1 stop,In-flight meal not included,7064,2019-04-01,1,4,0,1330,1,6,4
IndiGo,9/06/2019,Delhi,Cochin,DEL → COK,05:35,08:50,3h 15m,non-stop,No info,5601,2019-06-09,9,6,6,195,0,5,8
SpiceJet,21/05/2019,Delhi,Cochin,DEL → MAA → COK,15:45,22:05,6h 20m,1 stop,No info,7317,2019-05-21,21,5,1,380,1,15,22
Air India,6/05/2019,Kolkata,Banglore,CCU → DEL → COK → TRV → BLR,10:00,10:30 07 May,24h 30m,3 stops,No info,12797,2019-05-06,6,5,0,1470,3,10,10
IndiGo,6/04/2019,Kolkata,Banglore,CCU → MAA → BLR,06:15,10:30,4h 15m,1 stop,No info,4226,2019-04-06,6,4,5,255,1,6,10
Jet Airways,12/05/2019,Kolkata,Banglore,CCU → DEL → BLR,17:00,23:35,6h 35m,1 stop,No info,14151,2019-05-12,12,5,6,395,1,17,23
IndiGo,27/03/2019,Delhi,Cochin,DEL → BOM → COK,10:45,01:35 28 Mar,14h 50m,1 stop,No info,6628,2019-03-27,27,3,2,890,1,10,1
IndiGo,09/03/2019,Banglore,New Delhi,BLR → DEL,04:00,06:50,2h 50m,non-stop,No info,8033,2019-03-09,9,3,5,170,0,4,6
Multiple carriers,1/06/2019,Delhi,Cochin,DEL → BOM → COK,10:35,19:00,8h 25m,1 stop,No info,11200,2019-06-01,1,6,5,505,1,10,19
IndiGo,24/06/2019,Kolkata,Banglore,CCU → BLR,15:30,18:05,2h 35m,non-stop,No info,4804,2019-06-24,24,6,0,155,0,15,18
Air Asia,12/06/2019,Kolkata,Banglore,CCU → DEL → BLR,22:40,10:40 13 Jun,12h,1 stop,No info,5192,2019-06-12,12,6,2,720,1,22,10
Jet Airways,12/06/2019,Delhi,Cochin,DEL → JAI → BOM → COK,09:40,04:25 13 Jun,18h 45m,2 stops,No info,13014,2019-06-12,12,6,2,1125,2,9,4
Jet Airways,21/05/2019,Kolkata,Banglore,CCU → BOM → BLR,21:10,22:35 22 May,25h 25m,1 stop,In-flight meal not included,10844,2019-05-21,21,5,1,1525,1,21,22
Multiple carriers,6/03/2019,Delhi,Cochin,DEL → BOM → COK,07:00,15:30,8h 30m,1 stop,No info,15603,2019-03-06,6,3,2,510,1,7,15
GoAir,3/04/2019,Banglore,Delhi,BLR → DEL,07:45,10:40,2h 55m,non-stop,No info,4239,2019-04-03,3,4,2,175,0,7,10
Jet Airways,12/06/2019,Kolkata,Banglore,CCU → BOM → BLR,14:05,10:05 13 Jun,20h,1 stop,No info,13044,2019-06-12,12,6,2,1200,1,14,10
Jet Airways,27/05/2019,Delhi,Cochin,DEL → BOM → COK,18:15,19:00 28 May,24h 45m,1 stop,In-flight meal not included,12898,2019-05-27,27,5,0,1485,1,18,19
SpiceJet,1/04/2019,Kolkata,Banglore,CCU → PNQ → BLR,08:35,17:15,8h 40m,1 stop,No info,6013,2019-04-01,1,4,0,520,1,8,17
Jet Airways,6/05/2019,Kolkata,Banglore,CCU → BOM → BLR,16:30,22:35,6h 5m,1 stop,No info,14781,2019-05-06,6,5,0,365,1,16,22
Jet Airways,21/03/2019,Delhi,Cochin,DEL → BOM → COK,17:30,04:25 22 Mar,10h 55m,1 stop,No info,12557,2019-03-21,21,3,3,655,1,17,4
Multiple carriers,6/03/2019,Delhi,Cochin,DEL → BOM → COK,04:45,18:50,14h 5m,1 stop,No info,13875,2019-03-06,6,3,2,845,1,4,18
Jet Airways,15/06/2019,Delhi,Cochin,DEL → IDR → BOM → COK,09:35,04:25 16 Jun,18h 50m,2 stops,In-flight meal not included,11507,2019-06-15,15,6,5,1130,2,9,4
Air India,18/06/2019,Kolkata,Banglore,CCU → BLR,14:15,16:45,2h 30m,non-stop,No info,5510,2019-06-18,18,6,1,150,0,14,16
GoAir,24/03/2019,Kolkata,Banglore,CCU → AMD → BLR,16:25,00:05 25 Mar,7h 40m,1 stop,No info,10198,2019-03-24,24,3,6,460,1,16,0
Jet Airways,12/06/2019,Kolkata,Banglore,CCU → GAU → BLR,10:20,17:35,7h 15m,1 stop,No info,8355,2019-06-12,12,6,2,435,1,10,17
Jet Airways,1/06/2019,Banglore,Delhi,BLR → DEL,18:55,22:00,3h 5m,non-stop,No info,8016,2019-06-01,1,6,5,185,0,18,22
IndiGo,27/05/2019,Delhi,Cochin,DEL → BOM → COK,10:35,21:00,10h 25m,1 stop,No info,6314,2019-05-27,27,5,0,625,1,10,21
Air India,9/03/2019,Delhi,Cochin,DEL → COK,05:10,08:00,2h 50m,non-stop,No info,5831,2019-03-09,9,3,5,170,0,5,8
Jet Airways,24/06/2019,Delhi,Cochin,DEL → BOM → COK,19:15,04:25 25 Jun,9h 10m,1 stop,In-flight meal not included,10262,2019-06-24,24,6,0,550,1,19,4
Multiple carriers,6/03/2019,Delhi,Cochin,DEL → BOM → COK,13:55,01:35 07 Mar,11h 40m,1 stop,In-flight meal not included,15136,2019-03-06,6,3,2,700,1,13,1
Jet Airways,21/03/2019,Banglore,New Delhi,BLR → BOM → DEL,20:35,10:25 19 Mar,13h 50m,1 stop,In-flight meal not included,7832,2019-03-21,21,3,3,830,1,20,10
SpiceJet,24/03/2019,Chennai,Kolkata,MAA → CCU,08:20,10:35,2h 15m,non-stop,No info,3859,2019-03-24,24,3,6,135,0,8,10
IndiGo,6/04/2019,Kolkata,Banglore,CCU → BLR,15:15,17:45,2h 30m,non-stop,No info,4174,2019-04-06,6,4,5,150,0,15,17
Jet Airways,06/03/2019,Banglore,New Delhi,BLR → BOM → DEL,05:45,11:25,5h 40m,1 stop,No info,19225,2019-03-06,6,3,2,340,1,5,11
IndiGo,9/03/2019,Delhi,Cochin,DEL → BOM → COK,04:45,21:00,16h 15m,1 stop,No info,10518,2019-03-09,9,3,5,975,1,4,21
IndiGo,6/04/2019,Banglore,Delhi,BLR → DEL,07:10,10:05,2h 55m,non-stop,No info,4823,2019-04-06,6,4,5,175,0,7,10
Air India,24/03/2019,Banglore,New Delhi,BLR → DEL,10:00,12:45,2h 45m,non-stop,No info,7276,2019-03-24,24,3,6,165,0,10,12
Multiple carriers,9/06/2019,Delhi,Cochin,DEL → BOM → COK,10:00,19:00,9h,1 stop,No info,12192,2019-06-09,9,6,6,540,1,10,19
Air Asia,1/06/2019,Delhi,Cochin,DEL → BLR → COK,16:45,07:10 02 Jun,14h 25m,1 stop,No info,11410,2019-06-01,1,6,5,865,1,16,7
Air India,21/05/2019,Kolkata,Banglore,CCU → DEL → COK → BLR,10:00,01:20 22 May,15h 20m,2 stops,No info,13033,2019-05-21,21,5,1,920,2,10,1
Jet Airways,01/03/2019,Banglore,New Delhi,BLR → BOM → DEL,05:45,15:15,9h 30m,1 stop,No info,26890,2019-03-01,1,3,4,570,1,5,15
IndiGo,27/06/2019,Kolkata,Banglore,CCU → BLR,15:15,17:45,2h 30m,non-stop,No info,4804,2019-06-27,27,6,3,150,0,15,17
Jet Airways,15/05/2019,Kolkata,Banglore,CCU → BOM → BLR,18:55,20:45 16 May,25h 50m,1 stop,In-flight meal not included,10844,2019-05-15,15,5,2,1550,1,18,20
Air India,12/06/2019,Delhi,Cochin,DEL → JDH → BOM → COK,12:55,19:15 13 Jun,30h 20m,2 stops,No info,12436,2019-06-12,12,6,2,1820,2,12,19
IndiGo,21/06/2019,Banglore,Delhi,BLR → DEL,07:10,10:05,2h 55m,non-stop,No info,4823,2019-06-21,21,6,4,175,0,7,10
IndiGo,3/06/2019,Mumbai,Hyderabad,BOM → HYD,21:20,22:50,1h 30m,non-stop,No info,2227,2019-06-03,3,6,0,90,0,21,22
Jet Airways,1/06/2019,Delhi,Cochin,DEL → BOM → COK,20:55,12:35 02 Jun,15h 40m,1 stop,In-flight meal not included,10262,2019-06-01,1,6,5,940,1,20,12
Jet Airways,3/03/2019,Delhi,Cochin,DEL → BOM → COK,08:00,04:25 04 Mar,20h 25m,1 stop,No info,17024,2019-03-03,3,3,6,1225,1,8,4
Jet Airways,27/03/2019,Delhi,Cochin,DEL → IXC → BOM → COK,06:20,04:25 28 Mar,22h 5m,2 stops,In-flight meal not included,9296,2019-03-27,27,3,2,1325,2,6,4
Air India,6/06/2019,Delhi,Cochin,DEL → COK,18:05,21:10,3h 5m,non-stop,No info,6094,2019-06-06,6,6,3,185,0,18,21
Jet Airways,9/06/2019,Kolkata,Banglore,CCU → BOM → BLR,08:25,04:40 10 Jun,20h 15m,1 stop,In-flight meal not included,8586,2019-06-09,9,6,6,1215,1,8,4
Jet Airways,15/06/2019,Delhi,Cochin,DEL → NAG → BOM → COK,06:45,04:25 16 Jun,21h 40m,2 stops,In-flight meal not included,10919,2019-06-15,15,6,5,1300,2,6,4
GoAir,9/06/2019,Kolkata,Banglore,CCU → AMD → BLR,16:40,00:15 10 Jun,7h 35m,1 stop,No info,9495,2019-06-09,9,6,6,455,1,16,0
Jet Airways,12/06/2019,Delhi,Cochin,DEL → BOM → COK,21:50,04:25 13 Jun,6h 35m,1 stop,No info,14714,2019-06-12,12,6,2,395,1,21,4
Air India,24/06/2019,Delhi,Cochin,DEL → COK,14:10,17:10,3h,non-stop,No info,5201,2019-06-24,24,6,0,180,0,14,17
Air India,27/03/2019,Delhi,Cochin,DEL → HYD → MAA → COK,09:45,09:25 28 Mar,23h 40m,2 stops,No info,7090,2019-03-27,27,3,2,1420,2,9,9
IndiGo,15/05/2019,Mumbai,Hyderabad,BOM → HYD,09:10,10:40,1h 30m,non-stop,No info,4575,2019-05-15,15,5,2,90,0,9,10
Multiple carriers,15/05/2019,Delhi,Cochin,DEL → HYD → COK,07:05,16:10,9h 5m,1 stop,No info,9646,2019-05-15,15,5,2,545,1,7,16
IndiGo,12/06/2019,Delhi,Cochin,DEL → MAA → COK,02:00,07:25,5h 25m,1 stop,No info,5636,2019-06-12,12,6,2,325,1,2,7
Multiple carriers,15/06/2019,Delhi,Cochin,DEL → HYD → COK,07:05,16:10,9h 5m,1 stop,No info,9646,2019-06-15,15,6,5,545,1,7,16
Jet Airways,9/03/2019,Mumbai,Hyderabad,BOM → HYD,19:40,21:10,1h 30m,non-stop,In-flight meal not included,4050,2019-03-09,9,3,5,90,0,19,21
Jet Airways,9/06/2019,Delhi,Cochin,DEL → BOM → COK,21:50,19:00 10 Jun,21h 10m,1 stop,No info,14714,2019-06-09,9,6,6,1270,1,21,19
IndiGo,18/06/2019,Kolkata,Banglore,CCU → BLR,15:15,17:45,2h 30m,non-stop,No info,4804,2019-06-18,18,6,1,150,0,15,17
Jet Airways,9/06/2019,Delhi,Cochin,DEL → BOM → COK,18:15,19:00 10 Jun,24h 45m,1 stop,In-flight meal not included,10577,2019-06-09,9,6,6,1485,1,18,19
GoAir,15/06/2019,Banglore,Delhi,BLR → DEL,20:55,23:40,2h 45m,non-stop,No info,3898,2019-06-15,15,6,5,165,0,20,23
Jet Airways,6/06/2019,Kolkata,Banglore,CCU → BOM → BLR,20:00,12:00 07 Jun,16h,1 stop,No info,14571,2019-06-06,6,6,3,960,1,20,12
Jet Airways,15/06/2019,Delhi,Cochin,DEL → NAG → BOM → COK,06:45,04:25 16 Jun,21h 40m,2 stops,In-flight meal not included,10919,2019-06-15,15,6,5,1300,2,6,4
Jet Airways,18/06/2019,Banglore,Delhi,BLR → DEL,06:00,08:45,2h 45m,non-stop,No info,8016,2019-06-18,18,6,1,165,0,6,8
IndiGo,21/03/2019,Delhi,Cochin,DEL → HYD → COK,04:55,12:00,7h 5m,1 stop,No info,6287,2019-03-21,21,3,3,425,1,4,12
Air India,6/06/2019,Kolkata,Banglore,CCU → BOM → BLR,16:50,07:55 07 Jun,15h 5m,1 stop,No info,8366,2019-06-06,6,6,3,905,1,16,7
Jet Airways,6/03/2019,Delhi,Cochin,DEL → BOM → COK,11:30,18:50,7h 20m,1 stop,In-flight meal not included,15400,2019-03-06,6,3,2,440,1,11,18
Vistara,03/03/2019,Banglore,New Delhi,BLR → DEL,19:40,22:20,2h 40m,non-stop,No info,8553,2019-03-03,3,3,6,160,0,19,22
SpiceJet,9/04/2019,Kolkata,Banglore,CCU → BLR,06:55,09:30,2h 35m,non-stop,No check-in baggage included,3841,2019-04-09,9,4,1,155,0,6,9
Air India,9/04/2019,Delhi,Cochin,DEL → BHO → BOM → COK,05:55,07:40 10 Apr,25h 45m,2 stops,No info,10021,2019-04-09,9,4,1,1545,2,5,7
SpiceJet,24/06/2019,Chennai,Kolkata,MAA → CCU,17:45,20:05,2h 20m,non-stop,No info,3597,2019-06-24,24,6,0,140,0,17,20
IndiGo,24/05/2019,Chennai,Kolkata,MAA → CCU,11:35,14:00,2h 25m,non-stop,No info,4332,2019-05-24,24,5,4,145,0,11,14
GoAir,21/06/2019,Banglore,Delhi,BLR → DEL,20:55,23:40,2h 45m,non-stop,No info,3898,2019-06-21,21,6,4,165,0,20,23
Jet Airways,6/03/2019,Mumbai,Hyderabad,BOM → BDQ → DEL → HYD,13:05,16:50 07 Mar,27h 45m,2 stops,No info,21375,2019-03-06,6,3,2,1665,2,13,16
Vistara,6/06/2019,Kolkata,Banglore,CCU → DEL → BLR,07:10,23:25,16h 15m,1 stop,No info,8610,2019-06-06,6,6,3,975,1,7,23
IndiGo,15/06/2019,Kolkata,Banglore,CCU → BLR,17:15,19:50,2h 35m,non-stop,No info,4804,2019-06-15,15,6,5,155,0,17,19
Air India,1/06/2019,Delhi,Cochin,DEL → CCU → BOM → COK,14:25,19:15 02 Jun,28h 50m,2 stops,No info,13591,2019-06-01,1,6,5,1730,2,14,19
Jet Airways,6/05/2019,Kolkata,Banglore,CCU → BOM → BLR,06:30,16:20,9h 50m,1 stop,No info,14781,2019-05-06,6,5,0,590,1,6,16
Jet Airways,15/03/2019,Banglore,New Delhi,BLR → BOM → DEL,08:00,13:15,5h 15m,1 stop,In-flight meal not included,9134,2019-03-15,15,3,4,315,1,8,13
Air India,9/06/2019,Delhi,Cochin,DEL → NAG → BOM → COK,05:55,07:40 10 Jun,25h 45m,2 stops,No info,10493,2019-06-09,9,6,6,1545,2,5,7
Jet Airways,24/03/2019,Banglore,New Delhi,BLR → BOM → DEL,11:40,09:00 19 Mar,21h 20m,1 stop,In-flight meal not included,8147,2019-03-24,24,3,6,1280,1,11,9
SpiceJet,21/06/2019,Kolkata,Banglore,CCU → BLR,22:20,00:40 22 Jun,2h 20m,non-stop,No info,3873,2019-06-21,21,6,4,140,0,22,0
Jet Airways,9/06/2019,Kolkata,Banglore,CCU → BOM → BLR,18:55,12:00 10 Jun,17h 5m,1 stop,No info,14571,2019-06-09,9,6,6,1025,1,18,12
Air India,03/03/2019,Banglore,New Delhi,BLR → VGA → HYD → DEL,10:30,21:25,10h 55m,2 stops,No info,11003,2019-03-03,3,3,6,655,2,10,21
Jet Airways,3/06/2019,Delhi,Cochin,DEL → BOM → COK,19:15,04:25 04 Jun,9h 10m,1 stop,In-flight meal not included,10262,2019-06-03,3,6,0,550,1,19,4
Jet Airways,21/03/2019,Delhi,Cochin,DEL → BOM → COK,02:15,18:50,16h 35m,1 stop,No info,12719,2019-03-21,21,3,3,995,1,2,18
Jet Airways,24/06/2019,Delhi,Cochin,DEL → BOM → COK,20:55,19:00 25 Jun,22h 5m,1 stop,In-flight meal not included,10262,2019-06-24,24,6,0,1325,1,20,19
Air India,21/06/2019,Banglore,Delhi,BLR → DEL,17:00,19:45,2h 45m,non-stop,No info,7171,2019-06-21,21,6,4,165,0,17,19
SpiceJet,27/04/2019,Banglore,Delhi,BLR → DEL,05:55,08:35,2h 40m,non-stop,No info,4423,2019-04-27,27,4,5,160,0,5,8
Multiple carriers,9/03/2019,Delhi,Cochin,DEL → BOM → COK,17:25,01:35 10 Mar,8h 10m,1 stop,In-flight meal not included,12616,2019-03-09,9,3,5,490,1,17,1
Air India,1/06/2019,Delhi,Cochin,DEL → HYD → BOM → COK,17:15,19:15 02 Jun,26h,2 stops,No info,12970,2019-06-01,1,6,5,1560,2,17,19
Jet Airways,24/03/2019,Kolkata,Banglore,CCU → BOM → BLR,21:10,10:05 25 Mar,12h 55m,1 stop,No info,14914,2019-03-24,24,3,6,775,1,21,10
Jet Airways,6/05/2019,Mumbai,Hyderabad,BOM → HYD,02:55,04:20,1h 25m,non-stop,In-flight meal not included,3210,2019-05-06,6,5,0,85,0,2,4
GoAir,21/04/2019,Banglore,Delhi,BLR → DEL,07:45,10:40,2h 55m,non-stop,No info,4632,2019-04-21,21,4,6,175,0,7,10
Jet Airways,9/05/2019,Delhi,Cochin,DEL → BOM → COK,17:30,04:25 10 May,10h 55m,1 stop,In-flight meal not included,12373,2019-05-09,9,5,3,655,1,17,4
IndiGo,15/06/2019,Kolkata,Banglore,CCU → BLR,14:25,16:55,2h 30m,non-stop,No info,4804,2019-06-15,15,6,5,150,0,14,16
Multiple carriers,3/03/2019,Delhi,Cochin,DEL → GWL → IDR → BOM → COK,11:35,21:00,9h 25m,3 stops,No info,21829,2019-03-03,3,3,6,565,3,11,21
Multiple carriers,1/06/2019,Delhi,Cochin,DEL → BOM → COK,08:00,21:00,13h,1 stop,No info,13587,2019-06-01,1,6,5,780,1,8,21
Jet Airways,27/06/2019,Delhi,Cochin,DEL → AMD → BOM → COK,23:05,04:25 29 Jun,29h 20m,2 stops,No info,12819,2019-06-27,27,6,3,1760,2,23,4
Air Asia,27/03/2019,Delhi,Cochin,DEL → BLR → COK,20:10,07:10 28 Mar,11h,1 stop,No info,6151,2019-03-27,27,3,2,660,1,20,7
Jet Airways,1/06/2019,Banglore,Delhi,BLR → DEL,15:15,18:10,2h 55m,non-stop,No info,8016,2019-06-01,1,6,5,175,0,15,18
Multiple carriers,6/03/2019,Delhi,Cochin,DEL → BOM → COK,07:30,18:50,11h 20m,1 stop,No info,15135,2019-03-06,6,3,2,680,1,7,18
IndiGo,21/05/2019,Delhi,Cochin,DEL → BOM → COK,17:10,01:30 22 May,8h 20m,1 stop,No info,6794,2019-05-21,21,5,1,500,1,17,1
Vistara,15/05/2019,Kolkata,Banglore,CCU → DEL → BLR,17:00,20:20 16 May,27h 20m,1 stop,No info,8610,2019-05-15,15,5,2,1640,1,17,20
Air India,18/05/2019,Kolkata,Banglore,CCU → IXR → DEL → BLR,05:50,12:30 19 May,30h 40m,2 stops,No info,12723,2019-05-18,18,5,5,1840,2,5,12
Air India,6/06/2019,Kolkata,Banglore,CCU → BBI → BLR,12:00,13:15 07 Jun,25h 15m,1 stop,No info,7662,2019-06-06,6,6,3,1515,1,12,13
Multiple carriers,9/03/2019,Delhi,Cochin,DEL → BOM → COK,17:00,01:35 10 Mar,8h 35m,1 stop,No info,14343,2019-03-09,9,3,5,515,1,17,1
Multiple carriers,1/06/2019,Delhi,Cochin,DEL → BOM → COK,10:20,01:30 02 Jun,15h 10m,1 stop,No info,6795,2019-06-01,1,6,5,910,1,10,1
SpiceJet,9/05/2019,Kolkata,Banglore,CCU → BLR,22:20,00:40 10 May,2h 20m,non-stop,No info,3873,2019-05-09,9,5,3,140,0,22,0
IndiGo,12/06/2019,Mumbai,Hyderabad,BOM → HYD,19:05,20:35,1h 30m,non-stop,No info,2754,2019-06-12,12,6,2,90,0,19,20
Air India,6/03/2019,Mumbai,Hyderabad,BOM → CCU → HYD,06:10,21:15,15h 5m,1 stop,No info,16666,2019-03-06,6,3,2,905,1,6,21
Multiple carriers,1/06/2019,Delhi,Cochin,DEL → BOM → COK,04:55,12:35,7h 40m,1 stop,No info,11098,2019-06-01,1,6,5,460,1,4,12
Jet Airways,9/06/2019,Kolkata,Banglore,CCU → DEL → BLR,17:00,22:05 10 Jun,29h 5m,1 stop,In-flight meal not included,10539,2019-06-09,9,6,6,1745,1,17,22
Air India,27/05/2019,Delhi,Cochin,DEL → BOM → COK,07:00,19:15,12h 15m,1 stop,No info,9929,2019-05-27,27,5,0,735,1,7,19
Jet Airways,12/05/2019,Kolkata,Banglore,CCU → BOM → BLR,16:30,16:20 13 May,23h 50m,1 stop,In-flight meal not included,10844,2019-05-12,12,5,6,1430,1,16,16
Jet Airways,6/06/2019,Kolkata,Banglore,CCU → DEL → BLR,09:35,14:25 07 Jun,28h 50m,1 stop,No info,12692,2019-06-06,6,6,3,1730,1,9,14
Jet Airways,21/03/2019,Delhi,Cochin,DEL → BOM → COK,20:50,04:25 22 Mar,7h 35m,1 stop,In-flight meal not included,9212,2019-03-21,21,3,3,455,1,20,4
Multiple carriers,15/05/2019,Delhi,Cochin,DEL → BOM → COK,15:00,01:30 16 May,10h 30m,1 stop,No info,13727,2019-05-15,15,5,2,630,1,15,1
Air Asia,15/06/2019,Banglore,Delhi,BLR → DEL,04:55,07:45,2h 50m,non-stop,No info,4282,2019-06-15,15,6,5,170,0,4,7
Jet Airways,24/05/2019,Kolkata,Banglore,CCU → BOM → BLR,18:55,16:20 25 May,21h 25m,1 stop,In-flight meal not included,10844,2019-05-24,24,5,4,1285,1,18,16
Air India,27/06/2019,Delhi,Cochin,DEL → MAA → COK,17:20,09:25 28 Jun,16h 5m,1 stop,No info,7480,2019-06-27,27,6,3,965,1,17,9
IndiGo,1/05/2019,Banglore,Delhi,BLR → DEL,16:55,19:55,3h,non-stop,No info,4823,2019-05-01,1,5,2,180,0,16,19
Jet Airways,18/05/2019,Delhi,Cochin,DEL → BOM → COK,22:50,12:35 19 May,13h 45m,1 stop,In-flight meal not included,12373,2019-05-18,18,5,5,825,1,22,12
Multiple carriers,21/03/2019,Delhi,Cochin,DEL → BOM → COK,11:40,21:00,9h 20m,1 stop,No info,7215,2019-03-21,21,3,3,560,1,11,21
Air India,9/05/2019,Delhi,Cochin,DEL → MAA → COK,06:05,09:25 10 May,27h 20m,1 stop,No info,7480,2019-05-09,9,5,3,1640,1,6,9
Multiple carriers,24/06/2019,Delhi,Cochin,DEL → BOM → COK,09:00,21:00,12h,1 stop,No info,8143,2019-06-24,24,6,0,720,1,9,21
IndiGo,3/05/2019,Banglore,Delhi,BLR → DEL,18:25,21:20,2h 55m,non-stop,No info,4823,2019-05-03,3,5,4,175,0,18,21
Jet Airways,6/06/2019,Kolkata,Banglore,CCU → BOM → BLR,20:00,08:15 07 Jun,12h 15m,1 stop,In-flight meal not included,10844,2019-06-06,6,6,3,735,1,20,8
SpiceJet,12/04/2019,Banglore,Delhi,BLR → DEL,21:10,00:05 13 Apr,2h 55m,non-stop,No info,5621,2019-04-12,12,4,4,175,0,21,0
Vistara,18/05/2019,Kolkata,Banglore,CCU → DEL → BLR,20:20,20:20 19 May,24h,1 stop,No info,9555,2019-05-18,18,5,5,1440,1,20,20
IndiGo,21/03/2019,Banglore,New Delhi,BLR → DEL,01:30,04:15,2h 45m,non-stop,No info,4777,2019-03-21,21,3,3,165,0,1,4
SpiceJet,03/03/2019,Banglore,New Delhi,BLR → DEL,09:35,12:30,2h 55m,non-stop,No info,7648,2019-03-03,3,3,6,175,0,9,12
IndiGo,1/04/2019,Kolkata,Banglore,CCU → PAT → BLR,09:20,14:15,4h 55m,1 stop,No info,10308,2019-04-01,1,4,0,295,1,9,14
Jet Airways,24/05/2019,Delhi,Cochin,DEL → JDH → BOM → COK,11:40,19:00,7h 20m,2 stops,No info,21219,2019-05-24,24,5,4,440,2,11,19
IndiGo,6/05/2019,Kolkata,Banglore,CCU → PAT → BLR,09:20,14:15,4h 55m,1 stop,No info,11319,2019-05-06,6,5,0,295,1,9,14
Jet Airways,15/05/2019,Kolkata,Banglore,CCU → BOM → BLR,21:10,20:45 16 May,23h 35m,1 stop,In-flight meal not included,10844,2019-05-15,15,5,2,1415,1,21,20
Multiple carriers,9/05/2019,Delhi,Cochin,DEL → BOM → COK,18:15,01:30 10 May,7h 15m,1 stop,No info,15078,2019-05-09,9,5,3,435,1,18,1
SpiceJet,1/05/2019,Mumbai,Hyderabad,BOM → HYD,22:45,00:15 02 May,1h 30m,non-stop,No info,2017,2019-05-01,1,5,2,90,0,22,0
Air Asia,1/06/2019,Kolkata,Banglore,CCU → BLR,22:50,01:20 02 Jun,2h 30m,non-stop,No info,4409,2019-06-01,1,6,5,150,0,22,1
IndiGo,9/06/2019,Delhi,Cochin,DEL → HYD → COK,07:35,12:10,4h 35m,1 stop,No info,5054,2019-06-09,9,6,6,275,1,7,12
Air India,15/03/2019,Banglore,New Delhi,BLR → CCU → GAU → DEL,05:50,22:10,16h 20m,2 stops,No info,10111,2019-03-15,15,3,4,980,2,5,22
SpiceJet,18/03/2019,Banglore,New Delhi,BLR → DEL,20:30,23:20,2h 50m,non-stop,No check-in baggage included,4273,2019-03-18,18,3,0,170,0,20,23
Jet Airways,21/03/2019,Delhi,Cochin,DEL → MAA → BOM → COK,13:55,18:50 22 Mar,28h 55m,2 stops,In-flight meal not included,8728,2019-03-21,21,3,3,1735,2,13,18
Air India,24/05/2019,Kolkata,Banglore,CCU → BOM → BLR,16:50,07:55 25 May,15h 5m,1 stop,No info,8576,2019-05-24,24,5,4,905,1,16,7
Jet Airways,3/06/2019,Banglore,Delhi,BLR → DEL,17:45,20:45,3h,non-stop,No info,8016,2019-06-03,3,6,0,180,0,17,20
Jet Airways,9/06/2019,Banglore,Delhi,BLR → DEL,15:15,18:10,2h 55m,non-stop,No info,8016,2019-06-09,9,6,6,175,0,15,18
Jet Airways,18/05/2019,Kolkata,Banglore,CCU → DEL → BLR,20:25,23:35 19 May,27h 10m,1 stop,No info,14151,2019-05-18,18,5,5,1630,1,20,23
IndiGo,15/04/2019,Banglore,Delhi,BLR → DEL,06:05,08:50,2h 45m,non-stop,No info,4423,2019-04-15,15,4,0,165,0,6,8
Jet Airways,15/06/2019,Mumbai,Hyderabad,BOM → HYD,07:05,08:30,1h 25m,non-stop,In-flight meal not included,4050,2019-06-15,15,6,5,85,0,7,8
Jet Airways,6/05/2019,Kolkata,Banglore,CCU → BOM → BLR,14:05,19:50,5h 45m,1 stop,No info,14781,2019-05-06,6,5,0,345,1,14,19
Jet Airways,15/05/2019,Kolkata,Banglore,CCU → BOM → BLR,20:00,08:15 16 May,12h 15m,1 stop,In-flight meal not included,8586,2019-05-15,15,5,2,735,1,20,8
Air Asia,21/05/2019,Kolkata,Banglore,CCU → BBI → BLR,19:55,23:30,3h 35m,1 stop,No info,5162,2019-05-21,21,5,1,215,1,19,23
Jet Airways,9/06/2019,Kolkata,Banglore,CCU → BOM → BLR,21:10,04:40 10 Jun,7h 30m,1 stop,No info,13731,2019-06-09,9,6,6,450,1,21,4
Jet Airways,21/03/2019,Delhi,Cochin,DEL → BOM → COK,13:00,04:25 22 Mar,15h 25m,1 stop,In-flight meal not included,7438,2019-03-21,21,3,3,925,1,13,4
Jet Airways,15/05/2019,Kolkata,Banglore,CCU → DEL → BLR,09:35,10:55 16 May,25h 20m,1 stop,No info,14151,2019-05-15,15,5,2,1520,1,9,10
Vistara,12/04/2019,Banglore,Delhi,BLR → DEL,21:00,23:50,2h 50m,non-stop,No info,5613,2019-04-12,12,4,4,170,0,21,23
IndiGo,15/05/2019,Kolkata,Banglore,CCU → HYD → BLR,15:15,20:05,4h 50m,1 stop,No info,5380,2019-05-15,15,5,2,290,1,15,20
Jet Airways,21/03/2019,Delhi,Cochin,DEL → BOM → COK,11:30,04:25 22 Mar,16h 55m,1 stop,In-flight meal not included,7438,2019-03-21,21,3,3,1015,1,11,4
Multiple carriers,1/06/2019,Delhi,Cochin,DEL → HYD → COK,07:05,22:30,15h 25m,1 stop,No info,9646,2019-06-01,1,6,5,925,1,7,22
Air Asia,15/05/2019,Delhi,Cochin,DEL → BLR → COK,20:45,07:10 16 May,10h 25m,1 stop,No info,6853,2019-05-15,15,5,2,625,1,20,7
Jet Airways,18/03/2019,Banglore,New Delhi,BLR → BOM → DEL,14:05,20:20,6h 15m,1 stop,No info,13555,2019-03-18,18,3,0,375,1,14,20
IndiGo,15/06/2019,Delhi,Cochin,DEL → BOM → COK,17:30,01:30 16 Jun,8h,1 stop,No info,5883,2019-06-15,15,6,5,480,1,17,1
IndiGo,9/03/2019,Delhi,Cochin,DEL → HYD → COK,04:55,12:00,7h 5m,1 stop,No info,6171,2019-03-09,9,3,5,425,1,4,12
IndiGo,21/05/2019,Mumbai,Hyderabad,BOM → HYD,16:55,18:25,1h 30m,non-stop,No info,3175,2019-05-21,21,5,1,90,0,16,18
IndiGo,27/03/2019,Delhi,Cochin,DEL → AMD → COK,07:45,13:40,5h 55m,1 stop,No info,4832,2019-03-27,27,3,2,355,1,7,13
Multiple carriers,1/06/2019,Delhi,Cochin,DEL → BOM → COK,16:00,01:30 02 Jun,9h 30m,1 stop,No info,13377,2019-06-01,1,6,5,570,1,16,1
Jet Airways,24/06/2019,Delhi,Cochin,DEL → BOM → COK,19:45,04:25 25 Jun,8h 40m,1 stop,In-flight meal not included,10262,2019-06-24,24,6,0,520,1,19,4
Jet Airways,1/06/2019,Delhi,Cochin,DEL → BOM → COK,18:15,12:35 02 Jun,18h 20m,1 stop,In-flight meal not included,10262,2019-06-01,1,6,5,1100,1,18,12
Air India,18/05/2019,Delhi,Cochin,DEL → JAI → BOM → COK,12:00,07:40 19 May,19h 40m,2 stops,No info,8603,2019-05-18,18,5,5,1180,2,12,7
Jet Airways,6/06/2019,Kolkata,Banglore,CCU → BOM → BLR,06:30,04:40 07 Jun,22h 10m,1 stop,In-flight meal not included,8586,2019-06-06,6,6,3,1330,1,6,4
Vistara,21/05/2019,Kolkata,Banglore,CCU → DEL → BLR,20:20,09:05 22 May,12h 45m,1 stop,No info,8452,2019-05-21,21,5,1,765,1,20,9
Jet Airways,24/03/2019,Kolkata,Banglore,CCU → BOM → BLR,18:55,18:10 25 Mar,23h 15m,1 stop,No info,14231,2019-03-24,24,3,6,1395,1,18,18
Jet Airways,21/05/2019,Delhi,Cochin,DEL → BOM → COK,08:00,19:00,11h,1 stop,No info,16289,2019-05-21,21,5,1,660,1,8,19
SpiceJet,03/03/2019,Banglore,New Delhi,BLR → DEL,09:35,12:30,2h 55m,non-stop,No info,6860,2019-03-03,3,3,6,175,0,9,12
IndiGo,9/05/2019,Mumbai,Hyderabad,BOM → HYD,02:35,04:05,1h 30m,non-stop,No info,2754,2019-05-09,9,5,3,90,0,2,4
Multiple carriers,9/06/2019,Delhi,Cochin,DEL → HYD → COK,07:05,22:30,15h 25m,1 stop,No info,9646,2019-06-09,9,6,6,925,1,7,22
Air India,27/05/2019,Chennai,Kolkata,MAA → CCU,11:40,13:55,2h 15m,non-stop,No info,4667,2019-05-27,27,5,0,135,0,11,13
IndiGo,21/04/2019,Kolkata,Banglore,CCU → BLR,15:30,18:05,2h 35m,non-stop,No info,4804,2019-04-21,21,4,6,155,0,15,18
IndiGo,09/03/2019,Banglore,New Delhi,BLR → DEL,01:30,04:15,2h 45m,non-stop,No info,4545,2019-03-09,9,3,5,165,0,1,4
Jet Airways,01/03/2019,Banglore,New Delhi,BLR → BOM → DEL,22:50,20:20 02 Mar,21h 30m,1 stop,No info,25735,2019-03-01,1,3,4,1290,1,22,20
Jet Airways,21/03/2019,Delhi,Cochin,DEL → JAI → BOM → COK,05:30,04:25 22 Mar,22h 55m,2 stops,No info,12647,2019-03-21,21,3,3,1375,2,5,4
Jet Airways,1/05/2019,Kolkata,Banglore,CCU → BOM → BLR,14:05,08:15 02 May,18h 10m,1 stop,In-flight meal not included,8586,2019-05-01,1,5,2,1090,1,14,8
IndiGo,9/06/2019,Chennai,Kolkata,MAA → CCU,22:05,00:25 10 Jun,2h 20m,non-stop,No info,5277,2019-06-09,9,6,6,140,0,22,0
IndiGo,27/03/2019,Delhi,Cochin,DEL → BOM → COK,11:30,01:35 28 Mar,14h 5m,1 stop,No info,6206,2019-03-27,27,3,2,845,1,11,1
Air Asia,12/04/2019,Banglore,Delhi,BLR → DEL,11:10,13:55,2h 45m,non-stop,No info,4483,2019-04-12,12,4,4,165,0,11,13
Vistara,24/05/2019,Kolkata,Banglore,CCU → DEL → BLR,17:00,18:50 25 May,25h 50m,1 stop,No info,9870,2019-05-24,24,5,4,1550,1,17,18
SpiceJet,27/06/2019,Kolkata,Banglore,CCU → BLR,17:10,19:40,2h 30m,non-stop,No check-in baggage included,3841,2019-06-27,27,6,3,150,0,17,19
SpiceJet,27/03/2019,Kolkata,Banglore,CCU → BLR,09:00,11:30,2h 30m,non-stop,No check-in baggage included,3815,2019-03-27,27,3,2,150,0,9,11
IndiGo,24/03/2019,Banglore,New Delhi,BLR → DEL,23:30,02:20 25 Mar,2h 50m,non-stop,No info,6860,2019-03-24,24,3,6,170,0,23,2
Jet Airways,1/05/2019,Kolkata,Banglore,CCU → DEL → BLR,20:25,10:55 02 May,14h 30m,1 stop,No info,12121,2019-05-01,1,5,2,870,1,20,10
Jet Airways,27/03/2019,Delhi,Cochin,DEL → BOM → COK,09:55,18:50,8h 55m,1 stop,In-flight meal not included,5963,2019-03-27,27,3,2,535,1,9,18
SpiceJet,6/06/2019,Banglore,Delhi,BLR → DEL,05:55,08:35,2h 40m,non-stop,No info,3625,2019-06-06,6,6,3,160,0,5,8
SpiceJet,15/06/2019,Kolkata,Banglore,CCU → BLR,09:00,11:25,2h 25m,non-stop,No check-in baggage included,3841,2019-06-15,15,6,5,145,0,9,11
IndiGo,12/06/2019,Banglore,Delhi,BLR → DEL,20:00,22:50,2h 50m,non-stop,No info,4823,2019-06-12,12,6,2,170,0,20,22
Multiple carriers,12/06/2019,Delhi,Cochin,DEL → HYD → COK,09:45,16:10,6h 25m,1 stop,No info,9646,2019-06-12,12,6,2,385,1,9,16
Jet Airways,27/05/2019,Delhi,Cochin,DEL → BOM → COK,02:15,12:35,10h 20m,1 stop,In-flight meal not included,10152,2019-05-27,27,5,0,620,1,2,12
IndiGo,3/06/2019,Delhi,Cochin,DEL → HYD → COK,06:50,22:30,15h 40m,1 stop,No info,7514,2019-06-03,3,6,0,940,1,6,22
Jet Airways,06/03/2019,Banglore,New Delhi,BLR → BOM → DEL,07:00,18:25,11h 25m,1 stop,No info,16736,2019-03-06,6,3,2,685,1,7,18
Jet Airways,6/05/2019,Kolkata,Banglore,CCU → BOM → BLR,18:55,10:05 07 May,15h 10m,1 stop,No info,13584,2019-05-06,6,5,0,910,1,18,10
Air India,21/05/2019,Kolkata,Banglore,CCU → JAI → BOM → BLR,08:20,07:55 22 May,23h 35m,2 stops,No info,11222,2019-05-21,21,5,1,1415,2,8,7
IndiGo,1/05/2019,Chennai,Kolkata,MAA → CCU,07:55,10:15,2h 20m,non-stop,No info,3850,2019-05-01,1,5,2,140,0,7,10
Vistara,24/03/2019,Banglore,New Delhi,BLR → DEL,12:00,14:40,2h 40m,non-stop,No info,7608,2019-03-24,24,3,6,160,0,12,14
Jet Airways,12/05/2019,Kolkata,Banglore,CCU → BOM → BLR,20:00,16:20 13 May,20h 20m,1 stop,In-flight meal not included,10844,2019-05-12,12,5,6,1220,1,20,16
Multiple carriers,9/06/2019,Delhi,Cochin,DEL → BOM → COK,17:00,01:30 10 Jun,8h 30m,1 stop,No info,7408,2019-06-09,9,6,6,510,1,17,1
Vistara,18/05/2019,Chennai,Kolkata,MAA → CCU,07:05,09:20,2h 15m,non-stop,No info,3687,2019-05-18,18,5,5,135,0,7,9
SpiceJet,3/03/2019,Delhi,Cochin,DEL → BLR → COK,16:35,22:50,6h 15m,1 stop,No info,11726,2019-03-03,3,3,6,375,1,16,22
Jet Airways,6/05/2019,Kolkata,Banglore,CCU → BOM → BLR,06:30,09:20 07 May,26h 50m,1 stop,In-flight meal not included,9663,2019-05-06,6,5,0,1610,1,6,9
Air India,24/03/2019,Kolkata,Banglore,CCU → DEL → COK → BLR,07:00,13:45 25 Mar,30h 45m,2 stops,No info,12829,2019-03-24,24,3,6,1845,2,7,13
IndiGo,27/06/2019,Delhi,Cochin,DEL → BOM → COK,16:00,21:00,5h,1 stop,No info,6069,2019-06-27,27,6,3,300,1,16,21
Jet Airways,12/06/2019,Kolkata,Banglore,CCU → BOM → BLR,16:30,19:50 13 Jun,27h 20m,1 stop,In-flight meal not included,8529,2019-06-12,12,6,2,1640,1,16,19
Vistara,9/05/2019,Kolkata,Banglore,CCU → DEL → BLR,17:00,23:25,6h 25m,1 stop,No info,8085,2019-05-09,9,5,3,385,1,17,23
Vistara,15/05/2019,Banglore,Delhi,BLR → DEL,19:30,22:15,2h 45m,non-stop,No info,4878,2019-05-15,15,5,2,165,0,19,22
IndiGo,3/04/2019,Banglore,Delhi,BLR → DEL,13:00,15:50,2h 50m,non-stop,No info,4077,2019-04-03,3,4,2,170,0,13,15
IndiGo,9/05/2019,Kolkata,Banglore,CCU → PNQ → BLR,21:00,02:15 10 May,5h 15m,1 stop,No info,7605,2019-05-09,9,5,3,315,1,21,2
Jet Airways,15/06/2019,Delhi,Cochin,DEL → JAI → BOM → COK,05:30,04:25 16 Jun,22h 55m,2 stops,No info,13014,2019-06-15,15,6,5,1375,2,5,4
IndiGo,3/03/2019,Delhi,Cochin,DEL → HYD → COK,07:35,22:20,14h 45m,1 stop,No info,11600,2019-03-03,3,3,6,885,1,7,22
Jet Airways,12/05/2019,Kolkata,Banglore,CCU → DEL → BLR,17:00,09:45 13 May,16h 45m,1 stop,No info,14151,2019-05-12,12,5,6,1005,1,17,9
Air India,24/06/2019,Delhi,Cochin,DEL → HYD → BOM → COK,13:15,07:40 25 Jun,18h 25m,2 stops,No info,12497,2019-06-24,24,6,0,1105,2,13,7
Jet Airways,6/03/2019,Delhi,Cochin,DEL → BOM → COK,02:15,18:50,16h 35m,1 stop,No info,17024,2019-03-06,6,3,2,995,1,2,18
SpiceJet,9/03/2019,Chennai,Kolkata,MAA → CCU,09:30,12:05,2h 35m,non-stop,No info,6300,2019-03-09,9,3,5,155,0,9,12
Multiple carriers,6/03/2019,Delhi,Cochin,DEL → BOM → COK,17:45,01:35 07 Mar,7h 50m,1 stop,No info,15147,2019-03-06,6,3,2,470,1,17,1
Multiple carriers,1/06/2019,Delhi,Cochin,DEL → BOM → COK,12:50,01:30 02 Jun,12h 40m,1 stop,No info,6795,2019-06-01,1,6,5,760,1,12,1
IndiGo,3/03/2019,Mumbai,Hyderabad,BOM → HYD,19:05,20:30,1h 25m,non-stop,No info,5755,2019-03-03,3,3,6,85,0,19,20
Air India,12/05/2019,Kolkata,Banglore,CCU → DEL → BLR,20:30,16:15 13 May,19h 45m,1 stop,No info,10203,2019-05-12,12,5,6,1185,1,20,16
Jet Airways,6/06/2019,Delhi,Cochin,DEL → BOM → COK,11:30,04:25 07 Jun,16h 55m,1 stop,No info,14714,2019-06-06,6,6,3,1015,1,11,4
IndiGo,18/03/2019,Banglore,New Delhi,BLR → DEL,22:20,01:10 19 Mar,2h 50m,non-stop,No info,4545,2019-03-18,18,3,0,170,0,22,1
Jet Airways,15/05/2019,Kolkata,Banglore,CCU → BOM → BLR,06:30,20:45,14h 15m,1 stop,No info,14781,2019-05-15,15,5,2,855,1,6,20
Air India,12/03/2019,Banglore,New Delhi,BLR → TRV → COK → DEL,07:30,11:05 13 Mar,27h 35m,2 stops,No info,11602,2019-03-12,12,3,1,1655,2,7,11
IndiGo,6/05/2019,Mumbai,Hyderabad,BOM → HYD,06:25,07:55,1h 30m,non-stop,No info,4049,2019-05-06,6,5,0,90,0,6,7
Jet Airways,9/05/2019,Delhi,Cochin,DEL → JAI → BOM → COK,05:30,04:25 10 May,22h 55m,2 stops,In-flight meal not included,13029,2019-05-09,9,5,3,1375,2,5,4
Jet Airways,9/06/2019,Kolkata,Banglore,CCU → BOM → BLR,08:25,20:45,12h 20m,1 stop,No info,14571,2019-06-09,9,6,6,740,1,8,20
Air India,9/06/2019,Banglore,Delhi,BLR → DEL,06:10,08:55,2h 45m,non-stop,No info,6961,2019-06-09,9,6,6,165,0,6,8
SpiceJet,15/05/2019,Kolkata,Banglore,CCU → PNQ → BLR,08:35,17:15,8h 40m,1 stop,No info,6381,2019-05-15,15,5,2,520,1,8,17
SpiceJet,1/04/2019,Kolkata,Banglore,CCU → BLR,06:55,09:30,2h 35m,non-stop,No check-in baggage included,3841,2019-04-01,1,4,0,155,0,6,9
Jet Airways,21/03/2019,Delhi,Cochin,DEL → IXC → BOM → COK,06:20,04:25 22 Mar,22h 5m,2 stops,No info,11538,2019-03-21,21,3,3,1325,2,6,4
Vistara,6/05/2019,Kolkata,Banglore,CCU → DEL → BLR,20:20,20:20 07 May,24h,1 stop,No info,8610,2019-05-06,6,5,0,1440,1,20,20
Air India,6/03/2019,Delhi,Cochin,DEL → HYD → BOM → COK,07:05,19:15 07 Mar,36h 10m,2 stops,No info,11552,2019-03-06,6,3,2,2170,2,7,19
Multiple carriers,1/06/2019,Delhi,Cochin,DEL → BOM → COK,07:00,21:00,14h,1 stop,No info,7408,2019-06-01,1,6,5,840,1,7,21
Jet Airways,27/06/2019,Delhi,Cochin,DEL → BOM → COK,19:45,12:35 28 Jun,16h 50m,1 stop,In-flight meal not included,10262,2019-06-27,27,6,3,1010,1,19,12
Air India,6/05/2019,Kolkata,Banglore,CCU → IXR → DEL → BLR,05:50,08:55 07 May,27h 5m,2 stops,No info,10991,2019-05-06,6,5,0,1625,2,5,8
Multiple carriers,9/06/2019,Delhi,Cochin,DEL → BOM → COK,18:15,01:30 10 Jun,7h 15m,1 stop,No info,13587,2019-06-09,9,6,6,435,1,18,1
Air India,15/05/2019,Delhi,Cochin,DEL → MAA → COK,12:30,09:25 16 May,20h 55m,1 stop,No info,7480,2019-05-15,15,5,2,1255,1,12,9
IndiGo,09/03/2019,Banglore,New Delhi,BLR → IDR → DEL,17:55,22:55,5h,1 stop,No info,6351,2019-03-09,9,3,5,300,1,17,22
Multiple carriers,27/05/2019,Delhi,Cochin,DEL → BOM → COK,14:00,21:00,7h,1 stop,In-flight meal not included,7153,2019-05-27,27,5,0,420,1,14,21
Air Asia,6/05/2019,Kolkata,Banglore,CCU → BLR,19:55,22:25,2h 30m,non-stop,No info,4409,2019-05-06,6,5,0,150,0,19,22
IndiGo,15/05/2019,Kolkata,Banglore,CCU → PNQ → BLR,21:00,02:15 16 May,5h 15m,1 stop,No info,7228,2019-05-15,15,5,2,315,1,21,2
Multiple carriers,27/03/2019,Delhi,Cochin,DEL → BOM → COK,08:00,18:50,10h 50m,1 stop,No info,11667,2019-03-27,27,3,2,650,1,8,18
SpiceJet,12/06/2019,Kolkata,Banglore,CCU → MAA → BLR,15:05,20:20,5h 15m,1 stop,No info,4649,2019-06-12,12,6,2,315,1,15,20
Air India,9/05/2019,Kolkata,Banglore,CCU → BOM → COK → BLR,16:50,13:45 10 May,20h 55m,2 stops,No info,12592,2019-05-09,9,5,3,1255,2,16,13
Multiple carriers,12/06/2019,Delhi,Cochin,DEL → BOM → COK,10:20,19:00,8h 40m,1 stop,No info,11789,2019-06-12,12,6,2,520,1,10,19
Air India,1/06/2019,Chennai,Kolkata,MAA → CCU,11:40,13:55,2h 15m,non-stop,No info,4667,2019-06-01,1,6,5,135,0,11,13
Air Asia,21/05/2019,Kolkata,Banglore,CCU → DEL → BLR,22:40,10:40 22 May,12h,1 stop,No info,9719,2019-05-21,21,5,1,720,1,22,10
Air India,27/03/2019,Delhi,Cochin,DEL → BOM → COK,13:00,19:15,6h 15m,1 stop,No info,6902,2019-03-27,27,3,2,375,1,13,19
Jet Airways,21/05/2019,Kolkata,Banglore,CCU → BOM → BLR,20:00,04:40 22 May,8h 40m,1 stop,No info,14781,2019-05-21,21,5,1,520,1,20,4
Jet Airways,18/05/2019,Kolkata,Banglore,CCU → BOM → BLR,08:25,22:35,14h 10m,1 stop,In-flight meal not included,10844,2019-05-18,18,5,5,850,1,8,22
Air India,24/03/2019,Kolkata,Banglore,CCU → IXZ → MAA → BLR,05:40,14:35 25 Mar,32h 55m,2 stops,No info,11522,2019-03-24,24,3,6,1975,2,5,14
Air India,21/04/2019,Banglore,Delhi,BLR → DEL,13:20,16:10,2h 50m,non-stop,No info,6121,2019-04-21,21,4,6,170,0,13,16
Vistara,6/06/2019,Kolkata,Banglore,CCU → DEL → BLR,17:00,23:25,6h 25m,1 stop,No info,8610,2019-06-06,6,6,3,385,1,17,23
Air Asia,24/03/2019,Kolkata,Banglore,CCU → BLR,22:50,01:20 25 Mar,2h 30m,non-stop,No info,5620,2019-03-24,24,3,6,150,0,22,1
IndiGo,27/05/2019,Kolkata,Banglore,CCU → BLR,15:15,17:45,2h 30m,non-stop,No info,4804,2019-05-27,27,5,0,150,0,15,17
Multiple carriers,27/05/2019,Delhi,Cochin,DEL → BOM → COK,10:20,21:00,10h 40m,1 stop,No info,7005,2019-05-27,27,5,0,640,1,10,21
Jet Airways,1/05/2019,Delhi,Cochin,DEL → AMD → BOM → COK,23:05,19:00 02 May,19h 55m,2 stops,No info,15129,2019-05-01,1,5,2,1195,2,23,19
Jet Airways,24/05/2019,Kolkata,Banglore,CCU → BOM → BLR,20:00,04:40 25 May,8h 40m,1 stop,In-flight meal not included,8586,2019-05-24,24,5,4,520,1,20,4
Multiple carriers,18/05/2019,Delhi,Cochin,DEL → BOM → COK,08:00,19:00,11h,1 stop,No info,10197,2019-05-18,18,5,5,660,1,8,19
Multiple carriers,27/03/2019,Delhi,Cochin,DEL → BOM → COK,09:10,19:15,10h 5m,1 stop,No info,10667,2019-03-27,27,3,2,605,1,9,19
IndiGo,12/06/2019,Kolkata,Banglore,CCU → PAT → BLR,09:20,14:15,4h 55m,1 stop,No info,11160,2019-06-12,12,6,2,295,1,9,14
Air India,27/05/2019,Delhi,Cochin,DEL → LKO → BOM → COK,12:20,19:15 28 May,30h 55m,2 stops,No info,12488,2019-05-27,27,5,0,1855,2,12,19
Jet Airways,18/05/2019,Kolkata,Banglore,CCU → BOM → BLR,08:25,19:50,11h 25m,1 stop,In-flight meal not included,10844,2019-05-18,18,5,5,685,1,8,19
Air India,3/06/2019,Delhi,Cochin,DEL → AMD → BOM → COK,16:40,19:15 04 Jun,26h 35m,2 stops,No info,9968,2019-06-03,3,6,0,1595,2,16,19
Jet Airways,18/05/2019,Banglore,Delhi,BLR → DEL,18:55,22:00,3h 5m,non-stop,In-flight meal not included,5198,2019-05-18,18,5,5,185,0,18,22
Jet Airways,1/05/2019,Kolkata,Banglore,CCU → BOM → BLR,14:05,04:40 02 May,14h 35m,1 stop,In-flight meal not included,8586,2019-05-01,1,5,2,875,1,14,4
IndiGo,18/05/2019,Chennai,Kolkata,MAA → CCU,11:35,14:00,2h 25m,non-stop,No info,4332,2019-05-18,18,5,5,145,0,11,14
IndiGo,6/05/2019,Kolkata,Banglore,CCU → MAA → BLR,08:10,13:00,4h 50m,1 stop,No info,5069,2019-05-06,6,5,0,290,1,8,13
Jet Airways,6/05/2019,Banglore,Delhi,BLR → DEL,08:20,11:20,3h,non-stop,In-flight meal not included,4544,2019-05-06,6,5,0,180,0,8,11
Multiple carriers,3/03/2019,Delhi,Cochin,DEL → BOM → COK,04:00,15:30,11h 30m,1 stop,No info,14973,2019-03-03,3,3,6,690,1,4,15
Air India,12/03/2019,Banglore,New Delhi,BLR → BOM → IDR → GWL → DEL,06:45,18:05 13 Mar,35h 20m,3 stops,No info,13387,2019-03-12,12,3,1,2120,3,6,18
SpiceJet,9/06/2019,Banglore,Delhi,BLR → DEL,05:55,08:35,2h 40m,non-stop,No info,3625,2019-06-09,9,6,6,160,0,5,8
Jet Airways,24/05/2019,Kolkata,Banglore,CCU → DEL → BLR,09:35,14:25 25 May,28h 50m,1 stop,In-flight meal not included,10703,2019-05-24,24,5,4,1730,1,9,14
IndiGo,24/03/2019,Kolkata,Banglore,CCU → BLR,15:10,17:45,2h 35m,non-stop,No info,7615,2019-03-24,24,3,6,155,0,15,17
IndiGo,27/05/2019,Banglore,Delhi,BLR → DEL,18:25,21:20,2h 55m,non-stop,No info,4823,2019-05-27,27,5,0,175,0,18,21
Jet Airways,06/03/2019,Banglore,New Delhi,BLR → BOM → DEL,11:40,05:05 07 Mar,17h 25m,1 stop,No info,16736,2019-03-06,6,3,2,1045,1,11,5
Jet Airways,9/05/2019,Kolkata,Banglore,CCU → BOM → BLR,21:10,12:00 10 May,14h 50m,1 stop,In-flight meal not included,9663,2019-05-09,9,5,3,890,1,21,12
Multiple carriers,18/05/2019,Delhi,Cochin,DEL → BOM → COK,08:30,19:00,10h 30m,1 stop,No info,9205,2019-05-18,18,5,5,630,1,8,19
Jet Airways,9/05/2019,Delhi,Cochin,DEL → BOM → COK,22:50,04:25 10 May,5h 35m,1 stop,No info,15554,2019-05-09,9,5,3,335,1,22,4
SpiceJet,15/05/2019,Mumbai,Hyderabad,BOM → HYD,22:45,00:15 16 May,1h 30m,non-stop,No check-in baggage included,1965,2019-05-15,15,5,2,90,0,22,0
Air India,15/06/2019,Kolkata,Banglore,CCU → BLR,14:15,16:45,2h 30m,non-stop,No info,5510,2019-06-15,15,6,5,150,0,14,16
Multiple carriers,9/05/2019,Delhi,Cochin,DEL → BOM → COK,10:20,19:15,8h 55m,1 stop,No info,8266,2019-05-09,9,5,3,535,1,10,19
IndiGo,27/05/2019,Mumbai,Hyderabad,BOM → HYD,16:55,18:25,1h 30m,non-stop,No info,3175,2019-05-27,27,5,0,90,0,16,18
SpiceJet,9/05/2019,Delhi,Cochin,DEL → PNQ → COK,08:45,13:15,4h 30m,1 stop,No check-in baggage included,4760,2019-05-09,9,5,3,270,1,8,13
Multiple carriers,27/05/2019,Delhi,Cochin,DEL → BOM → COK,08:45,21:00,12h 15m,1 stop,No info,7740,2019-05-27,27,5,0,735,1,8,21
Jet Airways,15/05/2019,Kolkata,Banglore,CCU → BOM → BLR,14:05,23:35,9h 30m,1 stop,No info,13941,2019-05-15,15,5,2,570,1,14,23
Air Asia,6/06/2019,Delhi,Cochin,DEL → BLR → COK,16:45,07:10 07 Jun,14h 25m,1 stop,No info,11410,2019-06-06,6,6,3,865,1,16,7
Jet Airways,1/04/2019,Kolkata,Banglore,CCU → BOM → BLR,16:30,19:50 02 Apr,27h 20m,1 stop,No info,12681,2019-04-01,1,4,0,1640,1,16,19
Jet Airways,6/05/2019,Delhi,Cochin,DEL → JAI → BOM → COK,09:40,12:35 07 May,26h 55m,2 stops,No info,15129,2019-05-06,6,5,0,1615,2,9,12
Jet Airways,12/06/2019,Delhi,Cochin,DEL → JAI → BOM → COK,05:30,19:00,13h 30m,2 stops,In-flight meal not included,10368,2019-06-12,12,6,2,810,2,5,19
Air India,21/05/2019,Kolkata,Banglore,CCU → JAI → DEL → BLR,08:20,20:25,12h 5m,2 stops,No info,12324,2019-05-21,21,5,1,725,2,8,20
SpiceJet,15/04/2019,Kolkata,Banglore,CCU → BLR,17:10,19:40,2h 30m,non-stop,No check-in baggage included,3841,2019-04-15,15,4,0,150,0,17,19
Jet Airways,24/06/2019,Delhi,Cochin,DEL → JAI → BOM → COK,05:30,04:25 25 Jun,22h 55m,2 stops,No info,13014,2019-06-24,24,6,0,1375,2,5,4
IndiGo,27/06/2019,Delhi,Cochin,DEL → HYD → COK,06:50,22:30,15h 40m,1 stop,No info,6442,2019-06-27,27,6,3,940,1,6,22
Jet Airways,18/05/2019,Delhi,Cochin,DEL → BOM → COK,14:00,19:00,5h,1 stop,In-flight meal not included,12373,2019-05-18,18,5,5,300,1,14,19
Jet Airways,12/03/2019,Banglore,New Delhi,BLR → BOM → DEL,08:55,23:00,14h 5m,1 stop,No info,13817,2019-03-12,12,3,1,845,1,8,23
IndiGo,24/06/2019,Banglore,Delhi,BLR → DEL,18:55,21:50,2h 55m,non-stop,No info,4823,2019-06-24,24,6,0,175,0,18,21
Jet Airways,27/03/2019,Delhi,Cochin,DEL → MAA → BOM → COK,05:10,04:25 28 Mar,23h 15m,2 stops,In-flight meal not included,9412,2019-03-27,27,3,2,1395,2,5,4
Air India,27/05/2019,Delhi,Cochin,DEL → GOI → BOM → COK,22:00,19:15 28 May,21h 15m,2 stops,No info,10231,2019-05-27,27,5,0,1275,2,22,19
Jet Airways,9/04/2019,Banglore,Delhi,BLR → DEL,15:50,18:45,2h 55m,non-stop,No info,7229,2019-04-09,9,4,1,175,0,15,18
SpiceJet,24/03/2019,Banglore,New Delhi,BLR → DEL,09:35,12:30,2h 55m,non-stop,No check-in baggage included,4273,2019-03-24,24,3,6,175,0,9,12
Jet Airways,18/05/2019,Kolkata,Banglore,CCU → BOM → BLR,18:55,20:45 19 May,25h 50m,1 stop,In-flight meal not included,10844,2019-05-18,18,5,5,1550,1,18,20
IndiGo,27/05/2019,Delhi,Cochin,DEL → MAA → COK,02:00,07:25,5h 25m,1 stop,No info,7164,2019-05-27,27,5,0,325,1,2,7
Jet Airways,27/06/2019,Banglore,Delhi,BLR → DEL,07:10,10:10,3h,non-stop,In-flight meal not included,6478,2019-06-27,27,6,3,180,0,7,10
Jet Airways,12/05/2019,Banglore,Delhi,BLR → DEL,07:10,10:10,3h,non-stop,In-flight meal not included,5198,2019-05-12,12,5,6,180,0,7,10
SpiceJet,27/04/2019,Banglore,Delhi,BLR → DEL,05:55,08:35,2h 40m,non-stop,No check-in baggage included,4319,2019-04-27,27,4,5,160,0,5,8
Jet Airways,27/06/2019,Delhi,Cochin,DEL → BOM → COK,19:15,12:35 28 Jun,17h 20m,1 stop,In-flight meal not included,10262,2019-06-27,27,6,3,1040,1,19,12
Vistara,18/05/2019,Delhi,Cochin,DEL → COK,14:40,17:50,3h 10m,non-stop,No info,6741,2019-05-18,18,5,5,190,0,14,17
Jet Airways,6/06/2019,Kolkata,Banglore,CCU → BOM → BLR,14:05,22:35,8h 30m,1 stop,No info,14571,2019-06-06,6,6,3,510,1,14,22
Air India,01/03/2019,Banglore,New Delhi,BLR → MAA → DEL,11:50,23:55,12h 5m,1 stop,Change airports,26092,2019-03-01,1,3,4,725,1,11,23
Air India,27/06/2019,Delhi,Cochin,DEL → GOI → BOM → COK,10:55,19:15,8h 20m,2 stops,No info,11753,2019-06-27,27,6,3,500,2,10,19
Jet Airways,21/03/2019,Banglore,New Delhi,BLR → BOM → DEL,08:00,23:00,15h,1 stop,In-flight meal not included,7832,2019-03-21,21,3,3,900,1,8,23
Vistara,1/05/2019,Kolkata,Banglore,CCU → DEL → BLR,07:10,20:20,13h 10m,1 stop,No info,8610,2019-05-01,1,5,2,790,1,7,20
Jet Airways,12/06/2019,Kolkata,Banglore,CCU → BOM → BLR,14:05,22:35,8h 30m,1 stop,No info,13626,2019-06-12,12,6,2,510,1,14,22
Jet Airways,9/06/2019,Delhi,Cochin,DEL → JAI → BOM → COK,09:40,12:35 10 Jun,26h 55m,2 stops,In-flight meal not included,10368,2019-06-09,9,6,6,1615,2,9,12
IndiGo,18/06/2019,Mumbai,Hyderabad,BOM → HYD,02:35,04:05,1h 30m,non-stop,No info,2754,2019-06-18,18,6,1,90,0,2,4
Jet Airways,6/06/2019,Kolkata,Banglore,CCU → DEL → BLR,17:00,18:00 07 Jun,25h,1 stop,No info,12692,2019-06-06,6,6,3,1500,1,17,18
IndiGo,01/03/2019,Banglore,New Delhi,BLR → DEL,10:05,13:00,2h 55m,non-stop,No info,10067,2019-03-01,1,3,4,175,0,10,13
GoAir,3/06/2019,Delhi,Cochin,DEL → BOM → COK,10:35,19:35,9h,1 stop,No info,4959,2019-06-03,3,6,0,540,1,10,19
Air India,01/03/2019,Banglore,New Delhi,BLR → BOM → IDR → DEL,08:50,11:10 02 Mar,26h 20m,2 stops,No info,19372,2019-03-01,1,3,4,1580,2,8,11
Air India,18/05/2019,Mumbai,Hyderabad,BOM → HYD,06:20,07:40,1h 20m,non-stop,No info,3100,2019-05-18,18,5,5,80,0,6,7
Multiple carriers,15/05/2019,Delhi,Cochin,DEL → BOM → COK,07:30,21:00,13h 30m,1 stop,No info,8405,2019-05-15,15,5,2,810,1,7,21
Multiple carriers,27/05/2019,Delhi,Cochin,DEL → BOM → COK,11:30,21:00,9h 30m,1 stop,In-flight meal not included,6943,2019-05-27,27,5,0,570,1,11,21
SpiceJet,27/04/2019,Kolkata,Banglore,CCU → BLR,17:10,19:40,2h 30m,non-stop,No check-in baggage included,3841,2019-04-27,27,4,5,150,0,17,19
SpiceJet,6/06/2019,Mumbai,Hyderabad,BOM → HYD,22:45,00:15 07 Jun,1h 30m,non-stop,No info,2017,2019-06-06,6,6,3,90,0,22,0
Vistara,1/05/2019,Kolkata,Banglore,CCU → DEL → BLR,17:00,10:45 02 May,17h 45m,1 stop,No info,9187,2019-05-01,1,5,2,1065,1,17,10
Jet Airways,12/05/2019,Kolkata,Banglore,CCU → BOM → BLR,08:25,19:50,11h 25m,1 stop,No info,13941,2019-05-12,12,5,6,685,1,8,19
Jet Airways,21/03/2019,Delhi,Cochin,DEL → MAA → BOM → COK,19:15,18:50 22 Mar,23h 35m,2 stops,In-flight meal not included,8938,2019-03-21,21,3,3,1415,2,19,18
SpiceJet,18/05/2019,Banglore,Delhi,BLR → DEL,09:30,12:20,2h 50m,non-stop,No check-in baggage included,4319,2019-05-18,18,5,5,170,0,9,12
SpiceJet,1/04/2019,Banglore,Delhi,BLR → DEL,21:10,00:05 02 Apr,2h 55m,non-stop,No check-in baggage included,3573,2019-04-01,1,4,0,175,0,21,0
SpiceJet,3/05/2019,Kolkata,Banglore,CCU → BLR,09:00,11:25,2h 25m,non-stop,No check-in baggage included,3841,2019-05-03,3,5,4,145,0,9,11
Jet Airways,27/06/2019,Delhi,Cochin,DEL → COK,11:00,14:15,3h 15m,non-stop,In-flight meal not included,7202,2019-06-27,27,6,3,195,0,11,14
Vistara,9/06/2019,Kolkata,Banglore,CCU → DEL → BLR,17:00,22:55,5h 55m,1 stop,No info,9187,2019-06-09,9,6,6,355,1,17,22
GoAir,3/06/2019,Delhi,Cochin,DEL → AMD → COK,07:25,13:35,6h 10m,1 stop,No info,6976,2019-06-03,3,6,0,370,1,7,13
Jet Airways,21/05/2019,Delhi,Cochin,DEL → BOM → COK,18:15,12:35 22 May,18h 20m,1 stop,In-flight meal not included,12898,2019-05-21,21,5,1,1100,1,18,12
Jet Airways,27/05/2019,Delhi,Cochin,DEL → BOM → COK,02:15,04:25 28 May,26h 10m,1 stop,In-flight meal not included,12898,2019-05-27,27,5,0,1570,1,2,4
Jet Airways,15/06/2019,Delhi,Cochin,DEL → IDR → BOM → COK,21:25,19:00 16 Jun,21h 35m,2 stops,In-flight meal not included,10588,2019-06-15,15,6,5,1295,2,21,19
Air India,24/06/2019,Delhi,Cochin,DEL → GOI → BOM → COK,22:00,19:15 25 Jun,21h 15m,2 stops,No info,9181,2019-06-24,24,6,0,1275,2,22,19
Jet Airways,03/03/2019,Banglore,New Delhi,BLR → BOM → DEL,05:45,05:05 07 Mar,23h 20m,1 stop,In-flight meal not included,11087,2019-03-03,3,3,6,1400,1,5,5
Jet Airways,27/06/2019,Delhi,Cochin,DEL → BOM → COK,07:05,12:35,5h 30m,1 stop,In-flight meal not included,10262,2019-06-27,27,6,3,330,1,7,12
Jet Airways,6/04/2019,Delhi,Cochin,DEL → COK,11:00,14:15,3h 15m,non-stop,In-flight meal not included,4886,2019-04-06,6,4,5,195,0,11,14
IndiGo,21/03/2019,Delhi,Cochin,DEL → BBI → COK,02:35,08:30,5h 55m,1 stop,No info,8470,2019-03-21,21,3,3,355,1,2,8
Air India,21/05/2019,Kolkata,Banglore,CCU → GAU → IMF → DEL → BLR,09:50,23:15,13h 25m,3 stops,No info,14960,2019-05-21,21,5,1,805,3,9,23
SpiceJet,9/05/2019,Kolkata,Banglore,CCU → BLR,06:55,09:30,2h 35m,non-stop,No info,3873,2019-05-09,9,5,3,155,0,6,9
Air India,9/03/2019,Delhi,Cochin,DEL → AMD → BOM → COK,16:40,19:15 10 Mar,26h 35m,2 stops,No info,11911,2019-03-09,9,3,5,1595,2,16,19
Air India,15/06/2019,Delhi,Cochin,DEL → BLR → COK,09:45,23:00,13h 15m,1 stop,No info,8907,2019-06-15,15,6,5,795,1,9,23
SpiceJet,9/05/2019,Chennai,Kolkata,MAA → CCU,08:20,10:35,2h 15m,non-stop,No check-in baggage included,3859,2019-05-09,9,5,3,135,0,8,10
Air Asia,24/06/2019,Kolkata,Banglore,CCU → BLR,22:50,01:20 25 Jun,2h 30m,non-stop,No info,3807,2019-06-24,24,6,0,150,0,22,1
Air Asia,6/03/2019,Kolkata,Banglore,CCU → BLR,10:20,12:55,2h 35m,non-stop,No info,4384,2019-03-06,6,3,2,155,0,10,12
Multiple carriers,3/06/2019,Delhi,Cochin,DEL → BOM → COK,04:55,12:35,7h 40m,1 stop,No info,11622,2019-06-03,3,6,0,460,1,4,12
Vistara,24/03/2019,Banglore,New Delhi,BLR → DEL,19:40,22:20,2h 40m,non-stop,No info,4563,2019-03-24,24,3,6,160,0,19,22
SpiceJet,1/04/2019,Mumbai,Hyderabad,BOM → HYD,13:15,14:45,1h 30m,non-stop,No check-in baggage included,1965,2019-04-01,1,4,0,90,0,13,14
Air India,24/04/2019,Kolkata,Banglore,CCU → BLR,20:45,23:20,2h 35m,non-stop,No info,4145,2019-04-24,24,4,2,155,0,20,23
Jet Airways,24/03/2019,Kolkata,Banglore,CCU → BOM → BLR,21:10,20:40 25 Mar,23h 30m,1 stop,In-flight meal not included,10031,2019-03-24,24,3,6,1410,1,21,20
Air India,01/03/2019,Banglore,New Delhi,BLR → HYD → DEL,17:00,23:10,6h 10m,1 stop,No info,11628,2019-03-01,1,3,4,370,1,17,23
Jet Airways,15/06/2019,Delhi,Cochin,DEL → BOM → COK,07:05,12:35,5h 30m,1 stop,In-flight meal not included,10262,2019-06-15,15,6,5,330,1,7,12
SpiceJet,24/06/2019,Mumbai,Hyderabad,BOM → HYD,13:15,14:45,1h 30m,non-stop,No info,2017,2019-06-24,24,6,0,90,0,13,14
Vistara,27/04/2019,Delhi,Cochin,DEL → COK,06:00,09:10,3h 10m,non-stop,No info,6216,2019-04-27,27,4,5,190,0,6,9
Multiple carriers,15/05/2019,Delhi,Cochin,DEL → GWL → IDR → BOM → COK,11:35,01:30 16 May,13h 55m,3 stops,No info,16294,2019-05-15,15,5,2,835,3,11,1
IndiGo,3/06/2019,Banglore,Delhi,BLR → DEL,04:00,06:50,2h 50m,non-stop,No info,3943,2019-06-03,3,6,0,170,0,4,6
Multiple carriers,27/05/2019,Delhi,Cochin,DEL → HYD → COK,14:55,22:30,7h 35m,1 stop,No info,7038,2019-05-27,27,5,0,455,1,14,22
SpiceJet,09/03/2019,Banglore,New Delhi,BLR → PNQ → DEL,10:20,18:15,7h 55m,1 stop,No info,7294,2019-03-09,9,3,5,475,1,10,18
SpiceJet,6/04/2019,Kolkata,Banglore,CCU → BLR,09:00,11:25,2h 25m,non-stop,No info,3873,2019-04-06,6,4,5,145,0,9,11
Air India,18/06/2019,Mumbai,Hyderabad,BOM → HYD,13:55,15:25,1h 30m,non-stop,No info,3100,2019-06-18,18,6,1,90,0,13,15
Multiple carriers,27/05/2019,Delhi,Cochin,DEL → BOM → COK,10:00,19:00,9h,1 stop,No info,12507,2019-05-27,27,5,0,540,1,10,19
Air Asia,21/05/2019,Delhi,Cochin,DEL → BLR → COK,07:55,22:30,14h 35m,1 stop,No info,6152,2019-05-21,21,5,1,875,1,7,22
Air India,1/04/2019,Kolkata,Banglore,CCU → GAU → BLR,09:50,21:05,11h 15m,1 stop,No info,8030,2019-04-01,1,4,0,675,1,9,21
Jet Airways,18/06/2019,Banglore,Delhi,BLR → DEL,08:20,11:20,3h,non-stop,In-flight meal not included,5769,2019-06-18,18,6,1,180,0,8,11
IndiGo,6/06/2019,Kolkata,Banglore,CCU → BLR,17:15,19:50,2h 35m,non-stop,No info,4804,2019-06-06,6,6,3,155,0,17,19
Air India,18/05/2019,Delhi,Cochin,DEL → MAA → COK,09:45,09:25 19 May,23h 40m,1 stop,No info,8372,2019-05-18,18,5,5,1420,1,9,9
Jet Airways,15/03/2019,Banglore,New Delhi,BLR → MAA → DEL,09:45,14:25,4h 40m,1 stop,No info,8578,2019-03-15,15,3,4,280,1,9,14
Air India,18/05/2019,Delhi,Cochin,DEL → GOI → BOM → COK,22:00,19:15 19 May,21h 15m,2 stops,No info,11228,2019-05-18,18,5,5,1275,2,22,19
Air India,1/05/2019,Kolkata,Banglore,CCU → GAU → DEL → BLR,09:50,08:55 02 May,23h 5m,2 stops,No info,13227,2019-05-01,1,5,2,1385,2,9,8
IndiGo,15/03/2019,Banglore,New Delhi,BLR → DEL,20:00,22:55,2h 55m,non-stop,No info,8855,2019-03-15,15,3,4,175,0,20,22
Multiple carriers,12/06/2019,Delhi,Cochin,DEL → BOM → COK,03:50,12:35,8h 45m,1 stop,No info,12192,2019-06-12,12,6,2,525,1,3,12
Jet Airways,27/06/2019,Delhi,Cochin,DEL → AMD → BOM → COK,23:05,19:00 28 Jun,19h 55m,2 stops,No info,12819,2019-06-27,27,6,3,1195,2,23,19
IndiGo,27/06/2019,Banglore,Delhi,BLR → DEL,06:05,08:50,2h 45m,non-stop,No info,3943,2019-06-27,27,6,3,165,0,6,8
Multiple carriers,9/03/2019,Delhi,Cochin,DEL → BOM → COK,00:20,12:55,12h 35m,1 stop,In-flight meal not included,18260,2019-03-09,9,3,5,755,1,0,12
Air India,18/04/2019,Banglore,Delhi,BLR → DEL,06:10,08:55,2h 45m,non-stop,No info,5228,2019-04-18,18,4,3,165,0,6,8
Jet Airways,12/06/2019,Delhi,Cochin,DEL → ATQ → BOM → COK,12:15,04:25 13 Jun,16h 10m,2 stops,No info,14300,2019-06-12,12,6,2,970,2,12,4
Air India,1/05/2019,Kolkata,Banglore,CCU → BBI → BOM → BLR,12:00,18:30 02 May,30h 30m,2 stops,No info,10151,2019-05-01,1,5,2,1830,2,12,18
IndiGo,6/05/2019,Kolkata,Banglore,CCU → MAA → BLR,17:35,22:15,4h 40m,1 stop,No info,5699,2019-05-06,6,5,0,280,1,17,22
Vistara,21/05/2019,Kolkata,Banglore,CCU → DEL → BLR,07:10,10:45 22 May,27h 35m,1 stop,No info,9187,2019-05-21,21,5,1,1655,1,7,10
Vistara,6/06/2019,Kolkata,Banglore,CCU → DEL → BLR,20:20,09:05 07 Jun,12h 45m,1 stop,No info,8452,2019-06-06,6,6,3,765,1,20,9
Multiple carriers,21/03/2019,Delhi,Cochin,DEL → BOM → COK,02:15,13:20,11h 5m,1 stop,No info,13961,2019-03-21,21,3,3,665,1,2,13
Jet Airways,24/06/2019,Banglore,Delhi,BLR → DEL,07:10,10:10,3h,non-stop,In-flight meal not included,5769,2019-06-24,24,6,0,180,0,7,10
Multiple carriers,24/06/2019,Delhi,Cochin,DEL → BOM → COK,07:30,19:00,11h 30m,1 stop,No info,10877,2019-06-24,24,6,0,690,1,7,19
IndiGo,9/04/2019,Banglore,Delhi,BLR → DEL,23:30,02:20 10 Apr,2h 50m,non-stop,No info,4591,2019-04-09,9,4,1,170,0,23,2
Air India,6/05/2019,Kolkata,Banglore,CCU → BOM → AMD → BLR,09:25,05:25 07 May,20h,2 stops,No info,17732,2019-05-06,6,5,0,1200,2,9,5
Jet Airways,9/05/2019,Delhi,Cochin,DEL → BOM → COK,18:15,04:25 10 May,10h 10m,1 stop,In-flight meal not included,12373,2019-05-09,9,5,3,610,1,18,4
Air Asia,27/06/2019,Kolkata,Banglore,CCU → BLR,19:55,22:25,2h 30m,non-stop,No info,3807,2019-06-27,27,6,3,150,0,19,22
Vistara,9/06/2019,Kolkata,Banglore,CCU → DEL → BLR,07:10,20:20,13h 10m,1 stop,No info,9555,2019-06-09,9,6,6,790,1,7,20
Air Asia,6/06/2019,Banglore,Delhi,BLR → DEL,11:10,13:55,2h 45m,non-stop,No info,4483,2019-06-06,6,6,3,165,0,11,13
Jet Airways,12/05/2019,Kolkata,Banglore,CCU → BOM → BLR,14:05,20:45,6h 40m,1 stop,No info,14781,2019-05-12,12,5,6,400,1,14,20
Jet Airways,3/06/2019,Delhi,Cochin,DEL → IDR → BOM → COK,09:35,12:35 04 Jun,27h,2 stops,No info,13292,2019-06-03,3,6,0,1620,2,9,12
Jet Airways,18/05/2019,Delhi,Cochin,DEL → BOM → COK,19:15,19:00 19 May,23h 45m,1 stop,In-flight meal not included,12373,2019-05-18,18,5,5,1425,1,19,19
IndiGo,21/05/2019,Delhi,Cochin,DEL → HYD → COK,06:50,12:10,5h 20m,1 stop,No info,5530,2019-05-21,21,5,1,320,1,6,12
IndiGo,18/05/2019,Delhi,Cochin,DEL → BOM → COK,08:30,21:00,12h 30m,1 stop,No info,7081,2019-05-18,18,5,5,750,1,8,21
Jet Airways,15/06/2019,Delhi,Cochin,DEL → BOM → COK,09:00,12:35 16 Jun,27h 35m,1 stop,In-flight meal not included,10262,2019-06-15,15,6,5,1655,1,9,12
Multiple carriers,27/05/2019,Delhi,Cochin,DEL → BOM → COK,11:40,19:15,7h 35m,1 stop,No info,9316,2019-05-27,27,5,0,455,1,11,19
Jet Airways,9/05/2019,Kolkata,Banglore,CCU → BOM → BLR,06:30,18:15,11h 45m,1 stop,In-flight meal not included,10844,2019-05-09,9,5,3,705,1,6,18
IndiGo,1/05/2019,Delhi,Cochin,DEL → BOM → COK,07:30,21:00,13h 30m,1 stop,No info,8542,2019-05-01,1,5,2,810,1,7,21
IndiGo,15/04/2019,Banglore,Delhi,BLR → DEL,16:55,19:55,3h,non-stop,No info,4823,2019-04-15,15,4,0,180,0,16,19
Air India,6/03/2019,Delhi,Cochin,DEL → BOM → COK,04:00,07:40 07 Mar,27h 40m,1 stop,No info,12940,2019-03-06,6,3,2,1660,1,4,7
Jet Airways,6/06/2019,Kolkata,Banglore,CCU → BOM → BLR,21:10,04:40 07 Jun,7h 30m,1 stop,No info,13374,2019-06-06,6,6,3,450,1,21,4
Multiple carriers,21/03/2019,Delhi,Cochin,DEL → BOM → COK,11:30,21:00,9h 30m,1 stop,No info,13062,2019-03-21,21,3,3,570,1,11,21
Jet Airways,3/06/2019,Delhi,Cochin,DEL → JAI → BOM → COK,05:30,19:00,13h 30m,2 stops,No info,13014,2019-06-03,3,6,0,810,2,5,19
Jet Airways,21/06/2019,Banglore,Delhi,BLR → DEL,18:55,22:00,3h 5m,non-stop,No info,8541,2019-06-21,21,6,4,185,0,18,22
Jet Airways,24/03/2019,Kolkata,Banglore,CCU → BOM → BLR,13:55,10:05 25 Mar,20h 10m,1 stop,In-flight meal not included,11134,2019-03-24,24,3,6,1210,1,13,10
Jet Airways,21/03/2019,Banglore,New Delhi,BLR → BOM → DEL,08:55,19:10,10h 15m,1 stop,In-flight meal not included,7832,2019-03-21,21,3,3,615,1,8,19
Multiple carriers,9/05/2019,Delhi,Cochin,DEL → HYD → COK,13:15,22:30,9h 15m,1 stop,No info,8888,2019-05-09,9,5,3,555,1,13,22
Jet Airways,12/05/2019,Kolkata,Banglore,CCU → BOM → BLR,18:55,09:20 13 May,14h 25m,1 stop,In-flight meal not included,9663,2019-05-12,12,5,6,865,1,18,9
Multiple carriers,6/03/2019,Delhi,Cochin,DEL → BOM → COK,07:05,15:30,8h 25m,1 stop,No info,17267,2019-03-06,6,3,2,505,1,7,15
Jet Airways,21/03/2019,Banglore,New Delhi,BLR → BOM → DEL,20:35,11:25 19 Mar,14h 50m,1 stop,In-flight meal not included,7832,2019-03-21,21,3,3,890,1,20,11
Vistara,18/03/2019,Banglore,New Delhi,BLR → DEL,19:40,22:20,2h 40m,non-stop,No info,12123,2019-03-18,18,3,0,160,0,19,22
Multiple carriers,15/05/2019,Delhi,Cochin,DEL → BOM → COK,17:00,01:30 16 May,8h 30m,1 stop,No info,8073,2019-05-15,15,5,2,510,1,17,1
SpiceJet,12/04/2019,Banglore,Delhi,BLR → DEL,09:30,12:20,2h 50m,non-stop,No info,4991,2019-04-12,12,4,4,170,0,9,12
GoAir,12/06/2019,Banglore,Delhi,BLR → DEL,20:55,23:40,2h 45m,non-stop,No info,3419,2019-06-12,12,6,2,165,0,20,23
Jet Airways,27/06/2019,Delhi,Cochin,DEL → BOM → COK,19:45,19:00 28 Jun,23h 15m,1 stop,In-flight meal not included,10262,2019-06-27,27,6,3,1395,1,19,19
Jet Airways,1/06/2019,Delhi,Cochin,DEL → BOM → COK,19:45,12:35 02 Jun,16h 50m,1 stop,In-flight meal not included,10262,2019-06-01,1,6,5,1010,1,19,12
Air Asia,3/04/2019,Kolkata,Banglore,CCU → BLR,22:50,01:20 04 Apr,2h 30m,non-stop,No info,3807,2019-04-03,3,4,2,150,0,22,1
IndiGo,3/03/2019,Mumbai,Hyderabad,BOM → HYD,12:00,13:25,1h 25m,non-stop,No info,5755,2019-03-03,3,3,6,85,0,12,13
Jet Airways,1/06/2019,Delhi,Cochin,DEL → BOM → COK,21:50,04:25 02 Jun,6h 35m,1 stop,In-flight meal not included,10262,2019-06-01,1,6,5,395,1,21,4
Air India,21/05/2019,Delhi,Cochin,DEL → HYD → BOM → COK,17:15,07:40 22 May,14h 25m,2 stops,No info,13039,2019-05-21,21,5,1,865,2,17,7
Jet Airways,21/03/2019,Banglore,New Delhi,BLR → BOM → DEL,08:55,21:20,12h 25m,1 stop,In-flight meal not included,7832,2019-03-21,21,3,3,745,1,8,21
IndiGo,9/03/2019,Chennai,Kolkata,MAA → CCU,07:55,10:15,2h 20m,non-stop,No info,6297,2019-03-09,9,3,5,140,0,7,10
Jet Airways,24/06/2019,Mumbai,Hyderabad,BOM → HYD,19:35,21:05,1h 30m,non-stop,In-flight meal not included,3210,2019-06-24,24,6,0,90,0,19,21
Multiple carriers,3/03/2019,Delhi,Cochin,DEL → BOM → COK,10:20,21:00,10h 40m,1 stop,No info,15147,2019-03-03,3,3,6,640,1,10,21
IndiGo,24/06/2019,Mumbai,Hyderabad,BOM → HYD,09:10,10:40,1h 30m,non-stop,No info,4049,2019-06-24,24,6,0,90,0,9,10
Jet Airways,12/06/2019,Delhi,Cochin,DEL → LKO → BOM → COK,09:25,12:35 13 Jun,27h 10m,2 stops,No info,13882,2019-06-12,12,6,2,1630,2,9,12
Air India,21/05/2019,Kolkata,Banglore,CCU → BOM → BLR,09:25,21:50,12h 25m,1 stop,No info,8366,2019-05-21,21,5,1,745,1,9,21
Jet Airways,15/03/2019,Banglore,New Delhi,BLR → BOM → DEL,22:50,07:40 16 Mar,8h 50m,1 stop,In-flight meal not included,9134,2019-03-15,15,3,4,530,1,22,7
IndiGo,3/04/2019,Banglore,Delhi,BLR → DEL,08:30,11:20,2h 50m,non-stop,No info,4823,2019-04-03,3,4,2,170,0,8,11
Air India,9/04/2019,Kolkata,Banglore,CCU → MAA → BLR,14:35,14:35 10 Apr,24h,1 stop,No info,5006,2019-04-09,9,4,1,1440,1,14,14
Air India,1/06/2019,Delhi,Cochin,DEL → MAA → COK,12:30,09:25 02 Jun,20h 55m,1 stop,No info,7480,2019-06-01,1,6,5,1255,1,12,9
Jet Airways,6/06/2019,Kolkata,Banglore,CCU → BOM → BLR,16:30,22:35,6h 5m,1 stop,In-flight meal not included,10844,2019-06-06,6,6,3,365,1,16,22
Jet Airways,1/04/2019,Kolkata,Banglore,CCU → BOM → BLR,20:00,08:15 02 Apr,12h 15m,1 stop,In-flight meal not included,7064,2019-04-01,1,4,0,735,1,20,8
IndiGo,21/06/2019,Kolkata,Banglore,CCU → BLR,14:25,16:55,2h 30m,non-stop,No info,5224,2019-06-21,21,6,4,150,0,14,16
Air Asia,15/03/2019,Kolkata,Banglore,CCU → BLR,10:20,12:55,2h 35m,non-stop,No info,4384,2019-03-15,15,3,4,155,0,10,12
Multiple carriers,1/06/2019,Delhi,Cochin,DEL → BOM → COK,13:00,01:30 02 Jun,12h 30m,1 stop,No info,13377,2019-06-01,1,6,5,750,1,13,1
Multiple carriers,27/05/2019,Delhi,Cochin,DEL → BOM → COK,06:40,19:15,12h 35m,1 stop,No info,8837,2019-05-27,27,5,0,755,1,6,19
Air India,3/03/2019,Delhi,Cochin,DEL → MAA → COK,17:20,09:25 04 Mar,16h 5m,1 stop,No info,16352,2019-03-03,3,3,6,965,1,17,9
Air India,9/06/2019,Delhi,Cochin,DEL → GOI → BOM → COK,22:00,19:15 10 Jun,21h 15m,2 stops,No info,10441,2019-06-09,9,6,6,1275,2,22,19
IndiGo,9/05/2019,Chennai,Kolkata,MAA → CCU,13:15,15:35,2h 20m,non-stop,No info,3597,2019-05-09,9,5,3,140,0,13,15
Air Asia,12/06/2019,Kolkata,Banglore,CCU → BLR,19:55,22:25,2h 30m,non-stop,No info,3807,2019-06-12,12,6,2,150,0,19,22
Jet Airways,6/05/2019,Kolkata,Banglore,CCU → BOM → BLR,20:00,08:15 07 May,12h 15m,1 stop,In-flight meal not included,9663,2019-05-06,6,5,0,735,1,20,8
Jet Airways,1/04/2019,Kolkata,Banglore,CCU → BOM → BLR,20:00,19:50 02 Apr,23h 50m,1 stop,No info,12681,2019-04-01,1,4,0,1430,1,20,19
Vistara,24/05/2019,Banglore,Delhi,BLR → DEL,11:30,14:20,2h 50m,non-stop,No info,4668,2019-05-24,24,5,4,170,0,11,14
Jet Airways,18/05/2019,Delhi,Cochin,DEL → AMD → BOM → COK,13:25,12:35 19 May,23h 10m,2 stops,No info,15129,2019-05-18,18,5,5,1390,2,13,12
Multiple carriers,3/03/2019,Delhi,Cochin,DEL → BOM → COK,17:30,01:35 04 Mar,8h 5m,1 stop,No info,17057,2019-03-03,3,3,6,485,1,17,1
Air India,3/06/2019,Delhi,Cochin,DEL → BOM → COK,21:00,07:40 04 Jun,10h 40m,1 stop,No info,8372,2019-06-03,3,6,0,640,1,21,7
SpiceJet,1/03/2019,Kolkata,Banglore,CCU → BLR,17:15,19:45,2h 30m,non-stop,No info,5515,2019-03-01,1,3,4,150,0,17,19
Jet Airways,1/05/2019,Kolkata,Banglore,CCU → GAU → BLR,10:20,17:35,7h 15m,1 stop,No info,8355,2019-05-01,1,5,2,435,1,10,17
IndiGo,1/04/2019,Mumbai,Hyderabad,BOM → HYD,02:35,04:05,1h 30m,non-stop,No info,2754,2019-04-01,1,4,0,90,0,2,4
Multiple carriers,15/06/2019,Delhi,Cochin,DEL → BOM → COK,15:00,01:30 16 Jun,10h 30m,1 stop,No info,13377,2019-06-15,15,6,5,630,1,15,1
Jet Airways,9/05/2019,Delhi,Cochin,DEL → BOM → COK,19:45,19:00 10 May,23h 15m,1 stop,No info,15554,2019-05-09,9,5,3,1395,1,19,19
IndiGo,18/05/2019,Kolkata,Banglore,CCU → BLR,14:25,16:55,2h 30m,non-stop,No info,5224,2019-05-18,18,5,5,150,0,14,16
IndiGo,9/06/2019,Delhi,Cochin,DEL → BOM → COK,16:00,21:00,5h,1 stop,No info,6069,2019-06-09,9,6,6,300,1,16,21
Jet Airways,9/05/2019,Delhi,Cochin,DEL → BOM → COK,11:30,12:35 10 May,25h 5m,1 stop,In-flight meal not included,12373,2019-05-09,9,5,3,1505,1,11,12
Jet Airways,12/06/2019,Kolkata,Banglore,CCU → BOM → BLR,18:55,04:40 13 Jun,9h 45m,1 stop,In-flight meal not included,6959,2019-06-12,12,6,2,585,1,18,4
SpiceJet,27/05/2019,Kolkata,Banglore,CCU → BLR,09:00,11:25,2h 25m,non-stop,No check-in baggage included,3841,2019-05-27,27,5,0,145,0,9,11
Air India,15/05/2019,Delhi,Cochin,DEL → BOM → COK,03:50,19:15,15h 25m,1 stop,No info,8669,2019-05-15,15,5,2,925,1,3,19
Jet Airways,1/06/2019,Delhi,Cochin,DEL → JAI → BOM → COK,05:30,19:00,13h 30m,2 stops,No info,13014,2019-06-01,1,6,5,810,2,5,19
Jet Airways,6/06/2019,Kolkata,Banglore,CCU → BOM → BLR,08:25,04:40 07 Jun,20h 15m,1 stop,No info,13731,2019-06-06,6,6,3,1215,1,8,4
Multiple carriers,21/05/2019,Delhi,Cochin,DEL → BOM → COK,10:00,01:30 22 May,15h 30m,1 stop,No info,7888,2019-05-21,21,5,1,930,1,10,1
Vistara,24/03/2019,Kolkata,Banglore,CCU → DEL → BLR,07:10,22:10,15h,1 stop,No info,12942,2019-03-24,24,3,6,900,1,7,22
Vistara,6/03/2019,Mumbai,Hyderabad,BOM → DEL → HYD,11:55,09:25 07 Mar,21h 30m,1 stop,No info,12395,2019-03-06,6,3,2,1290,1,11,9
Jet Airways,9/06/2019,Kolkata,Banglore,CCU → BOM → BLR,16:30,23:35,7h 5m,1 stop,No info,14571,2019-06-09,9,6,6,425,1,16,23
IndiGo,27/04/2019,Banglore,Delhi,BLR → DEL,00:30,03:25,2h 55m,non-stop,No info,4591,2019-04-27,27,4,5,175,0,0,3
Air India,9/05/2019,Kolkata,Banglore,CCU → BOM → COK → BLR,09:25,13:45 10 May,28h 20m,2 stops,No info,12592,2019-05-09,9,5,3,1700,2,9,13
IndiGo,6/06/2019,Kolkata,Banglore,CCU → BLR,14:25,16:55,2h 30m,non-stop,No info,4804,2019-06-06,6,6,3,150,0,14,16
Jet Airways,21/05/2019,Kolkata,Banglore,CCU → BOM → BLR,14:05,08:15 22 May,18h 10m,1 stop,No info,14388,2019-05-21,21,5,1,1090,1,14,8
Air India,9/03/2019,Delhi,Cochin,DEL → GOI → BOM → COK,22:00,19:15 10 Mar,21h 15m,2 stops,No info,14851,2019-03-09,9,3,5,1275,2,22,19
Jet Airways,18/05/2019,Kolkata,Banglore,CCU → BOM → BLR,21:10,08:15 19 May,11h 5m,1 stop,In-flight meal not included,8586,2019-05-18,18,5,5,665,1,21,8
Jet Airways,01/03/2019,Banglore,New Delhi,BLR → BOM → DEL,22:50,09:30 02 Mar,10h 40m,1 stop,1 Long layover,31825,2019-03-01,1,3,4,640,1,22,9
Jet Airways,9/06/2019,Delhi,Cochin,DEL → BDQ → BOM → COK,18:25,04:25 10 Jun,10h,2 stops,No info,14237,2019-06-09,9,6,6,600,2,18,4
IndiGo,6/06/2019,Kolkata,Banglore,CCU → MAA → BLR,08:10,13:00,4h 50m,1 stop,No info,5069,2019-06-06,6,6,3,290,1,8,13
Jet Airways,1/06/2019,Delhi,Cochin,DEL → BOM → COK,07:05,12:35,5h 30m,1 stop,No info,16079,2019-06-01,1,6,5,330,1,7,12
Jet Airways,15/05/2019,Kolkata,Banglore,CCU → BOM → BLR,18:55,08:15 16 May,13h 20m,1 stop,In-flight meal not included,9663,2019-05-15,15,5,2,800,1,18,8
Multiple carriers,27/05/2019,Delhi,Cochin,DEL → BOM → COK,11:30,21:00,9h 30m,1 stop,No info,13587,2019-05-27,27,5,0,570,1,11,21
Air India,24/03/2019,Kolkata,Banglore,CCU → DEL → BLR,20:30,23:15 25 Mar,26h 45m,1 stop,No info,10808,2019-03-24,24,3,6,1605,1,20,23
Multiple carriers,27/05/2019,Delhi,Cochin,DEL → BOM → COK,10:00,19:15,9h 15m,1 stop,In-flight meal not included,11446,2019-05-27,27,5,0,555,1,10,19
Air India,1/05/2019,Mumbai,Hyderabad,BOM → HYD,19:30,20:45,1h 15m,non-stop,No info,3100,2019-05-01,1,5,2,75,0,19,20
GoAir,1/05/2019,Kolkata,Banglore,CCU → AMD → BLR,16:40,00:15 02 May,7h 35m,1 stop,No info,6484,2019-05-01,1,5,2,455,1,16,0
IndiGo,9/05/2019,Mumbai,Hyderabad,BOM → HYD,06:25,07:55,1h 30m,non-stop,No info,4049,2019-05-09,9,5,3,90,0,6,7
SpiceJet,24/03/2019,Banglore,New Delhi,BLR → DEL,20:30,23:20,2h 50m,non-stop,No check-in baggage included,3873,2019-03-24,24,3,6,170,0,20,23
IndiGo,09/03/2019,Banglore,New Delhi,BLR → GOI → DEL,19:30,00:40 13 Mar,5h 10m,1 stop,No info,7280,2019-03-09,9,3,5,310,1,19,0
Air India,27/05/2019,Mumbai,Hyderabad,BOM → HYD,13:55,15:25,1h 30m,non-stop,No info,3625,2019-05-27,27,5,0,90,0,13,15
SpiceJet,15/06/2019,Banglore,Delhi,BLR → DEL,21:10,00:05 16 Jun,2h 55m,non-stop,No check-in baggage included,3919,2019-06-15,15,6,5,175,0,21,0
Jet Airways,9/05/2019,Delhi,Cochin,DEL → BOM → COK,02:15,19:00,16h 45m,1 stop,No info,15554,2019-05-09,9,5,3,1005,1,2,19
IndiGo,3/06/2019,Chennai,Kolkata,MAA → CCU,07:55,10:15,2h 20m,non-stop,No info,3850,2019-06-03,3,6,0,140,0,7,10
Jet Airways,21/05/2019,Delhi,Cochin,DEL → AMD → BOM → COK,23:05,19:00 22 May,19h 55m,2 stops,No info,15129,2019-05-21,21,5,1,1195,2,23,19
Jet Airways,12/05/2019,Banglore,Delhi,BLR → DEL,18:55,22:00,3h 5m,non-stop,No info,7229,2019-05-12,12,5,6,185,0,18,22
IndiGo,27/04/2019,Banglore,Delhi,BLR → DEL,18:55,21:50,2h 55m,non-stop,No info,4823,2019-04-27,27,4,5,175,0,18,21
IndiGo,15/05/2019,Banglore,Delhi,BLR → DEL,18:55,21:50,2h 55m,non-stop,No info,4823,2019-05-15,15,5,2,175,0,18,21
Vistara,24/03/2019,Kolkata,Banglore,CCU → DEL → BLR,07:10,09:10 25 Mar,26h,1 stop,No info,11682,2019-03-24,24,3,6,1560,1,7,9
IndiGo,21/04/2019,Banglore,Delhi,BLR → DEL,18:55,21:50,2h 55m,non-stop,No info,4823,2019-04-21,21,4,6,175,0,18,21
Jet Airways,9/06/2019,Delhi,Cochin,DEL → BOM → COK,13:00,04:25 10 Jun,15h 25m,1 stop,In-flight meal not included,10262,2019-06-09,9,6,6,925,1,13,4
IndiGo,6/06/2019,Delhi,Cochin,DEL → HYD → COK,05:05,16:10,11h 5m,1 stop,No info,6818,2019-06-06,6,6,3,665,1,5,16
SpiceJet,27/05/2019,Mumbai,Hyderabad,BOM → HYD,22:45,00:15 28 May,1h 30m,non-stop,No check-in baggage included,1965,2019-05-27,27,5,0,90,0,22,0
Vistara,12/05/2019,Kolkata,Banglore,CCU → DEL → BLR,07:10,23:25,16h 15m,1 stop,No info,9345,2019-05-12,12,5,6,975,1,7,23
IndiGo,6/06/2019,Delhi,Cochin,DEL → HYD → COK,16:10,22:30,6h 20m,1 stop,No info,6938,2019-06-06,6,6,3,380,1,16,22
Jet Airways,15/06/2019,Delhi,Cochin,DEL → JAI → BOM → COK,09:40,12:35 16 Jun,26h 55m,2 stops,In-flight meal not included,10368,2019-06-15,15,6,5,1615,2,9,12
Air India,12/06/2019,Delhi,Cochin,DEL → GOI → BOM → COK,10:55,07:40 13 Jun,20h 45m,2 stops,No info,11753,2019-06-12,12,6,2,1245,2,10,7
Air India,27/05/2019,Delhi,Cochin,DEL → LKO → BOM → COK,18:30,19:15 28 May,24h 45m,2 stops,No info,12488,2019-05-27,27,5,0,1485,2,18,19
Jet Airways,12/06/2019,Kolkata,Banglore,CCU → BOM → BLR,14:05,19:50,5h 45m,1 stop,In-flight meal not included,9899,2019-06-12,12,6,2,345,1,14,19
Multiple carriers,6/06/2019,Delhi,Cochin,DEL → BOM → COK,09:15,19:00,9h 45m,1 stop,No info,11622,2019-06-06,6,6,3,585,1,9,19
SpiceJet,27/03/2019,Kolkata,Banglore,CCU → BLR,06:55,09:35,2h 40m,non-stop,No info,3847,2019-03-27,27,3,2,160,0,6,9
Jet Airways,27/06/2019,Delhi,Cochin,DEL → BOM → COK,22:50,04:25 28 Jun,5h 35m,1 stop,No info,16079,2019-06-27,27,6,3,335,1,22,4
Jet Airways,18/06/2019,Banglore,Delhi,BLR → DEL,06:00,08:45,2h 45m,non-stop,In-flight meal not included,6478,2019-06-18,18,6,1,165,0,6,8
Air India,21/06/2019,Delhi,Cochin,DEL → COK,14:10,17:10,3h,non-stop,No info,5201,2019-06-21,21,6,4,180,0,14,17
Air Asia,9/05/2019,Kolkata,Banglore,CCU → BLR,10:20,12:55,2h 35m,non-stop,No info,4409,2019-05-09,9,5,3,155,0,10,12
Jet Airways,06/03/2019,Banglore,New Delhi,BLR → BOM → DEL,08:55,09:30 07 Mar,24h 35m,1 stop,No info,17261,2019-03-06,6,3,2,1475,1,8,9
Vistara,27/05/2019,Banglore,Delhi,BLR → DEL,17:00,19:35,2h 35m,non-stop,No info,4878,2019-05-27,27,5,0,155,0,17,19
SpiceJet,18/05/2019,Banglore,Delhi,BLR → DEL,05:55,08:35,2h 40m,non-stop,No check-in baggage included,3573,2019-05-18,18,5,5,160,0,5,8
Jet Airways,18/05/2019,Kolkata,Banglore,CCU → BOM → BLR,20:00,16:20 19 May,20h 20m,1 stop,In-flight meal not included,10844,2019-05-18,18,5,5,1220,1,20,16
IndiGo,21/04/2019,Kolkata,Banglore,CCU → BLR,22:15,00:50 22 Apr,2h 35m,non-stop,No info,4804,2019-04-21,21,4,6,155,0,22,0
Air India,27/06/2019,Delhi,Cochin,DEL → COK,14:10,17:10,3h,non-stop,No info,5201,2019-06-27,27,6,3,180,0,14,17
Multiple carriers,18/05/2019,Delhi,Cochin,DEL → BOM → COK,13:00,19:15,6h 15m,1 stop,No info,14533,2019-05-18,18,5,5,375,1,13,19
SpiceJet,12/04/2019,Kolkata,Banglore,CCU → BLR,22:20,00:40 13 Apr,2h 20m,non-stop,No info,3873,2019-04-12,12,4,4,140,0,22,0
SpiceJet,6/06/2019,Chennai,Kolkata,MAA → CCU,17:45,20:05,2h 20m,non-stop,No check-in baggage included,3543,2019-06-06,6,6,3,140,0,17,20
Multiple carriers,21/03/2019,Delhi,Cochin,DEL → BOM → COK,10:20,21:00,10h 40m,1 stop,No info,7215,2019-03-21,21,3,3,640,1,10,21
Multiple carriers,21/03/2019,Delhi,Cochin,DEL → BOM → COK,10:20,18:50,8h 30m,1 stop,No info,11999,2019-03-21,21,3,3,510,1,10,18
IndiGo,18/05/2019,Mumbai,Hyderabad,BOM → HYD,12:00,13:30,1h 30m,non-stop,No info,2754,2019-05-18,18,5,5,90,0,12,13
Jet Airways,12/03/2019,Banglore,New Delhi,BLR → BOM → DEL,18:55,10:45 13 Mar,15h 50m,1 stop,No info,13817,2019-03-12,12,3,1,950,1,18,10
Air Asia,15/06/2019,Kolkata,Banglore,CCU → BLR,19:55,22:25,2h 30m,non-stop,No info,4107,2019-06-15,15,6,5,150,0,19,22
Multiple carriers,9/05/2019,Delhi,Cochin,DEL → BOM → COK,09:00,21:00,12h,1 stop,No info,8073,2019-05-09,9,5,3,720,1,9,21
IndiGo,27/06/2019,Mumbai,Hyderabad,BOM → HYD,21:20,22:50,1h 30m,non-stop,No info,2227,2019-06-27,27,6,3,90,0,21,22
Jet Airways,6/06/2019,Kolkata,Banglore,CCU → DEL → BLR,20:25,18:00 07 Jun,21h 35m,1 stop,In-flight meal not included,10539,2019-06-06,6,6,3,1295,1,20,18
IndiGo,3/05/2019,Banglore,Delhi,BLR → DEL,01:30,04:15,2h 45m,non-stop,No info,3943,2019-05-03,3,5,4,165,0,1,4
Jet Airways,24/05/2019,Kolkata,Banglore,CCU → BOM → BLR,14:05,16:20 25 May,26h 15m,1 stop,In-flight meal not included,10844,2019-05-24,24,5,4,1575,1,14,16
SpiceJet,24/03/2019,Banglore,New Delhi,BLR → DEL,20:30,23:20,2h 50m,non-stop,No info,3925,2019-03-24,24,3,6,170,0,20,23
Jet Airways,1/05/2019,Mumbai,Hyderabad,BOM → HYD,02:55,04:20,1h 25m,non-stop,In-flight meal not included,3210,2019-05-01,1,5,2,85,0,2,4
Jet Airways,6/06/2019,Banglore,Delhi,BLR → DEL,17:45,20:45,3h,non-stop,No info,8016,2019-06-06,6,6,3,180,0,17,20
SpiceJet,12/04/2019,Kolkata,Banglore,CCU → BLR,17:10,19:40,2h 30m,non-stop,No check-in baggage included,3841,2019-04-12,12,4,4,150,0,17,19
Jet Airways,9/05/2019,Kolkata,Banglore,CCU → BOM → BLR,21:10,04:40 10 May,7h 30m,1 stop,No info,14388,2019-05-09,9,5,3,450,1,21,4
IndiGo,18/06/2019,Chennai,Kolkata,MAA → CCU,14:45,17:05,2h 20m,non-stop,No info,3597,2019-06-18,18,6,1,140,0,14,17
Multiple carriers,9/03/2019,Delhi,Cochin,DEL → BOM → COK,15:05,01:35 10 Mar,10h 30m,1 stop,In-flight meal not included,14086,2019-03-09,9,3,5,630,1,15,1
IndiGo,9/06/2019,Banglore,Delhi,BLR → DEL,22:10,01:00 10 Jun,2h 50m,non-stop,No info,3749,2019-06-09,9,6,6,170,0,22,1
Jet Airways,24/05/2019,Banglore,Delhi,BLR → DEL,06:00,08:45,2h 45m,non-stop,No info,7229,2019-05-24,24,5,4,165,0,6,8
Multiple carriers,6/03/2019,Delhi,Cochin,DEL → BOM → COK,07:00,21:00,14h,1 stop,No info,15603,2019-03-06,6,3,2,840,1,7,21
IndiGo,27/05/2019,Banglore,Delhi,BLR → DEL,20:00,22:50,2h 50m,non-stop,No info,4823,2019-05-27,27,5,0,170,0,20,22
Jet Airways,3/04/2019,Mumbai,Hyderabad,BOM → HYD,10:20,11:50,1h 30m,non-stop,No info,8040,2019-04-03,3,4,2,90,0,10,11
Jet Airways,6/05/2019,Kolkata,Banglore,CCU → BOM → BLR,06:30,10:05 07 May,27h 35m,1 stop,No info,13941,2019-05-06,6,5,0,1655,1,6,10
Jet Airways,6/06/2019,Delhi,Cochin,DEL → BOM → COK,21:50,04:25 07 Jun,6h 35m,1 stop,No info,14714,2019-06-06,6,6,3,395,1,21,4
Vistara,1/04/2019,Kolkata,Banglore,CCU → DEL → BLR,07:10,18:50,11h 40m,1 stop,No info,7927,2019-04-01,1,4,0,700,1,7,18
Jet Airways,15/05/2019,Banglore,Delhi,BLR → DEL,11:10,14:05,2h 55m,non-stop,In-flight meal not included,4030,2019-05-15,15,5,2,175,0,11,14
IndiGo,21/03/2019,Delhi,Cochin,DEL → BOM → COK,09:10,21:00,11h 50m,1 stop,No info,8285,2019-03-21,21,3,3,710,1,9,21
Jet Airways,6/05/2019,Kolkata,Banglore,CCU → BOM → BLR,08:25,18:15,9h 50m,1 stop,In-flight meal not included,10844,2019-05-06,6,5,0,590,1,8,18
Jet Airways,12/05/2019,Kolkata,Banglore,CCU → BOM → BLR,06:30,09:20 13 May,26h 50m,1 stop,In-flight meal not included,9663,2019-05-12,12,5,6,1610,1,6,9
IndiGo,27/03/2019,Kolkata,Banglore,CCU → BLR,22:10,00:55 28 Mar,2h 45m,non-stop,No info,4148,2019-03-27,27,3,2,165,0,22,0
IndiGo,24/06/2019,Delhi,Cochin,DEL → BLR → COK,05:10,10:05,4h 55m,1 stop,No info,6496,2019-06-24,24,6,0,295,1,5,10
IndiGo,18/03/2019,Kolkata,Banglore,CCU → BLR,22:10,00:55 19 Mar,2h 45m,non-stop,No info,4148,2019-03-18,18,3,0,165,0,22,0
Jet Airways,24/03/2019,Kolkata,Banglore,CCU → BOM → BLR,06:30,19:40,13h 10m,1 stop,No info,13339,2019-03-24,24,3,6,790,1,6,19
Jet Airways,15/06/2019,Delhi,Cochin,DEL → LKO → BOM → COK,09:25,12:35 16 Jun,27h 10m,2 stops,No info,13882,2019-06-15,15,6,5,1630,2,9,12
IndiGo,12/05/2019,Banglore,Delhi,BLR → DEL,01:30,04:15,2h 45m,non-stop,No info,3943,2019-05-12,12,5,6,165,0,1,4
Jet Airways,12/03/2019,Banglore,New Delhi,BLR → BOM → DEL,20:35,12:25 13 Mar,15h 50m,1 stop,In-flight meal not included,11087,2019-03-12,12,3,1,950,1,20,12
Jet Airways,6/06/2019,Delhi,Cochin,DEL → ATQ → BOM → COK,20:00,04:25 07 Jun,8h 25m,2 stops,In-flight meal not included,15318,2019-06-06,6,6,3,505,2,20,4
SpiceJet,6/06/2019,Kolkata,Banglore,CCU → BLR,22:20,00:40 07 Jun,2h 20m,non-stop,No info,3873,2019-06-06,6,6,3,140,0,22,0
Multiple carriers,27/05/2019,Delhi,Cochin,DEL → BOM → COK,04:55,19:00,14h 5m,1 stop,No info,11573,2019-05-27,27,5,0,845,1,4,19
Vistara,15/05/2019,Banglore,Delhi,BLR → DEL,11:30,14:20,2h 50m,non-stop,No info,4668,2019-05-15,15,5,2,170,0,11,14
Air India,01/03/2019,Banglore,New Delhi,BLR → CCU → GAU → DEL,05:50,22:10,16h 20m,2 stops,No info,13576,2019-03-01,1,3,4,980,2,5,22
Air India,01/03/2019,Banglore,New Delhi,BLR → MAA → DEL,11:50,13:00 02 Mar,25h 10m,1 stop,1 Long layover,15434,2019-03-01,1,3,4,1510,1,11,13
Vistara,21/04/2019,Banglore,Delhi,BLR → DEL,11:30,14:20,2h 50m,non-stop,No info,5403,2019-04-21,21,4,6,170,0,11,14
Jet Airways,6/03/2019,Delhi,Cochin,DEL → IDR → BOM → COK,05:25,19:45 07 Mar,38h 20m,2 stops,No info,16914,2019-03-06,6,3,2,2300,2,5,19
Jet Airways,21/05/2019,Kolkata,Banglore,CCU → BOM → BLR,21:10,08:15 22 May,11h 5m,1 stop,No info,14781,2019-05-21,21,5,1,665,1,21,8
Jet Airways,9/04/2019,Banglore,Delhi,BLR → DEL,11:10,14:05,2h 55m,non-stop,In-flight meal not included,4544,2019-04-09,9,4,1,175,0,11,14
Air India,12/06/2019,Kolkata,Banglore,CCU → BBI → BOM → BLR,12:00,07:55 13 Jun,19h 55m,2 stops,No info,9416,2019-06-12,12,6,2,1195,2,12,7
Vistara,9/06/2019,Kolkata,Banglore,CCU → DEL → BLR,07:10,22:55,15h 45m,1 stop,No info,8662,2019-06-09,9,6,6,945,1,7,22
Air India,24/06/2019,Delhi,Cochin,DEL → BOM → COK,10:00,19:15,9h 15m,1 stop,No info,9194,2019-06-24,24,6,0,555,1,10,19
SpiceJet,3/06/2019,Kolkata,Banglore,CCU → BLR,06:55,09:30,2h 35m,non-stop,No info,3873,2019-06-03,3,6,0,155,0,6,9
IndiGo,9/06/2019,Kolkata,Banglore,CCU → PAT → BLR,09:20,14:15,4h 55m,1 stop,No info,11465,2019-06-09,9,6,6,295,1,9,14
Air India,9/06/2019,Delhi,Cochin,DEL → BLR → COK,09:45,23:00,13h 15m,1 stop,No info,8907,2019-06-09,9,6,6,795,1,9,23
Air India,21/03/2019,Delhi,Cochin,DEL → HYD → BOM → COK,17:15,19:15 22 Mar,26h,2 stops,No info,8770,2019-03-21,21,3,3,1560,2,17,19
Jet Airways,27/03/2019,Delhi,Cochin,DEL → BOM → COK,09:55,04:25 28 Mar,18h 30m,1 stop,No info,12242,2019-03-27,27,3,2,1110,1,9,4
Multiple carriers,12/06/2019,Delhi,Cochin,DEL → BOM → COK,10:00,19:00,9h,1 stop,No info,12192,2019-06-12,12,6,2,540,1,10,19
Vistara,1/04/2019,Kolkata,Banglore,CCU → DEL → BLR,07:10,10:45 02 Apr,27h 35m,1 stop,No info,8505,2019-04-01,1,4,0,1655,1,7,10
Jet Airways,9/05/2019,Kolkata,Banglore,CCU → BOM → BLR,14:05,09:20 10 May,19h 15m,1 stop,In-flight meal not included,9663,2019-05-09,9,5,3,1155,1,14,9
Multiple carriers,15/06/2019,Delhi,Cochin,DEL → BOM → COK,07:30,19:15,11h 45m,1 stop,No info,8614,2019-06-15,15,6,5,705,1,7,19
Jet Airways,24/06/2019,Delhi,Cochin,DEL → IDR → BOM → COK,05:30,04:25 25 Jun,22h 55m,2 stops,No info,13292,2019-06-24,24,6,0,1375,2,5,4
Multiple carriers,3/06/2019,Delhi,Cochin,DEL → BOM → COK,12:50,21:00,8h 10m,1 stop,No info,7740,2019-06-03,3,6,0,490,1,12,21
IndiGo,1/05/2019,Delhi,Cochin,DEL → BOM → COK,18:35,01:30 02 May,6h 55m,1 stop,No info,8854,2019-05-01,1,5,2,415,1,18,1
IndiGo,6/03/2019,Delhi,Cochin,DEL → HYD → MAA → COK,08:35,21:20,12h 45m,2 stops,No info,7682,2019-03-06,6,3,2,765,2,8,21
IndiGo,9/05/2019,Kolkata,Banglore,CCU → BLR,17:15,19:50,2h 35m,non-stop,No info,4804,2019-05-09,9,5,3,155,0,17,19
Vistara,21/05/2019,Banglore,Delhi,BLR → DEL,09:45,12:35,2h 50m,non-stop,No info,4668,2019-05-21,21,5,1,170,0,9,12
Multiple carriers,24/06/2019,Delhi,Cochin,DEL → BOM → COK,15:15,01:30 25 Jun,10h 15m,1 stop,In-flight meal not included,5797,2019-06-24,24,6,0,615,1,15,1
Air India,3/04/2019,Delhi,Cochin,DEL → COK,14:10,17:10,3h,non-stop,No info,4729,2019-04-03,3,4,2,180,0,14,17
Multiple carriers,21/05/2019,Delhi,Cochin,DEL → BOM → COK,13:00,01:30 22 May,12h 30m,1 stop,No info,7888,2019-05-21,21,5,1,750,1,13,1
IndiGo,24/05/2019,Kolkata,Banglore,CCU → MAA → BLR,08:10,13:00,4h 50m,1 stop,No info,5069,2019-05-24,24,5,4,290,1,8,13
Air India,21/03/2019,Delhi,Cochin,DEL → RPR → NAG → BOM → COK,05:15,19:15 22 Mar,38h,3 stops,No info,9128,2019-03-21,21,3,3,2280,3,5,19
Jet Airways,1/05/2019,Kolkata,Banglore,CCU → BOM → BLR,20:00,09:20 02 May,13h 20m,1 stop,In-flight meal not included,9663,2019-05-01,1,5,2,800,1,20,9
Air India,6/06/2019,Delhi,Cochin,DEL → MAA → COK,20:40,09:25 07 Jun,12h 45m,1 stop,No info,7952,2019-06-06,6,6,3,765,1,20,9
Jet Airways,24/06/2019,Delhi,Cochin,DEL → BOM → COK,10:00,12:35 25 Jun,26h 35m,1 stop,In-flight meal not included,10262,2019-06-24,24,6,0,1595,1,10,12
Jet Airways,6/06/2019,Delhi,Cochin,DEL → LKO → BOM → COK,11:45,04:25 07 Jun,16h 40m,2 stops,No info,13882,2019-06-06,6,6,3,1000,2,11,4
IndiGo,12/05/2019,Banglore,Delhi,BLR → DEL,13:00,15:50,2h 50m,non-stop,No info,4591,2019-05-12,12,5,6,170,0,13,15
Air India,12/03/2019,Mumbai,Hyderabad,BOM → GOI → PNQ → HYD,21:10,16:55,4h 15m,2 stops,No info,16172,2019-03-12,12,3,1,255,2,21,16
IndiGo,18/04/2019,Banglore,Delhi,BLR → DEL,01:30,04:15,2h 45m,non-stop,No info,4591,2019-04-18,18,4,3,165,0,1,4
IndiGo,24/06/2019,Mumbai,Hyderabad,BOM → HYD,06:25,07:55,1h 30m,non-stop,No info,4049,2019-06-24,24,6,0,90,0,6,7
IndiGo,3/05/2019,Kolkata,Banglore,CCU → BLR,15:30,18:05,2h 35m,non-stop,No info,4804,2019-05-03,3,5,4,155,0,15,18
Multiple carriers,27/03/2019,Delhi,Cochin,DEL → BOM → COK,08:00,15:30,7h 30m,1 stop,No info,6673,2019-03-27,27,3,2,450,1,8,15
Jet Airways,27/06/2019,Delhi,Cochin,DEL → AMD → BOM → COK,23:05,04:25 29 Jun,29h 20m,2 stops,In-flight meal not included,11150,2019-06-27,27,6,3,1760,2,23,4
Air India,15/06/2019,Delhi,Cochin,DEL → CCU → BOM → COK,20:15,19:15 16 Jun,23h,2 stops,No info,13591,2019-06-15,15,6,5,1380,2,20,19
IndiGo,9/05/2019,Banglore,Delhi,BLR → DEL,06:05,08:50,2h 45m,non-stop,No info,4077,2019-05-09,9,5,3,165,0,6,8
Multiple carriers,1/06/2019,Delhi,Cochin,DEL → BOM → COK,07:05,19:15,12h 10m,1 stop,In-flight meal not included,12927,2019-06-01,1,6,5,730,1,7,19
Jet Airways,21/05/2019,Delhi,Cochin,DEL → BHO → BOM → COK,05:30,12:35,7h 5m,2 stops,No info,16274,2019-05-21,21,5,1,425,2,5,12
Vistara,15/05/2019,Banglore,Delhi,BLR → DEL,07:00,09:40,2h 40m,non-stop,No info,4668,2019-05-15,15,5,2,160,0,7,9
Jet Airways,27/05/2019,Delhi,Cochin,DEL → BOM → COK,20:55,12:35 28 May,15h 40m,1 stop,In-flight meal not included,12898,2019-05-27,27,5,0,940,1,20,12
Air India,6/03/2019,Mumbai,Hyderabad,BOM → DEL → HYD,16:00,23:45,7h 45m,1 stop,No info,11678,2019-03-06,6,3,2,465,1,16,23
IndiGo,12/06/2019,Delhi,Cochin,DEL → LKO → COK,21:50,03:35 13 Jun,5h 45m,1 stop,No info,5775,2019-06-12,12,6,2,345,1,21,3
SpiceJet,1/03/2019,Kolkata,Banglore,CCU → BLR,09:00,11:30,2h 30m,non-stop,No info,5515,2019-03-01,1,3,4,150,0,9,11
Jet Airways,18/03/2019,Banglore,New Delhi,BLR → BOM → DEL,22:50,09:00 16 Mar,10h 10m,1 stop,No info,13555,2019-03-18,18,3,0,610,1,22,9
Jet Airways,24/05/2019,Kolkata,Banglore,CCU → BOM → BLR,16:30,04:40 25 May,12h 10m,1 stop,No info,14571,2019-05-24,24,5,4,730,1,16,4
SpiceJet,9/06/2019,Mumbai,Hyderabad,BOM → HYD,13:15,14:45,1h 30m,non-stop,No info,2227,2019-06-09,9,6,6,90,0,13,14
Air India,24/06/2019,Banglore,Delhi,BLR → DEL,13:20,16:10,2h 50m,non-stop,No info,6961,2019-06-24,24,6,0,170,0,13,16
Air India,9/03/2019,Delhi,Cochin,DEL → BOM → COK,07:00,19:15,12h 15m,1 stop,No info,15704,2019-03-09,9,3,5,735,1,7,19
Jet Airways,6/03/2019,Mumbai,Hyderabad,BOM → HYD,10:20,11:50,1h 30m,non-stop,No info,8040,2019-03-06,6,3,2,90,0,10,11
Jet Airways,1/06/2019,Delhi,Cochin,DEL → BOM → COK,19:15,04:25 02 Jun,9h 10m,1 stop,No info,14714,2019-06-01,1,6,5,550,1,19,4
Jet Airways,27/03/2019,Delhi,Cochin,DEL → IXC → BOM → COK,06:20,04:25 28 Mar,22h 5m,2 stops,In-flight meal not included,9296,2019-03-27,27,3,2,1325,2,6,4
Multiple carriers,21/05/2019,Delhi,Cochin,DEL → BOM → COK,09:00,19:00,10h,1 stop,No info,10197,2019-05-21,21,5,1,600,1,9,19
Air India,12/06/2019,Delhi,Cochin,DEL → BOM → COK,13:00,19:15,6h 15m,1 stop,No info,8372,2019-06-12,12,6,2,375,1,13,19
Vistara,9/03/2019,Delhi,Cochin,DEL → COK,14:55,17:50,2h 55m,non-stop,No info,6741,2019-03-09,9,3,5,175,0,14,17
IndiGo,9/03/2019,Chennai,Kolkata,MAA → CCU,17:05,19:40,2h 35m,non-stop,No info,6297,2019-03-09,9,3,5,155,0,17,19
Jet Airways,12/06/2019,Kolkata,Banglore,CCU → BOM → BLR,08:25,18:15,9h 50m,1 stop,No info,13626,2019-06-12,12,6,2,590,1,8,18
Jet Airways,27/05/2019,Delhi,Cochin,DEL → AMD → BOM → COK,19:10,19:00 28 May,23h 50m,2 stops,No info,15129,2019-05-27,27,5,0,1430,2,19,19
IndiGo,21/03/2019,Delhi,Cochin,DEL → BLR → COK,02:00,07:45,5h 45m,1 stop,No info,6426,2019-03-21,21,3,3,345,1,2,7
Jet Airways,9/03/2019,Delhi,Cochin,DEL → ATQ → BOM → COK,20:10,04:25 10 Mar,8h 15m,2 stops,No info,20904,2019-03-09,9,3,5,495,2,20,4
Air Asia,9/04/2019,Delhi,Cochin,DEL → BLR → COK,20:45,07:10 10 Apr,10h 25m,1 stop,No info,6451,2019-04-09,9,4,1,625,1,20,7
Air India,01/03/2019,Banglore,New Delhi,BLR → BBI → DEL,09:30,23:45,14h 15m,1 stop,No info,12704,2019-03-01,1,3,4,855,1,9,23
Jet Airways,24/05/2019,Kolkata,Banglore,CCU → DEL → BLR,20:25,09:45 25 May,13h 20m,1 stop,No info,13067,2019-05-24,24,5,4,800,1,20,9
Jet Airways,18/05/2019,Banglore,Delhi,BLR → DEL,06:00,08:45,2h 45m,non-stop,No info,7229,2019-05-18,18,5,5,165,0,6,8
Jet Airways,21/03/2019,Delhi,Cochin,DEL → BDQ → BOM → COK,18:25,04:25 23 Mar,34h,2 stops,No info,12347,2019-03-21,21,3,3,2040,2,18,4
Multiple carriers,3/03/2019,Delhi,Cochin,DEL → BOM → COK,13:55,21:00,7h 5m,1 stop,No info,17057,2019-03-03,3,3,6,425,1,13,21
Air India,18/05/2019,Kolkata,Banglore,CCU → BOM → HBX → BLR,09:25,18:20,8h 55m,2 stops,No info,8366,2019-05-18,18,5,5,535,2,9,18
Multiple carriers,9/05/2019,Delhi,Cochin,DEL → BOM → COK,10:00,01:30 10 May,15h 30m,1 stop,No info,15078,2019-05-09,9,5,3,930,1,10,1
Air Asia,9/06/2019,Kolkata,Banglore,CCU → DEL → BLR,07:35,19:25,11h 50m,1 stop,No info,7870,2019-06-09,9,6,6,710,1,7,19
IndiGo,12/05/2019,Mumbai,Hyderabad,BOM → HYD,16:55,18:25,1h 30m,non-stop,No info,3603,2019-05-12,12,5,6,90,0,16,18
Air India,12/06/2019,Kolkata,Banglore,CCU → DEL → BLR,07:00,16:15,9h 15m,1 stop,No info,11936,2019-06-12,12,6,2,555,1,7,16
Multiple carriers,27/05/2019,Delhi,Cochin,DEL → BOM → COK,10:00,01:30 28 May,15h 30m,1 stop,In-flight meal not included,8925,2019-05-27,27,5,0,930,1,10,1
Air India,21/04/2019,Delhi,Cochin,DEL → COK,14:10,17:10,3h,non-stop,No info,6934,2019-04-21,21,4,6,180,0,14,17
Jet Airways,15/04/2019,Delhi,Cochin,DEL → BOM → COK,11:30,19:00,7h 30m,1 stop,In-flight meal not included,6542,2019-04-15,15,4,0,450,1,11,19
IndiGo,15/03/2019,Kolkata,Banglore,CCU → BLR,14:20,16:55,2h 35m,non-stop,No info,4778,2019-03-15,15,3,4,155,0,14,16
IndiGo,24/05/2019,Kolkata,Banglore,CCU → BLR,17:15,19:50,2h 35m,non-stop,No info,4804,2019-05-24,24,5,4,155,0,17,19
Jet Airways,12/05/2019,Kolkata,Banglore,CCU → DEL → BLR,20:25,10:55 13 May,14h 30m,1 stop,No info,14151,2019-05-12,12,5,6,870,1,20,10
Multiple carriers,1/06/2019,Delhi,Cochin,DEL → BOM → COK,13:00,19:15,6h 15m,1 stop,No info,16108,2019-06-01,1,6,5,375,1,13,19
Multiple carriers,1/06/2019,Delhi,Cochin,DEL → BOM → COK,15:00,01:30 02 Jun,10h 30m,1 stop,No info,13377,2019-06-01,1,6,5,630,1,15,1
SpiceJet,1/04/2019,Banglore,Delhi,BLR → DEL,09:30,12:20,2h 50m,non-stop,No check-in baggage included,3919,2019-04-01,1,4,0,170,0,9,12
Multiple carriers,6/03/2019,Delhi,Cochin,DEL → BOM → COK,13:55,21:00,7h 5m,1 stop,In-flight meal not included,15136,2019-03-06,6,3,2,425,1,13,21
Vistara,21/05/2019,Kolkata,Banglore,CCU → DEL → BLR,07:10,20:20,13h 10m,1 stop,No info,9345,2019-05-21,21,5,1,790,1,7,20
Multiple carriers,27/03/2019,Delhi,Cochin,DEL → BOM → COK,02:15,15:30,13h 15m,1 stop,No info,12327,2019-03-27,27,3,2,795,1,2,15
Jet Airways,18/03/2019,Banglore,New Delhi,BLR → BOM → DEL,08:55,16:10,7h 15m,1 stop,No info,12284,2019-03-18,18,3,0,435,1,8,16
Air India,15/05/2019,Delhi,Cochin,DEL → HYD → BOM → COK,17:15,19:15 16 May,26h,2 stops,No info,13039,2019-05-15,15,5,2,1560,2,17,19
Jet Airways,9/03/2019,Delhi,Cochin,DEL → BOM → COK,17:25,04:25 10 Mar,11h,1 stop,In-flight meal not included,11848,2019-03-09,9,3,5,660,1,17,4
Jet Airways,21/05/2019,Delhi,Cochin,DEL → BOM → COK,18:15,19:00 22 May,24h 45m,1 stop,No info,16079,2019-05-21,21,5,1,1485,1,18,19
IndiGo,3/05/2019,Kolkata,Banglore,CCU → BLR,22:15,00:50 04 May,2h 35m,non-stop,No info,4804,2019-05-03,3,5,4,155,0,22,0
Jet Airways,9/06/2019,Kolkata,Banglore,CCU → BOM → BLR,20:00,23:35 10 Jun,27h 35m,1 stop,In-flight meal not included,10844,2019-06-09,9,6,6,1655,1,20,23
Vistara,1/04/2019,Kolkata,Banglore,CCU → DEL → BLR,20:20,10:45 02 Apr,14h 25m,1 stop,No info,8505,2019-04-01,1,4,0,865,1,20,10
Air India,24/03/2019,Kolkata,Banglore,CCU → BOM → GOI → BLR,09:25,05:35 25 Mar,20h 10m,2 stops,No info,11774,2019-03-24,24,3,6,1210,2,9,5
Jet Airways,3/06/2019,Banglore,Delhi,BLR → DEL,06:00,08:45,2h 45m,non-stop,In-flight meal not included,5769,2019-06-03,3,6,0,165,0,6,8
Jet Airways,1/05/2019,Kolkata,Banglore,CCU → BOM → BLR,08:25,20:45,12h 20m,1 stop,In-flight meal not included,10844,2019-05-01,1,5,2,740,1,8,20
SpiceJet,24/05/2019,Chennai,Kolkata,MAA → CCU,08:20,10:35,2h 15m,non-stop,No info,3597,2019-05-24,24,5,4,135,0,8,10
Multiple carriers,6/03/2019,Delhi,Cochin,DEL → BOM → COK,10:00,18:50,8h 50m,1 stop,No info,16497,2019-03-06,6,3,2,530,1,10,18
Jet Airways,15/05/2019,Kolkata,Banglore,CCU → DEL → BLR,17:00,19:10 16 May,26h 10m,1 stop,No info,14151,2019-05-15,15,5,2,1570,1,17,19
IndiGo,6/05/2019,Kolkata,Banglore,CCU → BLR,09:35,12:20,2h 45m,non-stop,No info,4804,2019-05-06,6,5,0,165,0,9,12
Air India,24/05/2019,Mumbai,Hyderabad,BOM → HYD,15:00,16:25,1h 25m,non-stop,No info,3100,2019-05-24,24,5,4,85,0,15,16
Jet Airways,3/06/2019,Delhi,Cochin,DEL → BOM → COK,09:00,19:00,10h,1 stop,No info,14714,2019-06-03,3,6,0,600,1,9,19
IndiGo,1/03/2019,Mumbai,Hyderabad,BOM → HYD,16:55,18:25,1h 30m,non-stop,No info,8853,2019-03-01,1,3,4,90,0,16,18
IndiGo,1/06/2019,Delhi,Cochin,DEL → MAA → COK,07:15,12:30,5h 15m,1 stop,No info,6582,2019-06-01,1,6,5,315,1,7,12
Vistara,3/06/2019,Banglore,Delhi,BLR → DEL,11:30,14:20,2h 50m,non-stop,No info,4668,2019-06-03,3,6,0,170,0,11,14
Jet Airways,6/06/2019,Kolkata,Banglore,CCU → BOM → BLR,20:00,16:20 07 Jun,20h 20m,1 stop,No info,14571,2019-06-06,6,6,3,1220,1,20,16
Jet Airways,6/03/2019,Delhi,Cochin,DEL → BOM → COK,21:50,04:25 07 Mar,6h 35m,1 stop,In-flight meal not included,13843,2019-03-06,6,3,2,395,1,21,4
Multiple carriers,3/06/2019,Delhi,Cochin,DEL → BOM → COK,06:40,19:15,12h 35m,1 stop,No info,7354,2019-06-03,3,6,0,755,1,6,19
